created_at,text,dale_chall_readability_score,flesch_kincaid,automated_readability,flesch_reading,sentence_count,coleman_liau_index,based_on_all_algorithms
Sat Jul 04 21:08:52 +0000 2020,I love this feeling,7.78,1.3,-0.7,92.8,1,0.0,-1th and 0th grade
Sat Jul 04 18:08:19 +0000 2020,Grande vittoria Abbiamo bisogno di questo spirito... FINO ALLA FINE,13.36,8.8,8.4,41.02,2,10.18,8th and 9th grade
Mon Jun 29 19:04:20 +0000 2020,What do you think about my look like my brother Panita,5.62,2.9,2.9,94.15,1,4.74,4th and 5th grade
Sat Jun 27 12:25:22 +0000 2020,Starting the weekend with a good vibe and a good style,7.05,2.9,2.9,94.15,1,4.74,4th and 5th grade
Fri Jun 26 22:24:38 +0000 2020,Vittoria importante Grandi ragazzi finoallafine,16.52,14.7,21.6,-1.29,1,28.16,14th and 15th grade
Thu Jun 25 18:22:44 +0000 2020,Enjoying this beautiful sunset torino,10.2,12.3,12.2,15.64,1,16.56,12th and 13th grade
Sun Jun 21 19:21:09 +0000 2020,"Never give up, always focused on the next step...All together finoallafine",7.05,7.6,11.5,60.31,1,13.15,7th and 8th grade
Wed Jun 17 09:02:37 +0000 2020,"Nem quero acreditar que o meu menino j tem 10 anos Como o tempo passou... e desde sempre foste motivo de orgulho do pai que tanto te ama. Muitos Parab ns, Filhote Um dia Feliz Amo te muito",9.98,8.3,6.8,69.11,2,4.99,9th and 10th grade
Mon Jun 15 17:41:37 +0000 2020,Get some Vitamin D,7.78,3.7,-1.9,75.88,1,-1.46,3rd and 4th grade
Fri Jun 12 13:41:47 +0000 2020,"Wherever you are, we'll always be together FinoAllaFine ForzaJuve",9.35,10.3,12.9,36.96,1,16.38,12th and 13th grade
Thu Jun 11 13:25:12 +0000 2020,Have a nice day thursdaystyle,7.04,0.5,4.6,100.24,1,7.28,1st and 2nd grade
Mon Jun 08 11:12:52 +0000 2020,Monday motivation The Competition is coming,9.2,13.9,11.4,6.17,1,15.88,15th and 16th grade
Fri Jun 05 18:01:52 +0000 2020,Let s rise to the challenge. What are you doing to ComeBackStronger Take part in the ClearResilienceChallenge at KeepaClearHead MentalHealthMatters,8.87,8.4,13.7,52.87,2,18.07,8th and 9th grade
Fri Jun 05 10:17:27 +0000 2020,Happy Birthday to my two sweeties Eva and Mateo We love you to the end of the world prouddad,7.07,7.2,6.4,77.57,1,5.28,6th and 7th grade
Wed Jun 03 11:32:53 +0000 2020,I fall in love every time I see these two dadysgirls,5.62,2.9,2.1,94.15,1,3.69,4th and 5th grade
Thu May 28 16:10:09 +0000 2020,Family Bike Ride,0.15,5.6,2.1,59.97,1,1.52,1st and 2nd grade
Tue May 26 16:51:26 +0000 2020,Approved,19.48,8.4,16.8,36.62,1,1.0,-1th and 0th grade
Fri May 22 15:48:48 +0000 2020,Work hard play hard,0.2,-2.3,-0.7,118.18,1,0.0,-1th and 0th grade
Tue May 19 17:40:14 +0000 2020,"When we become patient and consistent, we find the way to get through the difficulties backontrack beresponsible",9.12,11.1,13.7,45.76,1,14.85,10th and 11th grade
Sat May 16 17:10:35 +0000 2020,Our health is the most important thing we have How are you practicing good fitness and nutrition habits Nutrition.,7.07,9.5,11.9,60.65,1,11.72,11th and 12th grade
Fri May 15 08:00:00 +0000 2020,Home workout with EMS training gear SIXPAD. Stay Fit and Stay Positive SIXPAD traininggear Homeworkout stayfit,10.94,6.4,10.5,63.36,2,14.46,10th and 11th grade
Sat May 09 18:48:20 +0000 2020,Well done my friend,0.2,-2.3,-0.7,118.18,1,0.0,-1th and 0th grade
Thu May 07 16:24:11 +0000 2020,The greatest love...,9.05,0.9,8.3,93.81,1,3.43,0th and 1st grade
Tue May 05 17:04:29 +0000 2020,We ll be back family madeiraisland,6.57,4.5,4.3,73.85,1,7.18,6th and 7th grade
Fri May 01 12:00:00 +0000 2020,"Today is day 1 of Clear s 14 day resilience challenge to ComeBackStronger. Follow over the next two weeks for skills, hacks and tips on how to build your resilience. KeepaClearHead MentalHealthMatters",6.9,7.2,11.4,72.16,2,12.53,6th and 7th grade
Tue Apr 28 11:00:01 +0000 2020,These are challenging times. Let s make sure we stay on top of our game so we can all comebackstronger. Be part of the Clear 14 Days Resilience Challenge from May 1st at . I know I will. keepaclearhead resilience mentalhealthmatters,6.5,4.8,6.2,78.25,4,8.5,6th and 7th grade
Mon Apr 27 12:15:27 +0000 2020,Morning workout with a cycling session....these wheels are on fire,8.87,6.0,10.4,69.79,1,11.98,8th and 9th grade
Sat Apr 25 11:41:16 +0000 2020,Keep strong guys Lets go stayactive,6.57,2.1,5.1,90.77,1,8.17,2nd and 3rd grade
Mon Apr 20 18:20:36 +0000 2020,Workout to improve mind and body stayactive,8.5,6.0,7.0,64.37,1,10.74,8th and 9th grade
Sat Apr 18 12:02:57 +0000 2020,The best way to start the day,0.35,-1.2,-2.5,115.13,1,-0.87,-1th and 0th grade
Fri Apr 17 18:17:09 +0000 2020,Like father like son siiiimmmmm,7.04,14.7,6.5,-1.29,1,9.6,9th and 10th grade
Wed Apr 15 19:10:38 +0000 2020,Always challenge yourself For me it's time to study,5.84,3.3,5.6,87.72,1,8.03,3rd and 4th grade
Sun Apr 12 13:39:28 +0000 2020,We wish a Happy Easter to everyone stayhome,7.98,6.4,3.8,63.36,1,6.45,3rd and 4th grade
Sat Apr 11 09:15:41 +0000 2020,Another week of playing inside and staying active. Thanks to everyone for trying to beat me maybe next time Over to you . Get ready livingroomcup playinside,7.71,5.5,6.5,71.1,3,9.18,5th and 6th grade
Fri Apr 10 19:09:20 +0000 2020,In this very difficult moment for our world it is important we unite and support each other. Let s all do what we can to help. beyondthemask nevergiveup,6.59,6.4,6.6,74.19,2,7.59,6th and 7th grade
Sat Apr 04 12:43:05 +0000 2020,Stay home and keep stylish stayhomestaysafe,6.57,4.5,11.4,73.85,1,15.88,6th and 7th grade
Wed Apr 01 11:23:13 +0000 2020,"Breathe in, breathe out. Stay active stayhomesavelives",8.32,4.7,12.6,67.92,2,13.72,7th and 8th grade
Mon Mar 30 13:02:41 +0000 2020,"In this difficult moment for the whole world, let s be thankful for the things that matter our health, our family, our loved ones. Stay home and let s help all the health workers out there fighting to save lives. stayhomesavelives",6.19,7.7,10.6,76.05,2,8.88,10th and 11th grade
Sat Mar 21 14:01:09 +0000 2020,"If you ever dreamed of playing for millions around the world, now is your chance. Play inside, play for the world. staysafe playinside playfortheworld",6.86,4.4,9.5,84.68,2,11.59,5th and 6th grade
Fri Mar 20 19:30:58 +0000 2020,"Hi guys, just a little message and reminder of the steps we must all follow to protect ourselves and our loved ones. Please stay safe. stayhome staysafe",5.48,5.0,7.3,83.15,2,8.58,5th and 6th grade
Fri Mar 13 16:10:20 +0000 2020,For information,11.63,14.7,12.5,-6.7,1,10.0,12th and 13th grade
Mon Mar 09 10:08:10 +0000 2020,"So proud to reach 1000 official games in my career with a very important victory that put us on the top of the table again Thank you to all my teammates, coaches, my family amp friends and to my fans that helped me to reach this great achievement.",7.66,18.5,22.2,48.14,1,7.39,7th and 8th grade
Tue Mar 03 18:57:21 +0000 2020,"Thank you for all your messages of support for my mum. She is currently stable and recovering in hospital. Me and my family would like to thank the medical team looking after her, and kindly ask that we are all given some privacy at this time.",6.8,6.9,6.5,72.87,3,6.6,6th and 7th grade
Fri Feb 28 20:54:29 +0000 2020,Stay focused on your goals,7.04,0.5,1.8,100.24,1,3.8,1st and 2nd grade
Tue Feb 25 17:06:48 +0000 2020,Always on my mind... see you tomorrow UCL forzajuve,5.84,4.4,5.6,79.26,1,6.7,5th and 6th grade
Sat Feb 22 20:24:07 +0000 2020,3 more important points Now let s focus on UCL game finoallafine forzajuve,7.93,7.2,7.5,66.74,1,9.5,7th and 8th grade
Fri Feb 21 12:24:25 +0000 2020,"My new Mercurial Dream Speed is here and they make me feel like I can move at the speed of light So excited to see , , Wu Lei, all illuminate their games on pitch with it You can shop today at",2.77,15.4,16.4,56.26,1,4.77,15th and 16th grade
Mon Feb 17 18:51:33 +0000 2020,Ice recovery,11.63,8.8,5.5,35.61,1,1.3,11th and 12th grade
Fri Feb 14 15:12:04 +0000 2020,Family s lunch,0.15,5.6,-1.2,59.97,1,-2.38,-1th and 0th grade
Mon Feb 10 17:27:05 +0000 2020,No excuses,11.63,8.8,0.8,35.61,1,-4.51,0th and 1st grade
Sun Feb 02 14:36:10 +0000 2020,Good to get back to victories and happy to score again in our stadium Proud to reach 50 goals with the bianconeri shirt finoallafine forzajuve,8.03,10.7,13.3,63.02,1,10.39,10th and 11th grade
Thu Jan 30 17:09:01 +0000 2020,The games start to win during the week focus hardwork finoallafine,8.49,6.4,8.0,68.77,1,11.06,7th and 8th grade
Mon Jan 27 15:48:34 +0000 2020,Felicidades mi amor Te deseo un d a muy lindo Eres una gran mujer y una excelente madre para nuestros hijos. Te quiero mucho cari o,9.14,6.0,4.3,75.2,2,5.26,5th and 6th grade
Sun Jan 26 23:40:28 +0000 2020,So sad to hear the heartbreaking news of the deaths of Kobe and his daughter Gianna. Kobe was a true legend and inspiration to so many. Sending my condolences to his family and friends and the families of all who lost their lives in the crash. RIP Legend,6.73,7.2,6.9,72.16,3,7.07,6th and 7th grade
Mon Jan 20 18:02:25 +0000 2020,Charging...,19.48,8.4,30.9,36.62,1,1.0,-1th and 0th grade
Sun Jan 19 23:30:50 +0000 2020,Happy to score again today 3 important points finoallafine forzajuve,7.29,8.4,11.4,52.87,1,15.46,7th and 8th grade
Mon Jan 06 17:10:57 +0000 2020,Amazing feeling to kick off 2020 with a hat trick and a victory finoallafine forzajuve,8.59,8.0,8.7,64.71,1,9.97,8th and 9th grade
Fri Jan 03 17:58:32 +0000 2020,"New year, the same motivation forzajuve finoallafine",10.75,9.6,13.0,38.99,1,17.35,9th and 10th grade
Wed Jan 01 17:54:42 +0000 2020,"Feliz Ano, meu Amor Que 2020 seja um ano repleto de amor, sa de, paz e sucesso para todos Happy New Year to all",8.12,9.1,7.9,72.5,1,3.55,7th and 8th grade
Mon Dec 30 12:03:41 +0000 2019,Always with me,0.15,0.9,-1.2,93.81,1,-2.38,0th and 1st grade
Sun Dec 29 20:25:24 +0000 2019,"Honored to received one more time Globe Soccer Award A very emotional moment for me to share this award with my family Grateful for all the hospitality, see you soon Dubai",7.72,13.0,15.5,56.93,1,9.53,9th and 10th grade
Fri Dec 27 18:37:37 +0000 2019,You always make me feel so special,6.24,2.5,0.9,89.75,1,3.26,2nd and 3rd grade
Fri Dec 27 12:09:03 +0000 2019,Teaching how to jump Was a pleasure to see you and train with you my friend,5.42,3.6,4.2,97.54,1,4.17,3rd and 4th grade
Fri Dec 27 11:57:58 +0000 2019,Teaching how to jump Was a pleasure to see you and train with you my friend,5.42,3.6,4.2,97.54,1,4.17,3rd and 4th grade
Thu Dec 26 14:53:30 +0000 2019,Workout in the pool,7.78,1.3,-0.7,92.8,1,0.0,-1th and 0th grade
Wed Dec 18 23:16:33 +0000 2019,CR7 AIR JORDAN forzajuve finoallafine,13.36,7.6,12.2,49.48,1,16.56,7th and 8th grade
Sun Dec 15 17:39:35 +0000 2019,Great victory today with a strong perfomance from the team forzajuve finoallafine,8.18,9.2,12.0,50.84,1,15.65,11th and 12th grade
Wed Dec 11 23:01:39 +0000 2019,Good way to end our group stage See you in February championsleague forzajuve finoallafine,7.71,7.6,11.5,65.73,1,14.03,7th and 8th grade
Tue Dec 10 17:18:31 +0000 2019,How can i not fall in love with my sweet princess,0.55,0.5,0.8,111.07,1,2.13,0th and 1st grade
Sun Dec 08 11:25:16 +0000 2019,Keep strong and together until the end finoallafine,6.01,6.4,8.5,63.36,1,12.25,8th and 9th grade
Wed Dec 04 17:10:52 +0000 2019,Positive vibes,11.63,8.8,10.2,35.61,1,7.1,11th and 12th grade
Mon Nov 25 17:03:46 +0000 2019,I'm back Juventus finoallafine,11.73,9.6,12.4,33.58,1,14.5,11th and 12th grade
Sat Nov 23 19:04:46 +0000 2019,"Gran Carattere, bravi ragazzi finoallafine forzajuve",11.83,6.8,18.4,56.93,1,23.65,6th and 7th grade
Fri Nov 22 17:11:54 +0000 2019,Focused on my recovery to come back soon,7.98,4.1,2.0,80.28,1,4.31,3rd and 4th grade
Fri Nov 15 16:21:51 +0000 2019,Love this feeling,9.05,0.9,3.6,93.81,1,3.43,0th and 1st grade
Thu Nov 14 22:42:17 +0000 2019,Boa vit ria equipa Estamos a um passo do apuramento todosporportugal,9.92,9.9,8.9,43.39,1,12.1,9th and 10th grade
Tue Nov 12 19:15:57 +0000 2019,Feliz anivers rio meu amor,7.04,0.5,1.8,100.24,1,3.8,1st and 2nd grade
Mon Nov 11 11:13:38 +0000 2019,"Partita difficile, vittoria importante finoallafine",19.67,21.8,25.3,-52.05,1,31.64,21st and 22nd grade
Thu Nov 07 12:08:35 +0000 2019,We re on the ucl last 16 Bravi Ragazzi finoallafine,5.71,2.5,3.4,95.17,1,5.6,5th and 6th grade
Tue Nov 05 14:54:13 +0000 2019,Champions League here we go again,6.57,2.1,3.6,90.77,1,6.25,2nd and 3rd grade
Sun Nov 03 20:29:17 +0000 2019,The Show started with Love,7.04,0.5,1.8,100.24,1,3.8,1st and 2nd grade
Thu Oct 31 13:52:39 +0000 2019,Happy Halloween everyone,9.05,12.7,14.6,9.21,1,16.95,12th and 13th grade
Wed Oct 30 22:38:45 +0000 2019,finoallafine,19.48,20.2,35.6,-47.99,1,24.2,19th and 20th grade
Sun Oct 27 11:41:29 +0000 2019,Be careful we are here,0.25,0.5,-2.1,100.24,1,-0.85,-1th and 0th grade
Mon Oct 21 17:08:12 +0000 2019,Confident for tomorrow ucl liveahead finoallafine forzajuve,13.01,11.9,17.7,22.07,1,23.96,11th and 12th grade
Thu Oct 17 18:08:25 +0000 2019,Cold days ask for good quality footwear Check our CR7 Fall Winter collection. PLAYFECTIONISM CR7fw19 CR7,6.99,5.2,8.8,71.82,2,12.25,4th and 5th grade
Wed Oct 16 17:53:36 +0000 2019,Back on track,0.15,-2.7,-2.7,119.19,1,-4.29,0th and 1st grade
Mon Oct 14 10:13:04 +0000 2019,Ready for today todosportugal,7.78,7.2,11.2,50.5,1,14.5,7th and 8th grade
Sun Oct 13 12:17:00 +0000 2019,Madeira Island is nominated for the 5th time the best island in the world Let s vote Siiiiiiiii Place your vote at VisitMadeira MadeiraNoWordsNeeded TheBestIslandInTheWorld,8.03,15.4,19.0,29.18,1,17.35,17th and 18th grade
Sat Oct 12 13:10:43 +0000 2019,Feliz por ter marcado num est dio especial para mim e ter contribu do para uma vit ria que nos coloca mais perto do nosso objetivo,9.78,12.3,10.6,53.55,1,6.45,9th and 10th grade
Thu Oct 10 17:30:35 +0000 2019,Focado no jogo de amanh .,10.2,7.6,-0.2,49.48,1,0.32,-1th and 0th grade
Tue Oct 08 13:37:58 +0000 2019,"sempre uma grande felicidade estar de volta ao meu pa s, representar a sele o nacional e rever amigos de tantas batalhas. Todos juntos, lutaremos uma vez mais para erguer bem alto o nome de Portugal Vamos equipa",12.06,10.7,9.6,52.19,2,8.82,10th and 11th grade
Mon Oct 07 10:26:38 +0000 2019,Very strong performance by the team Great feeling to be on the top of the table again finoallafine forzajuve liveahead,8.58,8.7,11.9,68.1,1,11.43,11th and 12th grade
Sat Oct 05 14:13:45 +0000 2019,Best way to start my weekend,6.57,0.9,-0.5,99.23,1,1.38,1st and 2nd grade
Wed Oct 02 09:50:49 +0000 2019,3 important points Well done team finoallafine forzajuve liveahead,9.35,8.0,13.4,53.88,1,18.3,7th and 8th grade
Mon Sep 30 18:00:02 +0000 2019,Champions League is back See you tomorrow...,6.24,6.0,7.6,64.37,1,9.06,8th and 9th grade
Mon Sep 30 07:28:44 +0000 2019,"I ve achieved so much wearing Mercurial boots. Now, I am excited to see you all follow your dreams in my new Mercurial Dream Speed. Available today at",5.79,4.6,3.9,78.96,3,5.83,4th and 5th grade
Sat Sep 28 21:07:13 +0000 2019,Felice per il gol e la solida prestazione della squadra finoallafine forzajuve liveAhead,11.57,8.4,12.6,58.28,1,15.76,7th and 8th grade
Fri Sep 27 09:32:30 +0000 2019,Work done,0.1,-3.1,-1.7,120.21,1,-7.41,-1th and 0th grade
Tue Sep 24 11:44:16 +0000 2019,"Paci ncia e persist ncia s o duas caracter sticas que diferenciam o profissional do amador. Tudo o que hoje grande um dia come ou pequeno. Voc n o pode fazer tudo, mas fa a tudo o que puder para transformar seus sonhos em realidade. LR",8.86,8.1,5.7,64.41,3,5.56,8th and 9th grade
Thu Sep 19 11:24:56 +0000 2019,We will keep working hard to achieve our goals finoallafine,7.29,3.7,7.1,86.71,1,10.24,7th and 8th grade
Tue Sep 17 20:02:40 +0000 2019,Probably one of the most revealing interviews I ever did... Thanks for the interview.,8.5,6.0,6.3,64.37,2,8.24,8th and 9th grade
Tue Sep 17 17:41:57 +0000 2019,We're ready for UCL finoallafineforzajuventus liveahead,9.2,12.7,20.8,14.63,1,26.55,12th and 13th grade
Mon Sep 16 07:00:37 +0000 2019,Combining gym with SIXPAD helps me a lot. EMS technology will surprise you. SIXPAD traininggear,8.22,6.2,7.8,63.86,2,10.92,7th and 8th grade
Sun Sep 15 18:36:20 +0000 2019,Domingo em fam lia,7.78,1.3,-1.9,92.8,1,-1.46,0th and 1st grade
Fri Sep 13 16:42:50 +0000 2019,Smeling good with my new fragrance and looking great with you on my side georgina,6.49,3.2,7.1,98.55,1,8.05,6th and 7th grade
Fri Sep 13 09:01:58 +0000 2019,I m ready to Play It Cool Are you CR7PlayItCool,5.71,3.7,1.5,86.71,1,3.28,3rd and 4th grade
Wed Sep 11 18:27:47 +0000 2019,I love this feeling 93...,7.04,0.5,0.9,100.24,1,-0.85,0th and 1st grade
Wed Sep 11 07:38:53 +0000 2019,Feliz por marcar o segundo poker ao servi o da Sele o e ter contribu do para mais uma vit ria rumo ao nosso objetivo,10.56,11.9,8.4,54.56,1,4.36,11th and 12th grade
Fri Sep 06 18:19:12 +0000 2019,Ready for tomorrow,0.15,5.6,5.2,59.97,1,5.35,5th and 6th grade
Tue Sep 03 14:22:26 +0000 2019,sempre um prazer voltar sele o e representar Portugal,12.86,10.3,6.6,36.96,1,9.94,9th and 10th grade
Sun Sep 01 10:52:55 +0000 2019,Happy Sunday,0.1,8.8,5.5,35.61,1,1.3,-1th and 0th grade
Thu Aug 29 18:15:14 +0000 2019,Going back home,0.15,0.9,0.5,93.81,1,-0.46,0th and 1st grade
Thu Aug 29 08:02:44 +0000 2019,olha a os Reis do espadachim,9.2,2.1,-0.5,90.77,1,1.38,1st and 2nd grade
Wed Aug 28 19:00:01 +0000 2019,"No doubts in your mind, no dandruff on your head. keepaCLEARhead ClearMen NoDoubts NoDandruff MenShampoo",9.64,8.0,14.3,64.71,1,16.17,7th and 8th grade
Wed Aug 28 15:05:50 +0000 2019,"El otro d a estuve en y fue un placer hablar con todo el equipo, en el cual conf o. Si sufres de alopecia, comprueba el gran trabajo que podemos hacer por ti. Entra en y pide tu consulta gratuita. Yo conf o en Insparya, conf a tu tambi n",8.68,5.8,2.5,75.71,4,2.94,8th and 9th grade
Sat Aug 24 19:22:32 +0000 2019,Great to start the season with three points forzajuve liveahead finoallafine,8.49,6.4,12.3,68.77,1,16.34,5th and 6th grade
Thu Aug 22 17:22:15 +0000 2019,The Amazon Rainforest produces more than 20 of the world s oxygen and its been burning for the past 3 weeks. It s our responsibility to help to save our planet. prayforamazonia,8.38,8.4,7.9,63.7,2,8.35,7th and 8th grade
Mon Aug 19 19:20:35 +0000 2019,Back on track and focused on the first game of the season,5.55,3.3,2.6,93.14,1,4.05,4th and 5th grade
Sat Aug 10 19:49:59 +0000 2019,Feeling good and keep working,10.2,2.9,4.6,83.32,1,7.28,1st and 2nd grade
Fri Aug 09 18:02:36 +0000 2019,We re already in Sweden for tomorrow's game,7.98,5.2,3.8,71.82,1,5.76,3rd and 4th grade
Fri Aug 02 15:33:00 +0000 2019,NovaFotoDoPerfil,19.48,32.0,54.4,-132.59,1,47.4,31st and 32nd grade
Fri Aug 02 15:00:00 +0000 2019,Speed you can barely see Check out my latest Mercurial available today at Mercurial,7.71,9.9,9.1,48.81,1,11.13,7th and 8th grade
Thu Aug 01 14:25:52 +0000 2019,Eyes on the ball,0.2,-2.3,-4.2,118.18,1,-4.36,-1th and 0th grade
Wed Jul 31 11:46:14 +0000 2019,There is only one shampoo for me. ClearMen KeepAClearHead NoDandruff ClearHairCare Menshampoo,11.83,8.0,13.7,48.47,2,18.32,7th and 8th grade
Tue Jul 30 20:03:10 +0000 2019,Happiness Back To Training,7.78,7.2,7.7,50.5,1,10.15,7th and 8th grade
Tue Jul 30 11:54:48 +0000 2019,Abt last night,0.15,-2.7,-1.2,119.19,1,-2.38,0th and 1st grade
Mon Jul 29 17:58:00 +0000 2019,Muy contento y honrado por ganar este premio Leyenda. Gracias a todos los que me han ayudado y a los que me siguen ayudando en mi carrera.,10.15,7.4,4.9,66.23,2,5.73,7th and 8th grade
Tue Jul 23 17:25:51 +0000 2019,Always a pleasure to see you China,0.35,3.7,0.9,81.29,1,3.26,2nd and 3rd grade
Sun Jul 21 15:31:10 +0000 2019,Happy to be back finoallafine,7.04,5.2,4.6,66.4,1,7.28,4th and 5th grade
Sat Jul 20 18:06:28 +0000 2019,Recovery session,19.53,14.7,14.9,-6.7,1,12.9,14th and 15th grade
Fri Jul 19 15:22:04 +0000 2019,Let's go,0.1,-3.1,-4.0,120.21,1,-13.21,-1th and 0th grade
Thu Jul 18 15:46:14 +0000 2019,Ch das cinco,9.05,0.9,-4.3,93.81,1,-6.26,0th and 1st grade
Wed Jul 17 08:04:44 +0000 2019,Inspired by my friends in China. This one is for the commanders of the pitch. Shuai Available today on,6.44,2.2,2.6,90.46,3,4.52,2nd and 3rd grade
Tue Jul 16 09:27:07 +0000 2019,Light up your body this summer with the brand new High Summer CR7Underwear collection.,6.59,6.4,10.1,74.19,1,11.94,6th and 7th grade
Mon Jul 15 19:45:24 +0000 2019,How great it is to arrive at home after a day of hard work and be with my lovely family,0.99,7.6,4.6,76.56,1,2.44,7th and 8th grade
Sun Jul 14 20:09:59 +0000 2019,Work done,0.1,-3.1,-1.7,120.21,1,-7.41,-1th and 0th grade
Sat Jul 13 13:37:50 +0000 2019,Felice di tornare al lavoro e vedere i miei compagni di squadra finoallafine forzajuve,9.97,7.6,10.1,65.73,1,12.35,7th and 8th grade
Fri Jul 12 18:04:38 +0000 2019,", a sua poker face vale tudo",9.2,4.5,-1.2,73.85,1,-0.54,-1th and 0th grade
Mon Jul 08 10:47:26 +0000 2019,Sempre bom passar uns dias na minha linda ilha Ate breve Madeira,10.81,5.6,5.4,76.22,1,7.47,4th and 5th grade
Sat Jul 06 10:18:48 +0000 2019,New Mercs Excited for the season ahead in my new Mercurial. Available tomorrow at CR7 NikeFootball Nike Mercurial,6.71,9.2,8.2,45.42,2,11.57,8th and 9th grade
Thu Jul 04 08:20:05 +0000 2019,It was a fun time meeting these kids at the Singapore Olympic Foundation Peter Lim Scholarship event Follow your dreams and never give up,7.46,10.3,12.9,64.04,1,10.57,14th and 15th grade
Mon Jul 01 21:49:14 +0000 2019,Let s go guys,0.2,-2.3,-7.8,118.18,1,-8.71,-1th and 0th grade
Tue Jun 25 12:59:12 +0000 2019,Enjoying the vacation,14.31,12.7,9.9,9.21,1,11.15,12th and 13th grade
Sun Jun 23 12:37:46 +0000 2019,Holidays with my family in France Riviera Enjoy the views,7.29,7.2,6.2,61.33,1,9.08,7th and 8th grade
Wed Jun 19 10:14:52 +0000 2019,let's go,0.1,-3.1,-4.0,120.21,1,-13.21,-1th and 0th grade
Mon Jun 17 08:52:46 +0000 2019,"Muitos parab ns, filho Que continues a ser o lindo menino que tens sido at hoje, o pap tem muito orgulho em ti Que tenhas um dia muito feliz O pap ama te muito",9.5,13.0,13.0,62.35,1,4.48,12th and 13th grade
Wed Jun 12 09:22:02 +0000 2019,Em breve estar no meu Museu. And still,6.01,0.5,0.8,105.66,1,2.1,0th and 1st grade
Tue Jun 11 11:01:10 +0000 2019,Champ Champ,0.1,-3.1,3.1,120.21,1,-1.61,-1th and 0th grade
Mon Jun 10 11:38:53 +0000 2019,"Bom dia , depois de conquistar a super copa de It lia, campeonato italiano, n o poderia haver melhor maneira de terminar a poca, com a conquista da UefaNationsLeague 2 1 triplete",10.78,15.4,16.4,40.01,1,10.05,10th and 11th grade
Mon Jun 10 09:09:41 +0000 2019,3 times in a row,0.25,-1.9,-7.7,117.16,1,-7.81,1st and 2nd grade
Thu Jun 06 18:01:52 +0000 2019,"After 90 minutes of intense exercise, there s allways a chance for a final punchline Ending big is allways the best way to close the show",8.57,11.1,11.9,62.01,1,7.78,11th and 12th grade
Wed Jun 05 21:48:08 +0000 2019,Muito feliz por ajudar Portugal a chegar final da Liga das Na es Parab ns malta Obrigado ao p blico portugu s pelo apoio fant stico. For a,10.66,11.8,11.2,59.98,1,5.81,11th and 12th grade
Wed Jun 05 11:22:33 +0000 2019,Parab ns amores do papa Pena n o poder estar a com voc s neste dia t o especial. Mas a mam est convosco. Sejam sempre muito felizes. Amo vos muito,7.59,2.8,0.1,88.94,4,1.52,2nd and 3rd grade
Mon Jun 03 14:14:19 +0000 2019,Esp rito de equipa tudoporportugal,10.2,12.3,9.3,15.64,1,13.08,9th and 10th grade
Sat Jun 01 17:27:48 +0000 2019,Aiming for success. traditionalaccessories belt cr7footwear,14.46,13.9,24.0,6.17,1,30.38,13th and 14th grade
Sat Jun 01 12:01:55 +0000 2019,"A great adventure with a lot of friends you dance, amigo the rally maestro And...a panda Enjoy fiber",8.04,8.0,9.3,70.13,1,7.89,7th and 8th grade
Thu May 30 18:51:41 +0000 2019,I made a new friend while shooting the new TV commercial,7.05,4.0,3.8,85.69,1,5.78,5th and 6th grade
Thu May 30 11:35:57 +0000 2019,sempre um prazer estar de volta ao meu pa s. For a Portugal,10.03,4.6,-1.2,73.34,2,0.29,-1th and 0th grade
Tue May 28 17:45:00 +0000 2019,"Amazing residential destination in Dubai, bringing together traditional design with a modern twist MJLiving",13.35,14.7,17.2,14.97,1,20.64,14th and 15th grade
Mon May 27 22:29:47 +0000 2019,Partita del cuore 2019 orgoglio,10.2,5.2,6.5,66.4,1,9.6,9th and 10th grade
Thu May 23 18:27:17 +0000 2019,Always nice to see you Bro,0.3,0.9,-2.0,99.23,1,-0.54,-1th and 0th grade
Mon May 20 17:26:15 +0000 2019,"Campe o em Inglaterra, Espanha e It lia... Melhor Jogador em Inglaterra, Espanha e It lia... N o h limites para as conquistas quando o sonho se mant m vivo a cada dia que passa Fino Alla Fine",9.67,7.1,4.0,67.04,3,4.1,6th and 7th grade
Mon May 20 14:02:57 +0000 2019,It's always good to share these beautiful moments with my loves,5.62,5.2,6.8,77.23,1,8.97,5th and 6th grade
Sun May 19 22:27:19 +0000 2019,Very happy to win the second trophie for and my first Serie A championship finoallafine,8.59,8.0,9.0,64.71,1,10.37,8th and 9th grade
Sat May 18 16:53:25 +0000 2019,Grazie mister Abbiamo vissuto un solo anno insieme ma stato eccezionale perch oltre a essere un grande allenatore sei un grande uomo. stato un piacere lavorare con te,12.92,15.4,15.9,34.6,1,11.61,15th and 16th grade
Thu May 16 15:42:48 +0000 2019,Winning team,11.63,2.9,5.5,77.91,1,1.3,-1th and 0th grade
Fri May 10 11:00:24 +0000 2019,I never hit the gym or the field without my essentials,5.62,5.2,2.9,77.23,1,4.74,5th and 6th grade
Sat May 04 13:28:19 +0000 2019,Hi guys Check out my animated show trailer and the comic book now FCBD FreeComicBookDay SF7 CR7,7.27,7.6,9.0,71.14,1,9.39,7th and 8th grade
Thu May 02 18:57:16 +0000 2019,Filho de peixe sabe nadar,7.04,0.5,0.9,100.24,1,2.64,0th and 1st grade
Tue Apr 30 19:15:08 +0000 2019,Getting ready to go dinner out with my new Chicago green shoes,5.55,4.4,4.6,84.68,1,6.48,4th and 5th grade
Tue Apr 30 15:41:52 +0000 2019,Equipa vencedora TopTraining,14.31,12.7,20.9,9.21,1,24.72,12th and 13th grade
