created_at,text,dale_chall_readability_score,flesch_kincaid,automated_readability,flesch_reading,sentence_count,coleman_liau_index,based_on_all_algorithms
Mon Jul 20 17:02:58 +0000 2020,Rice plantation done . .,9.05,12.7,11.5,9.21,1,9.23,12th and 13th grade
Sun Jul 19 18:37:27 +0000 2020,Farminggg,19.48,8.4,21.5,36.62,1,6.8,-1th and 0th grade
Thu Jul 16 09:55:03 +0000 2020,Happy bday Katrina. .,9.05,17.4,8.3,-24.64,1,5.35,-1th and 0th grade
Tue Jul 14 10:44:58 +0000 2020,Respect to all the farmers . .,10.2,7.6,3.7,49.48,1,3.8,3rd and 4th grade
Sat Jul 11 16:10:31 +0000 2020,Daane daane pe likha hota hai khane wale Ka naam... jai jawan jai kissan,5.46,2.9,5.4,99.57,1,5.33,5th and 6th grade
Wed Jul 01 08:09:03 +0000 2020,"Aaj DoctorsDay hai, meri taraf se saare doctors ko dil se shukriya. Aapke dedication, or aapke sacrifices k liye Thank you for being the strongest pillars of our country in this pandemic",8.38,8.4,9.4,63.7,2,9.97,8th and 9th grade
Sat Jun 27 07:00:53 +0000 2020,Swagat toh karo Aarya ka What a comeback and what a show Congratulations aur dher saara pyaar,7.27,7.6,8.4,71.14,1,8.7,8th and 9th grade
Sun Jun 21 08:58:16 +0000 2020,"Happy father's Day , the best gift ur father wud want from u is for u to live happily. Kids khush fathers khush....",5.62,4.0,4.0,85.69,2,4.21,3rd and 4th grade
Sat Jun 20 18:13:11 +0000 2020,A request to all my fans to stand with sushant's fans n not to go by the language n the curses used but to go with the emotion behind it. Pls support n stand by his family n fans as the loss of a loved one is extremely painful.,6.46,8.1,8.0,80.45,2,3.84,7th and 8th grade
Wed Jun 17 11:05:30 +0000 2020,My heart goes out to all brave hearts who hv laid down their lives at the Galwan valley. This sacrifice will not go to waste. I join their families in grief... JaiHind WeStandWithIndianArmy,6.57,5.2,6.5,77.23,3,8.27,6th and 7th grade
Sun Jun 14 14:32:29 +0000 2020,U will be missed ... RIPSushant,7.04,2.9,5.6,83.32,1,4.96,1st and 2nd grade
Sat Jun 13 12:36:18 +0000 2020,"Happy bday Aditya, wish u all the success and happiness. God bless",5.55,4.4,6.1,84.68,1,7.47,5th and 6th grade
Sat Jun 06 13:19:07 +0000 2020,Shukriya for all ur love for FRSH Ab FRSH milega aapko pe bhi Try nahi karoge Go get ur FRSH... ko follow karo for more updates RahoFRSHRahoSafe,7.31,10.3,12.7,69.45,1,7.72,7th and 8th grade
Mon Jun 01 07:25:38 +0000 2020,"Wajid Vil always love, respect, remember n miss u as a person n ur talent, Love u n may your beautiful soul rest in peace ...",6.77,10.7,9.9,63.02,1,4.82,9th and 10th grade
Sat May 30 08:44:18 +0000 2020,Thank u IndiaFightsCorona,9.05,12.7,16.2,9.21,1,18.92,12th and 13th grade
Fri May 29 04:21:02 +0000 2020,Aaj kal Salaam Namaste karne mein hi swag hai Harghoontmeinswag swagsesolo socialdistancing,9.5,9.2,16.0,50.84,1,20.52,9th and 10th grade
Thu May 28 07:15:15 +0000 2020,"Video toh dekh liya, now listen to BhaiBhaiAudio SaajanSingh",7.59,8.0,10.3,53.88,1,13.83,7th and 8th grade
Wed May 27 12:15:28 +0000 2020,. SaajanSingh,19.48,32.0,35.6,-132.59,1,18.4,31st and 32nd grade
Wed May 27 12:15:28 +0000 2020,"Thank u for the response on bhai bhai , please make the younger generation hear this song again n again , your younger siblings , your kids etc .thank u 1s again ,may God be vit u n protect u . BhaiBhai",7.18,14.6,17.5,58.29,1,6.98,6th and 7th grade
Mon May 25 16:12:31 +0000 2020,"Maine aap subb ke liye kuch banaya hai, dekh ke batana kaisa laga... Aap subb ko eid mubarakh ... BhaiBhai SaajanSingh",7.29,3.7,6.6,86.71,2,7.63,5th and 6th grade
Sun May 24 14:49:44 +0000 2020,"Launching my new grooming amp personal care brand FRSH Yeh hai aapka, mera, hum sabka brand jo layega aap tak behtareen products. Sanitizers aa chuke hain, jo milenge aapko yaha Toh try karo ko follow karo RahoFrshRahoSafe",9.25,9.3,11.5,61.16,2,11.26,11th and 12th grade
Sat May 23 06:27:39 +0000 2020,All d vry best Namashi for BadBoy. Poster lajawaab jayantilalgada sajidqureshi rajkumarsantoshi himeshreshammiya amrin namashichakraborty,12.43,9.8,20.9,38.48,2,27.51,9th and 10th grade
Sat May 16 05:30:06 +0000 2020,"Zubaan se zyaada akal hai fast, Ali karega comedy ka blast. Ghar baithe baithe dekhiye the World Television Premiere of Freaky Ali aaj raat 9 baje, only on FreakyAliOnANDPictures",8.17,6.6,10.2,73.68,2,11.53,6th and 7th grade
Fri May 15 18:46:36 +0000 2020,Lockdown ka waqt hai. Sab ghar par hain. Stress bhi hai. Toh aaiye phir milkar stress door kartein hai. Navratna tel ki champi karein aur Thanda Thanda Cool Cool rahein. NavratnaCoolChampi,6.49,1.0,5.7,99.02,5,8.12,5th and 6th grade
Wed May 13 16:21:05 +0000 2020,Mat karo rumours pe trust.... staysafe,6.57,0.9,7.5,99.23,1,7.18,6th and 7th grade
Wed May 13 07:00:07 +0000 2020,"Video dekh liya, ab audio bhi sun lo. TereBinaAudio out now AjayBhatia SaajanSingh IndiaFightsCorona StaySafe",9.27,8.6,12.1,46.94,2,16.31,8th and 9th grade
Tue May 12 06:36:09 +0000 2020,. AjayBhatia SaajanSingh IndiaFightsCorona StaySafe,15.68,24.9,35.9,-76.41,1,43.5,24th and 25th grade
Tue May 12 06:36:08 +0000 2020,"Maine yeh gaana banaya, gaya, shoot kiya aur post kiya aap ke liye, ab aap bhi yeh gaana suno, gaao, aur aap ke swag mai shoot karo ghar pe, post karo, share karo, tag karo n enjoy karo... TereBina",6.38,12.6,17.3,74.19,1,5.29,16th and 17th grade
Mon May 11 07:43:15 +0000 2020,Tere Bina...coming to you at this premiere link soon TereBinaOutTomorrow Click here to Watch the premiere AjayBhatia SaajanSingh,8.92,12.7,16.6,36.28,1,17.22,12th and 13th grade
Sun May 10 06:37:17 +0000 2020,Tere bina... wishing all mothers a v happy Mother s Day AjayBhatia SaajanSingh TereBinaTeaser,11.1,12.3,12.5,31.89,1,14.03,11th and 12th grade
Sat May 09 15:30:06 +0000 2020,Tere Bina... TereBina TereBinaTeaserOutTomorrow LockdownConversations IndiaFightsCorona,17.09,31.6,46.0,-120.74,1,55.55,31st and 32nd grade
Sat May 09 09:45:20 +0000 2020,Interview Part II . . TereBina TereBinaSongOutTomorrow LockdownConversations IndiaFightsCorona,15.09,33.0,38.2,-135.13,2,45.22,32nd and 33rd grade
Fri May 08 12:17:22 +0000 2020,Here s some reassuring news. LIFEBUOY is the WORLD'S FIRST BRAND to report that its handwash and sanitiser are 99.9 effective against the Covid 19 Coronavirus. It s our responsibility to fight this together. Keep using Lifebuoy or any other soap. lifebuoykarona,6.79,6.2,8.5,69.28,4,10.82,8th and 9th grade
Wed May 06 14:37:41 +0000 2020,Chand roz ke baat hai yaaron... Jeetenge Agar ho Sabka Saath,5.34,-0.6,2.8,108.19,2,3.64,-1th and 0th grade
Sun May 03 15:54:05 +0000 2020,Thanks for the contribution... Thank you all AbhirajMinawala,7.78,8.4,11.8,42.04,2,13.05,11th and 12th grade
Fri May 01 12:29:59 +0000 2020,Congratzz Jacky on your new show on Netflix MrsSerialKiller,9.35,4.4,9.8,79.26,1,13.83,4th and 5th grade
Fri May 01 10:09:52 +0000 2020,Hey ... Would like to see what you're gonna post in the next one hour and would like to see a post from you every day ..,1.24,7.1,8.8,88.4,1,3.43,-1th and 0th grade
Thu Apr 30 07:03:17 +0000 2020,"Rest in peace chintu sirrr, kaha suna maaf , strength , peace n light to family n friends...",7.39,7.2,8.7,72.16,1,7.42,6th and 7th grade
Wed Apr 29 10:04:48 +0000 2020,"Big loss to the film industry, his fans, all of us n specially his family. My heart goes out to his family. May God give them strength. Rest in peace brother u shall always be missed n be in all our hearts..",1.27,2.7,2.4,94.66,4,3.22,2nd and 3rd grade
Tue Apr 28 12:17:24 +0000 2020,"Baba and baba's baba zeeshan ne aan baan aur shaan se 1,25,000 families ko ration bataa hai. Now this is a challenge that one should be a part of.. Challenge 'Anna Daan' Karo to khud ya kissi bharosemand ke through...",7.06,4.9,6.2,83.36,3,6.08,5th and 6th grade
Sun Apr 26 12:08:22 +0000 2020,"In times like these, the only thing that matters is your amp your family s health. Lifebuoy or any soap is the best way to prevent the spread of Covid 19. Until a cure is found, soap is our hope. My appeal to you all is to take necessary precautions and stay safe.",5.79,3.8,4.0,91.82,4,4.39,3rd and 4th grade
Sat Apr 25 20:42:10 +0000 2020,"Thank u Balaji Rao of Venky s Chicken for the 10,000 eggs and chicken not once but twice for the villagers here in Panvel. Would request kindly let us have the same again for them and for me as well as they hv run out of chicken and eggs and so hv we ....",6.14,8.9,9.8,78.42,2,4.48,8th and 9th grade
Sat Apr 25 12:27:00 +0000 2020,Hmmm....,19.48,8.4,16.8,36.62,1,-22.21,-1th and 0th grade
Sat Apr 25 12:26:19 +0000 2020,Ramadan Mubarak to all... Stay home stay safe,5.81,-1.1,2.9,109.72,2,2.2,1st and 2nd grade
Thu Apr 23 13:51:17 +0000 2020,"My fav heroine from Partner ... she s doing a show, pls go catch it ... DoKhiladiProblemBhaari HotstarSpecialsHundred",8.38,13.1,16.0,29.86,1,16.12,15th and 16th grade
Wed Apr 22 18:37:12 +0000 2020,"Praful sirrr, just saw your fitness video... Superb",11.93,5.2,8.5,71.82,1,9.35,8th and 9th grade
Wed Apr 22 10:23:51 +0000 2020,Superb work of supplying 1000 ppe kits for doctors...,9.35,4.4,6.6,79.26,1,8.03,4th and 5th grade
Mon Apr 20 09:32:07 +0000 2020,"Finally hamara YouTube channel shuru ho gaya hai, jaiye aur mera naya gaana dekhen aur enjoy karein. PyaarKarona SaajanSingh StayHome Lockdown NewMusic IndiaFightsCorona",9.7,9.0,14.4,51.34,2,18.08,9th and 10th grade
Mon Apr 20 06:47:41 +0000 2020,"Emotionally paas rahona, physically duurr rahona, aise hi is lockdown tak PyaarKarona Click here to Watch the premiere SaajanSingh StayHome Lockdown IndiaFightsCorona",11.19,15.4,20.6,23.77,1,20.42,14th and 15th grade
Mon Apr 20 05:30:05 +0000 2020,"Emotionally pass raho aur physically duurr raho na PyaarKarona, audio out now StayHome Lockdown NewMusic IndiaFightsCorona",13.31,15.4,18.1,12.94,1,20.88,15th and 16th grade
Sun Apr 19 06:54:13 +0000 2020,"So I m posting from my handle to let you know that tmmrw on my YouTube channel, mine kya It s ours Song out tmrw on it, hope u can handle it. PyaarKaronaOutTomorrow stayhome lockdown newmusic indiafightscorona",8.39,9.3,9.9,61.16,2,9.34,8th and 9th grade
Wed Apr 15 10:03:21 +0000 2020,Setting examples... IndiaFightsCorona,14.31,24.5,35.0,-75.4,1,36.32,24th and 25th grade
Sun Apr 12 09:18:30 +0000 2020,If MPK releases now... Happy Easter Stay focused and stay strong,8.22,4.3,4.4,74.35,2,5.78,5th and 6th grade
Fri Apr 10 13:50:43 +0000 2020,Being taken for a ride...,0.25,2.9,0.9,83.32,1,-0.85,-1th and 0th grade
Thu Apr 09 18:02:02 +0000 2020,Wah Thank u for listening n understanding the gravity of this situation the country is in . God bless n protect each n every 1 . . IndiaFightsCorona,7.41,10.5,7.6,41.87,2,9.21,10th and 11th grade
Sun Apr 05 19:18:02 +0000 2020,Be Home n Be Safe IndiaFightsCorona,6.57,6.8,5.1,56.93,1,8.17,6th and 7th grade
Thu Apr 02 17:51:03 +0000 2020,"Happy bday ... My friend, stay safe...",0.3,2.1,6.7,90.77,1,3.35,2nd and 3rd grade
Mon Mar 30 18:51:09 +0000 2020,Will always love you...,0.2,1.3,4.1,92.8,1,1.45,0th and 1st grade
Sat Mar 21 20:29:46 +0000 2020,IndiaFightsCorona,19.48,43.8,59.1,-217.19,1,53.2,43rd and 44th grade
Tue Mar 17 05:31:16 +0000 2020,"KeepChillingKeepFlipping with me and Slip into Bahamas and get into the fun zone, right now",6.49,6.8,10.2,73.17,1,11.53,6th and 7th grade
Mon Mar 16 14:58:18 +0000 2020,"Ayush n saiee in manjha Tera, sahi hai , good song n both of u looking v good , superb keep it up n keep working , god bless.",7.36,9.9,9.1,70.47,1,3.55,9th and 10th grade
Sat Mar 14 17:39:54 +0000 2020,Happy birthday Laal Singh Chaddha,7.04,5.2,8.4,66.4,1,11.92,1st and 2nd grade
Thu Mar 05 09:39:04 +0000 2020,Aayiye... aur mere saath humaari is daud mein to capture the reality in 64MP realme6 realme6Pro 64MP ProCameraProDisplay,8.04,9.1,14.5,61.67,1,14.67,14th and 15th grade
Wed Feb 26 10:21:06 +0000 2020,PowerMeetsStyle with me and To ho jaiye taiyyar Main lekar aa raha hoon realme6 aur realme6Pro 5th March ko. 64MP ProCameraProDisplay,7.69,9.1,14.4,67.08,1,13.63,7th and 8th grade
Tue Feb 18 18:00:11 +0000 2020,Aa rahe hain hum April mein to b up close n personal with u all ... see u all soon,6.24,6.0,3.7,86.03,1,1.05,5th and 6th grade
Sat Feb 15 06:30:11 +0000 2020,". pe aa gaye hai, swagat nahi karoge humara... Dabangg3",9.35,6.8,7.1,62.34,1,7.39,6th and 7th grade
Mon Feb 10 07:42:10 +0000 2020,"Is Valentine's Day par, single mat bolo, bolo swag se solo. Launching Pepsi's single anthem Swag Se Solo.",9.35,6.8,6.1,62.34,2,7.39,6th and 7th grade
Tue Feb 04 05:30:17 +0000 2020,Hawa se baatein karega singh... HawaSinghBiopic,9.2,4.5,14.5,73.85,1,16.87,4th and 5th grade
Mon Feb 03 12:51:17 +0000 2020,Kicking off the IIFA PresCon in Bhopal today.,6.01,2.9,4.9,88.74,1,7.21,2nd and 3rd grade
Sun Jan 26 10:39:39 +0000 2020,Keep being fit india and wish u all a very Happy Republic Day ...,6.71,7.2,3.9,66.74,1,3.7,6th and 7th grade
Sat Jan 25 12:34:56 +0000 2020,"Very very sorry n saddened to hear of the demise of Vinay ji, producer of a memorable film of mine Andaz Apna Apna. Deepest condolences to the entire family ...",8.71,8.9,7.1,56.76,2,7.3,8th and 9th grade
Sat Jan 18 09:22:27 +0000 2020,"Aaj ki taaza khabar.... Hamara Being Strong Gym equipment has been supplied to more then 500 gyms in India and across the world. And our Gym Franchise SK 27 is also spreading fast, opening 10 franchise gyms in next one month SK27Gym",7.34,5.2,7.0,82.65,3,7.65,5th and 6th grade
Sun Jan 12 13:57:00 +0000 2020,Ouiii ma .... jhakaas trailer AdityaRoyKapur,13.36,10.0,17.8,32.56,1,18.88,9th and 10th grade
Sun Jan 12 11:43:56 +0000 2020,"Mumbaikars, aa gaya hai SwachhSurvekshan2020Mumbai poll. Swagat to karo Mumbai ka par jaao aur Mumbai ke liye vote karo AnythingForMumbai",8.08,7.2,11.4,61.33,2,14.88,7th and 8th grade
Fri Jan 10 08:13:14 +0000 2020,Announcing my next film... KABHI EID KABHI DIWALI .... STORY amp PRODUCED BY SAJID NADIADWALA ... DIRECTED by FARHAD SAMJI... EID 2021 ... SajidNadiadwala,9.16,8.9,10.6,40.72,4,10.36,8th and 9th grade
Thu Jan 09 05:01:26 +0000 2020,Best wishes for the film HimeshReshammiya Raka SabitaManakchand,11.93,8.8,15.5,46.44,1,20.95,8th and 9th grade
Sat Jan 04 06:46:04 +0000 2020,All the best for the movie .... check it out . . rinkurajguru,5.71,7.2,6.6,61.33,1,6.18,6th and 7th grade
Fri Dec 27 15:45:30 +0000 2019,"Ayat k aane ki double khushi me, aapke liye Being Human Clothing sale 2 more days k liye 2712",7.07,7.2,6.7,77.57,1,5.28,6th and 7th grade
Fri Dec 27 12:57:40 +0000 2019,"Welcome to this beautiful world Ayat. Thank u Arpita n Ayush for the best birthday gift for the whole family. May everyone who reads this bless her n may she grow up n make everyone proud. Thank u for all the love n respect. You all have been very kind, thank u thank u thank u",5.04,2.9,2.8,93.95,5,4.04,4th and 5th grade
Fri Dec 27 07:10:52 +0000 2019,"Humaari movie toh logo'n ke dilon tak pahunch gayi hai. Mr. Salman Khan, ab hum apko apke handles vapas karte hain HappyBirthdaySalman Aur agar humein milna hai toh ticket book kijiye BMS Paytm",8.76,7.4,9.8,71.65,2,10.03,7th and 8th grade
Thu Dec 26 09:36:23 +0000 2019,"Thank you Mumbaikars, for joining us each day to inch closer to the SwachhMumbai of our dreams. Thousands of our SwachhataWarriors work relentlessly to make Mumbai clean, healthy, beautiful amp sustainable. To get there we're committed to do AnythingforMumbai",8.73,8.4,11.8,58.28,3,13.79,11th and 12th grade
Wed Dec 25 07:33:50 +0000 2019,"Christmas ko banao aur bhi special with our film Dabangg3, now in cinemas Book Tickets Now On BMS Paytm",8.73,8.3,9.1,69.11,1,8.36,8th and 9th grade
Tue Dec 24 14:50:43 +0000 2019,"Christmas ke mauke par, aap sabhi ke liye ek surprise. Aap sabhi ko Merry Christmas ChristmasWithChulbul Book Tickets Now On BMS Paytm",6.34,6.4,8.3,68.77,2,10.83,5th and 6th grade
Sat Dec 21 07:36:40 +0000 2019,"Dabangg ka swag, dabangg ki Pepsi swagstepchallenge swagattohkarohumaraswagse harghoontmeinswag Dabanng3",13.61,15.5,28.3,2.11,1,35.76,15th and 16th grade
Fri Dec 20 13:01:41 +0000 2019,"Humaare HabibiKeNain, kaabil e taareef",16.52,7.6,13.1,49.48,1,16.56,16th and 17th grade
Fri Dec 20 10:41:58 +0000 2019,Humaare is Pandey level dialogue ke saath Dabangg 3 ab hui apki. Aapke nazdeeki cinemagharon me dhamaal macha rahi hai Dabangg3InCinemas Book Tickets Now On BMS Paytm,9.57,7.4,9.8,66.23,2,12.0,9th and 10th grade
Fri Dec 20 05:33:34 +0000 2019,"Le aaye aap sabhi ke liye humaari picture 'Dabangg 3'. Hume kya dekh rahe ho, jaake film dekho Dabangg3InCinemas Book Tickets Now On BMS Paytm",8.05,5.8,7.1,75.71,2,8.28,5th and 6th grade
Thu Dec 19 08:36:58 +0000 2019,Aa rahe hain kal humari Rajjo ke saath lekar saal ka sabse bada tohfa aap sabhi ke liye. Swaagat toh karo humaara 1DayToDabangg3 Book Tickets Now On BMS Paytm,10.35,7.8,6.9,65.22,2,7.94,7th and 8th grade
Thu Dec 19 06:10:37 +0000 2019,"Hum aur humari Khushi, lekar aaye h humare romance ka fasaana Awara",8.18,4.4,6.6,84.68,1,8.4,4th and 5th grade
Wed Dec 18 09:32:42 +0000 2019,"Humaari is bade se dil ka bada sa hissa, humaari super sexy habibi Rajjo. Milte hain 20 December ko apke nazdeekhi cinema mein. 2DaysToDabangg3",8.84,6.8,8.1,67.76,2,10.14,8th and 9th grade
Wed Dec 18 06:31:34 +0000 2019,"Aapko kya laga, Hum aapko ek hi task deke kaam khatam karenge Abhi to khel shuru hua hai Abhi to mazza aayega BeLikeChulbul",8.9,9.9,10.7,65.05,1,8.25,8th and 9th grade
Tue Dec 17 06:40:35 +0000 2019,"Humaare dialogues bolna itna bhi asaan nahi h, Aazmaana chahenge apne aap ko Tohfa intezaar kar raha h SayItLikeChulbul",13.72,11.9,13.1,43.73,1,13.23,11th and 12th grade
Mon Dec 16 10:39:27 +0000 2019,In Chennai for promotions Dabangg3,13.36,10.0,9.3,32.56,1,13.08,9th and 10th grade
Mon Dec 16 08:34:41 +0000 2019,King of romance Shah Rukh Khan ya hum Khushi ke dil ki baat samajhana itna easy bhi nahi hai... 4DaysToDabangg3,7.79,7.6,10.2,76.56,1,8.53,7th and 8th grade
Mon Dec 16 05:32:00 +0000 2019,Ek chota sa surprise hai aap sab ke liye. Milo kal 12 baje humaare Instagram pe Dabangg3SurpriseTomorrow,9.63,9.0,7.2,45.93,2,10.34,8th and 9th grade
Sun Dec 15 06:36:03 +0000 2019,Intezaar khatam Book karo 'Dabangg3' ki tickets turrant 5DaysToDabangg3 Book Tickets Now On BMS Paytm,9.64,9.1,13.4,56.25,1,15.01,9th and 10th grade
Sat Dec 14 14:40:20 +0000 2019,Dabangg3 Promotions,19.53,20.6,22.0,-49.0,1,21.6,21st and 22nd grade
Sat Dec 14 10:47:01 +0000 2019,Aa rahe hain hum lagaane action ka tadka. Taiyaar rahiye 6DaysToDabangg3,11.09,5.4,7.9,65.89,2,11.06,5th and 6th grade
Wed Dec 11 08:32:28 +0000 2019,"Bali Singh jaise villain se bhidne ka alag hi mazaa hai, takkar is baar zabardast hogi BeingChulbul",8.19,6.4,10.1,79.6,1,10.38,8th and 9th grade
Wed Dec 11 05:34:38 +0000 2019,Apne andar ke Chulbul Pandey ko jagaao with the special 'Dabangg 3' filters BeingChulbul,13.35,8.8,10.8,57.27,1,12.35,8th and 9th grade
Sun Dec 08 17:25:16 +0000 2019,"Katrina and I, with the Hon. Prime Minister Sheikh Hasina.. it was a pleasure and honour to have met such a beautiful lady . . .",6.95,7.8,5.4,59.8,2,5.72,6th and 7th grade
Fri Dec 06 10:32:32 +0000 2019,"Dekhiye maasoom si Khushi ka beautiful sa gaana, NainaLade",5.84,3.3,9.3,87.72,1,12.5,3rd and 4th grade
Sat Nov 30 16:05:08 +0000 2019,"Humaare dil se ye tohfaa aap sab keliye Jao, or dekho ki MunnaBadnaamHuapar kaise",8.84,6.4,8.5,74.19,1,9.91,8th and 9th grade
Sat Nov 30 12:24:44 +0000 2019,2 2 ..n their family go through this extreme agony n loss as this has to be stopped. Let betii bachao not be just a campaign. This is the time to let these demons know that v all stand together. May Priyanka s soul rest in peace JusticeForPriyankaReddy,5.55,3.3,4.7,93.14,4,6.02,5th and 6th grade
Sat Nov 30 12:24:44 +0000 2019,"JusticeForPriyankaReddy These r the worst kind of shaitans disguised in the human form The pain, torture n death of innocent women like nirbhaya n Priyanka Reddy should now get us together n put an end to such shaitans who live among us, before any other innocent woman... 1 2",8.97,20.0,25.0,38.66,1,10.0,19th and 20th grade
Sat Nov 30 08:40:57 +0000 2019,"Taiiyyar ho jao saal ke sabse zabardast event k liye, live Aate hain... MunnaBadnaamHuaOutToday",8.84,7.6,13.2,65.73,1,14.43,7th and 8th grade
Thu Nov 28 10:53:48 +0000 2019,Aa rahe hain bahut jald with the most badass song 'Munna Badnaam Hua'... MunnaBadnaamHuaTeaser,7.71,6.4,12.8,74.19,1,13.62,6th and 7th grade
Fri Nov 22 12:43:19 +0000 2019,Dancing with special children of Umang in Jaipur yu karke,5.71,3.7,6.2,86.71,1,9.08,3rd and 4th grade
Fri Nov 22 06:32:35 +0000 2019,"Ye karo, wo karo, Sab karo,do whatever u want to do man lekin karo YuKarke",5.43,5.6,4.9,81.63,1,4.17,5th and 6th grade
Fri Nov 22 04:30:36 +0000 2019,"Dabangg 3 ke gifs dekhiye par. Search karo 'Dabangg 3' Instagram, TikTok aur Snapchat par aur banao chats ko superfun.",8.87,4.8,6.9,78.25,2,8.5,4th and 5th grade
Wed Nov 20 06:02:10 +0000 2019,Tanhaji manaji.. Ajay vijay bhava vijay bhava vijay bhava . . .,11.1,15.1,10.3,3.12,1,11.22,10th and 11th grade
Thu Nov 14 15:13:35 +0000 2019,Happy children s day today and every day . .,0.4,8.8,3.2,46.44,1,4.31,3rd and 4th grade
Thu Nov 14 08:31:01 +0000 2019,"HudHudDabangg pehle sunaya, aaj dikha bhi raha hun. Yakeen hai ke swagat karoge aap.",8.5,3.7,5.9,81.29,2,8.24,5th and 6th grade
Wed Nov 13 11:05:56 +0000 2019,"Ye raha 'Dabangg 3' Jukebox, ab saare gaano'n ka mazaa lo ek saath Dabangg3Jukebox",8.84,6.4,8.8,74.19,1,9.04,8th and 9th grade
Wed Nov 13 07:19:23 +0000 2019,"Nain jiske hain farebi, gaana unka jo hain humaari, 'Habibi'. HabibiKeNain",9.92,5.2,11.5,77.23,1,12.62,4th and 5th grade
Tue Nov 12 11:58:27 +0000 2019,"Pehle ishq ki baat hi kuch aur hoti hai. Suno Dabangg 3 ka naya gaana, 'Awara'. AwaraSong",5.92,0.7,3.0,105.15,2,3.85,3rd and 4th grade
Tue Nov 12 06:30:12 +0000 2019,"Hum chup hain, intezaar mein sahi counter ke. Aur humein poora bharosa hai ki aap humein denge, ek jabardast counter. Dabangg3BadassDialogue",7.16,5.0,10.7,77.74,2,13.26,4th and 5th grade
Mon Nov 11 12:52:11 +0000 2019,"Kamaal Khan ki aawaaz, Badshah ka rap aur Chulbul ki dabanggayi suniye MunnaBadnaamHua",10.35,7.2,11.9,66.74,1,14.43,6th and 7th grade
Sun Nov 10 05:30:08 +0000 2019,Congratz daisy on a good clean child friendly sporting teaser of Gujarat11 . . Gujarat11 OfficialTeaser 29thNovember JJCreations ProlifeEntertainment HGPictures,11.98,13.9,19.9,11.58,2,25.72,11th and 12th grade
Sat Nov 09 09:36:33 +0000 2019,"'Dabangg 3' ka naya gaana, 'Yu Karke', suno humaari yaani ki Chulbul Pandey ki aawaaz mein YuKarkeSong",7.27,5.2,10.9,88.06,1,9.74,6th and 7th grade
Thu Nov 07 12:15:50 +0000 2019,Best wishes to not just a superstar.. The only superstar Rajni garu in full motion DarbarMotionPoster DARBAR Nayanthara DarbarThiruvizha,10.76,9.4,12.6,44.91,2,16.38,10th and 11th grade
Thu Nov 07 08:18:34 +0000 2019,Yeh hai hamara romantic andaaz... suniye aur maze lijiye with Naina Lade ... NainaLadeDabangg3 SajidWajid,11.1,11.1,16.2,40.35,1,17.33,10th and 11th grade
Mon Nov 04 13:20:50 +0000 2019,RadheEid2020 . . . Day 1,9.05,17.4,9.9,-24.64,1,5.35,9th and 10th grade
Fri Nov 01 09:15:54 +0000 2019,And the journey begins . . . RadheEid2020,10.2,14.7,13.1,-1.29,1,14.24,14th and 15th grade
Thu Oct 31 10:31:27 +0000 2019,Dabangg3,19.48,20.2,16.8,-47.99,1,1.0,0th and 1st grade
Thu Oct 31 10:01:26 +0000 2019,Dabangg3,19.48,20.2,16.8,-47.99,1,1.0,0th and 1st grade
Thu Oct 31 09:35:00 +0000 2019,HUD HUD Dabangg Dabangg Dabangg 50DaysToDabangg3 SajidWajid ShababSabri,11.93,14.7,20.3,4.14,1,26.75,14th and 15th grade
Thu Oct 31 09:01:35 +0000 2019,Dabangg3,19.48,20.2,16.8,-47.99,1,1.0,0th and 1st grade
Thu Oct 24 05:33:25 +0000 2019,What a stylish teaser Very happy to launch HeroTeaser All the best to u and team Hero,6.34,5.2,6.2,88.06,1,5.97,5th and 6th grade
Wed Oct 23 14:24:45 +0000 2019,", , 3 Dabangg3TeluguTrailer GlobalCinemasLLP",14.31,36.3,42.9,-160.0,1,47.92,-1th and 0th grade
Wed Oct 23 14:07:43 +0000 2019,3 3 Dabangg3TamilTrailer,9.05,17.4,14.6,-24.64,1,16.95,14th and 15th grade
Wed Oct 23 13:47:38 +0000 2019,", 3 3 Dabangg3KannadaTrailer",9.05,24.5,19.3,-75.4,1,20.83,24th and 25th grade
Wed Oct 23 12:30:28 +0000 2019,Here it is...Pls take out time from your busy schedule and watch 3 mins of 'Dabangg 3' Dabangg3Trailer,7.16,8.0,9.8,70.13,1,8.18,7th and 8th grade
Tue Oct 22 08:46:24 +0000 2019,Hamari pure innocent masoom Khushi... Dabangg3TrailerOutTomorrow,11.83,18.6,27.9,-27.68,1,33.28,18th and 19th grade
Tue Oct 22 08:31:20 +0000 2019,Dabangg3TrailerOutTomorrow,19.48,79.2,101.5,-470.99,1,105.4,-1th and 0th grade
Mon Oct 21 11:26:22 +0000 2019,Aaj boss buss vote karo . . VoteKarMaharashtra,6.57,8.0,12.2,48.47,1,14.95,7th and 8th grade
Mon Oct 21 06:45:15 +0000 2019,Hindustani sabhyata ki chakki se bani hamaari super sexy Rajjo... 2DaysToDabangg3Trailer,12.79,14.7,17.5,9.55,1,21.09,14th and 15th grade
Mon Oct 21 06:30:45 +0000 2019,2DaysToDabangg3Trailer,19.48,55.6,82.7,-301.79,1,82.2,82nd and 83rd grade
Sun Oct 20 10:30:55 +0000 2019,Too much fun is on its way Dubai on 8 Nov at Coca Cola Arena. See you all there Book your tickets bhaiindubai,7.64,4.2,2.1,85.18,2,3.23,5th and 6th grade
Sun Oct 20 05:33:20 +0000 2019,"World TV Premiere of Bharat, tonight at 8PM on KatrinaKaif BharatOnZeeCinema SeeneMeinCinema ZeeCinema",10.35,11.9,17.7,32.9,1,21.56,17th and 18th grade
Sat Oct 19 15:23:56 +0000 2019,"One man changed our entire nation. His thoughts, his legacy will forever live on. Honouring 150 years of Gandhiji ChangeWithin",9.5,5.9,7.1,64.67,3,9.92,9th and 10th grade
Fri Oct 18 12:40:31 +0000 2019,Aap he ne poocha tha 'Dabangg 3' ke baad kya What and when Yeh lo answer EidRadheKi,6.34,6.4,5.6,79.6,1,4.58,5th and 6th grade
Thu Oct 17 07:45:08 +0000 2019,"Mazza aa gaya trailer dekh ke Chaa gaya hai humara Satellite, SatelliteShankar trailer IrfanKamal",11.1,8.8,13.8,57.27,1,16.52,8th and 9th grade
Sat Oct 12 11:07:53 +0000 2019,Trailer kaafi kamaal h Bhai ne bola aapko best wishes dene ko All the best,9.64,5.6,4.9,81.63,1,5.33,5th and 6th grade
