created_at,text,dale_chall_readability_score,flesch_kincaid,automated_readability,flesch_reading,sentence_count,coleman_liau_index,based_on_all_algorithms
Thu Mar 01 23:46:48 +0000 2012,Kansas City...Welcome to Club Paradise,10.2,7.6,13.1,49.48,1,14.24,7th and 8th grade
Thu Mar 01 07:48:13 +0000 2012,More chains than Busta...and more hoes than Usher.,7.98,2.9,7.9,88.74,1,8.66,2nd and 3rd grade
Thu Mar 01 06:53:23 +0000 2012,Tell you one thing about the new kids...all they wanna do is get money and party...that's the move...natural move.,6.24,8.3,11.9,69.11,1,8.65,8th and 9th grade
Thu Mar 01 05:32:08 +0000 2012,Just bought the WZRD album...about to have it playing from Oklahoma City to Kansas,8.84,6.4,8.8,74.19,1,9.45,8th and 9th grade
Thu Mar 01 04:04:32 +0000 2012,Ahhh man those two little girls swagged so hard on The Motto.,6.86,4.4,4.2,84.68,1,5.5,4th and 5th grade
Tue Feb 28 13:59:22 +0000 2012,With the cameras out...POV,7.78,3.7,7.7,75.88,1,5.8,7th and 8th grade
Tue Feb 28 13:59:11 +0000 2012,And you're so obsessed,7.78,1.3,2.9,92.8,1,2.9,2nd and 3rd grade
Mon Feb 27 05:35:42 +0000 2012,Club Paradise Tour Pics by up on,6.24,0.1,-0.6,106.67,1,1.57,-1th and 0th grade
Sun Feb 26 20:29:36 +0000 2012,Players Club,11.63,2.9,5.5,77.91,1,1.3,-1th and 0th grade
Sun Feb 26 08:57:39 +0000 2012,Maaaaan you always know the night is official when my brother is here,5.5,4.8,5.7,83.66,1,7.24,5th and 6th grade
Sun Feb 26 07:41:54 +0000 2012,NOLA...Come to Harrah's and see ya roooound,8.5,3.7,7.0,81.29,1,7.37,3rd and 4th grade
Sat Feb 25 06:41:12 +0000 2012,Husher Raymond,19.53,8.8,10.2,35.61,1,7.1,-1th and 0th grade
Sat Feb 25 00:42:22 +0000 2012,Tallahassee...Welcome to Club Paradise.,11.73,13.1,23.0,8.2,1,23.2,11th and 12th grade
Fri Feb 24 11:32:38 +0000 2012,Miscommunication throughout the nation.,15.68,19.0,23.0,-34.11,1,27.55,18th and 19th grade
Thu Feb 23 00:13:40 +0000 2012,You lucky I can't draw.,0.25,-1.9,-1.1,117.16,1,-2.01,1st and 2nd grade
Wed Feb 22 19:33:54 +0000 2012,Kentucky...Welcome to Club Paradise.,11.73,13.1,19.4,8.2,1,18.85,1st and 2nd grade
Sun Feb 19 06:41:18 +0000 2012,Word around town is we Boomin',0.3,-1.5,1.2,116.15,1,2.37,1st and 2nd grade
Sat Feb 18 17:53:01 +0000 2012,Columbus...Welcome to Club Paradise.,11.73,7.2,19.4,50.5,1,18.85,1st and 2nd grade
Sat Feb 18 16:54:38 +0000 2012,Praying for my homegirl Tip Drill one time.,7.98,2.9,3.8,88.74,1,5.76,2nd and 3rd grade
Sat Feb 18 01:21:50 +0000 2012,Nashville...Welcome to Club Paradise.,11.73,3.7,20.6,75.88,1,20.3,20th and 21st grade
Fri Feb 17 05:57:27 +0000 2012,My bath tub lift up...my walls do a 360...,0.45,0.9,0.9,104.64,1,-1.03,0th and 1st grade
Fri Feb 17 04:38:54 +0000 2012,Happy Birthday to The Weeknd. True blessing to know you and be on the same team. OVOXO,0.42,1.9,2.2,96.69,2,3.85,3rd and 4th grade
Fri Feb 17 04:35:45 +0000 2012,Just fyi...we are all on a college tour going to the schools that booked us...wish we could touch down everywhere.,0.99,7.6,10.9,76.56,1,8.24,7th and 8th grade
Thu Feb 16 00:25:21 +0000 2012,Gainesville...Welcome to Club Paradise.,7.78,3.7,23.0,75.88,1,23.2,22nd and 23rd grade
Tue Feb 14 20:11:10 +0000 2012,Miami...welcome to Club Paradise.,11.73,9.6,15.9,33.58,1,14.5,11th and 12th grade
Mon Feb 13 05:59:36 +0000 2012,Club Paradise starts on Tuesday...ASAP OVO TDE SFCB Mobbed out...that's all I care about.,6.59,5.2,11.1,82.65,1,10.32,5th and 6th grade
Mon Feb 13 04:39:46 +0000 2012,Pop down.,0.1,-3.1,-1.7,120.21,1,-10.31,-1th and 0th grade
Sun Feb 12 07:03:11 +0000 2012,There you go again starting wars making me more yours.,5.71,2.5,4.8,95.17,1,6.76,3rd and 4th grade
Sun Feb 12 01:13:29 +0000 2012,RIP Whitney Houston.,14.31,5.6,8.3,59.97,1,7.32,0th and 1st grade
Sun Feb 12 01:05:00 +0000 2012,I am not at the playboy mansion tonight False advertising...Cash Money party over everything.,7.71,9.9,12.5,48.81,1,13.62,7th and 8th grade
Sat Feb 11 02:54:04 +0000 2012,My ONLY party this weekend is Greystone Manor Me and DJ'ing...Voodoo Child Sound.,6.71,4.8,10.1,83.66,1,10.37,5th and 6th grade
Thu Feb 09 12:53:29 +0000 2012,No time to get down this ain't no la di da...but I ain't never fucked wit' a menage a trois...It's three like the stripes on the a di das,1.44,7.5,10.8,92.8,1,3.09,7th and 8th grade
Thu Feb 09 12:49:06 +0000 2012,I wrote many verses girl...many lines about you and me...us together,5.62,5.2,8.9,77.23,1,8.97,5th and 6th grade
Wed Feb 08 03:23:25 +0000 2012,Her man say she very special...but drizzy drake a di only man she wannnn,5.46,4.0,5.4,91.11,1,5.33,5th and 6th grade
Sun Feb 05 03:43:04 +0000 2012,Why is YG I'm Good not up for a Grammy Love that fuckin song.,5.46,2.9,1.7,99.57,1,1.21,5th and 6th grade
Sat Feb 04 23:37:48 +0000 2012,Somehow destroyed my phone...and lost everything. Very unrighteous.,7.98,10.0,17.9,37.98,1,20.26,7th and 8th grade
Thu Feb 02 22:55:57 +0000 2012,Tour starts Feb 14th...The Motto went platinum...my pool is heated to 91 degrees. Living life not giving a fuck. OVOXO A AP TDE...CLUB P,6.66,2.9,4.8,88.74,3,5.0,2nd and 3rd grade
Wed Feb 01 22:54:35 +0000 2012,Champagne Papi,19.53,8.8,10.2,35.61,1,7.1,-1th and 0th grade
Mon Jan 30 05:43:49 +0000 2012,Happy Bornday to my brother call the brinks truck,5.84,3.3,4.5,87.72,1,7.39,3rd and 4th grade
Mon Jan 30 00:42:41 +0000 2012,Thanks to everybody at NHL for an amazing night All the players that showed love and all the fans I got Gino's game stick,6.8,7.9,9.8,80.96,1,6.45,9th and 10th grade
Tue Jan 24 05:02:19 +0000 2012,YM Bitch...Errrryday. Two times on Sunday.,6.57,4.5,10.6,73.85,1,10.08,6th and 7th grade
Fri Jan 20 05:50:07 +0000 2012,Haaaaaaa. I died doggy.,7.78,1.3,4.1,92.8,1,2.9,0th and 1st grade
Tue Jan 17 10:39:24 +0000 2012,One of my favorite producers I ever worked with just dropped his album...,6.71,6.0,7.2,75.2,1,7.7,6th and 7th grade
Mon Jan 16 05:39:52 +0000 2012,Baby girl.,11.63,2.9,0.8,77.91,1,-7.41,-1th and 0th grade
Sun Jan 15 12:09:47 +0000 2012,Please make your long stories shorter...,6.57,2.1,9.0,90.77,1,10.08,1st and 2nd grade
Sun Jan 15 09:08:54 +0000 2012,I don't have an addictive personality...but I'm hooked on it.,7.29,8.4,8.1,52.87,1,7.92,7th and 8th grade
Fri Jan 13 03:02:47 +0000 2012,Watching rehearse today made me angry I'm gonna miss Coachella.,8.87,6.0,9.0,69.79,1,11.4,8th and 9th grade
Thu Jan 12 08:01:06 +0000 2012,I'm tryna put platinum eyebrows on these hoes,9.95,4.1,4.9,80.28,1,7.21,4th and 5th grade
Sun Jan 08 05:08:53 +0000 2012,Happy B Day to my real brother Up...Tunn Up...Reps Up.,0.5,6.0,4.8,69.79,1,3.28,3rd and 4th grade
Fri Jan 06 21:32:34 +0000 2012,really goes off on Triple Beam.,0.3,2.1,2.0,90.77,1,3.35,2nd and 3rd grade
Fri Jan 06 20:20:52 +0000 2012,The Bay knows its love and respect for the culture always.,7.05,4.0,4.6,85.69,1,6.3,4th and 5th grade
Fri Jan 06 20:20:27 +0000 2012,Only reason I changed that lyric on new years is cause I had a whole group of people on my left from LA all out in NY.,1.34,7.9,8.1,86.37,1,2.56,7th and 8th grade
Fri Jan 06 19:33:27 +0000 2012,YMCMB and Double M we RICH FOREVER.,8.5,6.0,1.6,64.37,1,3.26,8th and 9th grade
Mon Jan 02 10:53:32 +0000 2012,Vegas turrrrnt up. OVOXO all I know.,8.32,1.1,0.5,93.3,2,-1.19,0th and 1st grade
Sun Jan 01 00:54:32 +0000 2012,Thanks to everyone who showed love in 2011. Tomorrow I want nothing to change...we are on the right path.,0.47,3.5,4.9,87.21,2,6.0,3rd and 4th grade
Tue Dec 27 05:39:25 +0000 2011,I ask Yo cj do they have chicken burgers ...To which he replies they might do jacksonmisissippi,6.34,7.6,9.0,71.14,1,8.35,8th and 9th grade
Sun Dec 25 01:45:45 +0000 2011,that tape tho mayne...disrespectful...and much needed.,9.2,8.0,20.1,48.47,1,19.77,19th and 20th grade
Sat Dec 24 05:19:34 +0000 2011,Dj Khaled's grammy speech will be fucking amazing...,9.95,4.1,9.1,80.28,1,10.11,9th and 10th grade
Sat Dec 24 03:41:05 +0000 2011,Rich Forever.,11.63,8.8,7.8,35.61,1,1.3,11th and 12th grade
Thu Dec 22 18:06:08 +0000 2011,Trilogy complete.,19.53,14.7,17.3,-6.7,1,12.9,12th and 13th grade
Tue Dec 20 10:45:27 +0000 2011,Platinum. Luv.,11.63,2.9,10.2,77.91,1,1.3,-1th and 0th grade
Sat Dec 17 20:13:16 +0000 2011,Somebody is playing games on here...stand by.,6.24,6.0,8.3,64.37,1,9.06,5th and 6th grade
Sat Dec 17 00:39:26 +0000 2011,"Me, Cole, and Sean tonight...bare witness.",6.57,2.1,10.6,90.77,1,9.15,1st and 2nd grade
Thu Dec 15 10:51:32 +0000 2011,snapped on The Ride. Crazy.,0.25,-1.9,2.7,117.16,1,2.64,2nd and 3rd grade
Mon Dec 12 16:31:15 +0000 2011,I'm 22 with 10 in so there that go. You hear that flow Drove the underground wacko,4.99,0.7,1.1,105.15,2,2.46,0th and 1st grade
Mon Dec 12 16:25:57 +0000 2011,Y'all know y'all can't touch us...I flow luscious...it's so real I make her hop out and get the dutches,6.24,6.0,9.1,86.03,1,5.63,5th and 6th grade
Sat Dec 10 14:03:49 +0000 2011,El Clasico,11.63,8.8,0.8,35.61,1,-4.51,0th and 1st grade
Thu Dec 08 06:21:51 +0000 2011,In Amsterdam on a jet ski wave...word to Sneaky,5.84,4.4,3.5,79.26,1,4.14,3rd and 4th grade
Wed Dec 07 11:59:03 +0000 2011,Leaving for Africa. Love.,0.2,1.3,6.5,92.8,1,5.8,0th and 1st grade
Wed Dec 07 11:58:00 +0000 2011,Word on road is we saw him and he froze...you ain't gotta run and tell nobody they already know.,5.41,6.0,7.4,86.03,1,4.99,5th and 6th grade
Wed Dec 07 10:45:56 +0000 2011,Lean till I fall...I don't give a damn...I've felt the ground before.,0.6,3.3,7.3,93.14,1,5.5,4th and 5th grade
Tue Dec 06 08:32:41 +0000 2011,One night in the club sent me 30 waters with mad sparklers...and gave me the Ace Of Spades Rose Magnum nod as it showed up.,6.14,7.1,9.7,88.4,1,5.06,9th and 10th grade
Tue Dec 06 08:26:20 +0000 2011,Good is always a good thing.,0.3,0.9,-0.5,99.23,1,0.45,-1th and 0th grade
Tue Dec 06 08:26:20 +0000 2011,Good is always a good thing.,0.3,0.9,-0.5,99.23,1,0.45,-1th and 0th grade
Thu Dec 01 21:55:50 +0000 2011,Boston where we at tonight My first night off in a while.,5.55,2.1,2.6,101.6,1,3.58,4th and 5th grade
Wed Nov 30 16:58:44 +0000 2011,Das why people haffi rate me all when dem hate me...cause me always be me. Kartel,6.4,6.0,6.0,80.62,1,4.93,5th and 6th grade
Wed Nov 30 16:20:24 +0000 2011,New levels. New devils. New jacket. New medals.,7.98,4.1,6.1,80.28,1,6.45,5th and 6th grade
Sun Nov 27 06:25:24 +0000 2011,In the bay area...love it out here.,0.35,0.1,1.6,106.67,1,0.76,-1th and 0th grade
Sat Nov 26 14:18:16 +0000 2011,FINALLY NBA is back. Meaning I get to kick it with Uncle Wes...and also see random overly attractive women. This is a good thing.,6.66,5.2,3.4,71.82,3,4.54,4th and 5th grade
Sat Nov 26 02:28:39 +0000 2011,Happy bornday my brother I wish I could be there YMCMB OVOXO MMG RICH FOREVER,7.54,6.8,5.9,73.17,1,6.49,6th and 7th grade
Fri Nov 25 03:04:07 +0000 2011,CARE. Can't wait to hear this tonight.,0.35,-1.2,3.6,115.13,1,4.07,2nd and 3rd grade
Thu Nov 24 03:34:35 +0000 2011,The Motto video this weekend. OVOXO and YM in the Bay.,6.78,0.7,0.2,99.73,2,1.03,0th and 1st grade
Wed Nov 23 00:16:43 +0000 2011,I can't even find the words to express my appreciation... thank you and I owe you is all that comes to mind...truly.,6.16,8.3,9.9,74.53,1,5.63,5th and 6th grade
Sat Nov 19 12:42:36 +0000 2011,Who can I trust in 2012 No one not even myself.,0.55,1.7,-0.2,102.61,1,0.5,0th and 1st grade
Sat Nov 19 12:20:21 +0000 2011,You awlready know. I wish they'd just let young niggas live...respect always.,7.88,2.1,7.5,90.77,2,8.17,7th and 8th grade
Tue Nov 15 06:15:27 +0000 2011,Best Buy NYC Tommorow...see you there.,6.57,0.9,7.5,99.23,1,7.18,6th and 7th grade
Tue Nov 15 06:15:10 +0000 2011,THE ALBUM IS OUT I'm on a high.,6.01,0.5,-3.4,105.66,1,-3.71,2nd and 3rd grade
Tue Nov 15 06:14:22 +0000 2011,Thank you to everyone that came out to HMV today in Toronto 6 hours of signing the same name lol...cause I love ya'll like that.,6.14,8.3,10.7,79.94,1,5.98,5th and 6th grade
Sun Nov 13 10:40:52 +0000 2011,I can't call you followers because you are all individuals...but I appreciate the fact I hit 4 million.,7.16,11.5,10.1,44.75,1,8.52,11th and 12th grade
Sat Nov 12 14:55:36 +0000 2011,Cleveland...I'm up early on my egg whites and OJ shit. So ready for tonight.,5.11,0.1,3.3,106.67,2,3.66,2nd and 3rd grade
Thu Nov 10 07:11:15 +0000 2011,Despite all that is occuring on campus...I cannot wait to be part of the GREATNESS that is Penn State tmrw...rest well my friends.,8.21,8.7,12.2,73.51,1,8.48,8th and 9th grade
Thu Nov 10 06:52:52 +0000 2011,Happy Bday to my brother,0.25,2.9,-0.2,83.32,1,1.48,1st and 2nd grade
Wed Nov 09 07:30:16 +0000 2011,I run the game but the ladies think I'm running game,0.55,1.7,2.1,102.61,1,3.17,1st and 2nd grade
Tue Nov 08 06:20:29 +0000 2011,Send the haters all my love...x and o,0.4,-0.8,0.2,114.12,1,-0.05,-1th and 0th grade
Tue Nov 08 03:07:55 +0000 2011,I am the lightskin vs. Dizaster coming soon...craziest battle...thank you and the whole KOTD for that night.,6.84,4.2,8.3,79.77,2,9.3,3rd and 4th grade
Tue Nov 08 01:42:15 +0000 2011,A little old school playa never hurt...RIP Static,6.01,5.2,7.3,71.82,1,8.66,6th and 7th grade
Mon Nov 07 04:14:23 +0000 2011,"Listen, enjoy it, buy it if you like it...and take care until next time.",0.69,4.0,5.4,91.11,1,4.11,5th and 6th grade
Mon Nov 07 04:13:17 +0000 2011,I am not sure if the album leaked. But if it did thank god it doesn't happen a month early anymore.,5.66,2.7,1.5,94.66,2,2.24,2nd and 3rd grade
Mon Nov 07 00:40:49 +0000 2011,Headed to Flow. Feels so good to be home.,5.61,-1.0,-2.0,109.21,2,-2.37,-3th and -2th grade
Sat Nov 05 18:17:25 +0000 2011,Clashing,19.48,8.4,16.8,36.62,1,1.0,-1th and 0th grade
Sat Nov 05 07:54:23 +0000 2011,Cris we on that. Timbs we on that.,0.2,-2.3,-3.6,118.18,2,-5.06,-1th and 0th grade
Thu Nov 03 05:44:01 +0000 2011,put me up on YOLO...pay homage.,0.3,0.9,2.0,99.23,1,0.45,1st and 2nd grade
Thu Nov 03 02:13:02 +0000 2011,Cindy Crawford on my flight to NY looking like she just turned 21. Yes.,6.59,2.9,5.1,99.57,1,5.33,5th and 6th grade
Wed Nov 02 22:41:55 +0000 2011,Vice Versa g,9.05,0.9,-4.3,93.81,1,-6.26,0th and 1st grade
Wed Nov 02 19:21:48 +0000 2011,Throw em a bone and they want a steak.,0.45,-0.4,-1.3,113.1,1,-0.39,-1th and 0th grade
Tue Nov 01 05:16:56 +0000 2011,We back on,0.15,-2.7,-7.5,119.19,1,-10.09,0th and 1st grade
Tue Nov 01 03:03:06 +0000 2011,OVOXO Power 106 TAKEOVER Toronto boys in LA. Let's gooooo,5.71,2.5,6.2,95.17,1,7.92,3rd and 4th grade
Tue Nov 01 01:45:57 +0000 2011,Me and Power 106 Halloween night takeover...LA,6.24,3.7,9.0,81.29,1,10.74,2nd and 3rd grade
Mon Oct 31 07:20:53 +0000 2011,The Motto,11.63,2.9,-1.7,77.91,1,-7.41,-1th and 0th grade
Sat Oct 29 12:53:42 +0000 2011,Do you know where I can purchase an OVOXO velour suit,5.62,1.7,2.5,102.61,1,4.21,4th and 5th grade
Sat Oct 29 12:48:34 +0000 2011,Damn my vintage ICQ joke got crickets...disregard.,10.75,7.2,11.7,55.91,1,13.17,-1th and 0th grade
Sat Oct 29 11:45:06 +0000 2011,ICQ gt Twitter,9.05,0.9,-1.2,93.81,1,-2.38,0th and 1st grade
Thu Oct 27 14:02:02 +0000 2011,It's that time...Ambition.,9.05,5.6,17.8,59.97,1,11.15,5th and 6th grade
Thu Oct 27 00:29:41 +0000 2011,Birds chirping but the kid's working...NOVEMBER 15th TAKE CARE,7.59,4.4,11.3,79.26,1,13.19,3rd and 4th grade
Wed Oct 26 22:59:11 +0000 2011,All love and respect for the queen.,6.24,0.1,1.6,106.67,1,3.26,2nd and 3rd grade
Tue Oct 25 13:10:42 +0000 2011,and Team Drizzy THANK YOU FOR THE VIDEO That made my year. Much luv.,0.69,1.7,4.1,108.03,1,4.11,5th and 6th grade
Mon Oct 24 03:55:58 +0000 2011,You only live once...YOLO.,0.2,7.2,7.7,50.5,1,4.35,1st and 2nd grade
Mon Oct 24 03:49:58 +0000 2011,Momma I feel so alive...I made it to 25. Thank you all.,5.25,-0.4,-1.2,107.69,2,-1.99,-2th and -1th grade
Sat Oct 22 08:04:34 +0000 2011,I just wanted to show ya'll some love. I'm going to make another drink...Denver I see you...literally...I'm looking down from the clouds.,7.05,6.4,8.9,68.77,2,8.45,5th and 6th grade
Sat Oct 22 08:01:17 +0000 2011,Don't die baby. Live.,7.78,1.3,1.8,92.8,1,-1.46,1st and 2nd grade
Sat Oct 22 08:00:53 +0000 2011,It's hard to forget.,0.2,1.3,0.6,92.8,1,-1.46,0th and 1st grade
Sat Oct 22 07:59:34 +0000 2011,Thanks...it was a leak but I'm glad you like it. Final version is different.,6.24,2.5,3.3,89.75,2,3.66,2nd and 3rd grade
Sat Oct 22 07:58:21 +0000 2011,Very much so.,0.15,-2.7,-2.7,119.19,1,-6.26,0th and 1st grade
Sat Oct 22 07:57:35 +0000 2011,Now that I think about it...I do.,0.35,-1.2,0.3,115.13,1,-0.87,-1th and 0th grade
Sat Oct 22 07:57:02 +0000 2011,No bullshit tho. Star Trak was that movement.,7.78,1.3,2.9,92.8,2,2.9,2nd and 3rd grade
Sat Oct 22 07:56:21 +0000 2011,You too,0.1,-3.1,-6.4,120.21,1,-13.21,-1th and 0th grade
Sat Oct 22 07:55:36 +0000 2011,I'll be there soon. January February,0.3,6.8,5.9,56.93,1,7.18,6th and 7th grade
Sat Oct 22 07:54:07 +0000 2011,Thank you Meg for the encouragement.,6.57,4.5,5.9,73.85,1,8.17,6th and 7th grade
Sat Oct 22 07:53:33 +0000 2011,I live for the nights that I can't remember...remember,0.45,6.8,7.1,62.34,1,8.03,6th and 7th grade
Sat Oct 22 07:52:54 +0000 2011,Much appreciated.,11.63,20.6,17.3,-49.0,1,12.9,20th and 21st grade
Sat Oct 22 07:52:13 +0000 2011,Thanks that's luv.,0.15,-2.7,5.2,119.19,1,1.52,0th and 1st grade
Sat Oct 22 07:50:20 +0000 2011,Haaa everytime I do more than one tweet people keep telling me I must be drunk...I won't lie Gin and Tonics have me feeling righteous.,7.4,9.5,11.8,71.48,1,7.38,11th and 12th grade
Sat Oct 22 07:45:06 +0000 2011,OVOXO...Take Care...Echoes Of Silence,0.2,13.1,20.6,8.2,1,17.4,-1th and 0th grade
Sat Oct 22 07:44:00 +0000 2011,Wifi on the jet...YYZ I rep.,0.3,0.9,-0.5,99.23,1,-2.46,-1th and 0th grade
Sat Oct 22 02:38:59 +0000 2011,VEGAS for my birthday weekend. Ignorant shit.,10.75,7.2,8.3,55.91,1,10.74,10th and 11th grade
Sat Oct 22 02:37:08 +0000 2011,Much love to the Nova Nation That was fun...to the womens basketball team all ya'll are my wives. Better know it.,7.16,3.8,4.7,86.2,2,5.25,4th and 5th grade
Thu Oct 20 06:15:56 +0000 2011,Scary for you.,0.15,-2.7,-1.2,119.19,1,-4.29,0th and 1st grade
Thu Oct 20 00:29:47 +0000 2011,Handing in the album tonight. Surrender.,11.83,6.8,9.0,56.93,1,11.07,11th and 12th grade
Wed Oct 19 06:49:15 +0000 2011,Listening to Kush and Orange Juice,6.57,4.5,4.3,73.85,1,7.18,6th and 7th grade
Wed Oct 19 02:46:52 +0000 2011,North Star.,0.1,-3.1,3.1,120.21,1,-4.51,-1th and 0th grade
Sun Oct 16 06:16:43 +0000 2011,Thank you for making that dream come true SNL Wow.,0.5,1.3,2.9,103.63,1,4.44,3rd and 4th grade
Sat Oct 15 20:21:12 +0000 2011,SNL Tonight Life long dreams...,0.25,-1.9,6.5,117.16,1,6.12,1st and 2nd grade
Sat Oct 15 00:00:09 +0000 2011,Prayers for Rozay.,0.15,-2.7,5.2,119.19,1,3.43,0th and 1st grade
Fri Oct 14 21:45:24 +0000 2011,I'm so proud of jew.,0.25,-1.9,-4.0,117.16,1,-5.49,1st and 2nd grade
Fri Oct 14 21:44:30 +0000 2011,Team Drizzy raising money for MS...I'm so proud of you.,5.71,2.5,5.2,95.17,1,5.02,5th and 6th grade
Fri Oct 14 21:40:16 +0000 2011,I'm so proud of you.,0.25,-1.9,-4.0,117.16,1,-5.49,1st and 2nd grade
Fri Oct 14 21:39:51 +0000 2011,I'm so proud of you.,0.25,-1.9,-4.0,117.16,1,-5.49,1st and 2nd grade
Fri Oct 14 21:36:15 +0000 2011,I'm so proud of you.,0.25,-1.9,-4.0,117.16,1,-5.49,1st and 2nd grade
Fri Oct 14 21:35:39 +0000 2011,I'm so proud of you.,0.25,-1.9,-4.0,117.16,1,-5.49,1st and 2nd grade
Fri Oct 14 21:35:11 +0000 2011,I'm so proud of you.,0.25,-1.9,-4.0,117.16,1,-5.49,1st and 2nd grade
Fri Oct 14 21:33:56 +0000 2011,I'm so proud of you.,0.25,-1.9,-4.0,117.16,1,-5.49,1st and 2nd grade
Fri Oct 14 21:33:39 +0000 2011,I'm so proud of you.,0.25,-1.9,-4.0,117.16,1,-5.49,1st and 2nd grade
Fri Oct 14 21:33:25 +0000 2011,I'm so proud of you.,0.25,-1.9,-4.0,117.16,1,-5.49,1st and 2nd grade
Fri Oct 14 21:33:14 +0000 2011,I'm so proud of you.,0.25,-1.9,-4.0,117.16,1,-5.49,1st and 2nd grade
Fri Oct 14 21:32:58 +0000 2011,I'm so proud of you.,0.25,-1.9,-4.0,117.16,1,-5.49,1st and 2nd grade
Fri Oct 14 21:32:37 +0000 2011,I'm so proud of you.,0.25,-1.9,-4.0,117.16,1,-5.49,1st and 2nd grade
Fri Oct 14 00:57:17 +0000 2011,NYC HOT 97 NICKI MINAJ DRAKE MAKE ME PROUD NOVEMBER 15 TAKE CARE,6.71,4.8,3.9,83.66,1,5.03,4th and 5th grade
Fri Oct 14 00:56:48 +0000 2011,thank u sir.,0.15,-2.7,-4.3,119.19,1,-8.18,0th and 1st grade
Thu Oct 13 22:38:30 +0000 2011,You might want to catch the end of Flex set on Hot 97 tonight...............NYC,0.69,2.9,7.8,99.57,1,3.24,5th and 6th grade
Thu Oct 13 22:36:25 +0000 2011,Happy Birthday OVO squad,0.2,3.7,5.3,75.88,1,7.25,-1th and 0th grade
Wed Oct 12 10:21:57 +0000 2011,O v OXO,0.15,-2.7,-12.2,119.19,1,-15.89,0th and 1st grade
Tue Oct 11 07:42:01 +0000 2011,Blood Orange Sanpellegrino,9.05,17.4,17.8,-24.64,1,20.83,17th and 18th grade
Mon Oct 10 07:30:57 +0000 2011,Make Me Proud.,0.15,-2.7,-1.2,119.19,1,-4.29,0th and 1st grade
Sat Oct 08 23:07:44 +0000 2011,My brother party tonight...Happy Birthday,0.25,7.6,15.9,49.48,1,17.72,1st and 2nd grade
Sat Oct 08 00:23:16 +0000 2011,Drizzy Kendrick A AP Chase N Cashe...new dates and big news coming next week.,0.69,2.9,7.1,99.57,1,7.01,5th and 6th grade
Thu Oct 06 03:44:14 +0000 2011,My keeper has a new site... For di gyal dem.,5.46,-0.8,-2.5,108.7,2,-3.75,1st and 2nd grade
Sun Oct 02 20:43:53 +0000 2011,Dropping Headlines at 6pm...so you know it's real.,7.98,5.2,7.9,71.82,1,7.9,7th and 8th grade
Sat Oct 01 23:02:41 +0000 2011,Killed Trust Issues at the Walk Of Fame That was such an honor man.,5.46,2.9,3.8,99.57,1,4.11,5th and 6th grade
Sat Oct 01 08:38:29 +0000 2011,Everybody should follow and read his genius,6.24,6.0,7.0,64.37,1,10.74,5th and 6th grade
Sat Oct 01 05:00:23 +0000 2011,24 days to Take Care...Happy Birthday TakeCare,6.24,6.0,9.0,64.37,1,10.74,5th and 6th grade
Sat Oct 01 01:24:31 +0000 2011,Having dinner with he just called me a Heebro,5.84,3.3,2.4,87.72,1,4.78,3rd and 4th grade
Fri Sep 30 12:01:58 +0000 2011,I appreciate this moment in time...ball players and actors be knowing my rhymes Common,9.97,8.8,10.1,57.27,1,11.13,9th and 10th grade
Fri Sep 30 05:14:44 +0000 2011,Comin' wit da juice that's my new shit Soujer,5.84,0.9,2.4,104.64,1,3.51,3rd and 4th grade
Fri Sep 30 00:28:06 +0000 2011,Headlines Video Sunday 6pm on,7.04,2.9,4.6,83.32,1,7.28,1st and 2nd grade
Wed Sep 28 05:27:02 +0000 2011,Fifa 12,11.63,2.9,-6.4,77.91,1,-13.21,-1th and 0th grade
Wed Sep 28 01:41:07 +0000 2011,That ovo and that xo is everything you believe in.,0.5,3.7,2.9,86.71,1,4.44,3rd and 4th grade
Wed Sep 28 01:34:26 +0000 2011,and dropped today too,0.2,1.3,1.8,92.8,1,2.9,1st and 2nd grade
Tue Sep 27 07:45:39 +0000 2011,Happy Bornday to di general...Weezy da boss.,6.24,7.2,7.6,55.91,1,8.24,7th and 8th grade
Tue Sep 27 01:01:04 +0000 2011,Cole World drops at midnight...great album from a great team,5.71,3.7,7.6,86.71,1,9.08,3rd and 4th grade
Mon Sep 26 22:28:27 +0000 2011,That tracklist is false...sorry.,7.78,3.7,14.7,75.88,1,13.05,3rd and 4th grade
Mon Sep 26 04:23:50 +0000 2011,I mean well.,0.15,-2.7,-4.3,119.19,1,-8.18,0th and 1st grade
Mon Sep 26 01:42:11 +0000 2011,Fuck that...call me jay elechannukah,7.04,2.9,11.2,83.32,1,11.92,1st and 2nd grade
Sun Sep 25 07:58:14 +0000 2011,Thank u sir.,0.15,-2.7,-4.3,119.19,1,-8.18,0th and 1st grade
Sun Sep 25 07:20:46 +0000 2011,Make Me Proud.,0.15,-2.7,-1.2,119.19,1,-4.29,0th and 1st grade
Sun Sep 25 00:09:19 +0000 2011,First workout with getting ready for Club Paradise Tour NOVEMBER,7.29,6.0,9.5,69.79,1,13.14,5th and 6th grade
Sat Sep 24 09:13:19 +0000 2011,Man the Glenn Lewis Back For More video with the Hpnotiq and Vince Carter cameo was a crazy time for our city.,1.81,6.0,8.6,91.45,1,5.92,5th and 6th grade
Sat Sep 24 08:54:11 +0000 2011,We need to do a new song.,0.35,-1.2,-5.3,115.13,1,-5.05,2nd and 3rd grade
Sat Sep 24 06:35:15 +0000 2011,Take Care cover on,0.2,1.3,-1.9,92.8,1,-1.46,0th and 1st grade
Sat Sep 24 03:51:17 +0000 2011,I love it when your eyes are red...are you on my cloud yet,0.64,1.3,1.7,109.04,1,1.03,0th and 1st grade
Sat Sep 24 00:58:14 +0000 2011,Made the switch to super official.,9.2,4.5,4.3,73.85,1,6.25,4th and 5th grade
Thu Sep 22 20:27:04 +0000 2011,"Take Cover, Take Pleasure, Take Care.",0.3,2.1,6.7,90.77,1,7.18,1st and 2nd grade
Wed Sep 21 07:32:37 +0000 2011,you my friend are quite the pooch. Always wonder how your paws manage to type such truths.,4.99,1.9,3.3,96.69,2,5.24,4th and 5th grade
Wed Sep 21 04:32:21 +0000 2011,All we wanted was the opportunity...,9.2,8.0,5.9,48.47,1,6.25,5th and 6th grade
Tue Sep 20 23:37:49 +0000 2011,All Kinds.,0.1,-3.1,0.8,120.21,1,-7.41,-1th and 0th grade
Mon Sep 19 21:11:03 +0000 2011,"Take Care, Take Care Birthday Edition, Take Care OG Ron C Edition...10.24.11",5.55,4.4,10.1,84.68,1,9.85,4th and 5th grade
Sat Sep 17 21:55:35 +0000 2011,My niece was 4 when she felt chinchilla,6.01,0.5,1.4,105.66,1,3.55,0th and 1st grade
Sat Sep 17 19:12:39 +0000 2011,You look in the mirror you know who you are...right,0.5,1.3,3.4,103.63,1,3.86,3rd and 4th grade
Tue Sep 13 13:05:22 +0000 2011,Damn...RIP MEHDI,11.63,8.8,14.9,35.61,1,4.2,-1th and 0th grade
Tue Sep 13 10:54:23 +0000 2011,First place I'm going after I turn this album in is H Town,5.5,3.6,1.7,92.12,1,1.9,5th and 6th grade
Mon Sep 12 08:50:41 +0000 2011,"There is no old Drake. There is no new Drake. There is just a guy that makes AMAZING music, named Drake. This means the world.",0.94,-0.3,0.9,107.38,4,1.97,2nd and 3rd grade
Sun Sep 11 06:59:23 +0000 2011,Tommorrow is your moment Let's get it.,6.24,3.7,3.6,81.29,1,4.94,3rd and 4th grade
Sun Sep 11 06:17:25 +0000 2011,Going to cook more. Love.,0.25,0.5,0.9,100.24,1,0.32,0th and 1st grade
Sun Sep 11 06:08:47 +0000 2011,Last one isn't my song,0.25,0.5,-2.1,100.24,1,-2.01,1st and 2nd grade
Sun Sep 11 05:25:30 +0000 2011,Free Spirit.,0.1,2.9,5.5,77.91,1,-1.61,-1th and 0th grade
Sun Sep 11 04:02:07 +0000 2011,Songs coming up. HAPPY BDAY TO MY FAM and,0.22,0.3,-2.0,100.75,2,-1.67,-1th and 0th grade
