created_at,text,dale_chall_readability_score,flesch_kincaid,automated_readability,flesch_reading,sentence_count,coleman_liau_index,based_on_all_algorithms
Mon Oct 01 22:20:33 +0000 2012,Dropped my phone in a glass of wine...just to give you an idea of where my life is at these days.,1.04,4.4,6.4,100.92,1,2.9,-1th and 0th grade
Thu Sep 27 01:07:15 +0000 2012,I love me some Gayle King.,0.3,-1.5,-2.0,116.15,1,-1.53,-1th and 0th grade
Tue Sep 25 14:10:28 +0000 2012,OVO Chopstars,11.63,2.9,7.8,77.91,1,4.2,-1th and 0th grade
Tue Sep 25 00:17:13 +0000 2012,You're catching me at a bad time with all that talk about the good times.,5.43,3.2,4.6,98.55,1,4.17,4th and 5th grade
Fri Sep 14 00:58:54 +0000 2012,Higher off Big Sean mixtape is CRAZY.,8.5,2.5,2.9,89.75,1,4.94,2nd and 3rd grade
Thu Sep 13 08:28:33 +0000 2012,Sometimes seeing everything just gets in the way.,0.4,5.2,7.3,71.82,1,10.11,-1th and 0th grade
Thu Sep 13 07:24:44 +0000 2012,taking shit to another level man. New battles are all crazy. So happy to see the scene grow.,4.81,2.1,1.2,90.77,3,2.37,1st and 2nd grade
Thu Sep 13 05:12:05 +0000 2012,Cooking up. Stacking up.,7.78,3.7,5.3,75.88,1,4.35,3rd and 4th grade
Thu Sep 13 03:03:22 +0000 2012,Congratulations to my brother. New reasons to go even harder than before. New life. Blessings. Ezee.,7.98,6.4,7.6,63.36,2,9.35,7th and 8th grade
Tue Sep 11 10:31:22 +0000 2012,Happy Bday to my round,0.25,0.5,-2.1,100.24,1,-0.85,-1th and 0th grade
Sun Sep 09 02:06:38 +0000 2012,Produced by 40 and C Papi,9.2,2.1,-2.8,90.77,1,-1.53,1st and 2nd grade
Sun Sep 09 00:34:24 +0000 2012,Thank you to BMI for giving me Songwriter Of The Year for the 2nd year in a row,5.41,5.6,3.8,87.05,1,2.38,5th and 6th grade
Sun Sep 09 00:33:53 +0000 2012,I never said it was safe...I just said it existed.,5.71,3.7,2.9,86.71,1,2.7,2nd and 3rd grade
Fri Sep 07 23:21:31 +0000 2012,Busy day yesterday didn't get a chance to wish a happy bday,0.6,4.4,3.4,84.68,1,4.57,4th and 5th grade
Fri Sep 07 05:15:49 +0000 2012,bars are UP man and he showed Toronto love. Oh god.,5.62,1.7,1.6,102.61,1,2.13,1st and 2nd grade
Fri Sep 07 02:52:04 +0000 2012,Coaching at Kentucky Sept 15 BBN CoachCal,10.75,3.7,5.6,81.29,1,9.06,2nd and 3rd grade
Fri Sep 07 02:50:41 +0000 2012,Thank you to for killing that video Toronto,6.01,0.5,3.8,105.66,1,6.45,3rd and 4th grade
Wed Sep 05 10:51:22 +0000 2012,OVO Crooks tonight.,0.15,-2.7,6.8,119.19,1,5.35,0th and 1st grade
Tue Sep 04 10:39:26 +0000 2012,That good that young.,0.2,-2.3,1.8,118.18,1,1.45,1st and 2nd grade
Sun Sep 02 06:57:10 +0000 2012,Philly...Come see this kid from Canada at this thing called Made In America,5.5,4.8,7.9,83.66,1,8.63,5th and 6th grade
Sun Aug 26 09:10:47 +0000 2012,Pimps don't cry...word to Eva Mendes,0.3,0.9,5.9,99.23,1,5.27,0th and 1st grade
Wed Aug 22 09:10:40 +0000 2012,This shit is getting raunchy.,0.25,0.5,4.6,100.24,1,6.12,1st and 2nd grade
Wed Aug 22 08:06:05 +0000 2012,Yes lawd.,0.1,-3.1,-1.7,120.21,1,-10.31,-1th and 0th grade
Wed Aug 22 05:14:04 +0000 2012,Cooking up.,0.1,2.9,3.1,77.91,1,-4.51,-1th and 0th grade
Mon Aug 20 00:23:03 +0000 2012,l think we have different ideas of the future...,5.84,3.3,4.0,87.72,1,4.78,3rd and 4th grade
Thu Aug 09 07:26:32 +0000 2012,Waste yout.,0.1,-3.1,3.1,120.21,1,-4.51,-1th and 0th grade
Wed Aug 08 07:05:56 +0000 2012,I'll always try hard...I just like it easy in the late nights,0.6,3.3,4.2,93.14,1,4.05,4th and 5th grade
Tue Aug 07 21:41:08 +0000 2012,Instagram Champagnepapi,19.53,26.5,31.4,-91.3,1,33.2,26th and 27th grade
Thu Aug 02 18:16:23 +0000 2012,Despite what your daily dose of bullshit may lead you to believe. I am forever about this Young Money team.,6.5,4.8,4.3,78.25,2,6.18,4th and 5th grade
Tue Jul 31 07:26:25 +0000 2012,God Forgives I Don't A honor to be on this album with my brother. Geechi Liberache and Champagne. MMGOVOYMCMB,8.26,5.8,5.9,70.29,2,7.8,5th and 6th grade
Fri Jul 27 08:54:48 +0000 2012,Tell me what would you like me to do...to help you...help me...help you.,0.64,1.3,6.8,109.04,1,4.16,0th and 1st grade
Wed Jul 25 20:36:30 +0000 2012,Call me crazy shit at least you're calling...,0.4,0.5,4.9,105.66,1,5.0,4th and 5th grade
Wed Jul 25 20:32:48 +0000 2012,did that song poetic justice. Incredible.,11.83,10.4,9.8,31.55,1,12.05,11th and 12th grade
Wed Jul 25 01:14:51 +0000 2012,just called it OBO PEST,0.25,-1.9,-1.1,117.16,1,0.32,-1th and 0th grade
Tue Jul 24 13:43:17 +0000 2012,mafia mafia mafia,0.15,-2.7,3.6,119.19,1,3.43,0th and 1st grade
Tue Jul 24 04:16:32 +0000 2012,Man I'm just really about to have a drink and do a solo toast to and for being the best at what they do.,1.85,7.9,6.5,80.96,1,2.1,1st and 2nd grade
Sun Jul 22 07:19:20 +0000 2012,Made statements never gave statements.,7.04,5.2,13.1,66.4,1,16.56,1st and 2nd grade
Sat Jul 21 08:10:21 +0000 2012,That's just my 2 cents...but pennies make dollars,7.98,4.1,7.3,80.28,1,7.9,7th and 8th grade
Thu Jul 19 10:18:52 +0000 2012,We do more damage apart than together.,0.35,3.7,3.6,81.29,1,5.75,3rd and 4th grade
Tue Jul 17 22:37:20 +0000 2012,My condolences go out to the family and friends of Shyanne Charles and Joshua Yasay. Senseless violence in Toronto has to stop.,7.05,5.2,6.8,77.23,2,8.97,6th and 7th grade
Sun Jul 15 23:05:39 +0000 2012,I grew up with my mother but still got some things from my daddy girl you'll see...,0.84,4.0,5.6,96.52,1,3.94,3rd and 4th grade
Sun Jul 15 23:01:37 +0000 2012,No reasons for my ways...No excuses for my habits...that's just me.,7.05,5.2,8.5,77.23,1,7.35,5th and 6th grade
Fri Jul 13 21:05:18 +0000 2012,ICE AGE 4 today Can't wait to see it. I feel like I gave my mammoth a silky Leon Phelps voice. Enjoy kids.,1.26,1.9,1.5,102.1,2,1.72,1st and 2nd grade
Sun Jul 08 01:14:04 +0000 2012,Congrats to you today was INCREDIBLE.,9.2,8.0,6.7,48.47,1,9.15,8th and 9th grade
Sun Jul 08 01:13:32 +0000 2012,London thank you for tonight...OVOXO.,7.04,0.5,12.2,100.24,1,11.92,1st and 2nd grade
Thu Jul 05 20:22:20 +0000 2012,You never worry about the last laugh if you've been laughing the whole time.,5.46,5.2,6.8,82.65,1,7.42,5th and 6th grade
Mon Jul 02 04:30:04 +0000 2012,Best Male Hip Hop...that's righteous. Thank you BET,5.81,-1.1,6.5,109.72,2,5.1,5th and 6th grade
Sat Jun 30 17:47:19 +0000 2012,Fantasy 416,11.63,8.8,3.1,35.61,1,-1.61,11th and 12th grade
Tue Jun 26 21:39:32 +0000 2012,Also my dry cleaning just arrived.,6.57,4.5,4.3,73.85,1,6.25,6th and 7th grade
Tue Jun 26 21:37:19 +0000 2012,Also MMG Self Made 2 dropped and you know that's family so support that.,5.46,5.2,5.4,82.65,1,5.73,5th and 6th grade
Tue Jun 26 21:36:19 +0000 2012,Congrats to on a great album and for allowing me to be a part of it.,7.39,6.0,2.2,80.62,1,1.27,5th and 6th grade
Mon Jun 25 15:44:41 +0000 2012,Copy Papi,11.63,2.9,-1.7,77.91,1,-7.41,-1th and 0th grade
Mon Jun 25 15:44:29 +0000 2012,Here But I'm Gone.,0.2,-2.3,-1.9,118.18,1,-4.36,-1th and 0th grade
Fri Jun 22 07:46:36 +0000 2012,Happy Birthday to my brother. REPS UP OVO.,0.2,2.5,1.2,84.34,2,0.75,0th and 1st grade
Thu Jun 21 09:43:34 +0000 2012,I should've gotten back by now...Toronto.,9.2,4.5,9.8,73.85,1,9.15,9th and 10th grade
Wed Jun 20 10:12:39 +0000 2012,WHAT A RUN,0.15,-2.7,-7.5,119.19,1,-10.09,0th and 1st grade
Wed Jun 20 10:12:00 +0000 2012,Last show of the Club Paradise tour tonight in North Carolina. I want to thank every fan who came out and shared in the experience.,6.15,4.6,5.0,84.17,2,6.19,4th and 5th grade
Mon Jun 11 14:35:28 +0000 2012,"As an artist, I support giving emerging artists a chance to be heard. RiseCompetition",7.71,7.6,9.8,65.73,1,11.13,7th and 8th grade
Mon Jun 11 05:31:24 +0000 2012,I never have enough time at the end of the day cause it's already the end of the day,0.94,4.8,4.4,94.49,1,2.56,4th and 5th grade
Mon Jun 11 02:42:58 +0000 2012,I'm not at Liv tonight. I wish I was. But I'm not. Still on this ClubParadiseTour,4.82,1.3,0.0,92.8,4,-1.11,4th and 5th grade
Mon Jun 11 02:28:16 +0000 2012,tried to come in with the gym shuffle playlist and peaches and cream remix got involved somehow...weird,6.34,5.2,11.2,88.06,1,11.08,5th and 6th grade
Mon Jun 11 01:31:54 +0000 2012,Creep through the night...sleep through the sun.,0.35,0.1,10.3,106.67,1,11.55,-1th and 0th grade
Sun Jun 10 07:50:30 +0000 2012,Omelly whattup,19.53,14.7,10.2,-6.7,1,7.1,14th and 15th grade
Sun Jun 10 05:08:38 +0000 2012,What an embarrassing night for Boxing. Shit looked like the WWF. Pac Man and Jinky deserved to go home happy.,6.34,2.4,3.1,90.05,3,4.99,4th and 5th grade
Sun Jun 10 05:01:27 +0000 2012,That's a fix.,0.15,-2.7,-2.7,119.19,1,-8.18,0th and 1st grade
Sun Jun 10 05:01:01 +0000 2012,WHAT THE FUCK,0.15,-2.7,-2.7,119.19,1,-4.29,0th and 1st grade
Sat Jun 09 07:42:15 +0000 2012,Buffalo NY was love tonight. Been on tour since January. Got 10 days left till I get to spend a summer with Toronto. CLUB PARADISE.,5.31,3.0,2.9,88.43,3,4.54,2nd and 3rd grade
Sat Jun 09 07:40:02 +0000 2012,She's working at the Pyramid tonight.,9.2,2.1,6.7,90.77,1,8.17,1st and 2nd grade
Mon Jun 04 03:36:14 +0000 2012,"OVO Fest August 5th. A AP Rocky, 2 Chainz, The Weeknd, Drake. A special night we've created for the greatest city...Toronto.",6.99,2.5,5.4,89.75,3,6.04,2nd and 3rd grade
Mon Jun 04 00:14:41 +0000 2012,Cj and straight set up artists. They can't be trusted.,5.46,-0.8,2.3,108.7,2,2.64,1st and 2nd grade
Mon Jun 04 00:11:46 +0000 2012,Ahhahahaha this shit is classic.,10.2,10.0,7.4,32.56,1,9.6,9th and 10th grade
Sun Jun 03 11:58:59 +0000 2012,I'm on Punk'd tonight. I hope you allllllll have a good laugh. I will never forget that day for as long as I live,1.05,2.9,0.2,88.74,3,1.12,2nd and 3rd grade
Sun Jun 03 08:47:35 +0000 2012,RIP Chris Lewds. Always held everybody down and repped Crooks to the fullest. Days are too long life is too short.,0.35,0.1,3.2,106.67,3,5.17,2nd and 3rd grade
Sun Jun 03 07:36:30 +0000 2012,Gettin cheddar packs like KD...OKC that's playerrrr shit,9.95,5.2,11.4,71.82,1,13.01,-1th and 0th grade
Sun Jun 03 04:40:36 +0000 2012,"22,000 people from Chicago bought tickets to see a kid from Toronto tonight. Believe in yourself.",6.99,4.1,6.7,80.28,2,9.0,6th and 7th grade
Thu May 31 04:37:37 +0000 2012,just stunted on me heavy.,7.04,0.5,0.9,100.24,1,1.48,0th and 1st grade
Wed May 30 10:14:50 +0000 2012,The first million is the hardest.,6.57,2.1,3.6,90.77,1,5.27,1st and 2nd grade
Tue May 29 06:47:13 +0000 2012,Club with Ohio,0.15,-2.7,-1.2,119.19,1,-2.38,0th and 1st grade
Tue May 29 06:31:26 +0000 2012,Free Kartel,11.63,2.9,3.1,77.91,1,-1.61,-1th and 0th grade
Tue May 29 06:23:45 +0000 2012,We get gyal eeeeaasy.,0.2,-2.3,1.8,118.18,1,1.45,1st and 2nd grade
Tue May 29 06:15:00 +0000 2012,Oh that's your ho That's our ho too. Lol,0.45,-0.4,-0.3,113.1,1,-0.39,-1th and 0th grade
Sun May 27 21:43:53 +0000 2012,OVO Sound,0.1,-3.1,-1.7,120.21,1,-7.41,-1th and 0th grade
Sun May 27 03:54:22 +0000 2012,mom gotta be one of the greatest people I've ever met. The music keeps me young she told me. No lie.,5.66,2.7,1.8,94.66,2,2.24,2nd and 3rd grade
Fri May 25 10:01:45 +0000 2012,Happy Birthday to a legit Hamilton don,8.5,6.0,3.6,64.37,1,6.56,2nd and 3rd grade
Tue May 22 07:35:53 +0000 2012,Yo...remember getting kicked off someone's Top 8. Disrespect ting.,7.59,8.0,13.4,53.88,1,14.47,7th and 8th grade
Tue May 22 01:22:13 +0000 2012,Headed home at 6am to be with the family...to all the Raleigh and VA fans I will see you soon. My apologies.,6.16,7.2,8.2,82.99,1,4.35,8th and 9th grade
Sun May 20 05:06:52 +0000 2012,is incredible.,11.63,14.7,10.2,-6.7,1,4.2,14th and 15th grade
Sat May 19 21:32:53 +0000 2012,Congratulations to Chelsea Champions League Incredible.,11.83,16.3,20.8,-10.76,1,26.55,-1th and 0th grade
Thu May 17 22:52:40 +0000 2012,H Town.,0.1,-3.1,-6.4,120.21,1,-16.11,-1th and 0th grade
Thu May 17 06:49:10 +0000 2012,Me and got joints this year,0.3,-1.5,-1.2,116.15,1,0.45,-1th and 0th grade
Thu May 17 06:18:52 +0000 2012,What am I gonna do Say no,0.35,-1.2,-5.3,115.13,1,-4.24,2nd and 3rd grade
Wed May 16 11:51:47 +0000 2012,OVO Sound,0.1,-3.1,-1.7,120.21,1,-7.41,-1th and 0th grade
Mon May 14 23:38:20 +0000 2012,You never had no one like me Well why you so complacent.,5.55,4.4,2.2,84.68,1,3.12,5th and 6th grade
Sun May 13 07:33:27 +0000 2012,Forget the past cause you can't change it...and forget the present...cause I didn't get you one,0.79,6.0,10.1,80.62,1,8.52,5th and 6th grade
Sun May 13 01:32:48 +0000 2012,Where is That's the only question pending...,6.24,3.7,7.6,81.29,1,8.24,2nd and 3rd grade
Thu May 10 10:22:19 +0000 2012,good luck I have faith in you.,0.35,-1.2,-1.9,115.13,1,-0.87,-1th and 0th grade
Wed May 09 07:03:02 +0000 2012,Police made me cut the show short but I love you all for rocking with me Irvine,5.41,4.0,4.5,96.52,1,3.94,3rd and 4th grade
Tue May 08 22:47:45 +0000 2012,Get to club paradise early Show starts at 630 There's nobody on the bill you want to miss.,5.41,5.6,6.7,87.05,1,5.28,5th and 6th grade
Sun May 06 04:03:24 +0000 2012,Baaaaaare Tumblr Tings doggy.,11.73,3.7,11.2,75.88,1,13.05,11th and 12th grade
Sun May 06 00:31:30 +0000 2012,Leaving tonight for the biggest hip hop tour of the summer Club Paradise Cole Flocka Meek 2 Chainz Montana Drizzy Drake...our time now.,7.52,8.7,13.2,73.51,1,10.51,8th and 9th grade
Sat May 05 23:12:29 +0000 2012,Round of Applause,9.05,0.9,3.6,93.81,1,3.43,0th and 1st grade
Sat May 05 00:23:05 +0000 2012,Shade 45 Amen,0.15,-2.7,-2.7,119.19,1,-4.29,0th and 1st grade
Fri May 04 22:47:02 +0000 2012,Do Liv on Sunday like a Chuuuuuurch.,6.24,9.6,2.3,38.99,1,4.07,3rd and 4th grade
Tue May 01 22:22:41 +0000 2012,KY got the mix blowing my speakers in the Mulsanne. 40 on the vocals...proper tings.,8.59,6.8,8.1,73.17,1,7.24,6th and 7th grade
Tue May 01 22:21:05 +0000 2012,Thanks to everybody showing love on No Lie ...summer starting off riiiiiiight.,8.18,11.5,10.9,33.92,1,12.28,11th and 12th grade
Mon Apr 30 07:31:42 +0000 2012,Greystone,19.48,8.4,21.5,36.62,1,6.8,-1th and 0th grade
Sun Apr 29 02:32:40 +0000 2012,Run it...mek we dun it.,0.25,0.5,-1.1,100.24,1,-4.33,1st and 2nd grade
Sat Apr 28 22:35:15 +0000 2012,Mike Will made it.,0.2,-2.3,-1.9,118.18,1,-2.91,-1th and 0th grade
Sat Apr 28 06:27:03 +0000 2012,Shot to for really understanding the magnitude of my last tweet. Thank you based god.,6.11,5.0,4.6,72.32,2,7.03,4th and 5th grade
Sat Apr 28 06:00:26 +0000 2012,Twisted Metal.,11.63,8.8,10.2,35.61,1,4.2,-1th and 0th grade
Thu Apr 26 02:23:16 +0000 2012,OVO,0.05,-3.5,-6.9,121.22,1,-28.01,-1th and 0th grade
Wed Apr 25 11:24:05 +0000 2012,Last show tonight Nottingham,7.78,3.7,10.0,75.88,1,13.05,3rd and 4th grade
Tue Apr 24 22:17:50 +0000 2012,Man I just love the sport I have friends on different teams. Proud for them today. Stop watching man so closely.,5.49,1.3,2.7,98.21,3,4.65,2nd and 3rd grade
Tue Apr 24 20:38:35 +0000 2012,Chellllllseeeeeeeaaaaaaaaa DROGBAAAAAAAA ASHLEY COLE My brothers,14.46,12.7,27.9,14.63,1,36.18,12th and 13th grade
Tue Apr 24 20:35:34 +0000 2012,Chelseaaaaaaa,0.05,-3.5,40.3,121.22,1,30.0,-1th and 0th grade
Tue Apr 24 16:34:16 +0000 2012,musical ting called Yiy Change mixtape. Mawd ting.,7.98,4.1,7.9,80.28,1,10.11,7th and 8th grade
Sat Apr 21 18:27:54 +0000 2012,Sho how you get do,0.25,-1.9,-5.8,117.16,1,-5.49,1st and 2nd grade
Sat Apr 21 15:08:21 +0000 2012,Sade came to Club Paradise last night and told me how much she loved The Motto...top life moment...had to share.,6.21,7.6,10.5,76.56,1,7.66,7th and 8th grade
Sat Apr 21 03:19:07 +0000 2012,She's only 23 but ahead of her time...she's the dream of a million men.,0.69,4.0,5.1,91.11,1,3.65,5th and 6th grade
Fri Apr 20 06:41:03 +0000 2012,Di whole place a say Fry Yiy...some bwoy should write some hit song and stop cry. Popcaan,5.41,4.0,7.3,96.52,1,5.97,5th and 6th grade
Fri Apr 20 04:11:06 +0000 2012,Damn this OVOXO shit is worldwide.,6.57,0.9,4.3,99.23,1,6.25,6th and 7th grade
Wed Apr 18 18:08:33 +0000 2012,Chelsea v Barca...I'm in the car on the wayyyyyyy,5.84,0.9,4.5,104.64,1,4.78,4th and 5th grade
Tue Apr 17 18:51:57 +0000 2012,Jai Paul Jasmine,9.05,0.9,2.1,93.81,1,1.52,0th and 1st grade
Mon Apr 16 00:06:53 +0000 2012,YOUR TIME TONIGHT,0.15,-2.7,3.6,119.19,1,3.43,0th and 1st grade
Sun Apr 15 16:58:55 +0000 2012,Squad bout to murder today. OVOXO,0.3,2.1,3.6,90.77,1,5.27,1st and 2nd grade
Sat Apr 14 15:21:12 +0000 2012,Just copped all the Harry Potter wands in Copenhagen and I'm eating the best Indian food ever. Good day...word to Cube.,7.16,5.0,6.0,77.74,2,6.93,4th and 5th grade
Sat Apr 14 15:21:12 +0000 2012,Just copped all the Harry Potter wands in Copenhagen and I'm eating the best Indian food ever. Good day...word to Cube.,7.16,5.0,6.0,77.74,2,6.93,4th and 5th grade
Sat Apr 14 00:03:03 +0000 2012,In my crew every man a star...over my crew every gyal a warrrrr,5.5,3.6,3.5,92.12,1,3.23,3rd and 4th grade
Fri Apr 13 23:58:49 +0000 2012,Mix up and blem blem,0.25,-1.9,-4.0,117.16,1,-3.17,1st and 2nd grade
Fri Apr 13 23:45:57 +0000 2012,Got the streets...a nigga fine with that Monnnntaaaana,6.01,2.9,10.3,88.74,1,12.25,2nd and 3rd grade
Fri Apr 13 23:45:16 +0000 2012,CokeBoys3 via,11.63,2.9,7.8,77.91,1,4.2,-1th and 0th grade
Fri Apr 13 23:32:50 +0000 2012,It ain't about money...it ain't about shit. Making money nigga cause it only makes sense.,5.06,3.9,5.9,80.78,2,6.63,5th and 6th grade
Fri Apr 13 23:30:39 +0000 2012,That's ya old job.,0.2,-2.3,-1.9,118.18,1,-4.36,-1th and 0th grade
Fri Apr 13 22:02:49 +0000 2012,Life should be on Cinemax.,7.04,2.9,1.8,83.32,1,2.64,2nd and 3rd grade
Thu Apr 12 01:41:28 +0000 2012,HAHAHAHHAA,19.48,32.0,26.2,-132.59,1,12.6,12th and 13th grade
Wed Apr 11 17:12:37 +0000 2012,It's Yours.,0.1,-3.1,3.1,120.21,1,-7.41,-1th and 0th grade
Wed Apr 11 03:16:10 +0000 2012,Second home sick.,0.15,0.9,3.6,93.81,1,1.52,0th and 1st grade
Mon Apr 09 00:08:58 +0000 2012,Shout out to Drake and Josh.,0.3,-1.5,-0.5,116.15,1,0.45,-1th and 0th grade
Sun Apr 08 00:04:02 +0000 2012,No Lie.,0.1,-3.1,-6.4,120.21,1,-16.11,-1th and 0th grade
Sat Apr 07 00:14:24 +0000 2012,Thank you my brother. Appreciate that.,6.57,6.8,7.5,56.93,1,9.15,6th and 7th grade
Sat Apr 07 00:06:16 +0000 2012,is the real star in that HYFR video.,0.4,0.5,-0.4,105.66,1,0.65,0th and 1st grade
Thu Apr 05 21:53:10 +0000 2012,Paris was incredible. So much love. Just got to hug Mehdi's sister Just a great night...thank you.,4.85,2.0,4.1,91.07,3,4.45,4th and 5th grade
Thu Apr 05 11:34:29 +0000 2012,"Take Care and HYFR premiere Friday on MTV, OVO, and",5.71,2.5,3.4,95.17,1,4.44,3rd and 4th grade
Tue Apr 03 01:05:30 +0000 2012,Unlearn.,19.48,8.4,16.8,36.62,1,-4.81,-1th and 0th grade
Tue Apr 03 00:53:24 +0000 2012,6 Duece everytime...I never did the Heinz...57 can't catch up to mines.,5.55,4.4,8.1,84.68,1,6.95,5th and 6th grade
Sun Apr 01 16:21:53 +0000 2012,I'm over in Europe...but its still GO BIG BLUE,5.84,2.1,2.9,96.18,1,2.87,2nd and 3rd grade
Sun Apr 01 12:59:57 +0000 2012,hahahaha,19.48,32.0,16.8,-132.59,1,1.0,0th and 1st grade
Sun Apr 01 12:08:14 +0000 2012,New fan site launching Tuesday we're only getting stronger.,5.84,4.4,9.8,79.26,1,12.5,3rd and 4th grade
Sun Apr 01 12:00:07 +0000 2012,Waiting on Take Care video to come back. Somebody in the process is taking forever and a day. HYFR looks amazing. Two videos this week.,5.84,1.0,2.6,98.92,4,4.29,5th and 6th grade
Sat Mar 31 00:05:27 +0000 2012,Let's go half on a baby...and if not lets go half on a 'cedes,5.46,1.7,1.7,108.03,1,-0.08,5th and 6th grade
Fri Mar 30 23:48:03 +0000 2012,So proud and happy that I got to finally work with Melanie Fiona Go buy MF Life,0.84,5.2,4.5,88.06,1,3.94,4th and 5th grade
Fri Mar 30 18:50:06 +0000 2012,You a know.,0.15,-2.7,-5.9,119.19,1,-10.09,0th and 1st grade
Fri Mar 30 00:09:01 +0000 2012,Let it all work out.,0.25,-1.9,-4.0,117.16,1,-4.33,1st and 2nd grade
Wed Mar 28 17:39:51 +0000 2012,I just met Drogba and he said he's a fan...nobody can't talk to me for the rest of the day,1.78,6.4,5.3,85.02,1,1.86,1st and 2nd grade
Wed Mar 28 11:38:05 +0000 2012,Say its her destinyyyyyy. She say its her destiny.,7.37,0.3,2.8,100.75,2,3.44,-1th and 0th grade
Mon Mar 26 15:14:42 +0000 2012,What sort of things they been telling you I got to stop them from compelling you.,5.42,3.6,6.0,97.54,1,5.97,5th and 6th grade
Sun Mar 25 13:07:12 +0000 2012,Natasha McElhone I know you don't have twitter cause you are a mature British goddess...but I love you.,8.04,6.8,10.1,78.59,1,8.52,8th and 9th grade
Sun Mar 25 12:50:49 +0000 2012,I believe in people like you.,0.3,2.1,0.4,90.77,1,1.38,1st and 2nd grade
Sun Mar 25 00:29:32 +0000 2012,I forget 23...like I forget 17...and I forget my first love...like you forget a day dream.,0.79,7.2,8.7,72.16,1,5.97,6th and 7th grade
Sat Mar 24 23:55:23 +0000 2012,Just got so much love in Dublin. Take Care video coming soon. Apologize for jumping the gun you know I'm rushing for ya'll.,6.08,1.6,3.1,97.5,3,4.54,4th and 5th grade
Sat Mar 24 12:28:42 +0000 2012,"Finally in Dublin...shout out to DJ Mr Rogers, DJ Candlestick, and the movie Boiler Room for getting me thru that flight.",1.04,7.9,11.7,75.54,1,8.94,7th and 8th grade
Fri Mar 23 23:41:46 +0000 2012,Video is on hold while we all make our way to Dublin. Will update soon.,5.06,0.3,0.2,106.16,2,1.64,-1th and 0th grade
Fri Mar 23 05:26:32 +0000 2012,Saw Nadal at dinner tonight...didn't get to meet him but that's still boss. Seeing Nadal is boss as shit.,0.47,2.3,4.9,95.67,2,5.36,4th and 5th grade
Thu Mar 22 22:44:45 +0000 2012,Drake Cole Flocka Meek 2 Chainz French...one night...Club Paradise Summer.,7.29,6.0,14.2,69.79,1,14.88,3rd and 4th grade
Wed Mar 21 04:05:53 +0000 2012,Dance dance revolution.,9.05,9.2,13.0,34.59,1,13.12,12th and 13th grade
Wed Mar 21 03:57:03 +0000 2012,Take Care video drops Friday. Shooting HYFR tmrw. OVO,7.37,1.5,4.4,92.29,2,5.41,1st and 2nd grade
Tue Mar 20 11:12:13 +0000 2012,Streets talking...they'll confirm.,14.31,9.2,30.3,34.59,1,26.63,1st and 2nd grade
Tue Mar 20 11:10:23 +0000 2012,No lie.,0.1,-3.1,-6.4,120.21,1,-16.11,-1th and 0th grade
Tue Mar 20 00:40:59 +0000 2012,New tour pics up on,0.25,-1.9,-4.9,117.16,1,-4.33,1st and 2nd grade
Tue Mar 20 00:34:53 +0000 2012,New music.,0.1,2.9,0.8,77.91,1,-7.41,-1th and 0th grade
Mon Mar 19 05:01:14 +0000 2012,Amy Traphouse and some vodka...TO.,10.2,5.2,9.3,66.4,1,8.44,8th and 9th grade
Mon Mar 19 02:12:16 +0000 2012,Just been in my city.,0.25,-1.9,-3.0,117.16,1,-3.17,1st and 2nd grade
Sun Mar 18 23:10:41 +0000 2012,HYFR,0.05,-3.5,-2.2,121.22,1,-22.21,-1th and 0th grade
Sat Mar 17 01:46:48 +0000 2012,Chammmmmmmpagggggnnnnneeeeeeeee,19.48,67.4,125.1,-386.39,1,134.4,-1th and 0th grade
Thu Mar 15 06:18:45 +0000 2012,God must be a comedian at heart.,6.24,3.7,-0.6,81.29,1,0.76,3rd and 4th grade
Wed Mar 14 06:14:42 +0000 2012,Watching impromptu performance in LA...genius. Fuckin genius.,13.01,11.9,19.1,22.07,1,21.47,11th and 12th grade
Tue Mar 13 07:08:16 +0000 2012,But you don't know what you're doing...girl it takes some time to move on yo Sampha is that nigga.,7.07,6.0,7.9,86.03,1,5.28,7th and 8th grade
Tue Mar 13 06:45:48 +0000 2012,You got me feeling a way.,6.57,0.9,-2.8,99.23,1,-2.46,1st and 2nd grade
Mon Mar 12 10:34:11 +0000 2012,Duffle bag too heavy to carry to the car,5.84,2.1,-0.3,96.18,1,1.59,3rd and 4th grade
Mon Mar 12 10:32:33 +0000 2012,I made something outta nothing...thanks for nothing.,6.24,7.2,13.0,55.91,1,14.86,6th and 7th grade
Mon Mar 12 00:38:14 +0000 2012,LAST SHOW San Diego...Welcome to Club Paradise.,6.24,3.7,9.7,81.29,1,10.74,3rd and 4th grade
Sun Mar 11 12:01:58 +0000 2012,When she in the front I make her put in reverse...and if the pussy good then I put it in a verse,1.81,6.0,5.6,91.45,1,1.69,5th and 6th grade
Sun Mar 11 11:55:01 +0000 2012,Some people think small...Some people think big...,0.35,3.7,11.7,81.29,1,11.55,11th and 12th grade
Sun Mar 11 08:54:57 +0000 2012,Jerry Rice gave me an amazing gift at the show Thank you to him and his daughter.,6.34,5.2,5.1,88.06,1,4.23,5th and 6th grade
Sun Mar 11 02:49:14 +0000 2012,2nd last show tonite San Jose...Welcome to Club Paradise.,5.84,2.1,8.7,96.18,1,9.94,3rd and 4th grade
Sat Mar 10 03:23:33 +0000 2012,CMB is the tree...everybody branch...but won't nobody leave Gunz,0.45,4.4,12.4,79.26,1,12.5,3rd and 4th grade
Fri Mar 09 05:23:37 +0000 2012,Humidafire Junkie,11.63,2.9,17.3,77.91,1,15.8,-1th and 0th grade
Fri Mar 09 00:54:55 +0000 2012,Guilty consciences all around me. Lol.,6.57,0.9,7.5,99.23,1,9.15,1st and 2nd grade
Thu Mar 08 11:58:39 +0000 2012,Sometimes I wanna tweet things like Bitch how you stop fuckin with me and now you live on twitter everyday ...but then I just don't.,6.14,8.3,11.4,79.94,1,6.91,6th and 7th grade
Thu Mar 08 10:34:49 +0000 2012,Got the ultimate range I might be the only one and the Breitling where you pull it and the helicopter comes...yes lawd.,6.88,8.3,10.5,74.53,1,7.49,6th and 7th grade
Thu Mar 08 07:47:42 +0000 2012,I keep the ziploc bussin at the stitches...culinary chemist...I serve the malicious Pusha,9.14,7.2,13.0,66.74,1,13.5,7th and 8th grade
Thu Mar 08 04:54:21 +0000 2012,Tell a bad bitch yo ass too fat...capitalize that.,5.84,4.4,5.1,79.26,1,5.42,4th and 5th grade
Wed Mar 07 11:23:02 +0000 2012,From this nigga Diddy view I think I see his vision too.,8.18,4.4,2.2,84.68,1,3.12,4th and 5th grade
Wed Mar 07 07:39:00 +0000 2012,All my homies I ain't talk too in a while...I ain't mad atcha.,0.64,1.3,3.2,109.04,1,1.44,0th and 1st grade
Tue Mar 06 03:16:55 +0000 2012,LA...Welcome to Club Paradise.,7.78,3.7,12.4,75.88,1,10.15,3rd and 4th grade
Sun Mar 04 20:27:28 +0000 2012,Tucson...Welcome to Club Paradise.,11.73,9.6,17.1,33.58,1,15.95,1st and 2nd grade
Sat Mar 03 23:22:38 +0000 2012,thezone,19.48,8.4,12.0,36.62,1,-4.81,-1th and 0th grade
Sat Mar 03 07:20:02 +0000 2012,Seeing a doctor about this stomach flu...UTA gave me life Sorry to all my family at Club Zouk that I won't be seeing tonight. Be back soon.,1.25,5.0,5.1,83.15,2,5.1,4th and 5th grade
