created_at,text,dale_chall_readability_score,flesch_kincaid,automated_readability,flesch_reading,sentence_count,coleman_liau_index,based_on_all_algorithms
Fri May 01 04:01:36 +0000 2020,DARK LANE DEMO TAPES,7.78,1.3,0.6,92.8,1,1.45,0th and 1st grade
Fri Apr 03 04:18:55 +0000 2020,TOOSIE SLIDE official video,7.78,3.7,8.8,75.88,1,11.6,11th and 12th grade
Fri Apr 03 04:00:14 +0000 2020,TOOSIE SLIDE,0.1,-3.1,5.5,120.21,1,1.3,-1th and 0th grade
Tue Feb 11 20:05:52 +0000 2020,URL x CAFFEINE Excited to announce this major step forward I managed to get and linked up with the objective of making battle rap easier to access in you home or on your mobile device and it s FREE to watch battles once you sign up. Greatness Simplified.,9.64,19.6,22.9,39.68,1,8.37,19th and 20th grade
Sat Jan 25 05:45:27 +0000 2020,Congrats to the cast and crew on their premiere at Honored to be a part of this.,7.27,5.2,4.8,88.06,1,3.94,4th and 5th grade
Fri Sep 13 04:05:56 +0000 2019,TOP BOY a selection of music inspired by the series Now Available Everywhere TOP BOY The Netflix Series Available 12am PST,8.44,10.3,12.0,58.62,1,10.91,10th and 11th grade
Sat Aug 31 22:38:10 +0000 2019,Almost that time TOP BOY,0.25,0.5,-0.2,100.24,1,1.48,1st and 2nd grade
Sun Aug 04 19:27:30 +0000 2019,TONIGHT EPISODE 8,0.15,-2.7,3.6,119.19,1,3.43,0th and 1st grade
Sun Jul 28 21:37:40 +0000 2019,TONIGHT EPISODE 7,0.15,-2.7,3.6,119.19,1,3.43,0th and 1st grade
Sun Jul 21 21:53:44 +0000 2019,TONIGHT EPISODE 6,0.15,-2.7,3.6,119.19,1,3.43,0th and 1st grade
Sun Jul 14 21:42:43 +0000 2019,TONIGHT EPISODE 5,0.15,-2.7,3.6,119.19,1,3.43,0th and 1st grade
Sun Jul 07 21:34:51 +0000 2019,TONIGHT EPISODE 4,0.15,-2.7,3.6,119.19,1,3.43,0th and 1st grade
Mon May 13 19:21:25 +0000 2019,"Supporting home grown businesses has always been a top priority of mine, so when an opportunity came up to get involved with Cargojet, a great Canadian company I was honored to do so.",9.1,16.2,16.6,37.98,1,9.3,16th and 17th grade
Thu Mar 28 17:03:08 +0000 2019,euphoria is coming soon to,7.04,5.2,1.8,66.4,1,3.8,7th and 8th grade
Fri Feb 15 05:02:03 +0000 2019,"So Far Gone the full original version of the mixtape, streaming everywhere for the first time",8.38,7.2,9.6,72.16,1,10.32,8th and 9th grade
Tue Jan 22 08:57:57 +0000 2019,ASSASSINATION VACATION UK and EU tour tickets on sale Friday Me and w opening sound set by,8.19,8.7,7.6,62.68,1,7.65,7th and 8th grade
Fri Jan 18 16:28:00 +0000 2019,Proud to present MONSTERS AND MEN with in UK and Irish cinemas and on digital platforms today Film of the Week. A powerhouse that couldn t be more timely or necessary Book tickets and download now,8.48,8.0,8.6,70.13,2,8.18,7th and 8th grade
Thu Oct 04 23:13:37 +0000 2018,Excited and honored to be a part of such an important film. I can t wait for everyone to experience it.,5.66,6.2,2.4,69.28,2,3.63,5th and 6th grade
Thu Sep 27 19:55:11 +0000 2018,I m excited and honored to be a part of such an important film. I can t wait for everyone to experience it. Monsters and Men hits theatres this Friday September 28th,6.14,6.3,3.6,69.07,3,5.49,5th and 6th grade
Mon Jul 30 16:30:22 +0000 2018,side effects include EUPHORIA. coming soon,11.83,8.0,10.6,48.47,1,13.97,10th and 11th grade
Fri Jun 29 06:30:06 +0000 2018,ScorpionSZN,19.48,20.2,30.9,-47.99,1,18.4,19th and 20th grade
Mon Jun 11 10:58:45 +0000 2018,NEW DATES ADDED...,0.15,-2.7,5.2,119.19,1,-0.46,-1th and 0th grade
Sun May 27 16:19:46 +0000 2018,I'm Upset,0.1,2.9,-1.7,77.91,1,-10.31,-1th and 0th grade
Fri May 18 13:02:31 +0000 2018,Tickets on sale now,7.78,1.3,-0.7,92.8,1,0.0,-1th and 0th grade
Thu Mar 15 04:57:59 +0000 2018,playing fort nite with,7.78,1.3,2.9,92.8,1,4.35,0th and 1st grade
Sat Feb 17 05:31:10 +0000 2018,GODS PLAN VIDEO,0.15,-2.7,0.5,119.19,1,-0.46,0th and 1st grade
Mon Oct 10 09:38:00 +0000 2016,Tickets Available October 14,11.73,9.6,10.0,33.58,1,13.05,9th and 10th grade
Mon Sep 26 05:32:59 +0000 2016,PleaseForgiveMe A Film Inspired by The Album Views. Available now only on,9.2,4.5,5.9,73.85,2,8.63,5th and 6th grade
Thu Sep 22 03:29:35 +0000 2016,This Friday at the Tickets Now Available,8.5,3.7,5.0,81.29,1,8.24,2nd and 3rd grade
Wed Sep 21 21:04:16 +0000 2016,Now Available On The App Store.,6.57,0.9,2.0,99.23,1,3.35,1st and 2nd grade
Wed Sep 07 01:13:50 +0000 2016,Featuring SummerSixteen Tour Merchandise amp Exclusive LA Pop Up Revenge Merchandise.,11.36,13.5,16.2,18.01,1,20.57,10th and 11th grade
Sun Sep 04 02:41:28 +0000 2016,Drake Childs Play Video now playing on the OVO Blog.,5.71,1.3,3.8,103.63,1,5.6,3rd and 4th grade
Thu Sep 01 00:10:28 +0000 2016,Featuring SummerSixteen Tour Merchandise amp Exclusive Revenge Merchandise.,13.9,17.0,22.6,-12.79,1,28.96,22nd and 23rd grade
Wed Aug 17 19:18:45 +0000 2016,PARTYNEXTDOOR 3 P3 Now Available.,10.2,2.9,8.4,83.32,1,10.76,1st and 2nd grade
Wed Aug 03 16:18:59 +0000 2016,Featuring SummerSixteen Tour Merchandise amp Exclusive NYC Pop Up Revenge Merchandise.,11.36,13.5,16.6,18.01,1,21.09,10th and 11th grade
Fri Jul 29 16:47:14 +0000 2016,Toronto OVO Store Locations,11.73,7.2,8.8,50.5,1,11.6,11th and 12th grade
Thu Jul 21 07:07:15 +0000 2016,All Summer Sixteen,0.15,5.6,5.2,59.97,1,5.35,5th and 6th grade
Thu Jun 30 21:10:43 +0000 2016,Seventh Annual OVOFEST TD Echo Beach Tickets On Sale Now Exclusively at TicketMaster,9.14,10.7,11.2,41.36,1,13.96,10th and 11th grade
Sun Jun 05 01:55:43 +0000 2016,forfree,19.48,8.4,12.0,36.62,1,-4.81,-1th and 0th grade
Tue May 24 14:59:52 +0000 2016,New Dates Added Canada Pre Sales Start Today With American Express SummerSixteenTour,8.18,10.3,13.2,42.38,1,17.1,10th and 11th grade
Fri May 20 17:01:17 +0000 2016,"New Dates Added US Pre Sales Start Mon May 23, 2016 With American Express SummerSixteenTour",6.49,8.0,10.2,64.71,1,11.53,8th and 9th grade
Sat May 07 00:03:14 +0000 2016,VIEWS Available Now.,9.05,0.9,8.3,93.81,1,7.32,0th and 1st grade
Fri May 06 00:00:16 +0000 2016,VIEWS Available Now.,9.05,0.9,8.3,93.81,1,7.32,0th and 1st grade
Thu May 05 01:09:08 +0000 2016,VIEWS Available Now.,9.05,0.9,8.3,93.81,1,7.32,0th and 1st grade
Tue May 03 23:53:28 +0000 2016,VIEWS Now Available,9.05,0.9,6.8,93.81,1,7.32,0th and 1st grade
Fri Apr 29 12:06:40 +0000 2016,New date added to Summer Sixteen Tour. Tickets on sale today at 10am local time.,6.11,2.7,3.0,89.24,2,5.12,2nd and 3rd grade
Fri Apr 29 03:16:54 +0000 2016,VIEWS Now Available On iTunes,7.04,0.5,4.6,100.24,1,7.28,1st and 2nd grade
Fri Apr 29 00:03:52 +0000 2016,Views gone viral,9.05,0.9,2.1,93.81,1,1.52,0th and 1st grade
Thu Apr 28 16:00:42 +0000 2016,VIEWS Eve.,0.1,-3.1,0.8,120.21,1,-7.41,-1th and 0th grade
Wed Apr 27 20:34:28 +0000 2016,VIEWS Tracklist,11.63,2.9,12.5,77.91,1,10.0,-1th and 0th grade
Wed Apr 27 13:00:17 +0000 2016,Additional shows have been added to the Summer Sixteen Tour. Pre sales begin at 10am local time today.,5.84,4.4,5.3,79.26,2,7.68,5th and 6th grade
Tue Apr 26 01:23:30 +0000 2016,Tune into OVOSOUND Radio on Beats 1 this Thursday at 7PM PST 10PM EST 3AM GMT VIEWS,0.84,5.2,5.6,88.06,1,5.28,5th and 6th grade
Mon Apr 25 11:02:07 +0000 2016,Drake. Future. SummerSixteenTour. Tickets on sale Friday 4 29.,9.35,9.2,11.3,45.42,1,13.19,8th and 9th grade
Mon Apr 25 11:00:29 +0000 2016,Seventh Annual OVOFEST,9.05,9.2,11.5,34.59,1,13.12,11th and 12th grade
Mon Apr 25 01:01:17 +0000 2016,To the city I love and the people in it...Thank you for everything VIEWS,0.69,5.2,5.4,82.65,1,5.33,5th and 6th grade
Sun Apr 24 19:59:26 +0000 2016,TORONTO TODAY VIEWS 567 QUEEN ST. W TORONTO. 5PM Powered by,6.78,3.1,2.3,82.81,2,3.64,1st and 2nd grade
Sat Apr 23 22:05:01 +0000 2016,PALM SPRINGS TODAY VIEWS Powered by,6.57,2.1,5.1,90.77,1,8.17,1st and 2nd grade
Thu Apr 21 22:01:19 +0000 2016,LOS ANGELES TODAY VIEWS 441 N Fairfax LA. 5PM Powered by,8.49,6.4,3.8,68.77,1,5.26,5th and 6th grade
Tue Apr 19 19:02:47 +0000 2016,MIAMI TODAY VIEWS 500 NW 23RD ST MIAMI. 5PM Powered by,7.05,6.4,2.9,68.77,1,4.21,6th and 7th grade
Mon Apr 18 18:01:48 +0000 2016,NYC TODAY VIEWS Powered by,7.04,2.9,1.8,83.32,1,3.8,1st and 2nd grade
Sun Apr 10 03:26:58 +0000 2016,4 29 16 VIEWS,0.2,-2.3,-7.8,118.18,1,-8.71,-1th and 0th grade
Tue Apr 05 16:23:08 +0000 2016,Drake Pop Style Feat. The Throne now available on iTunes VIEWS,5.34,-0.6,3.6,108.19,2,5.78,-1th and 0th grade
Tue Apr 05 16:21:47 +0000 2016,Drake One Dance Feat. Wizkid amp Kyla now available on iTunes VIEWS,7.88,2.1,3.6,90.77,2,5.73,1st and 2nd grade
Sat Feb 20 20:38:20 +0000 2016,it's a beautiful ting....,0.2,3.7,6.5,75.88,1,1.45,1st and 2nd grade
Tue Feb 16 20:47:00 +0000 2016,And on the off chance that Metro Boomin doesn't trust you...well...,0.55,1.7,8.5,102.61,1,7.93,4th and 5th grade
Tue Feb 09 07:56:22 +0000 2016,That's why I sing all the songs I sung,0.45,-0.4,-1.3,113.1,1,-0.39,-1th and 0th grade
Mon Feb 08 00:53:15 +0000 2016,I am not performing at the Grammy Awards...but hey it's the thought that counts.,6.59,5.2,8.1,82.65,1,7.82,7th and 8th grade
Sun Feb 07 07:36:25 +0000 2016,DRAKE x SUPERBOWL 50 COMMERCIAL,10.2,7.6,6.5,49.48,1,9.6,9th and 10th grade
Thu Feb 04 23:08:30 +0000 2016,Master is a bit of a stretch. But then again you have to stretch before everything works out. So yes Reginald its a go,1.05,1.7,1.2,97.2,3,2.86,1st and 2nd grade
Sat Jan 30 08:24:19 +0000 2016,OVO Sound Radio Episode 14 tmrw at 3PM PST 6PM EST...it begins.,6.86,4.4,5.0,84.68,1,5.03,4th and 5th grade
Thu Oct 29 06:42:29 +0000 2015,Thank you to and NobuCaesarsPalace for the birthday hospitality.,7.59,9.2,12.4,45.42,1,16.38,-1th and 0th grade
Tue Oct 20 01:46:55 +0000 2015,Hotline Bling Video out now.,7.04,0.5,3.7,100.24,1,4.96,1st and 2nd grade
Mon Sep 21 00:14:27 +0000 2015,What a time to be alive,0.3,-1.5,-4.4,116.15,1,-3.44,-1th and 0th grade
Sun Sep 20 07:52:29 +0000 2015,OVO SOUND RADIO 6PM EST TODAY 6TH EPISODE. MAWD TINGS. WHAT A TIME TO BE ALIVE.,0.4,0.5,1.4,105.66,2,2.45,0th and 1st grade
Wed Jul 29 08:12:41 +0000 2015,Scary hours.,0.1,-3.1,5.5,120.21,1,-1.61,-1th and 0th grade
Fri Jul 10 16:43:48 +0000 2015,FIXXXXXXX UP YOURSELF.,0.15,0.9,11.5,93.81,1,11.15,0th and 1st grade
Fri Jul 10 15:30:08 +0000 2015,Dirty Sprite 2 and I am on there FBGOVO,5.84,2.1,-0.8,96.18,1,0.9,4th and 5th grade
Fri Jul 10 15:10:28 +0000 2015,That radio show you don't want to miss...Oliver vs Drake sound clash so you know I had to let exclusives ring off. No sound can test. AT ALL,5.46,4.0,4.6,91.11,2,4.28,4th and 5th grade
Thu Jun 25 15:09:24 +0000 2015,Drake Obey Your Thirst Documentary Episode 1 Video,6.01,4.1,7.9,80.28,1,11.56,3rd and 4th grade
Sun May 10 08:59:30 +0000 2015,Views.,0.05,-3.5,7.3,121.22,1,-16.41,-1th and 0th grade
Tue May 05 22:49:05 +0000 2015,I like all my S's with two lines thru them shits.,0.55,0.5,0.8,111.07,1,1.02,0th and 1st grade
Tue Apr 21 17:00:34 +0000 2015,If You're Reading This It's Too Late CD Now Available,5.71,2.5,4.3,95.17,1,5.6,3rd and 4th grade
Mon Apr 13 19:15:48 +0000 2015,DRAKE JUNGLE TOUR WITH FUTURE 2015,9.2,2.1,4.3,90.77,1,7.18,1st and 2nd grade
Fri Mar 27 19:01:32 +0000 2015,NOW LIVE,0.1,-3.1,-4.0,120.21,1,-10.31,-1th and 0th grade
Tue Mar 17 17:07:57 +0000 2015,James Prince and I stand together on not supporting the Drake Homecoming footage in theatres. protectingthefans,8.38,10.7,14.8,46.78,1,16.88,10th and 11th grade
Tue Mar 17 15:41:28 +0000 2015,Here is the lineup for the entire weekend,9.95,4.1,2.6,80.28,1,5.0,2nd and 3rd grade
Mon Mar 16 14:10:42 +0000 2015,The Drake Homecoming film is not something OVO or Drake have any part in. I feel it is my responsibility to inform and protect my fans.,6.1,6.0,5.0,75.2,2,5.9,5th and 6th grade
Sun Mar 08 20:25:06 +0000 2015,Excited to be performing for the first time ever in Dubai on March 14th at the Dubai International Cricket Stadium,7.79,11.1,10.9,51.18,1,10.27,10th and 11th grade
Sat Feb 21 06:50:06 +0000 2015,What do you want to hear on the New Zealand Australia tour dates,6.71,3.6,3.9,92.12,1,5.03,3rd and 4th grade
Tue Feb 10 22:54:00 +0000 2015,PND ain't wit the ray tay tay.,0.35,-1.2,-1.9,115.13,1,-1.74,2nd and 3rd grade
Tue Feb 10 21:53:48 +0000 2015,Happy birthday to Thank you for everything you have done for me. You are a RARE breed. GO CATS GO. UKvsLSU,0.35,1.3,1.4,98.21,3,2.97,2nd and 3rd grade
Sat Feb 07 09:38:37 +0000 2015,I hope one day you gain an understanding of how this goes...we wrote it in code then wrote it in stone. Suh it go.,1.25,2.1,2.4,101.6,2,2.6,2nd and 3rd grade
Thu Feb 05 20:53:14 +0000 2015,67,0.05,-3.5,-11.6,121.22,1,-33.81,-1th and 0th grade
Mon Feb 02 16:59:25 +0000 2015,We gon see...,0.15,-2.7,-2.7,119.19,1,-10.09,0th and 1st grade
Fri Jan 30 14:11:10 +0000 2015,"Wireless, Coachella, and Gov Ball...Blessed.",10.2,7.6,18.8,49.48,1,17.72,7th and 8th grade
Fri Jan 30 09:31:21 +0000 2015,way way way...blessings.,9.05,9.2,14.6,34.59,1,9.23,8th and 9th grade
Fri Jan 23 06:05:17 +0000 2015,Congrats to my brother Kyle Lowry on making the All Star East Well deserved.,6.59,5.2,6.8,82.65,1,7.82,5th and 6th grade
Thu Jan 22 06:04:57 +0000 2015,on that wave. Love.,0.2,-2.3,-0.7,118.18,1,-2.91,-1th and 0th grade
Sun Jan 18 12:57:40 +0000 2015,Rest in peace Yams. A AP is family.,0.2,1.3,-3.0,92.8,2,-4.36,1st and 2nd grade
Sat Jan 03 10:39:07 +0000 2015,too epic mayne,0.15,-2.7,-1.2,119.19,1,-2.38,0th and 1st grade
Mon Dec 29 19:38:26 +0000 2014,I ll be partying at this NYE2015.,6.24,2.5,0.3,89.75,1,1.57,-1th and 0th grade
Sat Dec 20 22:22:10 +0000 2014,Actually this redesign was executed without me. My collaboration with Mitchell amp Ness comes out next season.,7.77,9.0,8.9,45.93,2,12.03,8th and 9th grade
Sat Dec 20 02:30:19 +0000 2014,WOOWWWW James Johnson is LIT.,7.04,0.5,4.6,100.24,1,6.12,1st and 2nd grade
Sat Dec 20 02:28:29 +0000 2014,Hoping Landry is ok. 6Side Raptors,9.2,2.1,4.3,90.77,1,6.25,1st and 2nd grade
Sat Dec 20 02:28:04 +0000 2014,And Big Science is teaching that formula...the beaker is bubbling. dropping gems. Leo knows he wants to say Science.,8.26,4.6,7.6,78.75,2,9.02,4th and 5th grade
Sat Dec 20 02:25:14 +0000 2014,Patterson going offffff.,9.05,9.2,14.6,34.59,1,15.03,14th and 15th grade
Fri Dec 19 21:42:16 +0000 2014,I'm counting on you to stay so true to the Big Science movement tonight. Tell Jack I said stay waved up as per usual.,6.86,3.3,3.0,93.14,2,3.81,4th and 5th grade
Wed Dec 17 18:28:48 +0000 2014,Drake Night tonight vs. Brooklyn,7.04,0.5,7.4,100.24,1,9.6,1st and 2nd grade
Wed Dec 03 13:01:16 +0000 2014,coming home was a great thing. We need that. Work ethic like none other.,5.0,0.4,0.7,100.54,3,1.18,0th and 1st grade
Wed Dec 03 08:31:04 +0000 2014,I remember everything...juss know.,0.2,9.6,17.1,33.58,1,15.95,-1th and 0th grade
Wed Dec 03 03:13:41 +0000 2014,Hahahhahahaha too funny. 6 side.,7.04,12.3,7.4,15.64,1,8.44,7th and 8th grade
Wed Nov 19 14:59:46 +0000 2014,Vegas NYE at,9.05,0.9,-4.3,93.81,1,-6.26,0th and 1st grade
Wed Nov 12 10:58:50 +0000 2014,Just double checking.,9.05,5.6,9.9,59.97,1,9.23,9th and 10th grade
Thu Nov 06 03:15:03 +0000 2014,4 1 Raps Haaaaa my bad my app didn't update.,5.71,2.5,0.1,95.17,1,0.38,-1th and 0th grade
Wed Oct 29 10:50:43 +0000 2014,hardly hardly hardly forget anything.,0.25,10.0,12.2,32.56,1,15.4,1st and 2nd grade
Wed Oct 29 01:39:42 +0000 2014,Look forward to seeing the fans at Jurassic Park tomorrow. Our time this year WeTheNorth ovo goraptors,5.92,4.2,6.7,79.77,2,9.65,3rd and 4th grade
Wed Oct 29 01:39:42 +0000 2014,Look forward to seeing the fans at Jurassic Park tomorrow. Our time this year WeTheNorth ovo goraptors,5.92,4.2,6.7,79.77,2,9.65,3rd and 4th grade
Sat Oct 25 22:57:49 +0000 2014,That wasn't an EP. Just 3 songs that I knew some hackers had. But enjoy Back to this album.,5.61,1.0,-0.3,98.92,3,0.52,0th and 1st grade
Sat Oct 25 21:32:59 +0000 2014,6GOD HEATOFTHEMOMENT HOWBOUTNOW,14.31,12.7,25.6,9.21,1,30.52,12th and 13th grade
Sat Oct 25 20:56:46 +0000 2014,You should probably keep an eye on that in the next hour...just saying...,6.71,4.8,7.2,83.66,1,6.37,6th and 7th grade
Thu Oct 09 04:20:47 +0000 2014,is too incredible Everybody on Top Boy gives such incredible performances. That show is just too good.,5.92,6.6,6.7,62.85,2,9.3,6th and 7th grade
Mon Sep 22 19:47:55 +0000 2014,Excited to go to work tonight. LA Hollywood Bowl. Run up.,5.34,3.1,1.4,82.81,2,2.07,2nd and 3rd grade
Sun Sep 14 06:47:06 +0000 2014,Happy Birthstrong to the guy Chainz,6.57,2.1,5.1,90.77,1,8.17,1st and 2nd grade
Sat Sep 13 11:00:40 +0000 2014,When I come with with a Gatorade...or a Arizona...,5.84,2.1,5.1,96.18,1,4.14,3rd and 4th grade
Tue Aug 26 23:43:01 +0000 2014,now opening on the Drake vs. Lil Wayne tour. Get there by 730 to make sure you catch his set,1.12,0.0,-1.0,106.97,3,0.35,2nd and 3rd grade
Tue Aug 26 15:28:56 +0000 2014,I'm coming after whoever...who has it Ye,6.24,7.2,5.0,55.91,1,4.94,4th and 5th grade
Tue Aug 26 12:32:08 +0000 2014,Straw Ber Rita dreams turn to champagne reality.,9.95,6.4,6.7,63.36,1,9.35,6th and 7th grade
Tue Aug 26 12:31:16 +0000 2014,Your shit ain't getting me hiiiigh no more...my trap is still bunkin...to get all of these 100's might jump with no bungee La Flame,1.85,9.1,11.8,72.5,1,7.2,11th and 12th grade
Tue Aug 19 20:16:17 +0000 2014,Lil Wayne and I will be hitting the stage at 730pm tonight due to venue restrictions,6.4,4.8,6.9,89.08,1,7.42,6th and 7th grade
Wed Aug 13 10:21:19 +0000 2014,Did Kevin Blackistone really just ask why Shad or the other dancehall rappers aren't the Global Ambassador Haaa stop the madness.,9.19,11.5,13.5,50.16,1,12.3,11th and 12th grade
Sun Aug 10 23:21:21 +0000 2014,Vegas needs to be taking bets by now...,6.01,2.9,1.4,88.74,1,1.41,2nd and 3rd grade
Sun Aug 10 23:15:19 +0000 2014,Chicago Tonight it's a GO. Wayne is up 2 0. But TONIGHT is gonna be the first of MANY W's for the boy. DrakevsLilWayne,5.35,0.5,1.2,105.66,3,2.1,2nd and 3rd grade
Fri Aug 08 11:40:20 +0000 2014,The choice is clear though...BUFFALO NY see you tonight.,0.45,3.3,8.2,87.72,1,9.31,3rd and 4th grade
Fri Aug 08 11:40:05 +0000 2014,"You decide who STARTS the show, who WINS the show, and of course what side you are on Just choose your city and from there its on YOU.",1.39,7.1,10.6,93.82,1,4.53,4th and 5th grade
Fri Aug 08 11:39:13 +0000 2014,Everybody coming to the shows download the Drake vs Lil Wayne app free and put the power in your own hands,1.79,6.8,8.4,84.0,1,6.5,6th and 7th grade
Wed Aug 06 22:35:12 +0000 2014,My album title is VIEWS FROM THE 6. The 6 is Toronto. Rih is a great girl who I know is about to kill this tour with Eminem. It's all love,5.55,0.4,-1.3,105.86,4,-0.23,2nd and 3rd grade
Tue Aug 05 10:37:50 +0000 2014,Now on to this Drake vs Lil Wayne tour. It's about to be an event every night. I'm going to SNAP on that stage. I DO THIS,0.34,0.0,-1.6,106.87,4,-0.94,-1th and 0th grade
Sun Aug 03 20:19:23 +0000 2014,Looking forward to seeing the legendary Outkast headline tonight at the Fifth Annual OVOFEST.,9.97,8.8,12.5,57.27,1,14.84,8th and 9th grade
Sat Aug 02 00:23:52 +0000 2014,sidepieces,19.48,8.4,26.2,36.62,1,12.6,-1th and 0th grade
Fri Aug 01 18:32:45 +0000 2014,OVO BOUNCE FINALS TONIGHT,7.78,1.3,6.5,92.8,1,8.7,0th and 1st grade
Mon Jul 28 07:21:31 +0000 2014,PND2 has the place weeeeeak.,0.25,-1.9,3.7,117.16,1,4.96,1st and 2nd grade
Mon Jul 28 07:20:16 +0000 2014,OVO FEST is going to be one a dem ONEEES. Summer is exciting.,0.32,2.3,-0.5,90.26,2,0.76,2nd and 3rd grade
Mon Jul 28 07:15:50 +0000 2014,First day of Drake vs. Lil Wayne rehearsals were INCREDIBLE. Can't wait for the people to see it.,5.69,2.1,2.5,90.77,3,3.64,2nd and 3rd grade
Sat Jul 26 09:50:02 +0000 2014,tape is a CLASSIC. I'm so proud. EP is something INCREDIBLE OVO SOUND SUMMER.,6.13,2.8,2.4,83.62,3,2.87,2nd and 3rd grade
Sun Jul 20 02:37:59 +0000 2014,RIP Kennedy. So glad I got to meet you and experience your love for one day.,5.42,4.8,4.5,89.08,1,3.83,4th and 5th grade
Sun Jul 13 03:10:05 +0000 2014,King Of The Dot is forever the movement,7.98,4.1,1.4,80.28,1,3.55,3rd and 4th grade
Thu Jun 26 23:13:28 +0000 2014,"So excited for this Draft Pay the guys maan They've earned it. So proud of Andrew, Tyler, and Stauskas Canadian Basketball on the rise",6.21,4.4,6.4,84.68,2,7.7,6th and 7th grade
Thu Jun 12 16:00:34 +0000 2014,Drake Vs. Lil Wayne,0.2,-2.3,-0.7,118.18,1,-1.46,-1th and 0th grade
Tue May 20 06:42:35 +0000 2014,Friday June 13th I'm performing at Warehouse Live for HAW. Going back to where it all began.,5.92,4.2,3.9,79.77,2,5.53,5th and 6th grade
Sat May 17 07:47:43 +0000 2014,Big up Mad Child for the shout on Sway and the whole Swollen Members,5.46,2.9,4.1,99.57,1,4.92,4th and 5th grade
Mon May 12 14:02:53 +0000 2014,NEW,0.05,-3.5,-6.9,121.22,1,-28.01,-1th and 0th grade
Sun May 11 11:46:35 +0000 2014,Still up in the studio with 2 ON,6.01,0.5,-2.8,105.66,1,-1.5,2nd and 3rd grade
Sun May 11 08:09:45 +0000 2014,Drake be knowin .. via,0.2,1.3,1.8,92.8,1,0.0,1st and 2nd grade
Wed May 07 02:40:07 +0000 2014,you know I love you always.,0.3,0.9,-1.2,99.23,1,-0.54,-1th and 0th grade
Wed Apr 30 08:27:00 +0000 2014,Dreams and Nightmares Intro really one of the best rap moments of our generation...,8.84,8.8,9.1,57.27,1,9.91,8th and 9th grade
Fri Apr 25 21:04:07 +0000 2014,Going to the ACC to watch the game with the fans on the big screen Hope to see you all there. NorthernUprising RedHotRevival,6.15,8.7,10.9,73.51,1,8.48,8th and 9th grade
Wed Apr 09 17:30:10 +0000 2014,Honored to be this year's host 7.16.2014 ESPYS NWTS,7.59,2.1,5.6,96.18,1,6.7,3rd and 4th grade
Wed Apr 02 03:06:17 +0000 2014,Suits and ties yelling out pay the guys,0.4,-0.8,1.4,114.12,1,3.55,-1th and 0th grade
Tue Apr 01 06:35:58 +0000 2014,Draft Day.,0.1,-3.1,0.8,120.21,1,-7.41,-1th and 0th grade
Mon Mar 31 02:51:36 +0000 2014,BIG BLUE.,0.1,-3.1,-1.7,120.21,1,-10.31,-1th and 0th grade
Thu Mar 20 18:21:14 +0000 2014,HAW dates coming soon.,0.2,1.3,2.9,92.8,1,2.9,0th and 1st grade
Thu Mar 20 18:19:21 +0000 2014,"6 shows left then it's back home Birmingham x2, Liverpool, and London x3 I hope you're ready. WYLAT home stretch",6.5,3.7,5.5,86.71,2,6.76,6th and 7th grade
Thu Mar 20 18:17:00 +0000 2014,Man one time for my brothers and just because.,5.84,2.1,2.9,96.18,1,4.78,3rd and 4th grade
Mon Feb 24 16:25:07 +0000 2014,Or Nah,0.1,-3.1,-8.8,120.21,1,-16.11,-1th and 0th grade
Fri Feb 21 18:59:46 +0000 2014,I got whatever on Canada Always. Bet it back. I want a car. Haaa,6.13,1.6,-2.1,92.08,3,-2.13,1st and 2nd grade
Sat Feb 15 00:39:28 +0000 2014,x 2014 OVO Tour Jackets available tomorrow ovo wylat,7.59,4.4,6.1,79.26,1,9.31,3rd and 4th grade
Thu Feb 13 14:30:52 +0000 2014,I'm done doing interviews for magazines. I just want to give my music to the people. That's the only way my message gets across accurately.,6.57,5.3,4.4,71.51,3,6.17,6th and 7th grade
Mon Feb 10 05:48:26 +0000 2014,CARTER V,0.1,-3.1,-4.0,120.21,1,-10.31,-1th and 0th grade
Thu Jan 23 08:18:16 +0000 2014,Living my raps.,0.15,0.9,0.5,93.81,1,-2.38,0th and 1st grade
Fri Jan 17 00:38:18 +0000 2014,Make sure you watch Jimmy Fallon tonight at 12 35 ET PT,6.86,3.3,1.9,93.14,1,3.12,4th and 5th grade
Mon Jan 06 01:26:04 +0000 2014,The boys are ballin' regardless GoRaptors HardFought,10.75,6.0,13.0,64.37,1,17.35,8th and 9th grade
Mon Dec 30 06:55:46 +0000 2013,And they don't have no award for that.,0.4,-0.8,0.8,114.12,1,1.41,-1th and 0th grade
Sat Dec 28 10:58:57 +0000 2013,Trophies later I meant...go to sleep.,9.2,4.5,6.7,73.85,1,6.25,6th and 7th grade
Sat Dec 28 10:44:02 +0000 2013,Shot to Tanaya Henry on the go off campaign 2014 OVO,7.05,2.9,2.1,94.15,1,3.69,4th and 5th grade
Sat Dec 28 10:43:19 +0000 2013,Trophies up next.,9.05,0.9,3.6,93.81,1,1.52,0th and 1st grade
Sat Dec 28 10:38:49 +0000 2013,New Years Eve Anthems on deck,6.57,0.9,0.4,99.23,1,2.37,1st and 2nd grade
Sat Dec 28 10:05:53 +0000 2013,RIP Doe B,0.15,-2.7,-9.1,119.19,1,-12.06,0th and 1st grade
Sat Dec 28 06:39:51 +0000 2013,The only thing I'm seeing I'd like to put an amend on...perhaps a little more room here for the fixinsssss Kenny Powers,6.88,9.5,10.5,66.07,1,7.25,8th and 9th grade
Sat Dec 28 05:09:51 +0000 2013,We made it.,0.15,-2.7,-5.9,119.19,1,-10.09,0th and 1st grade
Wed Dec 25 05:34:26 +0000 2013,HOSTING AND PERFORMING on SNL January 18th. Best gift I could ever receive.,6.39,4.6,4.7,73.34,2,6.96,4th and 5th grade
Wed Dec 25 05:32:00 +0000 2013,Happy Holidays to everybody. Good Vibes Only word to Virgil.,7.04,6.4,5.1,57.94,2,6.7,5th and 6th grade
Wed Dec 25 05:31:13 +0000 2013,That shit is coming stay patient. Haaa. NYE Anthem.,7.59,3.3,5.6,87.72,1,6.7,3rd and 4th grade
Mon Dec 09 14:01:35 +0000 2013,Welcome To The Family,0.2,7.2,1.8,50.5,1,2.9,1st and 2nd grade
Sat Nov 23 01:31:51 +0000 2013,Happy Birthday to and Vegas Tonight,6.57,4.5,5.1,73.85,1,8.17,4th and 5th grade
Mon Nov 11 17:22:06 +0000 2013,Would You Like A Video,0.25,-1.9,-2.1,117.16,1,-0.85,-1th and 0th grade
Thu Oct 24 03:25:27 +0000 2013,On the west side of this east side shit...,0.45,-0.4,0.9,113.1,1,0.9,0th and 1st grade
Mon Oct 21 20:48:43 +0000 2013,And congrats to on the launch of Revolt,7.98,2.9,1.4,88.74,1,3.55,2nd and 3rd grade
Mon Oct 21 20:48:06 +0000 2013,Watch CrazySexyCool the TLC story tonight on VH1,6.01,4.1,6.7,80.28,1,10.11,3rd and 4th grade
Thu Oct 17 23:40:12 +0000 2013,Would You Like A Tour kicks off tomorrow in Pittsburgh,5.71,3.7,4.8,86.71,1,7.34,3rd and 4th grade
Wed Oct 16 12:29:33 +0000 2013,Thanks to for the 5 awards,0.3,-1.5,-2.0,116.15,1,-0.54,-1th and 0th grade
Wed Oct 16 12:10:18 +0000 2013,New Party Next Door on OVO SOUND,0.35,0.1,-0.6,106.67,1,1.57,-1th and 0th grade
Fri Oct 11 22:36:49 +0000 2013,All my prayers go out to AP. That is the most depressing news I've heard in a long time.,4.94,1.1,0.7,104.13,2,1.42,0th and 1st grade
Sun Oct 06 10:18:14 +0000 2013,FREE NOT NICE,0.15,-2.7,-2.7,119.19,1,-4.29,0th and 1st grade
Tue Oct 01 10:00:46 +0000 2013,Choppin Ain't The Same Dropping Soon.,9.2,2.1,6.7,90.77,1,8.17,1st and 2nd grade
Mon Sep 30 00:27:52 +0000 2013,Buy Nothing Was The Same on iTunes,0.35,0.1,0.9,106.67,1,3.26,2nd and 3rd grade
