created_at,text,dale_chall_readability_score,flesch_kincaid,automated_readability,flesch_reading,sentence_count,coleman_liau_index,based_on_all_algorithms
Thu Nov 02 22:07:18 +0000 2017,HausEditorial HAUS HausOfGaga Makeup Hair Styling amp Sandra Amador,11.1,11.5,14.0,28.5,1,18.99,11th and 12th grade
Wed Nov 01 22:27:23 +0000 2017,NewProfilePic,19.48,20.2,40.3,-47.99,1,30.0,19th and 20th grade
Wed Nov 01 19:58:29 +0000 2017,"GAGA X TUDOR Some are born to follow, others are BornToDare",8.49,6.4,5.0,68.77,1,6.82,5th and 6th grade
Wed Nov 01 19:26:48 +0000 2017,"GAGA x TUDOR And yes, that s really me playing. BornToDare The most important person to dare is yourself. TudorWatch",7.29,7.2,6.4,61.33,2,8.5,7th and 8th grade
Wed Nov 01 18:03:36 +0000 2017,A surprise duel coming in 3..2..1 Directed by the incredible Mark Romanek TudorWatch,10.35,10.7,11.2,41.36,1,12.17,10th and 11th grade
Wed Nov 01 17:56:34 +0000 2017,The HAUS our group of collective creatives had so much fun I gave freddy a really good hair cut.,7.07,7.2,7.4,77.57,1,6.21,6th and 7th grade
Wed Nov 01 17:15:59 +0000 2017,Hair Makeup Costume Styling Natali Germanotta Tom Erebout Lisa Bruno halloween HAUS hausofgaga,12.78,10.7,14.8,41.36,1,18.43,10th and 11th grade
Wed Nov 01 16:58:45 +0000 2017,This is incredible Happy Gagaween You re awesome,7.98,6.4,6.7,63.36,1,10.11,7th and 8th grade
Wed Nov 01 07:48:32 +0000 2017,Halloween HAUS Edward Scissorhands,15.68,7.2,17.1,50.5,1,21.75,-1th and 0th grade
Tue Oct 31 15:19:32 +0000 2017,Oh my I love this HappyHalloween HappyGagaween,8.5,9.6,9.0,38.99,1,13.17,8th and 9th grade
Mon Oct 30 18:22:11 +0000 2017,THE SHEET GHOST IS A CLASSIC I m just being timeless,7.05,4.0,2.1,85.69,1,3.69,3rd and 4th grade
Mon Oct 30 07:34:05 +0000 2017,"I have quite a skincare routine, rituals I learned from my mother and my friends mothers. thank you",8.04,6.8,9.0,78.59,1,8.18,8th and 9th grade
Mon Oct 30 03:02:16 +0000 2017,THIS IS SOME GAME I ll tell ya MLB,0.45,-0.4,-3.4,113.1,1,-2.3,-1th and 0th grade
Mon Oct 30 01:05:40 +0000 2017,Omgosh how cute I could die go girl HappyHalloween HappyGagaween,8.87,8.4,9.5,52.87,1,13.14,8th and 9th grade
Sun Oct 29 17:02:54 +0000 2017,Me too baby Here we go....A YO,6.24,0.1,-1.9,106.67,1,-3.37,2nd and 3rd grade
Fri Oct 27 17:33:09 +0000 2017,"I can t wait to see sing to him again. This is why it s so important to raise awareness about mental illness. It s invisible, but very real.",6.3,3.5,1.6,87.01,3,2.82,5th and 6th grade
Wed Oct 25 19:24:07 +0000 2017,A message from me amp my buddy Vice President to stop sexual assault. Go to ItsOnUs to help.,8.47,4.4,2.7,79.26,2,4.49,4th and 5th grade
Wed Oct 25 17:32:57 +0000 2017,So excited for me amp my co writers Hillary Lindsey from Nashville and MillionReasons is soon to be DOUBLE Platinum in the USA,8.21,9.9,11.4,65.05,1,9.23,9th and 10th grade
Wed Oct 25 02:17:56 +0000 2017,When you got the best seat in the house. Next to Joe Torre and your best friend since you were 4.,0.52,0.3,1.1,111.58,2,1.95,0th and 1st grade
Mon Oct 23 22:57:07 +0000 2017,you so much for doing all this for our country and showing great leadership to the world,7.27,6.4,7.0,79.6,1,7.02,6th and 7th grade
Mon Oct 23 21:29:46 +0000 2017,JoanneIsPlatinumParty let s trend it Love you monsters My family is so happy today,6.59,8.8,8.8,57.27,1,10.72,8th and 9th grade
Mon Oct 23 20:09:12 +0000 2017,There she is up close and personal Joanne Certified US PLATINUM. What a beautiful plaque my friends made for me,6.5,4.8,5.2,78.25,2,7.63,7th and 8th grade
Mon Oct 23 20:03:59 +0000 2017,My album Joanne is Officially Certified Platinum in the United States I couldn t be more happy thank you from me and my family to you,7.36,11.1,11.1,62.01,1,7.09,7th and 8th grade
Sun Oct 22 22:33:39 +0000 2017,HappySundayTwitterverse SundayFunday,19.53,44.2,62.0,-218.2,1,70.9,-1th and 0th grade
Sun Oct 22 02:50:23 +0000 2017,OneAmericaAppeal salutes u for establishing a mental health amp trauma recovery fund w me personally for hurricane victims,11.55,13.9,15.0,27.83,1,16.24,13th and 14th grade
Sun Oct 22 02:11:47 +0000 2017,Nothing more beautiful than everyone putting their differences aside to help humanity in the face of catastrophe. OneAmericaAppeal,8.04,13.9,17.1,27.83,1,18.5,13th and 14th grade
Sun Oct 22 01:07:28 +0000 2017,Now that s what I call an audience OneAmericaAppeal performing in a few minutes,8.84,8.8,7.8,57.27,1,9.45,8th and 9th grade
Sun Oct 22 00:46:16 +0000 2017,watch me now live OneAmericaAppeal HurricaneRelief,9.2,12.7,16.9,14.63,1,22.67,12th and 13th grade
Fri Oct 20 21:40:15 +0000 2017,Everyone should watch this amp maybe they could disability in a new way. Such a powerful video. BecauseWhoIsPerfect,5.84,6.8,8.7,62.34,2,11.86,8th and 9th grade
Fri Oct 20 21:40:15 +0000 2017,Everyone should watch this amp maybe they could disability in a new way. Such a powerful video. BecauseWhoIsPerfect,5.84,6.8,8.7,62.34,2,11.86,8th and 9th grade
Fri Oct 20 01:27:37 +0000 2017,Happy evening and good night and LoveToTheTwitterVerse,6.24,7.2,14.4,55.91,1,19.84,6th and 7th grade
Fri Oct 20 00:31:15 +0000 2017,Was such an honor working w on ARTPOP amp doing artist workshop w Marina Abramovi this award meant amp still means a lot to me.,8.03,9.5,10.5,71.48,1,6.68,6th and 7th grade
Mon Oct 16 01:17:51 +0000 2017,Wishing you a peaceful and calm evening. Or maybe even a wild one that lets off some steam. Sending LoveToTheTwitterverse and beyond.,6.87,3.8,6.2,80.99,3,8.77,6th and 7th grade
Sun Oct 15 22:57:16 +0000 2017,MeToo,0.05,-3.5,2.6,121.22,1,-16.41,-1th and 0th grade
Thu Oct 12 21:36:04 +0000 2017,Thank u for the nomination,7.04,5.2,1.8,66.4,1,3.8,7th and 8th grade
Wed Oct 11 17:01:49 +0000 2017,As part of my 1Mill dollar donation a age will go here. They are WONDERFUL please join me by clicking here,5.66,3.8,3.1,86.2,2,4.73,5th and 6th grade
Tue Oct 10 23:36:22 +0000 2017,"Part of my 1M donation goes 2 2 help youth in TX, FL PR heal from trauma build resilience.JOIN ME",7.0,7.6,6.9,76.56,1,4.76,6th and 7th grade
Tue Oct 10 22:41:53 +0000 2017,See you on InstagramLive for meditation silence prayer in 20 minutes meditation worldmentalhealthday mentalhealth depression anxiety,11.34,17.8,21.0,-3.99,1,24.82,20th and 21st grade
Tue Oct 10 22:13:47 +0000 2017,Please read message below about MentalHealth and join me in 40 minutes on Instagram Live for meditation silence prayer Depression BeKind,8.44,11.5,15.1,50.16,1,14.74,14th and 15th grade
Tue Oct 10 21:34:51 +0000 2017,Please read this very important message BeKind WorldMentalHealthDay depression Anxiety MentalHealth ChronicPain,10.81,16.2,23.8,0.08,1,30.15,-1th and 0th grade
Tue Oct 10 19:57:05 +0000 2017,YAY Today s WorldMentalHealthDay Just a reminder I invite u to meditate quietmind pray on Instagram Live w me PST,8.58,12.3,10.7,42.72,1,9.98,10th and 11th grade
Mon Oct 09 00:52:47 +0000 2017,Happy Bday Bruno All my love and kisses to you HappyBirthdayBruno,7.05,6.4,7.6,68.77,1,10.54,7th and 8th grade
Sun Oct 08 07:59:22 +0000 2017,Thank u,0.1,-3.1,-6.4,120.21,1,-13.21,-1th and 0th grade
Sat Oct 07 22:22:04 +0000 2017,This was the 1st time I ever played Sonja the song I wrote about and FOR her GrigioGirls This was her last birthday,6.15,7.5,9.1,81.97,1,6.45,5th and 6th grade
Sat Oct 07 21:37:26 +0000 2017,Happy Birthday Sonja. Not a day goes by that I don t miss you.,5.11,1.3,-1.5,98.21,2,-0.47,2nd and 3rd grade
Sat Oct 07 19:14:01 +0000 2017,"I m dreamt of you last night. Happy Birthday Sonja. I miss you every day but you will live on forever in me, my music amp all our friends.",5.21,2.4,1.3,95.47,3,2.47,4th and 5th grade
Sat Oct 07 03:50:24 +0000 2017,"This is my mom, such a powerhouse in the mental health stratosphere amp true a warrior for me BeKind",7.9,7.2,8.4,77.57,1,7.43,7th and 8th grade
Wed Oct 04 06:45:36 +0000 2017,Red Latex Lady Paparazzi. My first ever SNL Happy 8 year anniversary u Lorne Still is such an honor to be on this show.,6.21,4.4,3.4,84.68,2,4.57,5th and 6th grade
Tue Oct 03 08:25:35 +0000 2017,"Monsters LittleMonsters I miss you. Xoxo, Joanne",8.5,6.0,10.3,64.37,1,13.17,8th and 9th grade
Mon Oct 02 23:23:32 +0000 2017,"but we can always improve it, if we try. That is where the positive lies.",5.06,2.7,0.8,89.24,2,1.99,5th and 6th grade
Mon Oct 02 22:29:17 +0000 2017,Meditate with me now on instagram live. Let's come together in peace and heal,6.24,3.7,3.6,81.29,2,5.75,3rd and 4th grade
Mon Oct 02 16:08:02 +0000 2017,My intention is to connect us all through inner peace. I believe we can calm inflammation in the world by calming each other. meditation,7.52,6.8,6.8,67.76,2,8.69,6th and 7th grade
Mon Oct 02 15:42:52 +0000 2017,"4 anyone who'd like to join, I'm doing a 20 minute moment of meditation silence prayer on my InstagramLive for calming of the 3 30 PST",7.36,11.1,11.3,62.01,1,6.68,6th and 7th grade
Mon Oct 02 15:22:30 +0000 2017,Prayers are important but blood is on the hands of those who have power to legislate. GunControl act quickly.,5.77,4.6,5.9,78.75,2,8.09,5th and 6th grade
Mon Oct 02 15:16:13 +0000 2017,"This is terrorism plain and simple. Terror bares no race, gender or religion. Democrats amp Republicans please unite now guncontrol",8.71,5.9,8.3,64.67,3,11.37,8th and 9th grade
Sun Oct 01 23:20:04 +0000 2017,Miss u everyday Sonja. Never knew a woman so brave till her last breath.To more survivors amp in memory of others BreastCancerAwarenessMonth,7.77,7.6,9.6,60.31,2,12.39,7th and 8th grade
Sun Oct 01 02:25:20 +0000 2017,"While praying every day, I'm also donating 1Mil to relief efforts for Hurricanes Harvey, Irma, Jos , Maria and the Mexico City earthquake",11.19,13.1,14.2,40.69,1,11.72,14th and 15th grade
Sun Oct 01 00:49:11 +0000 2017,Miss you LittleMonsters miss Yo amp I. Can't wait to hit the piano again runnin'. This was live from Nebraska on the JoanneWorldTour,6.76,3.9,4.9,80.58,3,7.09,3rd and 4th grade
Sat Sep 30 15:41:38 +0000 2017,Oh I see you're not helping PR because of the electoral votes u need to be re elected Florida 29 Texas 38 PuertoRico 0,8.12,9.1,9.2,72.5,1,5.75,8th and 9th grade
Sat Sep 30 15:28:47 +0000 2017,I this it's clear where the 'poor leadership' lies Puerto Rico is part of the United States. This is our responsibility.,7.16,6.2,6.2,69.28,2,7.46,6th and 7th grade
Sat Sep 30 06:14:03 +0000 2017,Monsters LittleMonsters When you're lonely I'll be lonely too. And this is the fame. PawsUp for our unique community. I you so much,6.67,3.2,3.8,82.51,4,5.38,5th and 6th grade
Sat Sep 30 06:08:10 +0000 2017,What a killer article. Gettin' stronger everyday for my LittleMonsters can't wait to get back on stage amp be w u at JoanneWorldTour PawsUp,7.52,6.8,7.3,67.76,2,9.15,6th and 7th grade
Wed Sep 27 21:19:21 +0000 2017,Proud to be working with amp to GrowKindness Visit the StaplesForStudents Kindness Tree,7.93,7.2,12.2,66.74,1,15.3,7th and 8th grade
Mon Sep 25 21:54:45 +0000 2017,or written down by I should say A Charles C Finn poem. She loved reading and writing and painting.,0.47,3.5,3.1,87.21,2,4.78,3rd and 4th grade
Mon Sep 25 14:47:15 +0000 2017,"that was a poem written by the real Joanne, my dad's sister. We are so connected.",5.02,4.1,2.0,80.28,2,2.86,5th and 6th grade
Sun Sep 24 21:29:59 +0000 2017,Love u Tony,0.15,-2.7,-5.9,119.19,1,-8.18,0th and 1st grade
Sat Sep 23 20:02:14 +0000 2017,Praying for Mexico through all these earthquakes . Sending you healing energy and love.,11.25,7.0,8.6,56.42,2,11.89,8th and 9th grade
Fri Sep 22 23:41:39 +0000 2017,paws up angel,0.15,0.9,-2.7,93.81,1,-4.29,0th and 1st grade
Fri Sep 22 23:39:26 +0000 2017,"I called myself mother monster for a long time still do, it's not uncommon or delusional. My fans are unique our bond is too",6.21,4.4,4.4,84.68,2,5.5,5th and 6th grade
Fri Sep 22 22:05:59 +0000 2017,what a special time that was me too won't ever forget it,5.55,4.4,2.2,84.68,1,3.12,4th and 5th grade
Fri Sep 22 22:00:06 +0000 2017,u,0.05,-3.5,-16.3,121.22,1,-39.61,-1th and 0th grade
Fri Sep 22 20:41:11 +0000 2017,May 18th it's happening AStarIsBorn,10.2,7.6,10.3,49.48,1,13.08,10th and 11th grade
Fri Sep 22 19:12:43 +0000 2017,"GagaFiveFootTwo, out now on",7.78,1.3,8.8,92.8,1,10.15,0th and 1st grade
Fri Sep 22 10:06:27 +0000 2017,she is truly a rare diamond of a woman and musician,5.62,6.4,1.6,68.77,1,3.17,5th and 6th grade
Fri Sep 22 10:03:30 +0000 2017,"Thank you Lorde, you're so talented sweet and supportive. So glad you enjoyed it. Chris is a really talented director.",7.13,5.9,5.2,64.67,3,7.02,5th and 6th grade
Fri Sep 22 09:57:26 +0000 2017,I felt so terrible,0.2,3.7,-1.9,75.88,1,-1.46,1st and 2nd grade
Fri Sep 22 08:37:50 +0000 2017,amazing she is brilliant,11.73,3.7,5.3,75.88,1,7.25,3rd and 4th grade
Fri Sep 22 08:37:01 +0000 2017,yes always. The second I hear the music that spotlight hits me and I hear your voices. Then I'm home,5.71,3.7,2.6,86.71,2,3.86,3rd and 4th grade
Fri Sep 22 07:51:05 +0000 2017,I was nervous. I really wanted her to love it,7.04,2.9,-2.1,83.32,2,-1.43,1st and 2nd grade
Fri Sep 22 07:39:13 +0000 2017,thank you for believing in me I believe in you,5.71,3.7,1.0,86.71,1,2.7,5th and 6th grade
Fri Sep 22 07:31:08 +0000 2017,"how connected we all became creating it, and how we were able to share our deepest thoughts and secrets and put it in the",7.46,9.1,9.8,72.5,1,6.45,9th and 10th grade
Fri Sep 22 07:20:41 +0000 2017,family is where it's at,0.25,2.9,-1.1,83.32,1,-0.85,2nd and 3rd grade
Fri Sep 22 07:18:07 +0000 2017,I felt like that when I watched it for the first time. Really touched my heart.,0.4,0.5,1.4,105.66,2,2.86,0th and 1st grade
Fri Sep 22 06:52:53 +0000 2017,so is mine,0.15,-2.7,-7.5,119.19,1,-10.09,0th and 1st grade
Fri Sep 22 04:09:09 +0000 2017,2 hrs 50 min roughly till GagaFiveFootTwo goes live on Pacific Standard Time. A toast to the little monster family. I love u so.,7.32,4.1,3.2,80.28,3,5.0,4th and 5th grade
Fri Sep 22 00:36:39 +0000 2017,you know I will. So nice to know so many monsters will be watching at once GagaFiveFootTwo,6.84,1.9,3.3,96.69,2,5.53,2nd and 3rd grade
Fri Sep 22 00:08:05 +0000 2017,"Dear little monsters, fans, amp lovers I'll be watching GAGA FIVE FOOT TWO with all of you 2nite At 12am PST GagaFiveFootTwo",6.88,7.2,11.6,82.99,1,9.11,6th and 7th grade
Thu Sep 21 21:52:05 +0000 2017,A message from me about GAGA FIVE FOOT TWO. The documentary is available worldwide at 12 01am PT tonight on,6.5,3.7,4.3,86.71,2,6.47,5th and 6th grade
Thu Sep 21 09:32:25 +0000 2017,. This really cheered me up. Keep killin it lil' music angel really warmed my heart to hear you sing my song,0.52,3.8,3.3,86.2,2,4.44,3rd and 4th grade
Mon Sep 18 07:09:14 +0000 2017,"To my fans, I love you so much.",0.4,-0.8,-3.4,114.12,1,-3.71,-1th and 0th grade
Fri Sep 15 23:12:55 +0000 2017,Prayers amp love to you are a warrior princess. What an inspiration.,6.57,2.1,3.9,90.77,2,5.73,5th and 6th grade
Thu Sep 14 19:02:09 +0000 2017,"I was taken to the hospital its not simply hip pain or wear amp tear from tour, I'm in severe pain. I'm in good hands w the very best doctors",5.96,4.4,3.6,90.09,2,3.01,3rd and 4th grade
Thu Sep 14 18:26:34 +0000 2017,"I ask for your grace and understanding, and promise that I will come back and perform for you soon.",6.24,7.2,8.1,77.57,1,6.85,6th and 7th grade
Thu Sep 14 18:26:10 +0000 2017,"Brazil, I'm devastated that I'm not well enough 2 come to Rock In Rio. I would do anything 4 u but I have to take care of my body right now.",1.28,3.4,3.0,98.04,2,2.09,2nd and 3rd grade
Tue Sep 12 23:59:40 +0000 2017,"Thought ice helped Fibromyalgia. I was wrong amp making it worse. Warm Heat is better. Electric Heated Blanket, Infrared Sauna, Epsom Baths.",6.78,3.1,6.8,82.81,4,8.68,6th and 7th grade
Tue Sep 12 19:01:59 +0000 2017,JOANNEworldtour merch available for sale online for 1 week only if u missed it at a show,7.27,6.4,7.0,79.6,1,7.02,6th and 7th grade
Tue Sep 12 12:59:39 +0000 2017,I am praying that more and more people come forward and we can all share what helps hurts so we can help each other,1.85,7.9,8.6,80.96,1,5.23,7th and 8th grade
Tue Sep 12 11:49:19 +0000 2017,In our documentary the chronicillness chronicpain I deal w is Fibromyalgia I wish to help raise awareness amp connect people who have it.,8.21,11.1,13.6,56.59,1,11.78,11th and 12th grade
Tue Sep 12 04:55:53 +0000 2017,We will never forget. September11th Love now. There is no other time.,5.15,1.3,3.3,92.8,3,3.36,0th and 1st grade
Mon Sep 11 14:17:59 +0000 2017,"your son is my hero, you guys are family, I'm so glad we got to meet",0.79,3.6,2.2,97.54,1,0.58,0th and 1st grade
Mon Sep 11 06:15:34 +0000 2017,"Blue collar and a red state treasure, love junkie on a three day bender, his grip so hard, eyes glare trouble like a mugshot",1.85,7.9,10.4,80.96,1,6.68,9th and 10th grade
Mon Sep 11 06:11:39 +0000 2017,"This girl, that outfit, that parking lot in PA, that attitude that she will persevere through it all. That's my album Joanne, right there.",6.86,4.4,7.1,84.68,2,7.93,7th and 8th grade
Mon Sep 11 04:58:32 +0000 2017,Owen he is an angel,0.25,0.5,-4.9,100.24,1,-4.33,1st and 2nd grade
Sun Sep 10 18:34:36 +0000 2017,"it is extremely frustrating and life changing. you aren't alone, others in pain will always be listening",9.12,9.9,11.5,54.22,1,11.42,11th and 12th grade
Sun Sep 10 14:39:20 +0000 2017,"Love from me to all fashion weeks' participants. A celebration of your art, passion, amp above all your talent. Photo by Nick Knight Sept 2010",7.21,4.2,5.0,79.97,3,6.86,6th and 7th grade
Sat Sep 09 17:40:50 +0000 2017,When you love your outfit so much everywheres a catwalk,7.29,4.8,5.2,78.25,1,7.92,4th and 5th grade
Fri Sep 08 18:01:14 +0000 2017,GAGA FIVE FOOT TWO premieres 2night at Toronto Film Festival. Makeup hair I love u monsters amp SEPT22 on,9.09,4.6,4.9,78.75,2,7.22,4th and 5th grade
Thu Sep 07 19:15:30 +0000 2017,"I pray everyone in Florida evacuate as asked and as easily as possible, don't risk it board up your homes and get out HurricaineIrma",7.46,11.5,12.0,55.58,1,8.88,11th and 12th grade
Thu Sep 07 00:31:03 +0000 2017,GagaFiveFootTwo,19.48,8.4,49.7,36.62,1,41.6,-1th and 0th grade
Mon Sep 04 22:27:55 +0000 2017,I'm sending free to any monsters outside my hotel The William Gray Montr al . I love u so much amp I'm so sorry u are the most loyal fans.,6.53,5.4,3.5,82.14,2,3.12,5th and 6th grade
Mon Sep 04 22:12:34 +0000 2017,I tried all day to nurse my voice amp my body to push through the show amp my doctors amp vocal coach said no I'm sorry,6.14,7.5,8.6,87.39,1,3.78,7th and 8th grade
Mon Sep 04 22:06:14 +0000 2017,my heart is broken I am so so sorry. you are my heart and soul,0.74,3.2,1.1,98.55,1,0.28,0th and 1st grade
Mon Sep 04 21:08:10 +0000 2017,I'm so sorry Montr al. We are working on postponing the show. Please read this message from my below.,6.44,3.4,2.3,82.0,3,3.59,2nd and 3rd grade
Mon Sep 04 20:42:01 +0000 2017,"Happy Birthday Honey B To my Telephone partner in crime, can you believe that was 8 years ago HappyBdayBeyonce",5.41,10.7,10.9,52.19,1,10.5,10th and 11th grade
Mon Sep 04 17:54:27 +0000 2017,"Happy Birthday my love and my buddy I love you xoxo, Joanne",5.55,4.4,3.4,84.68,1,4.57,4th and 5th grade
Sun Sep 03 20:02:18 +0000 2017,She loved you so much and talked about you and lit up when we worked. She helped me want to dream again and know it's power. ElizabethKemp,1.25,2.7,4.9,100.07,2,5.56,5th and 6th grade
Sat Sep 02 16:47:58 +0000 2017,2night I'll be returning to Fenway Park Afterward I'll be crashin' my buddies party across the street w,7.16,8.0,10.1,70.13,1,9.16,7th and 8th grade
Fri Sep 01 16:39:13 +0000 2017,I'm so honored to be the 1st WOMAN EVER TO HEADLINE FENWAY PARK 2 Sold Out Stadium shows starting tonight here we go,8.21,8.7,9.3,73.51,1,6.45,8th and 9th grade
Wed Aug 30 18:26:04 +0000 2017,Tudor x Gaga BornToDare,11.73,7.2,4.1,50.5,1,5.8,11th and 12th grade
Wed Aug 30 05:05:42 +0000 2017,2 packed Citi Field JoanneWorldTourNYC nights in a row might give a girl a cold except I'm from here so.. the show must go on,1.87,7.1,10.1,88.4,1,5.75,5th and 6th grade
Tue Aug 29 14:46:06 +0000 2017,"Apparently Tony loves not just the Lady in me, but the Gaga. And the Joanne too. And so do I Tony I love all of you",1.04,2.0,-0.9,96.48,3,0.08,1st and 2nd grade
Mon Aug 28 23:11:33 +0000 2017,Taking over Instagram account amp we'll see u tonight Monsters So happy to be home JOANNEworldtour,7.39,8.4,11.0,63.7,1,12.18,8th and 9th grade
Mon Aug 28 17:50:30 +0000 2017,Hedi Slimane x Gaga x V Magazine,8.5,6.0,-0.6,64.37,1,1.57,8th and 9th grade
Sun Aug 27 17:51:34 +0000 2017,Praying for Houston what a special place. Making relief donations and sending .,11.83,8.0,7.9,48.47,2,10.6,7th and 8th grade
Sat Aug 26 17:41:31 +0000 2017,So proud to have been the 1st Woman to headline at Wrigley Field joanneworldtour wih my manager and friend by my side We love u Chicago,6.75,9.9,11.5,70.47,1,7.55,11th and 12th grade
Sat Aug 26 05:29:50 +0000 2017,"I can't believe I was the 1st Woman ever to headline Wrigley Field. And on toppa it, we SOLD OUT What an honor Chicago JoanneWorldTour",6.78,5.8,5.5,75.71,2,6.66,6th and 7th grade
Thu Aug 24 14:00:11 +0000 2017,"GagaFiveFootTwo, a Original Documentary, Sept 22 worldwide",13.01,10.7,17.1,30.53,1,21.47,10th and 11th grade
Thu Aug 24 13:44:41 +0000 2017,GagaFiveFootTwo,19.48,8.4,49.7,36.62,1,41.6,-1th and 0th grade
Thu Aug 24 12:58:58 +0000 2017,GagaFiveFootTwo,19.48,8.4,49.7,36.62,1,41.6,-1th and 0th grade
Thu Aug 24 12:25:37 +0000 2017,GagaFiveFootTwo,19.48,8.4,49.7,36.62,1,41.6,-1th and 0th grade
Thu Aug 24 11:37:30 +0000 2017,"I'm known for being larger than life, but really I'm just... GagaFiveFootTwo",6.86,5.6,10.1,76.22,1,10.37,5th and 6th grade
Sun Aug 20 00:57:39 +0000 2017,"Thank u to my fans, thank u this album, thank you to Joanne...the stories and the journey that made me who I am. Nebraska JoanneWorldTour",6.77,9.5,12.4,71.48,1,7.84,6th and 7th grade
Sun Aug 20 00:37:03 +0000 2017,"Sold Out tonight in Omaha I'd rather die, without Yo amp I Nebraska JoanneWorldTourNebraska JoanneWorldTour Xoxo, Joanne",8.19,9.9,15.9,54.22,1,16.88,9th and 10th grade
Sat Aug 19 01:47:31 +0000 2017,identify,19.48,20.2,16.8,-47.99,1,1.0,0th and 1st grade
Sat Aug 19 01:43:10 +0000 2017,"reach out to those u trust, share ur story, go to btwf website for resources start to identity what triggers you negatively",8.32,9.5,11.4,66.07,1,9.11,9th and 10th grade
Fri Aug 18 22:58:15 +0000 2017,16 members resigned 2day It's Reverse Apprentice No one wants the job amp we get to see how long it takes everyone to quit,7.46,9.1,10.0,72.5,1,6.68,6th and 7th grade
Fri Aug 18 21:19:39 +0000 2017,This weeks White House musical of choice is Bye Bye Bannon.,7.05,4.0,5.0,85.69,1,6.82,5th and 6th grade
Fri Aug 18 05:02:29 +0000 2017,Bless Her,0.1,-3.1,-1.7,120.21,1,-7.41,-1th and 0th grade
Fri Aug 18 02:31:44 +0000 2017,Will say so many prayers tonight 4 Spain. May your sorrow know the worlds love and compassion. we are so sorry for your pain amp suffering.,5.5,3.6,5.7,92.12,2,6.6,6th and 7th grade
Wed Aug 16 01:35:04 +0000 2017,"I didn't know this till recently, 's dad Fred Trump marched in 1927 for KKK amp was arrested.",6.28,6.8,7.4,78.59,1,5.62,6th and 7th grade
Tue Aug 15 23:21:53 +0000 2017,looking for better resources so I can become more educated on how to be a productive ally,9.12,9.9,7.3,54.22,1,7.31,9th and 10th grade
Tue Aug 15 23:13:39 +0000 2017,"sincerely want to learn, more and more everyday on how to be a productive ally",7.54,8.0,6.2,64.71,1,6.49,7th and 8th grade
Tue Aug 15 21:01:36 +0000 2017,Do you think saying both sides are to blame in Charlottesville makes him a racist supporter Yes or no,7.07,7.2,8.7,77.57,1,8.07,11th and 12th grade
Tue Aug 15 18:08:53 +0000 2017,"For the Black Community, tell us ways the non racist white community who loves u can do better to help influence the country HowWeDoBetter",6.8,11.5,13.1,55.58,1,10.57,11th and 12th grade
Mon Aug 14 17:28:46 +0000 2017,. You should read my poll I have a lot of followers.,5.62,4.0,1.6,85.69,1,2.13,5th and 6th grade
Mon Aug 14 17:05:47 +0000 2017,did you feel the presidents speech just now was adequate and showed good leadership in response to racism,8.04,8.0,10.6,70.13,1,10.79,10th and 11th grade
Sat Aug 12 20:15:29 +0000 2017,I believe the overall plan toward harmony to be that simple,7.05,6.4,5.0,68.77,1,7.35,7th and 8th grade
Sat Aug 12 20:09:36 +0000 2017,it's important to see reality even on the internet which studies show to be a negative climate. We have to fight w kindness,7.64,6.6,5.0,68.26,2,6.48,6th and 7th grade
Sat Aug 12 19:45:12 +0000 2017,How do you think it's best to solve the worlds problems ItsNotUS Charlottesville BeKind,7.71,6.4,10.5,74.19,1,12.35,7th and 8th grade
Sat Aug 12 19:26:45 +0000 2017,Tweet amp tell him how you think he could BeKind and be a better leader. ThisIsNotUS BeKind Charlottesville POTUS,6.6,4.6,6.9,78.75,2,9.65,6th and 7th grade
Sat Aug 12 19:20:08 +0000 2017,". too afraid to do the right thing cuz you will lose votes Doesn't matter, younger generation has the answer to BeKind.",1.79,7.9,11.1,75.54,1,8.7,11th and 12th grade
Sat Aug 12 19:16:56 +0000 2017,"I know we are not created to hate each other, but to help amp love. Use hashtag BeKind ThisIsNotUS to tweet positive messages. Charlotte",8.18,6.8,6.8,67.76,2,8.4,6th and 7th grade
Sat Aug 12 19:12:50 +0000 2017,I pray a true leader will rise to expel hatred from America. This is not US This is Anti American ThisIsNotUS Charlottesville BeKind,7.64,7.8,6.8,59.8,2,9.03,7th and 8th grade
Sat Aug 12 19:02:23 +0000 2017,Mother Monster here witnessing legendary fans you're unlike any others Monsters,12.79,8.8,13.6,51.85,1,17.38,8th and 9th grade
Sat Aug 12 18:51:53 +0000 2017,Whoever made this compilation of all my opening silhouette from all my tours. WOW joanneworldtour,9.64,10.3,12.1,47.79,1,13.85,9th and 10th grade
