created_at,text,dale_chall_readability_score,flesch_kincaid,automated_readability,flesch_reading,sentence_count,coleman_liau_index,based_on_all_algorithms
Tue Jul 07 02:46:02 +0000 2020,President Trump champions American greatness in his Mount Rushmore speech.,10.45,9.6,14.2,44.41,1,18.36,9th and 10th grade
Tue Jul 07 02:32:35 +0000 2020,"The highly respected Henry Ford Health System just reported, based on a large sampling, that HYDROXYCHLOROQUINE cut the death rate in certain sick patients very significantly. The Dems disparaged it for political reasons me . Disgraceful. Act now",10.1,11.7,14.4,44.24,2,14.68,14th and 15th grade
Tue Jul 07 02:00:12 +0000 2020,"Wall is moving fast in Texas, Arizona, New Mexico and California. Great numbers at the Southern Border. Dems want people to just flow in. They want very dangerous open Borders",7.17,5.0,5.3,72.32,4,7.61,7th and 8th grade
Mon Jul 06 20:17:46 +0000 2020,"Why does the Lamestream Fake News Media REFUSE to say that China Virus deaths are down 39 , and that we now have the lowest Fatality Mortality Rate in the World. They just can t stand that we are doing so well for our Country",6.52,8.3,8.9,74.53,2,6.33,6th and 7th grade
Mon Jul 06 20:11:42 +0000 2020,"Corrupt Joe Biden and the Democrats don t want to open schools in the Fall for political reasons, not for health reasons They think it will help them in November. Wrong, the people get it",5.86,6.6,7.9,79.09,2,7.31,6th and 7th grade
Mon Jul 06 18:44:09 +0000 2020,"The Democrats would not have BANNED travel from heavily infected China, especially so early, therefore, far more people would have died. Corrupt Joe Biden now admits this",8.4,7.4,10.4,66.23,2,12.23,7th and 8th grade
Mon Jul 06 18:40:10 +0000 2020,SCHOOLS MUST OPEN IN THE FALL,0.3,-1.5,0.4,116.15,1,2.37,-1th and 0th grade
Mon Jul 06 18:36:59 +0000 2020,"...of 2,541 patients hospitalized between March 10 and May 2, 2020 across the system s six hospitals, the study found 13 of those treated with hydroxychloroquine alone died compared to 26.4 not treated with hydroxychloroquine.",8.53,15.8,21.9,44.41,1,13.82,21st and 22nd grade
Mon Jul 06 18:36:59 +0000 2020,"Treatment with hydroxychloroquine cut the death rate significantly in sick patients hospitalized with COVID 19 and without heart related side effects, according to a new study published by Henry Ford Health System. In a large scale retrospective analysis...",9.98,11.9,15.3,43.73,2,15.55,15th and 16th grade
Mon Jul 06 18:36:50 +0000 2020,"BREAKING NEWS The Mortality Rate for the China Virus in the U.S. is just about the LOWEST IN THE WORLD Also, Deaths in the U.S. are way down, a tenfold decrease since the Pandemic height and, our Economy is coming back strong .",8.35,17.3,20.3,45.77,1,8.03,19th and 20th grade
Mon Jul 06 18:24:06 +0000 2020,"Deaths from the China Virus are down 39 , while our great testing program continues to lead the World, by FAR Why isn t the Fake News reporting that Deaths are way down It is only because they are, indeed, FAKE NEWS",7.21,15.7,19.0,55.24,1,7.68,7th and 8th grade
Mon Jul 06 18:13:16 +0000 2020,"They name teams out of STRENGTH, not weakness, but now the Washington Redskins amp Cleveland Indians, two fabled sports franchises, look like they are going to be changing their names in order to be politically correct. Indians, like Elizabeth Warren, must be very angry right now",8.21,11.1,14.1,56.59,2,11.78,11th and 12th grade
Mon Jul 06 13:39:13 +0000 2020,NASDAQ HITS ALL TIME HIGH,7.04,0.5,0.9,100.24,1,2.64,0th and 1st grade
Mon Jul 06 13:31:53 +0000 2020,"This is no longer about peaceful protesting, this is about angry, violent, criminal mobs taking over certain Democrat run cities. It is a lack of political leadership in that city. Chad Wolf",7.39,8.4,10.0,63.7,2,10.32,8th and 9th grade
Mon Jul 06 13:17:46 +0000 2020,"New York City and Chicago play the Sanctuary City card, where criminals are protected. Perhaps they will have to start changing their ways and thinking .",8.05,5.8,8.9,75.71,2,10.83,6th and 7th grade
Mon Jul 06 12:33:07 +0000 2020,"Has apologized to all of those great NASCAR drivers amp officials who came to his aid, stood by his side, amp were willing to sacrifice everything for him, only to find out that the whole thing was just another HOAX That amp Flag decision has caused lowest ratings EVER",8.32,20.0,24.3,38.66,1,9.42,19th and 20th grade
Mon Jul 06 12:28:26 +0000 2020,China has caused great damage to the United States and the rest of the World,0.74,4.4,5.5,90.09,1,6.08,5th and 6th grade
Mon Jul 06 12:26:47 +0000 2020,"If you want your 401k s and Stocks, which are getting close to an all time high NASDAQ is already there , to disintegrate and disappear, vote for the Radical Left Do Nothing Democrats and Corrupt Joe Biden. Massive Tax Hikes They will make you very poor, FAST",6.82,8.9,11.6,73.0,2,8.54,8th and 9th grade
Mon Jul 06 12:13:52 +0000 2020,Statue of Frederick Douglass Torn Down in Rochester via This shows that these anarchists have no bounds,8.19,7.6,11.2,71.14,1,12.12,11th and 12th grade
Sun Jul 05 22:34:33 +0000 2020,"New China Virus Cases up because of massive testing , deaths are down, low and steady . The Fake News Media should report this and also, that new job numbers are setting records",6.95,7.0,8.4,72.66,2,8.81,6th and 7th grade
Sun Jul 05 21:29:36 +0000 2020,Democrats want to Defund amp Abolish Police. This despite poor crime numbers in cities that they run. CRAZY,7.59,3.3,6.6,87.72,2,9.31,3rd and 4th grade
Sun Jul 05 21:20:51 +0000 2020,"Chicago and New York City crime numbers are way up. 67 people shot in Chicago, 13 killed. Shootings up significantly in NYC where people are demanding that amp act now. Federal Government ready, willing and able to help, if asked",6.66,6.1,7.6,74.9,3,8.51,6th and 7th grade
Sun Jul 05 21:05:50 +0000 2020,. weekend afternoons is the worst Getting into and MSDNC territory. Watch amp instead. Much better,8.22,9.8,8.4,38.48,2,11.27,10th and 11th grade
Sun Jul 05 20:47:26 +0000 2020,". gladly puts up the phony suppression polls as soon as they come out. We are leading in the REAL polls because people are sick amp tired of watching the Democrat run cities, in all cases, falling apart. Also, now 96 Approval Rating in the Republican Party. Another 2016",7.72,8.4,8.4,63.7,3,8.41,7th and 8th grade
Sun Jul 05 05:32:20 +0000 2020,"Wow. got caught cold manipulating the words and meaning of my 4th of July Speech. They were brazen, desperate. Watch what happens",6.87,3.8,5.4,80.99,3,7.49,6th and 7th grade
Sun Jul 05 03:48:54 +0000 2020,"On this wonderful day, we celebrate our history, our heroes, our heritage, our flag, and our FREEDOM. Happy Fourth of July to Everyone SaluteToAmerica",6.86,9.2,9.5,50.84,2,11.06,9th and 10th grade
Sat Jul 04 20:19:07 +0000 2020,Will be speaking at 7 00 P.M. Thank you for all of the nice comments on the Mount Rushmore speech last night,6.34,1.7,2.7,102.61,2,3.92,3rd and 4th grade
Sat Jul 04 20:14:51 +0000 2020,Big 4th of July Air Show soon coming down the East Coast. Get ready to look up to the sky. Check local listings,5.39,1.6,0.6,97.5,3,2.28,2nd and 3rd grade
Sat Jul 04 20:03:59 +0000 2020,Would lead to disaster,7.78,3.7,2.9,75.88,1,4.35,3rd and 4th grade
Sat Jul 04 20:03:07 +0000 2020,....The Fake News Media is being laughed at all over the world,5.55,3.3,4.6,93.14,1,4.57,4th and 5th grade
Sat Jul 04 19:56:04 +0000 2020,"This would be the beginning of the end. He has no clue, but he wouldn t be calling the shots",0.5,2.5,0.8,95.17,2,1.83,0th and 1st grade
Sat Jul 04 19:52:47 +0000 2020,"...And if the Federal Government wasn t getting ready to go in, and we were all set, it would still be a squatter s anarchist s mess",6.73,10.3,10.6,69.45,1,4.71,10th and 11th grade
Sat Jul 04 18:49:57 +0000 2020,"....In a certain way, our tremendous Testing success gives the Fake News Media all they want, CASES. In the meantime, Deaths and the all important Mortality Rate goes down. You don t hear about that from the Fake News, and you never will. Anybody need any Ventilators",6.91,5.5,6.6,76.42,4,7.46,6th and 7th grade
Sat Jul 04 18:49:56 +0000 2020,"Cases, Cases, Cases If we didn t test so much and so successfully, we would have very few cases. If you test 40,000,000 people, you are going to have many cases that, without the testing like other countries , would not show up every night on the Fake Evening News.....",6.14,9.3,12.0,71.99,2,7.38,6th and 7th grade
Sat Jul 04 17:57:48 +0000 2020,Change Hearts Not Stones. There is no end to historical purification. Great historian Doug Wead,7.04,5.2,6.5,66.4,3,8.85,8th and 9th grade
Sat Jul 04 17:38:54 +0000 2020,Thank you my friend. America loves India,6.07,2.3,3.2,84.84,2,2.93,2nd and 3rd grade
Sat Jul 04 17:37:21 +0000 2020,Great,0.05,-3.5,2.6,121.22,1,-16.41,-1th and 0th grade
Sat Jul 04 17:20:00 +0000 2020,The is a very corrupt and dishonest media outlet that suffers TDS at a level rarely seen. They will lose any remaining credibility on the evening of November 3rd.,8.17,7.8,7.6,65.22,2,8.52,7th and 8th grade
Sat Jul 04 16:56:07 +0000 2020,"An amazing guy. Burgess is what we need in Washington, tough and smart",6.39,1.1,2.8,98.72,2,4.76,2nd and 3rd grade
Sat Jul 04 16:48:25 +0000 2020,"Sara, the Silent Majority will speak on NOVEMBER 3rd. You are doing a Great job amp , together with some very well known others who got it right on Russia, Russia, Russia, should get a now very discredited Pulitzer Prize. Committee should get them back from those that got it wrong",6.36,7.4,8.7,71.44,3,8.41,8th and 9th grade
Sat Jul 04 16:07:59 +0000 2020,Thank you Tammy. You have quickly become a great voice for freedom,5.25,2.1,3.1,90.77,2,5.27,1st and 2nd grade
Sat Jul 04 05:16:37 +0000 2020,Jim Banks New York Times Damaged National Security to Hurt Trump via Thank you Jim. They are Fake News,6.6,3.5,4.1,87.21,2,6.29,3rd and 4th grade
Fri Jul 03 21:12:48 +0000 2020,Congressman Jeff Van Drew is a Courageous Leader who defended me against Pelosi s Impeachment Scam and is a conservative who shares our Republican values. Jeff is a fighter for South Jersey and will always put America First. Vote for Jeff,7.78,7.5,8.2,66.03,3,9.85,7th and 8th grade
Fri Jul 03 21:12:29 +0000 2020,"Congressman is a tremendous supporter of our MAGA agenda He is Strong on the Wall, Law Enforcement and the Second Amendment, and he always puts America First Paul has my Complete and Total Endorsement. AZ04",9.88,15.8,19.2,44.41,1,11.33,18th and 19th grade
Fri Jul 03 21:12:20 +0000 2020,"Tony Gonzales will be a GREAT Congressman for Texas A Navy veteran, he is Strong on the Economy, Life and the Second Amendment. We need him to defeat the Radical Left in November. Tony has my Complete and Total Endorsement TX23",7.78,7.5,6.9,66.03,3,8.0,7th and 8th grade
Fri Jul 03 21:11:56 +0000 2020,"...talks big for the worker, but never delivers. Tim Ryan was a failed Presidential candidate and he keeps failing Ohio. Vote for Christina Hagan, who has my Complete and Total Endorsement OH13",8.61,6.3,7.7,69.07,3,9.61,9th and 10th grade
Fri Jul 03 21:11:55 +0000 2020,"Christina Hagan will be an incredible Congresswoman for the working families of Northeast Ohio. An early supporter of our MAGA agenda, she is Strong on Jobs, Border Security and your Second Amendment. Christina is running against an absolute failure, Tim Ryan, who...",9.97,9.9,10.9,48.81,3,12.11,10th and 11th grade
Fri Jul 03 21:09:12 +0000 2020,....I know Ronny well. He will NEVER let you down. Solid as a rock. Ronny has my Complete and Total Endorsement TX13 MAGA,8.04,3.2,1.7,82.51,4,2.37,1st and 2nd grade
Fri Jul 03 21:09:12 +0000 2020,". is a spectacular man. An Admiral in the Navy, he is a brave and loyal Warrior who loves our Military and Vets. As a medical doctor, Ronny is great on HealthCare and he is Strong on Cutting Taxes, the Border and the Second Amendment...",8.31,7.8,6.4,65.01,3,6.26,7th and 8th grade
Fri Jul 03 21:08:37 +0000 2020,"My friend, will be a phenomenal Senator for Tennessee He did an incredible job for our country as Ambassador to Japan. Strong on the Economy, Trade and the Wall, Bill stands Tall for Law amp Order. He has my Complete and Total Endorsement",7.65,7.7,7.2,65.42,3,7.88,7th and 8th grade
Fri Jul 03 21:07:53 +0000 2020,"Congratulations, on your impressive primary victory A Super Bowl Champion, Burgess knows how to WIN. Strong on Life, Military, Vets and the 2A, he will always fight for Utah. Burgess has my Complete and Total Endorsement UT04",7.66,6.9,8.8,67.45,3,10.37,7th and 8th grade
Fri Jul 03 12:12:26 +0000 2020,"NASDAQ HAD ITS 23RD RECORD CLOSE OF THE YEAR. OTHER EXCHANGES ARE FOLLOWING CLOSELY BEHIND. TREMENDOUS POTENTIAL REMAINING. BIG MONTHS UPCOMING. NEXT YEAR, DEPENDING ON AN ELECTION WIN, WILL BE ONE OF THE BEST EVER",8.04,4.8,6.3,72.83,5,8.88,8th and 9th grade
Fri Jul 03 03:50:36 +0000 2020,"Actually, a must read. Really good",6.57,8.0,4.3,48.47,1,5.27,3rd and 4th grade
Fri Jul 03 03:44:42 +0000 2020,"There is a rise in Coronavirus cases because our testing is so massive and so good, far bigger and better than any other country. This is great news, but even better news is that death, and the death rate, is DOWN. Also, younger people, who get better much easier and faster",6.03,6.4,7.7,79.6,3,7.02,7th and 8th grade
Fri Jul 03 03:25:18 +0000 2020,He cannot pass the test I aced . He should give it a try,0.32,1.1,-2.7,98.72,2,-1.52,2nd and 3rd grade
Fri Jul 03 00:19:23 +0000 2020,MAKE AMERICA GREAT AGAIN,0.2,3.7,5.3,75.88,1,7.25,1st and 2nd grade
Fri Jul 03 00:17:52 +0000 2020,LAW amp ORDER,0.15,0.9,-2.7,93.81,1,-4.29,0th and 1st grade
Thu Jul 02 23:41:58 +0000 2020,"Mail In Ballots will lead to massive electoral fraud and a rigged 2020 Election. Look at all of the cases and examples that are out there right now, with the Patterson, N.J., being the most recent example. Republicans, in particular, cannot let this happen",8.31,7.8,8.7,65.01,3,9.04,7th and 8th grade
Thu Jul 02 23:29:01 +0000 2020,. should move Fredo back to the morning slot. He was rewarded for bad ratings with a much better time slot and again got really bad ratings. Getting totally trounced by Give him another shot in the morning He would easily beat Morning Joe s poorly rated show,6.77,7.1,7.6,72.46,3,8.12,8th and 9th grade
Thu Jul 02 23:19:03 +0000 2020,Darrell always has had my full support and complete and total Endorsement. We need him badly in Washington,9.35,6.8,6.3,62.34,2,9.31,8th and 9th grade
Thu Jul 02 23:17:09 +0000 2020,"Minnesota, we need Lacy Johnson in Washington, D.C. Has my Complete and Total Endorsement. He s tough and smart and loves Minnesota. Look at the MESS you just went through No more. Next time call up the National Guard much sooner, and Vote for Lacy",6.89,3.3,4.4,87.72,5,6.23,6th and 7th grade
Thu Jul 02 23:16:47 +0000 2020,"The Governor of North Carolina, made it absolutely IMPOSSIBLE for the Republican Party to have its Convention there and we all love the State. Millions of Dollars, amp JOBS, lost by State. VOTE FOR",7.73,8.7,9.8,62.68,2,9.57,9th and 10th grade
Thu Jul 02 23:11:50 +0000 2020,"If I didn t demand that National Guard Troops go into Minneapolis after watching how poorly the Liberal Democrat government was handling things, you wouldn t even have a Minneapolis now. Once they were deployed, in force, all looting, burning and crime stopped DEAD",8.68,10.7,13.4,57.61,2,11.31,10th and 11th grade
Thu Jul 02 23:09:47 +0000 2020,"It s a trap because they want to tank the economy and make everything look trrrible so they can make President Trump look bad in November. They want Trump to have to send in troops so it looks bad for him. Dave Rubin, author of Don t Burn This Book.",5.73,6.3,5.7,79.9,3,5.16,5th and 6th grade
Thu Jul 02 23:07:50 +0000 2020,"The United States has been experiencing, believe it or not, Historically Low Crime Rates. The last thing we will be doing is Defunding or Eliminating our many and various Police Departments or, putting an end to our great Second Amendment",7.79,11.1,12.0,51.18,2,11.02,11th and 12th grade
Thu Jul 02 23:04:06 +0000 2020,Thank you George,0.15,-2.7,2.1,119.19,1,1.52,1st and 2nd grade
Thu Jul 02 22:59:59 +0000 2020,"Dr. Taylor Marshall, author. There Is A War On Christianity .",8.62,6.4,5.1,57.94,2,5.54,5th and 6th grade
Thu Jul 02 22:48:54 +0000 2020,SPIRIT OF AMERICA SHOWCASE,7.78,9.6,7.7,33.58,1,10.15,7th and 8th grade
Thu Jul 02 21:45:19 +0000 2020,We MUST lower drug prices for patients and have SHOWN LEADERSHIP while and WALK AWAY,7.54,5.6,8.1,81.63,1,9.21,7th and 8th grade
Thu Jul 02 15:27:16 +0000 2020,"JOBS, JOBS, JOBS MAGA",7.78,1.3,1.8,92.8,1,0.0,1st and 2nd grade
Thu Jul 02 14:40:16 +0000 2020,HISTORIC JOBS NUMBERS MAGA,15.68,7.2,7.7,50.5,1,10.15,7th and 8th grade
Thu Jul 02 13:11:31 +0000 2020,News Conference at 9 30. Great Jobs Numbers,7.78,2.5,1.8,84.34,2,2.2,1st and 2nd grade
Wed Jul 01 17:55:45 +0000 2020,"Special thank you to the and for their support of what will, without question, be a special evening Salute2America",7.07,8.3,11.9,69.11,1,11.43,7th and 8th grade
Wed Jul 01 13:48:48 +0000 2020,"....horrible BLM chant, Pigs In A Blanket, Fry Em Like Bacon . Maybe our GREAT Police, who have been neutralized and scorned by a mayor who hates amp disrespects them, won t let this symbol of hate be affixed to New York s greatest street. Spend this money fighting crime instead",6.68,6.3,8.5,79.9,3,7.83,8th and 9th grade
Wed Jul 01 13:48:48 +0000 2020,"NYC is cutting Police s by ONE BILLION DOLLARS, and yet the is going to paint a big, expensive, yellow Black Lives Matter sign on Fifth Avenue, denigrating this luxury Avenue. This will further antagonize New York s Finest, who LOVE New York amp vividly remember the....",7.15,11.3,12.8,56.08,2,9.41,12th and 13th grade
Wed Jul 01 12:30:27 +0000 2020,"Biden was asked questions at his so called Press Conference yesterday where he read the answers from a teleprompter. That means he was given the questions, just like Crooked Hillary. Never have seen this before",5.57,4.3,8.1,84.98,3,10.19,5th and 6th grade
Wed Jul 01 12:07:26 +0000 2020,No corroborating evidence to back reports. Department of Defense. Do people still not understand that this is all a made up Fake News Media Hoax started to slander me amp the Republican Party. I was never briefed because any info that they may have had did not rise to that level,7.06,7.1,6.1,66.94,4,7.53,7th and 8th grade
Wed Jul 01 11:19:44 +0000 2020,"WOW. Record Growth in 2nd Quarter Under Corrupt Joe Biden and his MASSIVE Tax and Regulation increases, Markets, and your 401k s, will PLUNGE Expect a Record 2021",7.84,11.8,15.3,59.98,1,10.16,15th and 16th grade
Wed Jul 01 11:12:00 +0000 2020,"My Executive Order to protect Monuments, Statues etc., IS IN FULL FORCE AND EFFECT. In excess of a 10 year prison term. Please do not put yourself in jeopardy. Many people now under arrest",7.31,4.2,4.3,79.77,4,6.05,3rd and 4th grade
Wed Jul 01 11:09:21 +0000 2020,"The Russia Bounty story is just another made up by Fake News tale that is told only to damage me and the Republican Party. The secret source probably does not even exist, just like the story itself. If the discredited has a source, reveal it. Just another HOAX",6.53,6.8,5.5,67.76,4,6.95,6th and 7th grade
Wed Jul 01 11:05:07 +0000 2020,"Congratulations to on completely dominating the just released morning TV Ratings. Morning Joke, staring Psycho Joe Scarborough on MSDNC, a Concast Company, was a disaster. Even worse was the barely registering mess",10.09,11.0,10.8,35.23,3,13.78,10th and 11th grade
Wed Jul 01 10:53:32 +0000 2020,"Can t believe how badly has done in the newly released TV ratings. They are so far below thank you President Trump that you can barely find them. Fredo should be given a big pay cut MSDNC also did poorly. As I have long said, Fake News does not pay",6.47,4.6,3.6,84.17,4,4.45,5th and 6th grade
Wed Jul 01 10:50:18 +0000 2020,Minneapolis City Council unanimously approves proposal to disband police. The Democrats would do this all over the U.S. It would be a disaster for safety amp security,8.76,8.0,7.5,53.88,3,10.35,7th and 8th grade
Wed Jul 01 10:48:13 +0000 2020,Happening fast,11.63,8.8,10.2,35.61,1,7.1,11th and 12th grade
Wed Jul 01 03:58:14 +0000 2020,"I will Veto the Defense Authorization Bill if the Elizabeth Pocahontas Warren of all people Amendment, which will lead to the renaming plus other bad things of Fort Bragg, Fort Robert E. Lee, and many other Military Bases from which we won Two World Wars, is in the Bill",7.43,10.5,12.2,63.53,2,8.71,8th and 9th grade
Wed Jul 01 03:29:59 +0000 2020,Congratulations on a really great win,6.57,10.4,6.7,31.55,1,10.08,6th and 7th grade
Wed Jul 01 02:30:14 +0000 2020,"I know better than anyone that my friend Roger Ailes died 3 years ago, just look at what happened to We all miss Roger",1.85,6.8,9.2,89.42,1,5.75,5th and 6th grade
Wed Jul 01 02:01:44 +0000 2020,He knew the questions and still couldn t answer them. Lamestream Media being laughed at all over the world,5.77,2.3,5.1,95.67,2,7.51,3rd and 4th grade
Wed Jul 01 01:54:55 +0000 2020,"She gets fired by for giving Crooked Hillary the debate questions, and gets hired by Where are you Roger Ailes",6.21,6.4,10.0,85.02,1,8.82,8th and 9th grade
Wed Jul 01 01:20:21 +0000 2020,"At the request of many great Americans who live in the Suburbs, and others, I am studying the AFFH housing regulation that is having a devastating impact on these once thriving Suburban areas. Corrupt Joe Biden wants to make them MUCH WORSE. Not fair to homeowners, I may END",8.96,7.3,8.5,71.85,3,8.7,8th and 9th grade
Tue Jun 30 23:00:17 +0000 2020,"This is a battle to save the Heritage, History, and Greatness of our Country MAGA2020",7.54,9.1,8.3,56.25,1,8.81,8th and 9th grade
Tue Jun 30 22:52:02 +0000 2020,"As I watch the Pandemic spread its ugly face all across the world, including the tremendous damage it has done to the USA, I become more and more angry at China. People can see it, and I can feel it",5.81,7.6,7.3,76.56,2,5.22,7th and 8th grade
Tue Jun 30 22:46:40 +0000 2020,"Today s SCOTUS ruling is a historic win for families who want SCHOOL CHOICE NOW SchoolChoice is a civil rights issue, and no parent should have to send their child to a failing school. I will continue to fight for School Choice and will always defend Religious Freedom",8.12,10.3,12.2,64.04,2,9.46,8th and 9th grade
Tue Jun 30 14:49:02 +0000 2020,THE LONE WARRIOR,9.05,0.9,2.1,93.81,1,1.52,0th and 1st grade
Tue Jun 30 14:13:54 +0000 2020,"Chuck, we will get lower drug prices done. Thanks",5.84,0.9,4.5,104.64,1,6.06,3rd and 4th grade
Tue Jun 30 13:16:36 +0000 2020,We are tracking down the two Anarchists who threw paint on the magnificent George Washington Statue in Manhattan. We have them on tape. They will be prosecuted and face 10 years in Prison based on the Monuments and Statues Act. Turn yourselves in now,7.41,5.2,6.2,77.23,4,8.45,5th and 6th grade
Mon Jun 29 19:20:57 +0000 2020,"Senator from Colorado is a GREAT Senator who always fights for the people of his state. He protects your 2A, loves our Vets and Military, and cares deeply about our BEAUTIFUL public lands. Cory has my Complete and Total Endorsement COSEN",7.01,6.3,8.0,74.49,3,9.45,7th and 8th grade
Mon Jun 29 19:20:25 +0000 2020,Congressman is a great supporter of the MAGA Agenda He fights for your 2A rights and the Border Wall. Scott is working hard for Colorado and has my Complete and Total Endorsement CO03,9.24,7.4,8.4,71.65,2,8.81,8th and 9th grade
Mon Jun 29 14:25:57 +0000 2020,"Sorry to inform the Do Nothing Democrats, but I am getting VERY GOOD internal Polling Numbers. Just like 2016, the Polls are Fake The Polls are a JOKE Do you think they will apologize to me amp their subscribers AGAIN when I WIN People want LAW, ORDER amp SAFETY",6.46,9.3,11.4,71.99,2,7.9,6th and 7th grade
Mon Jun 29 14:15:02 +0000 2020,"Seattle Looters, Agitators, Anarchists and Protestors , are now refusing to leave the CHOP Zone. They have ZERO respect for Government, or the Mayor of Seattle or Governor of Washington State Not good",9.36,10.7,11.3,46.78,2,11.95,11th and 12th grade
Mon Jun 29 13:48:02 +0000 2020,"95 Approval Rating of President Trump in the Republican Party. I would imagine the 5 are the RINOS and stupid people who don t want to see great Judges amp Supreme Court Justice s, a new amp powerful Military, Choice for Vets, 2A Protection, big RegulationCuts, Life, amp much more",8.03,10.7,12.9,63.02,2,9.12,8th and 9th grade
Mon Jun 29 12:34:18 +0000 2020,Can anyone believe that Princeton just dropped the name of Woodrow Wilson from their highly respected policy center. Now the Do Nothing Democrats want to take off the name John Wayne from an airport. Incredible stupidity,7.6,9.1,11.8,61.67,2,11.89,11th and 12th grade
Mon Jun 29 12:17:08 +0000 2020,This Tweet from has been withheld in Canada.,7.98,2.9,4.4,88.74,1,6.45,2nd and 3rd grade
Mon Jun 29 02:40:24 +0000 2020,"Intel just reported to me that they did not find this info credible, and therefore did not report it to me or Possibly another fabricated Russia Hoax, maybe by the Fake News wanting to make Republicans look bad",9.68,16.9,19.0,41.37,1,9.41,9th and 10th grade
Mon Jun 29 02:30:33 +0000 2020,"Absentee Ballots are fine. A person has to go through a process to get and use them. Mail In Voting, on the other hand, will lead to the most corrupt Election is USA history. Bad things happen with Mail Ins. Just look at Special Election in Patterson, N.J. 19 of Ballots a FRAUD",6.25,3.9,3.9,86.1,5,5.26,5th and 6th grade
Mon Jun 29 02:18:01 +0000 2020,"Corrupt Joe Biden s team is running false ads. Almost everything in them is a knowing lie, just the opposite of what they are saying, amp very much like their Fake News partners",6.85,6.2,7.5,80.11,2,7.36,7th and 8th grade
Mon Jun 29 02:12:20 +0000 2020,The Dems want to Defund and Abolish the Police. Not good,7.05,4.0,3.8,85.69,1,5.26,3rd and 4th grade
