created_at,text,dale_chall_readability_score,flesch_kincaid,automated_readability,flesch_reading,sentence_count,coleman_liau_index,based_on_all_algorithms
Tue Jan 24 05:36:46 +0000 2017,Mustafa Mustafa don't worry Mustafa teaser looks supercool,7.98,5.2,12.6,71.82,1,16.6,7th and 8th grade
Mon Jan 23 19:17:34 +0000 2017,Introducing Matin Rey Tangu,11.73,9.6,8.8,33.58,1,11.6,11th and 12th grade
Mon Jan 23 17:52:28 +0000 2017,Backed by Matin Rey Tangu,7.04,0.5,0.9,100.24,1,2.64,0th and 1st grade
Mon Jan 23 06:54:34 +0000 2017,Special Video Q amp A for my loved ones . Toh Sawaal bhejo Connect.BeingInTouch Will try to answer the best ones BeingInTouch,6.41,6.2,7.1,69.28,2,9.43,5th and 6th grade
Sat Jan 21 10:11:21 +0000 2017,All the best for Machine . Kiara and Mustafa are looking really good in the poster,5.06,2.7,3.4,89.24,2,5.87,2nd and 3rd grade
Wed Jan 18 07:06:18 +0000 2017,Thank you for all the support and good wishes,7.59,2.1,2.4,96.18,1,4.78,3rd and 4th grade
Tue Jan 17 14:23:55 +0000 2017,In Workers ke liye 'Thanks' toh banta hai .,7.98,4.1,3.2,80.28,1,3.55,3rd and 4th grade
Tue Jan 17 11:45:52 +0000 2017,Thank you for giving this film to my Chedi Singh . This is the coolest,5.11,1.3,0.9,98.21,2,2.85,2nd and 3rd grade
Sun Jan 15 09:52:49 +0000 2017,"Thanx rakeshji 4 giving n me 21yearsofKaranArjun, Congrats duggu on 17YearsOfKNPH . Best of luck Raees amp Kaabil 25Jan .",9.35,6.8,9.8,62.34,2,12.84,9th and 10th grade
Sat Jan 14 11:55:27 +0000 2017,Rehearsing for .,11.63,14.7,12.5,-6.7,1,7.1,12th and 13th grade
Fri Jan 13 15:25:43 +0000 2017,Shooting with Partner,9.05,5.6,9.9,59.97,1,11.15,9th and 10th grade
Fri Jan 13 05:30:03 +0000 2017,"SingingStar born,thanx 2whoever putup this vid.RequestColorsCEO consider her4RisingStar",13.9,12.3,29.7,21.06,1,36.9,12th and 13th grade
Thu Jan 12 19:30:41 +0000 2017,It's not the right time to post right now Will post tomo morn at 11am,5.43,3.2,3.4,98.55,1,3.01,2nd and 3rd grade
Mon Jan 09 05:30:01 +0000 2017,Yesteryear Cricket stars .,14.31,12.7,16.2,9.21,1,16.95,12th and 13th grade
Sun Jan 08 09:11:19 +0000 2017,Congratulations to my dear friend Mahesh Manjrekar for Dhyanimani . Check out the Trailer,10.03,8.2,9.4,47.96,2,13.23,8th and 9th grade
Fri Jan 06 20:37:40 +0000 2017,Ab vo do Khans Kumar Devgan Roshan ko con karna baki hai. Ok jaanu Help Bhai Aditya,7.77,3.1,1.4,88.23,2,3.15,3rd and 4th grade
Fri Jan 06 20:27:58 +0000 2017,Ek khan ko con kiya to take this pic . Bhai let me post this on his twitter AdityaRoyKapur,5.84,2.1,1.9,96.18,2,3.8,5th and 6th grade
Fri Jan 06 13:27:06 +0000 2017,"So sad . Lost one of the most iconic Actors, RIP Om Puri ji",6.71,3.6,1.7,92.12,1,1.44,1st and 2nd grade
Thu Jan 05 08:03:43 +0000 2017,Food has a special connection with my childhood. Know the story on my app .,6.24,3.7,2.6,81.29,2,4.47,3rd and 4th grade
Thu Jan 05 06:58:09 +0000 2017,Aap ji n aap ji de pure parivar nu Dhan Dhan SHRI GURU GOBIND SINGH JI de prakash purab di lakh lakh wadhai,7.52,7.5,7.5,81.97,1,4.48,7th and 8th grade
Wed Jan 04 12:12:31 +0000 2017,Just saw this commercial . It's a phenomenal initiative by Sonata . Thank you TATA BYE BYE for now .,6.71,5.5,3.8,65.69,3,5.15,8th and 9th grade
Mon Jan 02 16:31:04 +0000 2017,Joining hands on a project where is the hero and will be co produced by and SKF,6.34,4.0,4.5,96.52,1,3.94,3rd and 4th grade
Mon Jan 02 07:58:29 +0000 2017,Here s a chance for all my fans to get a VIP Pass to excl sale Click now for ur excl entry,6.16,6.0,4.4,91.45,1,0.93,5th and 6th grade
Sun Jan 01 14:03:10 +0000 2017,Happy new year yohaan n puppy .,0.3,4.5,1.2,73.85,1,2.37,2nd and 3rd grade
Thu Dec 29 15:58:47 +0000 2016,The most sweetest b'day wishes I got .,8.5,3.7,2.9,81.29,1,4.07,2nd and 3rd grade
Wed Dec 28 16:30:24 +0000 2016,Aa gaya mera Hero . Mera Partner . Superb Trailer . Link,7.59,8.0,6.6,53.88,1,8.03,7th and 8th grade
Tue Dec 27 05:31:03 +0000 2016,BeingInTouchApp is Live on the Google Play Store Go Download .,7.29,4.8,8.1,78.25,1,10.82,7th and 8th grade
Mon Dec 26 19:00:25 +0000 2016,Celebrate my birthday with Flat 51 Off at stores and exclusively online 2712,7.93,7.2,8.2,66.74,1,10.37,7th and 8th grade
Mon Dec 26 18:29:02 +0000 2016,BeingInTouchTomorrow11am,19.48,55.6,92.1,-301.79,1,93.8,55th and 56th grade
Mon Dec 26 05:30:10 +0000 2016,1DaytoGoforBeingInTouch,19.48,67.4,87.4,-386.39,1,88.0,87th and 88th grade
Thu Dec 22 20:07:03 +0000 2016,My Family saw Dangal today evening and thought it was a much better film than Sultan. Love u personally Aamir but hate u professionally,6.86,6.8,6.6,67.76,2,8.69,6th and 7th grade
Tue Dec 20 11:12:31 +0000 2016,Happy Birthday,0.1,8.8,10.2,35.61,1,7.1,-1th and 0th grade
Tue Dec 20 06:24:28 +0000 2016,"So happy that I'm a part of the youngest pipe company, now amongst the Fortune500. Thanku Sandeep sir for making me a part of your brand.",1.25,3.6,5.4,92.12,2,5.9,5th and 6th grade
Sat Dec 17 19:37:13 +0000 2016,. pls don't embarrass me. U r the one who worked this out. Thank you,5.11,1.3,0.3,98.21,2,0.76,0th and 1st grade
Sat Dec 17 18:34:14 +0000 2016,"Met commissioner amp officials at BMC office.Soon going to share info about d work, all of them do a thankless job which is fab,Appreciate them",8.03,11.9,13.5,54.56,1,9.93,9th and 10th grade
Sat Dec 17 08:00:13 +0000 2016,Get ready . Aa raha hai bada surprise ComingSoon BirthdaySurprise .,11.1,11.5,12.9,28.5,1,16.38,11th and 12th grade
Mon Dec 12 15:16:49 +0000 2016,Retail Se yaad aaya ke kuch gaane tailormade hote hai.Nice to c brothers singing in one tune,7.27,5.2,8.1,88.06,1,8.0,7th and 8th grade
Mon Dec 12 10:35:37 +0000 2016,Happy Retail Employees day BeingHumanClothing .,13.36,19.4,20.6,-35.13,1,25.84,12th and 13th grade
Thu Dec 01 19:00:17 +0000 2016,At Koffee with Karan shoot koffeecentury,9.2,8.0,9.0,48.47,1,12.98,8th and 9th grade
Thu Dec 01 11:59:54 +0000 2016,Hello UAE Happy National Day from all of us,5.84,4.4,1.4,79.26,1,3.51,3rd and 4th grade
Thu Dec 01 05:30:31 +0000 2016,No looking or turning back Ahan,9.2,2.1,2.0,90.77,1,4.28,1st and 2nd grade
Wed Nov 30 13:04:27 +0000 2016,Ahan Looking good I'm so happy Just heard you signed a film with Grandson Welcome to the Indian film Industry .,6.21,9.9,10.0,59.64,1,8.53,9th and 10th grade
Tue Nov 29 13:30:04 +0000 2016,. ki film aa Rahi hai . Date Maine decide kar di hai . Title tum log decide kardo . Best of luck ImtiazAli,5.46,5.2,0.6,66.4,4,1.19,5th and 6th grade
Tue Nov 29 13:02:07 +0000 2016,"I'm going to tweet at 7pm today, Ek Baar jo maine commitment kar di ... too much fun",5.41,6.4,5.6,79.6,1,3.59,5th and 6th grade
Sat Nov 26 11:41:05 +0000 2016,Enjoy DearZindagi on anti obesity day. Indiafightsobesity I am in Are you B wise 2 B healthy and wealthy,7.43,5.8,4.7,70.29,2,6.87,6th and 7th grade
Thu Nov 24 08:15:50 +0000 2016,Happy birthday Dad .,0.15,9.2,6.8,34.59,1,5.35,0th and 1st grade
Mon Nov 14 17:00:00 +0000 2016,HappyChildrensday,19.48,43.8,59.1,-217.19,1,53.2,43rd and 44th grade
Mon Nov 14 16:42:44 +0000 2016,After oh oh Jane janaaa comes this gaana. Amazing single by Kamaal Khan.,6.39,2.3,3.6,90.26,2,5.63,2nd and 3rd grade
Mon Nov 14 13:10:58 +0000 2016,HappyChildrensDay .,19.48,55.6,63.9,-301.79,1,53.2,55th and 56th grade
Sat Nov 12 17:58:29 +0000 2016,PRDPAnniversary,19.48,32.0,49.7,-132.59,1,41.6,31st and 32nd grade
Sat Nov 12 07:58:12 +0000 2016,Himesh's new album Aap se Mausiiquii has nice songs. HimeshReshammiya,8.87,4.8,11.8,78.25,1,14.88,4th and 5th grade
Fri Nov 11 13:38:47 +0000 2016,At work .,0.1,2.9,-4.0,77.91,1,-13.21,0th and 1st grade
Sat Nov 05 09:23:03 +0000 2016,Hope you win. May god give you the strength to follow the constitution and human values. All the best. HillaryClintonforpresident,7.13,5.9,7.8,64.67,3,10.79,7th and 8th grade
Thu Nov 03 17:31:44 +0000 2016,"Thank you Amit Bhosle for the Trial of W Hotel, Goa. The whole family had a great holiday, Beautiful Property, God bless.",5.62,6.4,5.5,68.77,2,6.59,5th and 6th grade
Wed Nov 02 18:18:20 +0000 2016,My son n my jaan,0.25,-1.9,-7.7,117.16,1,-7.81,1st and 2nd grade
Wed Nov 02 18:07:20 +0000 2016,Do kutte ghode bache k so Gaye,0.35,-1.2,-1.9,115.13,1,-0.06,-1th and 0th grade
Wed Nov 02 17:49:48 +0000 2016,N so does saint 2.,0.25,-1.9,-5.8,117.16,1,-6.65,1st and 2nd grade
Wed Nov 02 17:48:56 +0000 2016,My love says good nite sleep peacefully,6.24,2.5,4.3,89.75,1,7.37,3rd and 4th grade
Sun Oct 30 19:39:44 +0000 2016,Dj Willy in the house,0.25,-1.9,-3.0,117.16,1,-2.01,1st and 2nd grade
Fri Oct 28 13:57:41 +0000 2016,Best of luck for Shivaay aur AeDilHaiMushkil .,8.5,6.0,8.3,64.37,1,11.55,8th and 9th grade
Thu Oct 27 17:04:47 +0000 2016,"Congratulations Murad Bhai for winning the Yash Bharti award, the highest award in UP",9.97,8.8,9.8,57.27,1,11.53,9th and 10th grade
Mon Oct 24 12:06:39 +0000 2016,Sandesh2Soldiers .,19.48,32.0,59.1,-132.59,1,47.4,31st and 32nd grade
Sat Oct 15 12:33:23 +0000 2016,Ke kehve angreji mein tonight at 8pm World TV Premiere only on SultanOnMAX,9.14,7.2,7.5,66.74,1,9.5,7th and 8th grade
Sat Oct 08 14:02:34 +0000 2016,Chedi Singh umeed karta hu TutakTutakTutiya super hit hogi . Warna hum itne ched kar denge ki ... wish u luck .,9.09,8.2,5.6,53.37,2,6.87,5th and 6th grade
Wed Oct 05 17:31:39 +0000 2016,"Haha Godbless DevasishAK Bade hoke jhagda mat karna, aur kiya toh makeup kar lena",11.1,7.6,8.5,65.73,1,9.91,7th and 8th grade
Wed Oct 05 06:30:12 +0000 2016,"See the autumn winter being human hope u like, feed bak v imp Achaaaa ya not so Achaaaa.",5.41,5.6,6.1,87.05,1,4.64,5th and 6th grade
Fri Sep 30 10:26:41 +0000 2016,Being human Jewellery launched today. Hope you like it .,7.37,5.0,5.4,66.91,2,6.69,1st and 2nd grade
Thu Sep 22 05:31:41 +0000 2016,Check out the new campaign of Splash . . Go shop n have fun,5.25,2.1,-0.5,90.77,2,0.45,2nd and 3rd grade
Tue Sep 20 16:05:20 +0000 2016,2 much fun,0.15,-2.7,-7.5,119.19,1,-10.09,0th and 1st grade
Tue Sep 20 13:45:56 +0000 2016,Wah aur . Kya Baat Hai Bajao,6.57,2.1,-1.2,90.77,1,-0.54,2nd and 3rd grade
Sat Sep 17 15:59:17 +0000 2016,my friend s new show starts 2day . All d best Ashmit .,5.34,1.9,-0.8,91.27,2,-0.03,1st and 2nd grade
Thu Sep 15 14:20:29 +0000 2016,"Congrats to one of d most talented amp complete musician Himesh Reshamiya, Best of luck for d release of his 2nd album",9.75,9.5,10.3,66.07,1,8.01,9th and 10th grade
Wed Sep 14 10:33:52 +0000 2016,"Bhushan amp team, all d best for TumBin2 .",0.4,0.5,2.6,105.66,1,3.55,3rd and 4th grade
Tue Sep 13 09:20:04 +0000 2016,It's time of the year to vote for our favourite DJ's Dimitri Vegas amp Like Mike as the 1 Dj in the world Vote here,6.14,7.1,8.2,88.4,1,3.66,6th and 7th grade
Sun Sep 11 04:34:41 +0000 2016,"Saw the trailer of Banjo, Ritesh and Nargis are outstanding. Abh Yeh deko . ThankGodBappa now with HindiSubtitles",8.56,5.5,8.0,65.69,3,10.6,8th and 9th grade
Thu Sep 08 07:36:41 +0000 2016,. suna,0.05,8.4,2.6,36.62,1,-22.21,-1th and 0th grade
Fri Sep 02 11:37:29 +0000 2016,Dekho SULTAN ab digital pe. On Google Play SultanOnDigital,9.12,6.2,7.0,58.45,2,9.24,6th and 7th grade
Sun Aug 28 07:38:40 +0000 2016,My official game BeingSalmanGame is out now Khelo,9.95,6.4,7.3,63.36,1,10.8,6th and 7th grade
Sat Aug 27 11:34:56 +0000 2016,And here comes Bigg Boss season 10 .,0.35,2.5,1.6,89.75,1,3.26,2nd and 3rd grade
Fri Aug 26 14:31:21 +0000 2016,Uper walla body builders ki kher Karen,8.5,2.5,3.6,89.75,1,6.56,2nd and 3rd grade
Thu Aug 25 11:35:18 +0000 2016,Let's play a game on Sunday .,0.3,2.1,-0.5,90.77,1,-0.54,-1th and 0th grade
Fri Aug 19 16:46:07 +0000 2016,Saw d finals on tv with my mom and told her I hv a picture with Sindhu . Proud .,6.28,6.8,3.5,78.59,1,1.45,6th and 7th grade
Fri Aug 19 15:50:18 +0000 2016,The DreamTeam is Katrina Aditya and,6.57,4.5,5.1,73.85,1,8.17,4th and 5th grade
Fri Aug 19 15:49:13 +0000 2016,"America .. The DreamTeam is in your city go watch them perform in chicago tonight 19th Aug, LA 20th Aug n New Jersey 21st Aug",6.8,9.1,10.4,72.5,1,6.68,6th and 7th grade
Wed Aug 17 12:26:24 +0000 2016,"And also companies like Edelweiss, Jio and others who have come forward to support the Olympics.",8.38,7.2,10.4,72.16,1,11.08,7th and 8th grade
Wed Aug 17 12:25:17 +0000 2016,I admire the work that Olympic Gold Quest OGQ is doing to shape tmrw's champions .,7.54,8.0,7.1,64.71,1,7.24,7th and 8th grade
Wed Aug 17 12:24:25 +0000 2016,The government is very supportive of sports . Each of us can also do our bit to encourage a sports nation .,6.5,6.0,3.8,69.79,2,5.6,5th and 6th grade
Wed Aug 17 12:22:44 +0000 2016,"As a gesture of appreciation for our Olympic athletes, I will present each one with a cheque of Rs1,01,000.",7.07,7.2,10.1,77.57,1,8.65,6th and 7th grade
Sat Aug 13 17:38:55 +0000 2016,DreamTeam2016 Katrina Aditya,9.05,9.2,20.9,34.59,1,24.72,8th and 9th grade
Sat Aug 13 17:36:16 +0000 2016,Heard the Dream Team rocked Houston last nite. Follow The Dream Team US Tour . Go experience the magic in your city,5.49,2.5,3.2,89.75,3,5.46,2nd and 3rd grade
Sat Aug 13 08:09:42 +0000 2016,Radio Nasha 91.9 pe tune Karo every sat sun 4pm on 'The 70mm Show' with .. aur enjoy Karo,0.89,5.6,6.1,87.05,1,3.71,5th and 6th grade
Sun Aug 07 12:52:22 +0000 2016,Get Freaky with FreakyAliTrailer,7.78,7.2,14.7,50.5,1,18.85,7th and 8th grade
Sun Aug 07 07:49:38 +0000 2016,"Freakout 2day, trailer of Freaky Ali, Cinepolis Andheri n live on Freakyali",9.5,4.4,9.7,84.68,1,11.82,4th and 5th grade
Sat Aug 06 11:19:26 +0000 2016,Watch all the freaks coming together in Freaky Ali FreakyAli,0.5,3.7,7.6,86.71,1,10.82,3rd and 4th grade
Sat Aug 06 11:16:48 +0000 2016,Freaky Rivalry FreakyAli,9.05,5.6,14.6,59.97,1,16.95,14th and 15th grade
Sat Aug 06 11:14:05 +0000 2016,Freaky Friendship FreakyAli,0.15,0.9,19.3,93.81,1,22.75,0th and 1st grade
Sat Aug 06 11:11:36 +0000 2016,Freaky Love FreakyAli,0.15,-2.7,9.9,119.19,1,11.15,0th and 1st grade
Sat Aug 06 08:11:20 +0000 2016,"The Freak Nawaz, poor man in the rich man sports who became the game changer Freakyali",5.42,3.6,7.5,97.54,1,7.83,7th and 8th grade
Fri Aug 05 12:54:49 +0000 2016,Hello Brother Jai Ho my Partner,0.3,4.5,2.0,73.85,1,4.28,1st and 2nd grade
Fri Aug 05 11:58:25 +0000 2016,"09.09.2016 is going to be FreakyFriday for all the fans who have loved Hello Brother, PKTDK, Partner and Jai Ho .",6.21,8.7,10.5,68.1,1,8.24,8th and 9th grade
Tue Aug 02 14:09:40 +0000 2016,10DaysToRustom,19.48,20.2,45.0,-47.99,1,35.8,19th and 20th grade
Fri Jul 29 19:00:23 +0000 2016,Rest in peace my brother Rajjat Barjatya,8.5,6.0,5.0,64.37,1,8.24,8th and 9th grade
Mon Jul 25 14:02:12 +0000 2016,thank u for ur prayers and support .,6.24,2.5,1.6,89.75,1,3.26,2nd and 3rd grade
Sun Jul 24 07:01:45 +0000 2016,Watch the last song from TukTuk,6.57,0.9,2.0,99.23,1,4.28,1st and 2nd grade
Sat Jul 23 15:21:05 +0000 2016,Wah yaar is doing a tribute to his teacher Shri Jagjit Singh in Singapore at the Esplanade on 9 Sep,7.79,7.6,7.4,76.56,1,5.92,7th and 8th grade
Fri Jul 22 14:23:01 +0000 2016,My favourite song Bulleya from,7.04,0.5,5.6,100.24,1,8.44,1st and 2nd grade
Sun Jul 17 12:21:48 +0000 2016,Must read it .,0.15,0.9,-2.7,93.81,1,-6.26,0th and 1st grade
Tue Jul 12 07:15:09 +0000 2016,Sultan ka ek aur Gaana SachiMuchi .,6.57,2.1,4.3,90.77,1,6.25,2nd and 3rd grade
Sun Jul 10 13:13:11 +0000 2016,Thx for appreciating sultan . Wld u want to watch my performance on iifa tonite. sm thing like this..,6.71,4.4,4.8,79.26,2,6.41,4th and 5th grade
Sun Jul 10 10:05:15 +0000 2016,BMC is planing 2 crore trees all over Maharashtra.. How cool TreePlantation,7.88,4.5,6.7,73.85,2,9.15,6th and 7th grade
Thu Jun 30 07:03:31 +0000 2016,This Tweet from has been withheld in response to a report from the copyright holder. Learn more.,7.27,6.4,9.3,79.6,1,9.05,6th and 7th grade
Fri Jun 24 05:59:20 +0000 2016,Welcome Jhakaassss..,0.1,2.9,24.3,77.91,1,18.7,-1th and 0th grade
Fri Jun 17 16:48:33 +0000 2016,And the BeingHumanClothing store was launched by . Toh jao enjoy shopping .,5.34,6.6,8.3,57.43,2,11.06,5th and 6th grade
Fri Jun 17 15:09:23 +0000 2016,Happy to announce opening today of one of the biggest stores for BeingHumanClothing in Indore .,9.64,10.3,11.2,47.79,1,12.69,9th and 10th grade
Thu Jun 16 07:34:21 +0000 2016,"Apna version jo 12volt ka tha, that now sounds like 6volts ka lekin ye smile toh hai 440volt ka.Only for u guys.Njoy",7.6,8.3,9.9,74.53,1,6.96,7th and 8th grade
Wed Jun 15 10:58:07 +0000 2016,Let's cheer for Manish S. Rawat RioOlympics2016 MakeIndiaProud,9.76,4.9,13.0,67.42,2,15.25,4th and 5th grade
Tue Jun 14 07:04:32 +0000 2016,Hope barah volt is kafi fr now 440Volt .,6.01,2.9,1.4,88.74,1,2.86,2nd and 3rd grade
Tue Jun 14 07:00:06 +0000 2016,440 Pata nahi but apna version 12 volt toh hoga minimum D,9.5,5.6,2.6,76.22,1,4.05,5th and 6th grade
Tue Jun 14 05:28:34 +0000 2016,Let's cheer for Laxmirani Majhi RioOlympics2016 MakeIndiaProud,13.01,9.6,19.8,38.99,1,25.64,9th and 10th grade
Sun Jun 12 06:30:22 +0000 2016,Let's cheer for Sapna Punia RioOlympics2016 MakeIndiaProud,13.01,9.6,17.1,38.99,1,22.34,9th and 10th grade
Sat Jun 11 07:36:52 +0000 2016,Let's cheer for Dattu Bhokanal RioOlympics2016 MakeIndiaProud,10.75,7.2,19.1,55.91,1,24.77,-1th and 0th grade
Fri Jun 10 07:30:02 +0000 2016,"Sultan is not just a game, its a sport Download the game now",6.71,3.6,2.4,92.12,1,2.83,2nd and 3rd grade
Thu Jun 09 07:01:31 +0000 2016,Ek baar maine commitment kar di Toh... So suno jag.... in my voice . JagGhoomeyaSalmanVersion . Link,6.11,5.0,8.7,72.32,2,9.35,8th and 9th grade
Wed Jun 08 11:36:50 +0000 2016,Let's cheer for B. Sumeeth Reddy amp Manu Attri RioOlympics2016 MakeIndiaProud,9.65,4.3,10.4,74.35,2,13.67,9th and 10th grade
Wed Jun 08 07:02:05 +0000 2016,Check out the preview of Releasing on 10 June.,7.59,3.3,2.9,87.72,1,4.78,4th and 5th grade
Tue Jun 07 12:21:41 +0000 2016,Do din buss . Itna toh wait karhi sakte ho till then enjoy Rahat .,7.6,4.6,0.7,73.34,2,2.09,2nd and 3rd grade
Tue Jun 07 07:09:52 +0000 2016,My version sung for my fans coming up in 2 days .,5.62,4.0,0.3,85.69,1,1.02,3rd and 4th grade
Tue Jun 07 07:00:10 +0000 2016,Enjoy JagGhoomeya Rahat's version .,15.68,13.1,17.1,8.2,1,18.85,1st and 2nd grade
Mon Jun 06 13:45:49 +0000 2016,Let's cheer for Manavjit Singh Sandhu RioOlympics2016 MakeIndiaProud,11.93,8.8,18.5,46.44,1,23.85,8th and 9th grade
Sun Jun 05 09:35:36 +0000 2016,Let's cheer for Srikanth Kidambi RioOlympics2016 MakeIndiaProud,10.75,7.2,20.4,55.91,1,26.46,-1th and 0th grade
Sat Jun 04 11:32:52 +0000 2016,Let's cheer for Gurpreet Singh RioOlympics2016 MakeIndiaProud,10.75,7.2,19.1,55.91,1,24.77,-1th and 0th grade
Fri Jun 03 12:08:42 +0000 2016,Let's cheer for P. V. Sindhu RioOlympics2016 MakeIndiaProud,9.76,4.9,11.2,67.42,2,12.35,11th and 12th grade
Fri Jun 03 06:47:02 +0000 2016,Having fun with Sultan amp YRF music. Hope u like it .,5.34,3.1,-0.4,82.81,2,0.51,-1th and 0th grade
Thu Jun 02 05:30:21 +0000 2016,Let's cheer for Gurmeet Singh RioOlympics2016 MakeIndiaProud,8.5,6.0,18.4,64.37,1,23.96,8th and 9th grade
Wed Jun 01 05:59:20 +0000 2016,Let's cheer for Nitendra S. Rawat RioOlympics2016 MakeIndiaProud,9.76,7.2,14.2,50.5,2,16.7,16th and 17th grade
Tue May 31 10:35:38 +0000 2016,Let's cheer for Kheta Ram RioOlympics2016 MakeIndiaProud,8.5,6.0,15.7,64.37,1,20.66,8th and 9th grade
Tue May 31 08:31:42 +0000 2016,Album link .,11.63,8.8,3.1,35.61,1,-4.51,0th and 1st grade
Tue May 31 08:06:19 +0000 2016,Sultan's full music album coming up at 2pm.,7.98,5.2,3.8,71.82,1,5.0,4th and 5th grade
Tue May 31 07:28:44 +0000 2016,Dekho sultan ka pehla song . BabyKoBassPasandHai,9.2,6.8,14.5,56.93,1,18.78,9th and 10th grade
Mon May 30 07:20:47 +0000 2016,Let's cheer for Ashwini Ponappa amp Jwala Gutta RioOlympics2016 MakeIndiaProud,12.03,10.7,16.1,35.95,1,20.68,10th and 11th grade
Sun May 29 06:13:20 +0000 2016,Let's cheer for Shiva Thapa RioOlympics2016 MakeIndiaProud,13.01,9.6,17.1,38.99,1,22.34,9th and 10th grade
Sat May 28 05:42:18 +0000 2016,Let's cheer for Kavita Raut RioOlympics2016 MakeIndiaProud,10.75,7.2,17.1,55.91,1,22.34,-1th and 0th grade
Fri May 27 06:23:12 +0000 2016,Let's cheer for Sudha Singh RioOlympics2016 MakeIndiaProud,10.75,7.2,17.1,55.91,1,22.34,-1th and 0th grade
Thu May 26 05:33:17 +0000 2016,Let's cheer for Heena Sidhu RioOlympics2016 MakeIndiaProud,10.75,7.2,17.1,55.91,1,22.34,-1th and 0th grade
Wed May 25 06:07:32 +0000 2016,Let's cheer for Ayonika Paul RioOlympics2016 MakeIndiaProud,10.75,9.6,17.7,38.99,1,23.15,9th and 10th grade
Tue May 24 14:18:53 +0000 2016,Kaisa Laga,11.63,2.9,0.8,77.91,1,-4.51,-1th and 0th grade
Tue May 24 14:18:53 +0000 2016,Kaisa Laga,11.63,2.9,0.8,77.91,1,-4.51,-1th and 0th grade
Tue May 24 05:28:54 +0000 2016,Let's cheer for Deepika Kumari RioOlympics2016 MakeIndiaProud,13.01,9.6,19.1,38.99,1,24.77,9th and 10th grade
Mon May 23 13:59:58 +0000 2016,Dekhna Jaroor . SultanTrailerOnSONY ExtraInningsT20 main Kal Saat baje,11.93,10.0,19.1,37.98,1,24.61,11th and 12th grade
Mon May 23 07:03:17 +0000 2016,Let's cheer for Tintu Luka RioOlympics2016 MakeIndiaProud,13.01,9.6,16.4,38.99,1,21.47,9th and 10th grade
Sat May 21 05:29:55 +0000 2016,Let's cheer for Jitu Rai RioOlympics2016 MakeIndiaProud,10.75,7.2,15.0,55.91,1,19.84,14th and 15th grade
Fri May 20 07:04:16 +0000 2016,Let's cheer for Chain Singh RioOlympics2016 MakeIndiaProud,8.5,6.0,17.1,64.37,1,22.34,8th and 9th grade
Thu May 19 05:34:51 +0000 2016,Let's cheer for Sharath Kamal Achanta RioOlympics2016 MakeIndiaProud,11.93,8.8,18.5,46.44,1,23.85,8th and 9th grade
Wed May 18 09:32:42 +0000 2016,Dnt stop eating. Jst eat right. Read Dr Muffi's book. EatRight DrMuffi,7.78,1.3,3.7,92.8,3,3.36,4th and 5th grade
Wed May 18 06:15:42 +0000 2016,Let's cheer for Soumyajit Ghosh RioOlympics2016 MakeIndiaProud,10.75,7.2,19.8,55.91,1,25.64,-1th and 0th grade
Tue May 17 05:30:57 +0000 2016,Let's cheer for Mouma Das RioOlympics2016 MakeIndiaProud,8.5,6.0,15.7,64.37,1,20.66,8th and 9th grade
Mon May 16 09:38:33 +0000 2016,Let's cheer for Apurvi Chandela RioOlympics2016 MakeIndiaProud,10.75,7.2,19.8,55.91,1,25.64,-1th and 0th grade
Sun May 15 07:38:34 +0000 2016,Let's cheer for Manika Batra RioOlympics2016 MakeIndiaProud,13.01,9.6,17.7,38.99,1,23.15,9th and 10th grade
Sat May 14 05:56:45 +0000 2016,Let's cheer for Kynan Chenai RioOlympics2016 MakeIndiaProud,10.75,7.2,17.7,55.91,1,23.15,-1th and 0th grade
Fri May 13 05:21:57 +0000 2016,Let's cheer for Saina Nehwal RioOlympics2016 MakeIndiaProud,10.75,9.6,17.7,38.99,1,23.15,9th and 10th grade
Thu May 12 06:37:03 +0000 2016,Let's cheer for Prakash Nanjappa RioOlympics2016 MakeIndiaProud,10.75,9.6,20.4,38.99,1,26.46,19th and 20th grade
Wed May 11 19:27:04 +0000 2016,Unconditional,19.48,43.8,40.3,-217.19,1,30.0,43rd and 44th grade
Wed May 11 05:29:35 +0000 2016,Let's cheer for Inderjeet Singh RioOlympics2016 MakeIndiaProud,10.75,9.6,19.8,38.99,1,25.64,19th and 20th grade
Tue May 10 06:07:14 +0000 2016,Let's cheer for Manpreet Kaur RioOlympics2016 MakeIndiaProud,10.75,7.2,18.4,55.91,1,23.96,-1th and 0th grade
Mon May 09 06:40:37 +0000 2016,Let's cheer for Vikas Gowda RioOlympics2016 MakeIndiaProud,10.75,7.2,17.1,55.91,1,22.34,-1th and 0th grade
Sun May 08 08:10:03 +0000 2016,Happy Mother's Day .,9.05,9.2,6.8,34.59,1,3.43,0th and 1st grade
Sun May 08 05:28:44 +0000 2016,Let's cheer for Khushbir Kaur RioOlympics2016 MakeIndiaProud,10.75,7.2,18.4,55.91,1,23.96,-1th and 0th grade
Sat May 07 17:05:50 +0000 2016,Well done Vinesh Phogat amp Sakshi Malik . d 1st time 2 women wrestlers frm India hv qualified for d Olympics. MakeIndiaProud,9.19,10.3,12.4,58.62,1,10.91,12th and 13th grade
Sat May 07 05:29:35 +0000 2016,Let's cheer for Lalita Babar RioOlympics2016 MakeIndiaProud,10.75,7.2,17.7,55.91,1,23.15,-1th and 0th grade
Fri May 06 10:26:53 +0000 2016,iss saal 8may ek cup chai peelo n support those fighting cancer,9.5,4.4,5.0,84.68,1,6.95,4th and 5th grade
Fri May 06 10:25:24 +0000 2016,they hv started this thing k chai peeo aur uss ka paisa vil help them help others .,6.34,5.2,5.3,88.06,1,4.58,4th and 5th grade
Fri May 06 10:25:07 +0000 2016,when max died of cancer his ma baap started the max foundation to help other cancer patients .,8.19,8.7,8.4,62.68,1,8.35,8th and 9th grade
Fri May 06 05:28:10 +0000 2016,Let's cheer for Gagan Narang . RioOlympics2016 MakeIndiaProud,8.5,7.2,18.4,55.91,1,23.15,-1th and 0th grade
Thu May 05 05:38:46 +0000 2016,Let's cheer for O.P. Jaisha RioOlympics2016 MakeIndiaProud,8.32,4.7,15.3,67.92,2,16.22,4th and 5th grade
Wed May 04 05:29:30 +0000 2016,Let's cheer for Sandeep Kumar . RioOlympics2016 MakeIndiaProud,10.75,9.6,19.1,38.99,1,23.96,9th and 10th grade
Tue May 03 05:31:31 +0000 2016,Three cheers for gold medalist amp India's Goodwill Ambassador RioOlympics2016 MakeIndiaProud,12.79,9.9,19.6,43.39,1,24.75,9th and 10th grade
Mon May 02 16:41:00 +0000 2016,Salma Nani and Nanha Ahil .,7.04,2.9,1.8,83.32,1,2.64,1st and 2nd grade
Mon May 02 10:07:24 +0000 2016,"This younger gen is fab has a lot of integrity, respect n culture. God bless em .",6.99,2.9,1.7,88.74,2,2.86,2nd and 3rd grade
Mon May 02 10:06:42 +0000 2016,"Gud upbringing, so happy to hv taken a pic vit him. Learn .",5.55,5.6,3.0,76.22,1,3.12,5th and 6th grade
Mon May 02 10:04:46 +0000 2016,"at the airport wen ppl were slyly n openly taking pics vit thr phones, this kid stood quietly, requested for a pic.",7.6,9.5,9.7,66.07,1,6.73,9th and 10th grade
Sun May 01 05:35:24 +0000 2016,Happy Birthday to my Sultani Arfa SultanKiJaan .,10.75,10.7,9.7,30.53,1,13.17,10th and 11th grade
Sat Apr 30 18:27:56 +0000 2016,Let's cheer our 2016 Olympic stars . Here's Dipa Karmakar YouMakeUsProud,7.04,1.7,10.3,91.78,2,12.5,1st and 2nd grade
Fri Apr 29 18:35:31 +0000 2016,"Filmed sultaan in muzaffarnagar,cld not hv happened vit out the support of the C M, people,film development Corp,police n admin. 2 much fun.",8.9,13.4,14.2,39.67,1,11.26,12th and 13th grade
Mon Apr 25 17:39:58 +0000 2016,"Mary Kom . Boxer, MP, winner . brings a winning attitude to all her work .",6.71,8.4,6.5,58.28,1,5.9,7th and 8th grade
