created_at,text,dale_chall_readability_score,flesch_kincaid,automated_readability,flesch_reading,sentence_count,coleman_liau_index,based_on_all_algorithms
Mon Nov 28 18:55:54 +0000 2016,Day 1 complete. Here s how I trained fast for El Cl sico today StrikeSeries,6.11,1.5,1.5,97.7,2,3.55,1st and 2nd grade
Sat Nov 26 18:44:33 +0000 2016,3 points,0.1,-3.1,-4.0,120.21,1,-10.31,-1th and 0th grade
Thu Nov 24 15:16:44 +0000 2016,Happy morning,0.1,8.8,7.8,35.61,1,4.2,-1th and 0th grade
Thu Nov 24 07:32:45 +0000 2016,Open your eyes this is how I wake up raiseit,5.71,1.3,0.1,103.63,1,1.54,3rd and 4th grade
Tue Nov 22 09:08:34 +0000 2016,Honoured to debut my boots back where it all started. CR7 Discovery,9.5,5.6,6.6,76.22,1,8.4,5th and 6th grade
Mon Nov 21 17:33:31 +0000 2016,Inspired by the match that changed my career. Excited to wear my new boots tomorrow Mercurial,6.99,6.4,5.6,63.36,2,8.25,5th and 6th grade
Mon Nov 21 08:02:08 +0000 2016,Men s daily essentials CLEARMEN Mercurial Ad,10.75,10.7,7.6,30.53,1,11.55,10th and 11th grade
Sun Nov 20 18:14:30 +0000 2016,Stretching boy,11.63,2.9,10.2,77.91,1,7.1,-1th and 0th grade
Sun Nov 20 01:02:08 +0000 2016,Top well done team,0.2,-2.3,-1.9,118.18,1,-1.46,-1th and 0th grade
Thu Nov 17 08:29:44 +0000 2016,Always working. Fresh Trainers. Gear up for the gym on,7.29,3.7,4.8,86.71,1,6.18,3rd and 4th grade
Wed Nov 16 18:24:12 +0000 2016,Unleashed my inner lion while filming with BeatTheClock,11.93,6.4,10.8,63.36,1,15.15,2nd and 3rd grade
Sat Nov 12 18:04:07 +0000 2016,Love my new Collection,7.78,3.7,2.9,75.88,1,4.35,3rd and 4th grade
Sat Nov 12 09:00:40 +0000 2016,"Target practice Mercurial CR7 Chapter 3, lace up at",11.1,8.0,5.6,53.88,1,8.03,7th and 8th grade
Fri Nov 11 17:16:32 +0000 2016,Glad to make your wishes come true,6.24,0.1,0.9,106.67,1,3.26,2nd and 3rd grade
Fri Nov 11 09:01:16 +0000 2016,No substitute for hard work StrikeSeries CR7 Chapter 3 Collection at,9.92,6.4,8.9,68.77,1,12.1,6th and 7th grade
Thu Nov 10 12:19:22 +0000 2016,NIKE MAN,0.1,-3.1,-4.0,120.21,1,-10.31,-1th and 0th grade
Wed Nov 09 15:00:31 +0000 2016,Just found the next generation of Fast in Lisbon StrikeSeries,8.87,6.0,8.1,69.79,1,11.4,7th and 8th grade
Wed Nov 09 13:58:46 +0000 2016,Back in Lisbon leading a masterclass with the future of Fast. Watch out for these guys Mercurial,8.7,5.4,5.0,71.31,2,7.62,4th and 5th grade
Tue Nov 08 23:44:35 +0000 2016,The Man,0.1,-3.1,-6.4,120.21,1,-13.21,-1th and 0th grade
Tue Nov 08 16:01:44 +0000 2016,My sports cars just got jealous Mercurial New wheels at,7.29,4.8,5.2,78.25,1,7.92,4th and 5th grade
Tue Nov 08 08:00:13 +0000 2016,"New wheels, same results. Mercurial New boots",8.32,4.7,6.6,67.92,2,6.3,6th and 7th grade
Mon Nov 07 22:58:23 +0000 2016,Es un honor recibir nuevamente el trofeo Alfredo di Stefano. Gracias a todos,11.25,7.0,5.0,56.42,2,7.89,6th and 7th grade
Mon Nov 07 14:25:53 +0000 2016,We're even for now... CR7 Discovery just got a whole new meaning. Nice one bro Mercurial,6.86,3.0,2.7,83.02,3,3.23,2nd and 3rd grade
Mon Nov 07 14:16:35 +0000 2016,You were behind this too Can't believe you guys did this behind my back,0.69,4.0,5.1,91.11,1,5.73,5th and 6th grade
Mon Nov 07 08:01:38 +0000 2016,Love my new Mercurial boots. CR7 Chapter3 Discovery,9.76,7.2,6.5,50.5,2,8.0,6th and 7th grade
Sat Nov 05 15:02:42 +0000 2016,Just came back from the tailor and my suit fits perfectly Sacoor Brothers attention to detail is one reason why I am a huge fan,6.77,9.5,10.5,71.48,1,6.91,6th and 7th grade
Sat Nov 05 08:20:42 +0000 2016,G morning,0.1,2.9,-1.7,77.91,1,-7.41,-1th and 0th grade
Thu Nov 03 18:53:42 +0000 2016,Check out my new film FW16 Collection. I hope you enjoy it.,5.25,2.1,0.4,90.77,2,1.38,2nd and 3rd grade
Thu Nov 03 11:56:52 +0000 2016,Keep your head up,0.2,-2.3,-3.0,118.18,1,-2.91,-1th and 0th grade
Tue Nov 01 20:33:59 +0000 2016,UCL,0.05,-3.5,-6.9,121.22,1,-28.01,-1th and 0th grade
Tue Nov 01 17:59:57 +0000 2016,"Spend the holidays with me Visit to see my CR7 Christmas blankets Super soft, save 15 with promo code CR7.",7.79,8.7,9.1,68.1,1,7.37,8th and 9th grade
Mon Oct 31 18:04:23 +0000 2016,I hope you enjoy my new FW16 Collection as much as I do. Check it at,5.02,1.7,-1.9,97.2,2,-0.81,-1th and 0th grade
Sun Oct 30 19:52:34 +0000 2016,Good night,0.1,-3.1,0.8,120.21,1,-4.51,-1th and 0th grade
Sun Oct 30 13:53:36 +0000 2016,Happy Halloween day,9.05,5.6,6.8,59.97,1,7.32,6th and 7th grade
Sat Oct 29 18:36:15 +0000 2016,With my boy,0.15,-2.7,-5.9,119.19,1,-8.18,0th and 1st grade
Sat Oct 29 17:48:00 +0000 2016,Great win and very important 3 points. Well done boys,0.25,0.5,1.8,100.24,2,3.22,1st and 2nd grade
Fri Oct 28 17:50:29 +0000 2016,"To stay fresh throughout a match, I use CLEAR ad",5.71,1.3,1.9,103.63,1,3.28,3rd and 4th grade
Fri Oct 28 10:24:53 +0000 2016,"Great dinner last night,discussing plans for the present and future",7.29,4.8,10.9,78.25,1,14.3,4th and 5th grade
Thu Oct 27 15:10:03 +0000 2016,Extra effort. Extra reward. StrikeSeries Speed up with Modern uniform of fast,8.18,8.0,10.5,59.3,1,12.75,4th and 5th grade
Thu Oct 27 08:34:14 +0000 2016,Bom dia,0.1,-3.1,-6.4,120.21,1,-13.21,-1th and 0th grade
Thu Oct 20 18:53:00 +0000 2016,Help me kick breast cancer.Visit save 15 with promo code Pink7 and Elite Team will donate to Breast Cancer Research,7.79,7.6,11.2,76.56,1,10.27,7th and 8th grade
Fri Oct 14 17:04:03 +0000 2016,"I m so excited the Z11 has finally come to spain My friends at are giving one away, enter here",0.99,7.6,6.2,76.56,1,4.18,7th and 8th grade
Fri Oct 14 10:52:25 +0000 2016,Thanks,0.05,-3.5,7.3,121.22,1,-10.61,-1th and 0th grade
Thu Oct 13 17:30:12 +0000 2016,Couldn't resist a quick game while filming something exciting for PokerStars... raiseit,9.5,10.3,14.4,42.38,1,16.63,9th and 10th grade
Tue Oct 11 17:00:18 +0000 2016,Win an autographed CR7MiniBlanket. Visit shop my exclusive line of CR7 blankets and enter to win today CR7BLANKETS,8.47,6.8,8.5,62.34,2,11.86,8th and 9th grade
Mon Oct 10 21:46:49 +0000 2016,Two games 6 points well done team,0.35,-1.2,0.3,115.13,1,2.44,2nd and 3rd grade
Mon Oct 10 11:25:29 +0000 2016,Morning walk,0.1,2.9,5.5,77.91,1,1.3,-1th and 0th grade
Sat Oct 08 17:01:03 +0000 2016,It s my turn to support my team Help us make Madeira win World s Leading Destination 2016. Vote here,7.0,7.6,7.6,76.56,1,5.92,7th and 8th grade
Fri Oct 07 21:38:33 +0000 2016,Happy to score my first poker for Portugal,7.98,5.2,3.2,71.82,1,5.76,5th and 6th grade
Wed Oct 05 12:08:07 +0000 2016,Training,19.48,8.4,16.8,36.62,1,1.0,-1th and 0th grade
Mon Oct 03 17:02:28 +0000 2016,Want to watch me play a match live in Madrid are giving you the chance to win this amazing trip Enter now,1.81,6.0,7.6,91.45,1,4.88,4th and 5th grade
Fri Sep 30 20:32:44 +0000 2016,Glad to be the cover of 5th anniversary book. THE JOURNEY .,5.62,6.4,4.6,68.77,1,5.78,5th and 6th grade
Fri Sep 30 16:49:01 +0000 2016,Wow More than 5 million downloads of my mobile game Thank you Download Kick'n'Run here for free,8.19,7.6,9.0,71.14,1,8.7,8th and 9th grade
Fri Sep 30 11:00:19 +0000 2016,Winning team,11.63,2.9,5.5,77.91,1,1.3,-1th and 0th grade
Thu Sep 29 08:09:11 +0000 2016,I'm really excited to share with you the new SACOORBROTHERS Fall Winter Collection Meet my favorite new items at,6.24,9.5,11.4,60.65,1,11.08,11th and 12th grade
Thu Sep 22 19:08:57 +0000 2016,I'm good and you,0.2,-2.3,-4.2,118.18,1,-5.81,-1th and 0th grade
Thu Sep 22 09:39:55 +0000 2016,Great moment,0.1,2.9,5.5,77.91,1,1.3,-1th and 0th grade
Wed Sep 21 21:22:24 +0000 2016,Hala Madrid,11.63,2.9,3.1,77.91,1,-1.61,-1th and 0th grade
Wed Sep 14 10:33:38 +0000 2016,CHAMPIONS LEAGUE TONIGHT,9.05,5.6,14.6,59.97,1,16.95,14th and 15th grade
Sun Sep 11 17:34:15 +0000 2016,Did you try this awesome feature in my mobile game Download here,9.5,4.4,5.4,84.68,1,7.47,4th and 5th grade
Fri Sep 09 10:19:14 +0000 2016,Always nice to be with the fans,0.35,0.1,-1.2,106.67,1,0.76,-1th and 0th grade
Thu Sep 08 15:02:40 +0000 2016,Great to be back to full team training Train fast with Strike Series,6.71,3.6,5.4,92.12,1,6.83,6th and 7th grade
Mon Sep 05 18:01:11 +0000 2016,Step into the spotlight with my latest collection,9.95,6.4,7.3,63.36,1,10.8,7th and 8th grade
Mon Sep 05 16:48:36 +0000 2016,"First training with the team, very happy Enjoy the picture",5.71,4.8,6.6,78.25,1,9.08,3rd and 4th grade
Sat Sep 03 12:14:40 +0000 2016,V D,0.1,-3.1,-15.8,120.21,1,-24.81,-1th and 0th grade
Sat Sep 03 08:01:56 +0000 2016,Thanks for this kind gift. The new rose gold Heuer 01 is amazing dontcrackunderpressure,6.24,3.7,7.0,81.29,2,10.27,5th and 6th grade
Fri Sep 02 11:39:11 +0000 2016,Soon,0.05,-3.5,-2.2,121.22,1,-22.21,-1th and 0th grade
Fri Sep 02 07:10:41 +0000 2016,Z11 doesn t believe in limitations. DreamWithoutBoundaries,8.5,10.7,17.1,30.53,1,22.34,10th and 11th grade
Thu Sep 01 09:30:36 +0000 2016,Happy,0.05,8.4,2.6,36.62,1,-16.41,-1th and 0th grade
Wed Aug 31 14:40:09 +0000 2016,Selfie time,11.63,2.9,3.1,77.91,1,-1.61,-1th and 0th grade
Tue Aug 30 10:29:34 +0000 2016,Mood,0.05,-3.5,-2.2,121.22,1,-22.21,-1th and 0th grade
Sun Aug 28 16:00:30 +0000 2016,Training done with my boys,7.04,0.5,1.8,100.24,1,3.8,1st and 2nd grade
Fri Aug 26 17:22:42 +0000 2016,Feeling good lets go,7.78,1.3,0.6,92.8,1,1.45,0th and 1st grade
Fri Aug 26 15:36:51 +0000 2016,Training fast to come back stronger with the Strike Series.,7.29,2.5,7.1,95.17,1,9.66,3rd and 4th grade
Fri Aug 26 08:45:48 +0000 2016,Gracias equipo,11.63,2.9,10.2,77.91,1,7.1,-1th and 0th grade
Thu Aug 25 18:16:46 +0000 2016,Very happy and proud to win such a special award. Thank you to my team mates from Real Madrid and Portugal,5.66,2.7,3.1,94.66,2,4.73,4th and 5th grade
Thu Aug 25 15:30:37 +0000 2016,Enjoying being back in training in my latest gear. Get the Strike Series,8.82,4.6,3.6,73.34,2,6.09,5th and 6th grade
Wed Aug 24 17:55:58 +0000 2016,Not ready to let this summer go yet Check out my summer looks at SacoorBrothers,5.43,5.6,6.5,81.63,1,7.24,5th and 6th grade
Tue Aug 23 16:03:33 +0000 2016,I train fast to play fast. Thanks for the new Nike Train Ultrafast Flyknit,6.24,1.3,2.6,98.21,2,4.94,2nd and 3rd grade
Mon Aug 22 18:05:53 +0000 2016,Another shot from my latest campaign Check the range out on,7.05,5.2,5.0,77.23,1,7.35,4th and 5th grade
Mon Aug 22 14:41:03 +0000 2016,Mood,0.05,-3.5,-2.2,121.22,1,-22.21,-1th and 0th grade
Sat Aug 20 17:57:31 +0000 2016,Poker at home while watching the action in Brazil two great games on the go,7.54,4.4,5.2,90.09,1,5.73,5th and 6th grade
Sat Aug 20 15:19:47 +0000 2016,Congratulations my friend for your triple gold,6.24,6.0,9.0,64.37,1,13.17,8th and 9th grade
Sat Aug 20 11:08:10 +0000 2016,"Madeira Island is pretty awesome, don t you think guys madeiraislands exploremadeira visitmadeira madeiraisgold",9.97,8.8,18.5,57.27,1,22.32,9th and 10th grade
Fri Aug 19 18:06:06 +0000 2016,Time to focus on the new season with my timepiece. DontCrackUnderPressure,8.49,7.6,11.1,60.31,1,14.25,7th and 8th grade
Thu Aug 18 10:59:34 +0000 2016,The smartphone of champions will land on Aug 31st WhatsNU,8.87,4.8,6.2,78.25,1,9.08,4th and 5th grade
Mon Aug 15 16:57:51 +0000 2016,Stepping into the spotlight for FW16 Now available on CR7Underwear,8.87,7.2,10.4,61.33,1,14.3,7th and 8th grade
Mon Aug 15 12:09:30 +0000 2016,Morning run,0.1,2.9,3.1,77.91,1,-1.61,-1th and 0th grade
Sat Aug 13 12:02:55 +0000 2016,Paz,0.05,-3.5,-6.9,121.22,1,-28.01,-1th and 0th grade
Thu Aug 11 10:15:16 +0000 2016,In the spotlight for my latest campaign. Check out new styles on CR7Underwear,8.82,3.5,5.4,81.8,2,8.3,5th and 6th grade
Wed Aug 10 15:14:45 +0000 2016,Faz j um m s...recorda o muito feliz Dois grandes homens,8.49,4.0,3.8,85.69,1,4.21,3rd and 4th grade
Tue Aug 09 21:44:44 +0000 2016,Champions.,19.48,20.2,26.2,-47.99,1,6.8,19th and 20th grade
Tue Aug 09 18:31:22 +0000 2016,Not in the field but always with you Good luck guys halamadrid,5.55,4.4,4.6,84.68,1,6.48,5th and 6th grade
Tue Aug 09 08:42:47 +0000 2016,Have a selfie with me. Check out my new CR7 Selfie Fans with a Cause App CR7SelfieApp,5.92,1.9,1.9,96.69,2,3.85,1st and 2nd grade
Mon Aug 08 17:57:09 +0000 2016,Solid work,11.63,2.9,0.8,77.91,1,-4.51,-1th and 0th grade
Mon Aug 08 15:12:39 +0000 2016,Wake up after a great nap with crj,0.4,0.5,-1.6,105.66,1,-0.05,-1th and 0th grade
Sun Aug 07 16:03:16 +0000 2016,Ice cream time,0.15,-2.7,-1.2,119.19,1,-2.38,0th and 1st grade
Sat Aug 06 17:15:44 +0000 2016,My baby miss me,7.78,1.3,-5.4,92.8,1,-5.81,0th and 1st grade
Fri Aug 05 15:52:26 +0000 2016,Quick remind,0.1,2.9,5.5,77.91,1,1.3,-1th and 0th grade
Thu Aug 04 08:31:48 +0000 2016,Are you ready to spend some time with me I have great news coming your way. Stay tuned Coming on 9th August,0.55,1.7,2.5,102.61,2,3.92,3rd and 4th grade
Fri Jul 29 16:11:18 +0000 2016,Good morning gym,0.15,0.9,2.1,93.81,1,1.52,0th and 1st grade
Thu Jul 28 19:58:15 +0000 2016,Lunch time,0.1,-3.1,0.8,120.21,1,-4.51,-1th and 0th grade
Wed Jul 27 14:06:29 +0000 2016,"I ve joined a new team, Elite Team. Visit to see my exclusive luxury blankets.",7.17,3.9,2.4,80.78,2,3.96,3rd and 4th grade
Sun Jul 24 16:11:52 +0000 2016,A TRUE CHAMPION chooses CLEARMEN. TRUECHAMPION POWERHAIR CLEARNODANDRUFF,13.7,13.1,18.9,8.2,2,23.2,13th and 14th grade
Sat Jul 23 12:34:45 +0000 2016,Thanks Madeira,0.1,-3.1,10.2,120.21,1,7.1,-1th and 0th grade
Fri Jul 22 10:08:39 +0000 2016,I will be back,0.2,-2.3,-6.6,118.18,1,-7.26,-1th and 0th grade
Thu Jul 21 16:07:36 +0000 2016,"On the field, I need the right tools to win. Online trading is no different, I chose",5.92,1.9,1.7,96.69,2,2.8,1st and 2nd grade
Wed Jul 20 15:35:15 +0000 2016,Check out our power moves Stay fresh with CLEARMEN. TRUECHAMPION CLEARNODANDRUFF CLEARPOWERMOVE,9.2,8.0,14.5,48.47,2,19.3,7th and 8th grade
Tue Jul 19 16:39:38 +0000 2016,My mobile game is moving to Rio de Janeiro with the awesome new update available now,8.38,6.0,6.9,80.62,1,7.42,6th and 7th grade
Mon Jul 18 10:39:07 +0000 2016,Spend time with my little man,0.3,0.9,0.4,99.23,1,2.37,0th and 1st grade
Sat Jul 16 15:39:10 +0000 2016,"We dream, we fight, and we exceed. Remember how we GoBeyond today and every day with nubia Euro2016 Champion",7.43,7.0,5.6,61.83,2,7.51,5th and 6th grade
Sat Jul 16 12:25:04 +0000 2016,Lunch,0.05,-3.5,2.6,121.22,1,-16.41,-1th and 0th grade
Fri Jul 15 08:54:25 +0000 2016,Mercurial Superfly Portugal Champions of Europe by NIKEiD.,13.9,14.7,12.6,4.14,1,16.6,12th and 13th grade
Wed Jul 13 09:29:34 +0000 2016,"When a team and a nation believe, anything is possible. SparkBrilliance justdoit",8.18,9.2,11.7,50.84,1,14.2,8th and 9th grade
Tue Jul 12 10:10:36 +0000 2016,Mood,0.05,-3.5,-2.2,121.22,1,-22.21,-1th and 0th grade
Mon Jul 11 15:02:03 +0000 2016,Wow,0.05,-3.5,-6.9,121.22,1,-28.01,-1th and 0th grade
Mon Jul 11 09:11:39 +0000 2016,History,0.05,20.2,12.0,-47.99,1,-4.81,-1th and 0th grade
Mon Jul 11 08:50:10 +0000 2016,One moment can change everything. Never give up. Make them believe. SparkBrilliance JustDoIt,6.28,5.0,9.7,67.11,3,11.73,4th and 5th grade
Sun Jul 10 23:09:15 +0000 2016,Proud of my team. Proud of my country. Make them believe. JustDoIt,5.15,1.3,2.1,92.8,3,1.91,1st and 2nd grade
Sat Jul 09 14:09:46 +0000 2016,My boys,0.1,-3.1,-6.4,120.21,1,-13.21,-1th and 0th grade
Fri Jul 08 17:38:34 +0000 2016,Time to focus. Counting down the hours with my . See you on Sunday on the field. dontcrackunderpressure,6.71,4.3,5.2,74.15,3,7.18,6th and 7th grade
Tue Jul 05 13:58:57 +0000 2016,Happy moments,11.63,8.8,7.8,35.61,1,4.2,-1th and 0th grade
Tue Jul 05 10:55:41 +0000 2016,Keeping my mind sharp in between games lovepoker,7.98,5.2,6.7,71.82,1,10.11,6th and 7th grade
Mon Jul 04 10:24:56 +0000 2016,Mood,0.05,-3.5,-2.2,121.22,1,-22.21,-1th and 0th grade
Thu Jun 30 23:54:27 +0000 2016,When you believe you achieve,0.25,0.5,3.7,100.24,1,6.12,1st and 2nd grade
Wed Jun 29 17:10:26 +0000 2016,Time to relax and bring out my Carrera to fuel me up before the big match DontCrackUnderPressure,7.27,8.7,9.3,62.68,1,9.74,8th and 9th grade
Tue Jun 28 22:06:43 +0000 2016,g n,0.1,-3.1,-15.8,120.21,1,-24.81,-1th and 0th grade
Fri Jun 24 15:03:16 +0000 2016,Have you played my new game Cristiano Ronaldo Kick'n'Run It's pretty cool Try it here,7.54,5.6,8.3,81.63,1,8.4,7th and 8th grade
Fri Jun 24 15:03:16 +0000 2016,Have you played my new game Cristiano Ronaldo Kick'n'Run It's pretty cool Try it here,7.54,5.6,8.3,81.63,1,8.4,7th and 8th grade
Sat Jun 18 23:47:09 +0000 2016,Triste com o resultado mas sei que todos juntos vamos dar a volta por cima.,9.64,8.0,5.2,64.71,1,5.33,7th and 8th grade
Fri Jun 17 15:06:08 +0000 2016,Mentally preparing for tomorrow s match. Try Pro Genius in the App,7.88,5.6,3.1,65.39,2,5.27,5th and 6th grade
Wed Jun 15 17:10:57 +0000 2016,"Time to train, more games yet to come DontCrackUnderPressure",5.84,4.4,10.3,79.26,1,13.83,4th and 5th grade
Tue Jun 14 10:16:55 +0000 2016,"Hoje queremos levar para campo, n o s a vontade de vencer de 11 mas a de todos os . Contamos com o vosso apoio",8.84,5.6,1.4,76.22,2,2.13,5th and 6th grade
Mon Jun 13 14:39:08 +0000 2016,Soon,0.05,-3.5,-2.2,121.22,1,-22.21,-1th and 0th grade
Mon Jun 13 08:22:04 +0000 2016,The game starts tomorrow. Mental preparation starts now. Train your brain with Pro Genius ...,7.25,3.9,7.5,75.16,3,8.67,7th and 8th grade
Sat Jun 11 20:06:31 +0000 2016,Dinner time with my boys,0.25,0.5,-0.2,100.24,1,1.48,1st and 2nd grade
Sat Jun 11 15:09:54 +0000 2016,"Fuel up like me Try 2 scoops RebuildStrength, bananas, strawberries amp milk. Herbalife24",9.14,7.2,13.0,66.74,1,14.83,7th and 8th grade
Fri Jun 10 15:02:22 +0000 2016,I m celebrating the Euro Cup kick off with my new mobile game. Play the game here,6.84,3.1,0.8,88.23,2,2.46,3rd and 4th grade
Thu Jun 09 07:12:38 +0000 2016,One moment can change everything. SparkBrilliance.,6.57,8.0,16.9,48.47,1,20.75,7th and 8th grade
Wed Jun 08 21:19:22 +0000 2016,Great win tonight,0.15,-2.7,3.6,119.19,1,3.43,0th and 1st grade
Wed Jun 08 15:11:55 +0000 2016,See what happens when two worlds collide. SparkBrilliance Watch the film tomorrow,7.88,4.5,9.0,73.85,2,12.52,4th and 5th grade
Tue Jun 07 19:53:33 +0000 2016,Team,0.05,-3.5,-2.2,121.22,1,-22.21,-1th and 0th grade
Tue Jun 07 15:04:44 +0000 2016,"Seriously, what s going on SparkBrilliance See the whole story on June 9",6.71,7.2,6.8,66.74,1,8.16,6th and 7th grade
Mon Jun 06 22:27:24 +0000 2016,I m feeling a little different today SparkBrilliance Discover what s happened on June 9,7.54,10.3,9.0,47.79,1,10.37,10th and 11th grade
Sun Jun 05 15:05:32 +0000 2016,SparkBrilliance See the full story June 9 in the App,5.71,3.7,3.8,86.71,1,6.18,3rd and 4th grade
Sat Jun 04 15:03:58 +0000 2016,I drive my training with proper hydration. Evolve your sports drink CR7Drive,7.88,3.3,7.1,82.31,2,10.08,2nd and 3rd grade
Wed Jun 01 18:04:39 +0000 2016,I stay fresh with CLEARMEN. Show your best tricks with CLEARPOWERMOVE or upload at,7.37,3.7,5.3,81.29,2,8.24,5th and 6th grade
Sun May 29 20:14:33 +0000 2016,Great night,0.1,-3.1,3.1,120.21,1,-1.61,-1th and 0th grade
Sun May 29 07:06:44 +0000 2016,"At my house, speed gets its own room. sparkbrilliance Get the new Mercurial now",6.59,6.4,7.8,74.19,1,8.63,6th and 7th grade
Sun May 29 00:17:20 +0000 2016,Love you,0.1,-3.1,-4.0,120.21,1,-10.31,-1th and 0th grade
Thu May 26 15:39:11 +0000 2016,Boom,0.05,-3.5,-2.2,121.22,1,-22.21,-1th and 0th grade
Thu May 26 07:00:02 +0000 2016,Check out my Mercurial Speed Room premiering in the App sparkbrilli...,8.49,7.6,9.7,60.31,1,11.58,7th and 8th grade
Wed May 25 16:07:41 +0000 2016,One of my picks for the warm days ahead of us Tassel loafers are a must have. Check it now,1.29,1.3,0.3,103.63,2,1.54,1st and 2nd grade
Wed May 25 07:02:04 +0000 2016,See the world's fastest Mercurial collection. My new film premiers tomorrow. See it first,7.25,5.1,6.5,66.7,3,8.2,7th and 8th grade
Mon May 23 14:05:40 +0000 2016,The Summer of Sport Football Nouveau OR x Nikelab. With,7.29,4.8,5.2,78.25,1,7.34,3rd and 4th grade
Mon May 23 13:56:59 +0000 2016,The Summer of Sport Football Nouveau OR x Nikelab. With for dreamteam,6.57,2.1,4.3,90.77,2,6.72,1st and 2nd grade
Fri May 20 16:15:25 +0000 2016,Let me introduce the family The children would do anything to please their parents,6.59,7.6,8.8,65.73,1,10.72,7th and 8th grade
Thu May 19 14:55:02 +0000 2016,Training,19.48,8.4,16.8,36.62,1,1.0,-1th and 0th grade
Thu May 19 07:00:04 +0000 2016,Looking and feeling faster than ever. Get the new Mercurial first on May 28th,7.37,3.7,3.6,81.29,2,6.16,3rd and 4th grade
Wed May 18 07:06:10 +0000 2016,"My new Mercurial are fase as they look, trust me. Get them first, May 28th",5.06,1.5,1.2,97.7,2,2.39,1st and 2nd grade
Tue May 17 07:11:53 +0000 2016,Ready to play fast Thanks Get the new Mercurial first,5.71,3.7,4.3,86.71,1,6.76,3rd and 4th grade
Mon May 16 15:58:42 +0000 2016,In my new commercial I'm in the central square of Tel Aviv. Get ready neshamot it's gonna be HOT,6.6,2.3,2.7,95.67,2,3.85,2nd and 3rd grade
Thu May 12 15:52:50 +0000 2016,Always working hard Caught on set wearing,8.5,3.7,5.6,81.29,1,9.06,2nd and 3rd grade
Wed May 11 15:56:42 +0000 2016,Crushing the game on PokerStars.,10.2,5.2,7.4,66.4,1,9.6,9th and 10th grade
Thu May 05 19:17:31 +0000 2016,Another shooting day with the special visit of my friend Peter Lim.,8.18,6.8,6.6,67.76,1,8.4,6th and 7th grade
Wed Apr 27 16:02:42 +0000 2016,The time has come for you to meet us in cr7footwears16,5.62,1.7,2.9,102.61,1,4.74,4th and 5th grade
Fri Apr 22 13:41:02 +0000 2016,In 2013 and 2014 Madeira was Europe s Leading Island Destination Vote for Madeira hat trick,7.39,7.2,8.9,72.16,1,9.97,7th and 8th grade
Tue Apr 19 19:30:35 +0000 2016,Unveiling one of my next 4 hotel projects with Pestana Hotel Group pestanahotels,7.93,8.4,9.7,58.28,1,12.17,7th and 8th grade
Mon Apr 18 16:01:32 +0000 2016,So proud to have my very own collection at the stores. Don t miss it,5.06,0.3,-0.8,106.16,2,0.83,-1th and 0th grade
Thu Apr 14 16:31:04 +0000 2016,Funny moments practicing penalties with my son,10.75,7.2,9.0,55.91,1,13.17,8th and 9th grade
Tue Apr 12 23:14:53 +0000 2016,Great win today Thanks for all your support,6.01,2.9,3.8,88.74,1,6.45,2nd and 3rd grade
Mon Apr 11 13:32:48 +0000 2016,Today is a special day the launch of my mom's book throughout Spain,6.71,3.6,5.0,92.12,1,5.9,5th and 6th grade
Sun Apr 10 16:58:11 +0000 2016,Speed redefined sanahizmiyok,9.05,5.6,20.9,59.97,1,24.72,5th and 6th grade
Fri Apr 08 18:32:58 +0000 2016,Amazed with the sound of my new ROC Freedom headphones livelifeloud,5.62,2.9,8.5,94.15,1,11.58,4th and 5th grade
Mon Apr 04 16:33:03 +0000 2016,I'm delighted to become the official ambassador of . Join me XTrade,8.22,6.6,5.3,57.43,2,7.35,6th and 7th grade
Sat Apr 02 22:13:54 +0000 2016,"Grande jogo de toda a equipa. Vencemos juntos, celebramos juntos. HalaMadrid RMClasico",13.14,10.4,11.0,31.55,2,13.97,10th and 11th grade
Sat Apr 02 07:05:53 +0000 2016,Thanks getting me equipped for the match Your pair is available now on,5.5,3.6,6.1,92.12,1,7.7,5th and 6th grade
Fri Apr 01 07:02:02 +0000 2016,No days off Gear up with my new CR7 Natural Diamond training apparel now on,7.54,8.0,5.2,64.71,1,5.73,7th and 8th grade
Wed Mar 30 18:49:47 +0000 2016,"Do you remember Last month, surprised me.Well, it happened again, the experience was amazing CristianoAndSFR",9.64,10.3,15.6,47.79,1,16.93,10th and 11th grade
Tue Mar 29 23:20:34 +0000 2016,Back home with my boys,0.25,-1.9,-2.1,117.16,1,-0.85,-1th and 0th grade
Tue Mar 29 22:44:33 +0000 2016,Great win,0.1,-3.1,-1.7,120.21,1,-7.41,-1th and 0th grade
Sun Mar 27 21:02:07 +0000 2016,ronaldoyahizlazim,19.48,43.8,59.1,-217.19,1,53.2,43rd and 44th grade
Sat Mar 26 18:03:07 +0000 2016,The only person better than me at my own game is Cristiano Junior Download it for free here,6.28,6.8,6.9,78.59,1,6.26,6th and 7th grade
Sat Mar 26 13:44:35 +0000 2016,Working out to recover for the next challenge,9.95,5.2,4.9,71.82,1,7.9,4th and 5th grade
Fri Mar 25 08:00:17 +0000 2016,Delighted to wear these Get exclusive product in the Nike Football App,8.18,6.8,7.7,67.76,1,10.37,6th and 7th grade
Thu Mar 24 22:38:36 +0000 2016,Ready for tomorrow,0.15,5.6,5.2,59.97,1,5.35,5th and 6th grade
Thu Mar 24 22:22:14 +0000 2016,Great to be with my Portuguese NT team mates,5.84,0.9,1.9,104.64,1,4.14,3rd and 4th grade
Wed Mar 23 18:03:49 +0000 2016,Talking about fashion,9.05,5.6,9.9,59.97,1,11.15,9th and 10th grade
Wed Mar 23 14:32:13 +0000 2016,Think I'm bluffing,9.05,0.9,5.2,93.81,1,3.43,0th and 1st grade
Sun Mar 20 08:16:47 +0000 2016,Get my Mercurial Natural Diamond boots in the Nike Football App today,6.86,10.3,7.3,42.38,1,9.85,9th and 10th grade
Sat Mar 19 15:19:43 +0000 2016,Happy Father's Day to all daddy's in the world,7.59,3.3,2.9,87.72,1,4.14,3rd and 4th grade
Sat Mar 19 10:49:07 +0000 2016,Work hard to achieve success The boots will be available tomorrow in the Nike Ftbl App,7.39,6.0,7.5,80.62,1,8.18,7th and 8th grade
Fri Mar 18 15:00:24 +0000 2016,Can t wait to lace up my new boots Thanks . Get your boots March 20th,0.37,0.3,-0.8,106.16,2,0.83,-1th and 0th grade
Thu Mar 17 20:52:25 +0000 2016,Engineered Speed.Novo Equipamento Principal de Portugal 2016. SparkBrilliance,15.88,17.0,23.8,-12.79,1,29.65,16th and 17th grade
Wed Mar 16 19:06:54 +0000 2016,Wow Thanks for letting me be the first athlete trying the new HyperAdapt 1.0 nike2016 nikeinnovation,8.38,8.4,11.6,63.7,1,12.87,8th and 9th grade
Tue Mar 15 19:04:52 +0000 2016,Live Life Loud,0.15,-2.7,-1.2,119.19,1,-2.38,0th and 1st grade
Mon Mar 14 15:25:54 +0000 2016,Arriving to my home island Madeira on a cruise ship is unique madeiraislands exploremadeira madeiraisgold,8.59,8.0,14.7,64.71,1,17.33,8th and 9th grade
Sun Mar 13 14:17:29 +0000 2016,SaveSyriasChildren like 5 yr old Ayman who loves playing football like Cristiano Junior.,9.14,8.4,12.6,58.28,1,15.3,8th and 9th grade
