created_at,text,dale_chall_readability_score,flesch_kincaid,automated_readability,flesch_reading,sentence_count,coleman_liau_index,based_on_all_algorithms
Thu Jun 11 20:04:21 +0000 2020,"...We need Karen in Washington badly She loves Georgia and the USA. Has my Complete and Total Endorsement November 3rd, a big day for us all GA06",7.23,6.2,6.1,74.69,2,6.6,6th and 7th grade
Thu Jun 11 20:04:21 +0000 2020,"Congratulations to on running a great race and terrific primary victory 75 , despite tough competition. Previously beat Jon Ossoff who, after his 2017 Congressional failure, is now running against a GREAT Senator, David",9.24,12.1,13.4,37.81,2,14.21,12th and 13th grade
Thu Jun 11 19:53:17 +0000 2020,"Senator of IOWA has a new book, Daughter of the Heartland My Ode to the Country That Raised Me. The first female combat veteran elected to serve in the U.S. Senate Joni is as tough as they come and a true inspiration for women everywhere. Get her book today",6.82,5.7,4.8,75.91,4,5.96,5th and 6th grade
Thu Jun 11 19:44:24 +0000 2020,"...Unlike her Radical Liberal opponent, Theresa Greenfield, and Theresa s failed record in real estate, Joni stands for Iowa. Vote for Joni Ernst on November 3rd, a big day for us all IASEN",7.8,7.4,9.2,71.65,2,8.64,7th and 8th grade
Thu Jun 11 19:44:23 +0000 2020,"Few people have ever fought as strongly for Iowa as Senator A combat Veteran, her service to Iowa and our Country is remarkable Joni is Strong on Crime, our Military, Vets, Low Taxes and will protect your 2A at all times...",8.37,16.9,20.1,46.78,1,8.49,16th and 17th grade
Thu Jun 11 19:42:17 +0000 2020,...Second Amendment. Matt has my Complete and Total Endorsement We need him in Washington now NH01,9.36,8.4,11.0,63.7,1,11.08,8th and 9th grade
Thu Jun 11 19:42:16 +0000 2020,"Matt is a champion for the Great State of New Hampshire He was a winner in my Administration and he will always put America First. Strong on our Military, Vets, Low Taxes and the...",6.34,7.6,7.6,71.14,2,6.67,7th and 8th grade
Thu Jun 11 19:33:52 +0000 2020,"...of Schumer and Pelosi. David is Strong on Crime, our Military, Vets, Low Taxes and will protect your 2A at all times. He is a GREAT Senator and has my Complete and Total Endorsement. Vote for David Perdue on November 3rd, a big day for us all GASEN",6.53,4.4,4.6,84.68,4,5.26,4th and 5th grade
Thu Jun 11 19:33:51 +0000 2020,"We need our Great David Perdue in the Senate to Drain the Swamp amp Make America Great Again His Radical Liberal opponent, Jon Ossoff who we beat in 2017 , supports LAWLESS Sanctuary Cities, wants to raise your taxes, amp weaken our Great Military. He is a puppet...",8.83,10.1,12.3,64.54,2,9.06,8th and 9th grade
Thu Jun 11 19:30:35 +0000 2020,"Chris is a Great Winner and Fighter for New York. He will never let you down Strong on Crime, Military, our Vets, Reducing Taxes, Regulations, and importantly, our 2A. Vote on June 23rd. Chris has my Complete and Total Endorsement NY27",7.61,4.9,6.1,77.94,4,7.57,7th and 8th grade
Thu Jun 11 19:29:29 +0000 2020,"...Strong on Crime, our Military, Vets and Low Taxes. Nancy has my Complete and Total Endorsement November 3rd, a big day for us all SC01",8.05,5.8,6.1,75.71,2,6.42,6th and 7th grade
Thu Jun 11 19:29:28 +0000 2020,"Despite very tough competition, had a tremendous victory on Tuesday in South Carolina s 1st Congressional District. The first woman to graduate from the Citadel, she is a Great Warrior who we need in Washington now...",8.48,10.3,11.4,53.21,2,10.79,10th and 11th grade
Thu Jun 11 18:21:38 +0000 2020,"Seriously failed presidential candidate, Senator Elizabeth Pocahontas Warren, just introduced an Amendment on the renaming of many of our legendary Military Bases from which we trained to WIN two World Wars. Hopefully our great Republican Senators won t fall for this",10.43,13.6,14.9,33.75,2,14.39,13th and 14th grade
Thu Jun 11 18:08:29 +0000 2020,"Radical Left Governor and the Mayor of Seattle are being taunted and played at a level that our great Country has never seen before. Take back your city NOW. If you don t do it, I will. This is not a game. These ugly Anarchists must be stopped IMMEDIATELY. MOVE FAST",6.0,4.9,3.6,78.04,5,5.14,4th and 5th grade
Thu Jun 11 17:24:33 +0000 2020,Anarchists just took over Seattle and the Liberal Democrat Governor just said he knows nothing about that .,9.12,9.9,12.0,54.22,1,12.82,9th and 10th grade
Thu Jun 11 17:23:04 +0000 2020,"June 14th just happens to be my birthday, thank you Love our Boaters, Love our Country MAGA",6.34,5.2,7.8,88.06,1,7.31,7th and 8th grade
Thu Jun 11 15:07:35 +0000 2020,"The Federal Reserve is wrong so often. I see the numbers also, and do MUCH better than they do. We will have a very good Third Quarter, a great Fourth Quarter, and one of our best ever years in 2021. We will also soon have a Vaccine amp Therapeutics Cure. That s my opinion. WATCH",5.9,4.0,3.4,85.69,5,4.5,5th and 6th grade
Thu Jun 11 14:09:59 +0000 2020,THOSE THAT DENY THEIR HISTORY ARE DOOMED TO REPEAT IT,5.71,4.8,4.3,78.25,1,6.76,4th and 5th grade
Thu Jun 11 14:02:01 +0000 2020,Sleepy Joe Biden refuses to leave his basement sanctuary and tell his Radical Left BOSSES that they are heading in the wrong direction. Tell them to get out of Seattle now. Liberal Governor is looking the fool . LAW amp ORDER,7.69,6.0,5.4,69.79,4,7.63,5th and 6th grade
Thu Jun 11 12:49:46 +0000 2020,"Our great National Guard Troops who took care of the area around the White House could hardly believe how easy it was. A walk in the park , one said. The protesters, agitators, anarchists ANTIFA , and others, were handled VERY easily by the Guard, D.C. Police, amp S.S. GREAT JOB",6.82,5.7,6.7,75.91,4,7.41,6th and 7th grade
Thu Jun 11 03:38:11 +0000 2020,"Domestic Terrorists have taken over Seattle, run by Radical Left Democrats, of course. LAW amp ORDER",7.98,6.4,7.6,63.36,2,10.11,7th and 8th grade
Thu Jun 11 03:27:22 +0000 2020,Very troubled by Durham probe findings. A.G. Bill Barr,7.59,2.1,7.1,96.18,1,8.67,3rd and 4th grade
Thu Jun 11 02:36:23 +0000 2020,...And the Trump family didn t ask the Federal government for money to carry this and many other very expensive to carry properties,6.84,12.3,12.4,48.13,1,9.75,11th and 12th grade
Thu Jun 11 02:21:28 +0000 2020,LAW amp ORDER,0.15,0.9,-2.7,93.81,1,-4.29,0th and 1st grade
Wed Jun 10 22:17:51 +0000 2020,"So honored by Archbishop Vigan s incredible letter to me. I hope everyone, religious or not, reads it",8.47,8.0,5.1,53.88,2,7.04,7th and 8th grade
Wed Jun 10 21:37:33 +0000 2020,"Congratulations to Dr. Rich McCormick on a BIG WIN in Georgia last night We need you in Washington, D.C. badly. You have my Complete and Total Endorsement MAGA GA07",8.47,5.9,5.5,70.09,3,7.46,5th and 6th grade
Wed Jun 10 21:23:30 +0000 2020,"Congratulations on last nights BIG WIN, Keep up the great work so we can MAGA We need you in Washington fast. You have my Complete and Total Endorsement SC01",7.62,6.6,6.8,73.68,2,7.53,7th and 8th grade
Wed Jun 10 21:22:00 +0000 2020,I am sending 219.9M to the San Diego area in CARES Act funding for These funds from will be CRITICAL for economic recovery. We have to keep people moving safely and efficiently,7.88,7.2,7.9,72.16,2,8.35,7th and 8th grade
Wed Jun 10 21:21:12 +0000 2020,"Big headed to the Pittsburgh area I m sending 141.7M in CARES Act funding to from to aid in the recovery. This will be critical to helping people get where they need to go and more importantly, keeping them SAFE",8.18,8.7,8.8,68.1,2,7.2,8th and 9th grade
Wed Jun 10 18:40:38 +0000 2020,...Our history as the Greatest Nation in the World will not be tampered with. Respect our Military,8.7,5.4,5.5,71.31,2,7.27,5th and 6th grade
Wed Jun 10 18:40:38 +0000 2020,"...history of Winning, Victory, and Freedom. The United States of America trained and deployed our HEROES on these Hallowed Grounds, and won two World Wars. Therefore, my Administration will not even consider the renaming of these Magnificent and Fabled Military Installations...",8.94,9.8,12.9,49.11,3,14.26,12th and 13th grade
Wed Jun 10 18:40:37 +0000 2020,"It has been suggested that we should rename as many as 10 of our Legendary Military Bases, such as Fort Bragg in North Carolina, Fort Hood in Texas, Fort Benning in Georgia, etc. These Monumental and very Powerful Bases have become part of a Great American Heritage, and a...",7.75,10.5,12.6,63.53,2,8.83,7th and 8th grade
Wed Jun 10 14:56:15 +0000 2020,Incredible just took Congressional Hearing off the air just prior to important witness statements. More like CNN Fox is lost,8.08,7.2,8.3,61.33,2,11.4,7th and 8th grade
Wed Jun 10 14:33:19 +0000 2020,"Great statement to Congress by concerning Defunding not our great Police. This Radical Left agenda is not going to happen. Sleepy Joe Biden will be already is pulled all the way Left. Many, like Minneapolis, want to close their Police Departments. Crazy",7.16,6.2,7.6,69.28,4,9.66,7th and 8th grade
Wed Jun 10 13:32:44 +0000 2020,"For the first time in history, Police Organizations amp National Security Organizations were used to SPY on a Campaign, amp there was no basis for it. The media largely drove that, amp claims were made that could have affected the election of the President. A.G. Bill Barr",8.16,11.3,13.0,56.08,2,10.04,10th and 11th grade
Wed Jun 10 12:51:05 +0000 2020,New York State is killing small businesses. Let them properly open,6.78,3.1,5.3,82.81,2,7.87,2nd and 3rd grade
Wed Jun 10 12:49:28 +0000 2020,"NASDAQ HITS ALL TIME HIGH. Tremendous progress being made, way ahead of schedule. USA",7.37,2.5,6.3,89.75,2,8.65,2nd and 3rd grade
Wed Jun 10 02:02:15 +0000 2020,Republican AGs come out in force against defunding police,7.59,8.0,8.7,53.88,1,12.5,7th and 8th grade
Wed Jun 10 00:45:02 +0000 2020,"Thank you George, great honor",0.25,0.5,4.6,100.24,1,6.12,1st and 2nd grade
Tue Jun 09 18:34:51 +0000 2020,"Great work in the Republican Senate on some big nominees. Still 154 to go, hope they don t adjourn until the job is done",6.86,4.4,3.6,84.68,2,4.8,3rd and 4th grade
Tue Jun 09 17:44:29 +0000 2020,Relief is on the way to Utah I m proud to send 187.18M in CARES Act funding to This money will keep people moving and support a swift and smooth economic recovery for the GREAT people of Utah,7.6,14.6,16.6,58.29,1,6.69,16th and 17th grade
Tue Jun 09 17:43:35 +0000 2020,"I am allocating 2.96 BILLION in Emergency Solutions Grants to support homeless Americans and those at risk of becoming homeless because of job or wage loss, or illness due to COVID 19. We are taking care of our Nation s most vulnerable citizens. Thanks",8.68,10.7,11.9,57.61,2,9.75,9th and 10th grade
Tue Jun 09 17:42:54 +0000 2020,"My decision to appoint General Charles Brown as the USA s first ever African American military service chief has now been approved by the Senate. A historic day for America Excited to work even more closely with Gen. Brown, who is a Patriot and Great Leader",7.14,8.1,7.9,64.41,3,8.46,8th and 9th grade
Tue Jun 09 14:23:32 +0000 2020,Defunding Police would be good for Robbers amp Rapists.,7.59,4.4,7.7,79.26,1,10.58,7th and 8th grade
Tue Jun 09 14:19:10 +0000 2020,"BIG DEMAND Starting up again soon, maybe next week",7.59,2.1,5.1,96.18,1,7.39,3rd and 4th grade
Tue Jun 09 14:04:11 +0000 2020,"Should have let police do their job and brought in National Guard on Day One, not Day Four",5.41,5.6,6.7,87.05,1,5.62,5th and 6th grade
Tue Jun 09 13:51:56 +0000 2020,"Minnesota needs DJT amp NOW. When I insisted on the National Guard, things got better FAST. Enough with Omar, you ll have nothing left",6.01,2.9,4.4,88.74,3,6.22,5th and 6th grade
Tue Jun 09 13:43:12 +0000 2020,MAKE AMERICA GREAT AGAIN,0.2,3.7,5.3,75.88,1,7.25,1st and 2nd grade
Tue Jun 09 13:41:46 +0000 2020,THE REAWAKENING OF AMERICA,7.78,9.6,7.7,33.58,1,10.15,7th and 8th grade
Tue Jun 09 13:39:24 +0000 2020,. TRANSITION TO GREATNESS,14.31,12.7,14.6,9.21,1,15.03,14th and 15th grade
Tue Jun 09 13:24:57 +0000 2020,"Mattis was our Country s most overrated General. He talked a lot, but never brought home the bacon. He was terrible Someday I will tell the real story on him and others both good and bad",5.99,5.6,4.3,76.22,3,5.67,5th and 6th grade
Tue Jun 09 12:42:57 +0000 2020,"Poll Trump Better Than Biden On Economic Growth, 55 to 34 . That s all Who are the 34",4.96,2.1,0.6,96.18,2,1.88,4th and 5th grade
Tue Jun 09 12:34:39 +0000 2020,"Buffalo protester shoved by Police could be an ANTIFA provocateur. 75 year old Martin Gugino was pushed away after appearing to scan police communications in order to black out the equipment. I watched, he fell harder than was pushed. Was aiming scanner. Could be a set up",7.92,6.7,7.1,67.96,4,8.8,8th and 9th grade
Tue Jun 09 12:30:01 +0000 2020,NASDAQ HITS ALL TIME HIGH,7.04,0.5,0.9,100.24,1,2.64,0th and 1st grade
Tue Jun 09 12:25:57 +0000 2020,"Vote today for Big Jim, a great Governor. Love West Virginia",6.78,3.1,2.8,82.81,2,4.16,2nd and 3rd grade
Tue Jun 09 12:22:04 +0000 2020,A GREAT Senator. Must return to Washington. Steve has my Complete amp Total Endorsement,9.51,5.1,5.8,66.7,3,7.8,5th and 6th grade
Tue Jun 09 12:01:49 +0000 2020,Democrats amp Activists call to Defund Police Departments. They ve gone so far Left that they eat their young.,6.6,3.5,6.1,87.21,2,8.44,5th and 6th grade
Mon Jun 08 19:14:47 +0000 2020,"...Crooked Hillary Clinton in 2016. They are called SUPPRESSION POLLS, and are put out to dampen enthusiasm. Despite 3 years of phony Witch Hunts, we are winning, and will close it out on November 3rd",7.37,4.3,6.7,84.98,3,7.69,6th and 7th grade
Mon Jun 08 19:14:45 +0000 2020,"I have retained highly respected pollster, McLaughlin amp Associates, to analyze todays CNN Poll and others , which I felt were FAKE based on the incredible enthusiasm we are receiving. Read analysis for yourself. This is the same thing they and others did when we defeated...",9.29,9.1,10.2,56.25,3,10.9,9th and 10th grade
Mon Jun 08 15:44:09 +0000 2020,"This year has seen the lowest crime numbers in our Country s recorded history, and now the Radical Left Democrats want to Defund and Abandon our Police. Sorry, I want LAW amp ORDER",7.33,7.4,7.9,71.65,2,7.89,7th and 8th grade
Mon Jun 08 15:31:59 +0000 2020,"Big day for Stock Market. Smart money, and the World, know that we are heading in the right direction. Jobs coming back FAST. Next year will be our greatest ever",5.06,2.7,3.0,89.24,4,4.89,2nd and 3rd grade
Mon Jun 08 13:02:06 +0000 2020,96 Approval Rating in the Republican Party. Thank you,9.35,8.0,6.6,53.88,1,9.31,7th and 8th grade
Mon Jun 08 12:57:43 +0000 2020,"The Lamestream Media refuses to talk about our Country s record setting Jobs Numbers, which are indicating GREATNESS, and soon",8.58,9.9,13.8,59.64,1,13.17,11th and 12th grade
Mon Jun 08 12:48:35 +0000 2020,"CNN Polls are as Fake as their Reporting. Same numbers, and worse, against Crooked Hillary. The Dems would destroy America",5.55,2.4,6.2,90.05,3,8.47,2nd and 3rd grade
Mon Jun 08 12:33:30 +0000 2020,"LAW amp ORDER, NOT DEFUND AND ABOLISH THE POLICE. The Radical Left Democrats have gone Crazy",6.99,4.1,5.2,80.28,2,7.55,5th and 6th grade
Mon Jun 08 12:30:23 +0000 2020,"Tremendous sincerity, what a guy. Hard to believe, with this kind of political talent, his numbers would tank so badly in Utah",7.77,6.4,6.5,68.77,2,8.16,7th and 8th grade
Mon Jun 08 04:01:03 +0000 2020,"Actually, a great book by a great and highly respected historian, Doug Wead",9.14,9.5,7.9,49.82,1,9.03,9th and 10th grade
Mon Jun 08 03:54:43 +0000 2020,"Could it be even remotely possible that in Roger Goodell s rather interesting statement of peace and reconciliation, he was intimating that it would now be O.K. for the players to KNEEL, or not to stand, for the National Anthem, thereby disrespecting our Country amp our Flag",9.33,21.6,25.0,23.77,1,11.1,21st and 22nd grade
Mon Jun 08 03:42:18 +0000 2020,"Colin Powell was a pathetic interview today on Fake News CNN. In his time, he was weak amp gave away everything to everybody so bad for the USA. Also got the weapons of mass destruction totally wrong, and you know what that mistake cost us Sad Only negative questions asked.",6.99,7.4,8.1,71.44,3,7.94,6th and 7th grade
Sun Jun 07 22:41:54 +0000 2020,"If I wasn t constantly harassed for three years by fake and illegal investigations, Russia, Russia, Russia, and the Impeachment Hoax, I d be up by 25 points on Sleepy Joe and the Do Nothing Democrats. Very unfair, but it is what it is",6.88,9.5,10.0,66.07,2,6.96,9th and 10th grade
Sun Jun 07 22:35:06 +0000 2020,". is a SUPERSTAR running against a Lamb, to be exact, a weak puppet of crazy Nancy Pelosi",7.27,7.6,7.0,71.14,1,5.97,6th and 7th grade
Sun Jun 07 22:08:55 +0000 2020,"I built the greatest economy in the World, the best the U.S. has ever had. I am doing it again",6.5,3.7,1.2,86.71,2,1.83,5th and 6th grade
Sun Jun 07 20:50:45 +0000 2020,"Opinion Editor at just walked out. That s right, he quit over the excellent Op Ed penned by our great Senator TRANSPARENCY The State of Arkansas is very proud of Tom. The New York Times is Fake News",6.76,4.7,4.9,83.96,3,5.96,4th and 5th grade
Sun Jun 07 20:40:05 +0000 2020,"If Biden had any passion or respect for law enforcement, he kept it well hidden in his Philadelphia address. He criticized cops far more than he did arsonists amp looters. Michael Goodwin,",8.38,8.4,9.7,63.7,2,10.15,8th and 9th grade
Sun Jun 07 19:15:02 +0000 2020,...I know Ronny well. He will NEVER let you down. Solid as a rock. Ronny has my Complete and Total Endorsement TX13 MAGA,8.04,3.2,1.5,82.51,4,2.37,1st and 2nd grade
Sun Jun 07 19:15:02 +0000 2020,". is a spectacular man. An Admiral in the Navy, he is a brave and loyal Warrior who loves our Military and Vets. As a medical doctor, Ronny is great on HealthCare and he is Strong on Cutting Taxes, the Border and the Second Amendment...",8.31,7.8,6.4,65.01,3,6.26,7th and 8th grade
Sun Jun 07 19:13:36 +0000 2020,Congressman Jeff Van Drew is a Courageous Leader who defended me against Pelosi s Impeachment Scam and is a conservative who shares our Republican values. Jeff is a fighter for South Jersey and will always put America First. Vote for Jeff,7.78,7.5,8.2,66.03,3,9.85,7th and 8th grade
Sun Jun 07 19:12:51 +0000 2020,"Congressman Mark Amodei is working hard for the incredible people of Nevada He is Strong on Immigration, Taxes, Job Creation and he Loves our Military and Vets. Mark has my Complete and Total Endorsement NV02 MAGA",10.23,10.3,10.8,53.21,2,10.61,10th and 11th grade
Sun Jun 07 19:12:26 +0000 2020,"Governor Doug Burgum is doing a phenomenal job leading North Dakota He is a true Conservative, and First Lady Kathryn Burgum s leadership against the disease of addiction inspires us all. Doug has my Complete and Total Endorsement NDGOV",10.68,10.9,12.2,51.68,2,11.89,10th and 11th grade
Sun Jun 07 19:11:46 +0000 2020,"Congresswoman Carol Miller is a tremendous advocate for the people of West Virginia She fights for our Coal Miners, the Second Amendment and for Lower Taxes. Carol has my Complete and Total Endorsement WV03",10.05,9.9,11.0,54.22,2,11.6,9th and 10th grade
Sun Jun 07 19:11:23 +0000 2020,"Congressman Alex Mooney is a champion for West Virginia He is strong on Life and the Second Amendment, and he works hard for our incredible Veterans and Coal Miners. Alex has my Complete and Total Endorsement WV02",8.39,9.3,10.3,61.16,2,10.15,11th and 12th grade
Sun Jun 07 19:10:53 +0000 2020,"Unlike Senator Manchin, Big Jim Justice was very loyal to your favorite President during Pelosi s Impeachment Scam. Big Jim is doing a tremendous job for West Virginia. Vote for Big Jim MAGA",8.97,6.4,6.6,68.77,3,8.8,8th and 9th grade
Sun Jun 07 18:58:10 +0000 2020,"We need back in Congress to fight for the incredible people of Georgia She is a tremendous advocate for our Military, Vets, Border Security and the Second Amendment. Karen has my Complete and Total Endorsement GA06",9.79,10.3,11.0,53.21,2,10.79,10th and 11th grade
Sun Jun 07 18:56:42 +0000 2020,"Congressman Austin Scott is doing a phenomenal job for the GREAT State of Georgia. He works hard for our incredible Farmers, Military, Vets and the Second Amendment. Austin has my Complete and Total Endorsement GA08",9.18,6.7,8.8,68.06,3,10.88,10th and 11th grade
Sun Jun 07 18:56:18 +0000 2020,Congressman Buddy Carter keeps fighting for the incredible people of Georgia. Buddy has my Complete and Total Endorsement Vote for Buddy GA01,9.92,8.8,9.7,51.85,2,12.91,9th and 10th grade
Sun Jun 07 18:53:03 +0000 2020,"Congressman Joe Wilson is a champion for the people of South Carolina He served our Country as a Colonel in the Army, and now he serves our Military amp Vets in Congress. Strong on the 2A and Border Security Joe has my Complete amp Total Endorsement SC02",8.16,10.1,11.2,64.54,2,8.42,7th and 8th grade
Sun Jun 07 18:49:26 +0000 2020,"Senator is a good friend and strong voice for the people of South Carolina. He s helped us confirm GREAT Judges, rebuild the Military, and keep our Country SAFE. Strong on Life and our Vets. Lindsey has my Complete and Total Endorsement",7.16,5.0,5.7,77.74,4,7.46,4th and 5th grade
Sun Jun 07 15:20:15 +0000 2020,"At the request of amp of the Great State of Louisiana, I will be approving amp signing today an EMERGENCY DECLARATION which will help with all aspects of the big storm that is currently hitting your shores. FEMA is already there. God Bless You",7.95,6.7,7.3,73.47,3,8.11,7th and 8th grade
Sun Jun 07 15:10:22 +0000 2020,"Somebody please tell highly overrated Colin Powell that I will have gotten almost 300 Federal Judges approved a record , Two Great Supreme Court Justices, rebuilt our once depleted Military, Choice for Vets, Biggest Ever Tax amp Regulation Cuts, Saved Healthcare amp 2A, amp much more",10.78,19.7,26.1,34.26,1,13.65,19th and 20th grade
Sun Jun 07 14:31:26 +0000 2020,"Fantastic job on by new Republican Superstar running for Congress with my complete amp total Endorsement against a Crazy Nancy Pelosi Puppet who has done nothing , amp a slightly older Republican Superstar, Thank you to both",10.25,18.5,21.2,26.48,1,13.3,18th and 19th grade
Sun Jun 07 14:19:03 +0000 2020,"Colin Powell, a real stiff who was very responsible for getting us into the disastrous Middle East Wars, just announced he will be voting for another stiff, Sleepy Joe Biden. Didn t Powell say that Iraq had weapons of mass destruction They didn t, but off we went to WAR",7.09,10.7,11.9,63.02,2,8.07,7th and 8th grade
Sun Jun 07 14:01:40 +0000 2020,"Not only will Sleepy Joe Biden DEFUND THE POLICE, but he will DEFUND OUR MILITARY He has no choice, the Dems are controlled by the Radical Left.",7.31,10.3,12.7,69.45,1,7.72,7th and 8th grade
Sun Jun 07 13:53:03 +0000 2020,"I have just given an order for our National Guard to start the process of withdrawing from Washington, D.C., now that everything is under perfect control. They will be going home, but can quickly return, if needed. Far fewer protesters showed up last night than anticipated",7.48,8.1,9.6,64.41,3,9.85,9th and 10th grade
Sun Jun 07 13:09:25 +0000 2020,Sleepy Joe Biden and the Radical Left Democrats want to DEFUND THE POLICE . I want great and well paid LAW ENFORCEMENT. I want LAW amp ORDER,5.89,3.1,3.5,88.02,3,5.65,5th and 6th grade
Sun Jun 07 02:12:10 +0000 2020,. amp MSDNC are doing everything possible to inflame the crowd. Fortunately they have a very small audience,8.7,9.0,7.7,45.93,2,10.69,8th and 9th grade
Sun Jun 07 02:09:10 +0000 2020,"Much smaller crowd in D.C. than anticipated. National Guard, Secret Service, and D.C. Police have been doing a fantastic job. Thank you",7.59,6.1,6.6,64.07,3,8.01,7th and 8th grade
Sat Jun 06 22:48:22 +0000 2020,LAW amp ORDER,0.15,0.9,-2.7,93.81,1,-4.29,0th and 1st grade
Sat Jun 06 22:31:20 +0000 2020,Wow 96 Approval Rating in the Republican Party and I believe this was before the GREAT Jobs Numbers yesterday . Thank you,7.69,11.5,11.5,50.16,1,10.04,11th and 12th grade
Sat Jun 06 11:53:36 +0000 2020,Riot gear or military control is not necessary because ANTIFA amp other Wacko groups of Anarchists aren t present to cause trouble. Incredible people. Thank you Maine,8.4,8.6,9.8,57.77,2,11.77,8th and 9th grade
Sat Jun 06 03:19:25 +0000 2020,Great new book by called Nothing to Lose . The Pastor is a winner and a great guy. Much can be learned from him. Buy the book. Make him a Big Deal Author,0.81,1.1,-0.5,98.82,5,0.69,0th and 1st grade
Sat Jun 06 02:57:49 +0000 2020,This is a flat out lie. They the media are making things up The Lamestream Media is out of control. It would be impossible to fully explain how dishonest they are,5.68,4.9,3.8,77.94,3,5.54,4th and 5th grade
Sat Jun 06 02:00:45 +0000 2020,Crazy,0.05,-3.5,2.6,121.22,1,-16.41,-1th and 0th grade
Sat Jun 06 01:36:28 +0000 2020,Biden wants to Defund the Police,6.57,2.1,2.8,90.77,1,5.27,1st and 2nd grade
Sat Jun 06 01:29:46 +0000 2020,We will always defend. Great job Jay,0.17,1.1,0.5,93.3,2,-0.38,0th and 1st grade
Sat Jun 06 01:26:57 +0000 2020,You must be kidding This is a total disgrace,9.35,3.3,1.9,87.72,1,4.14,3rd and 4th grade
Sat Jun 06 01:01:42 +0000 2020,THANK YOU MAINE MAGA,7.78,1.3,0.6,92.8,1,1.45,0th and 1st grade
Sat Jun 06 01:01:07 +0000 2020,Twitter Pulls Trump Campaign Video of President Showing Empathy For Peaceful Protesters They are fighting hard for the Radical Left Democrats. A one sided battle. Illegal. Section 230,10.53,8.8,11.8,57.27,2,13.8,8th and 9th grade
Sat Jun 06 00:56:36 +0000 2020,"Democrat John Hickenlooper Held in Contempt After Failing to Comply with Subpoena over Ethics Complaint Got caught big time with his hand in the cookie jar. Should be the end of his Colorado Senate bid. Makes no difference, we already have a GREAT Senator",7.95,6.7,8.6,73.47,3,9.68,9th and 10th grade
Sat Jun 06 00:51:51 +0000 2020,What a fantastic group,7.78,3.7,2.9,75.88,1,4.35,3rd and 4th grade
Sat Jun 06 00:50:12 +0000 2020,Great,0.05,-3.5,2.6,121.22,1,-16.41,-1th and 0th grade
