created_at,text,dale_chall_readability_score,flesch_kincaid,automated_readability,flesch_reading,sentence_count,coleman_liau_index,based_on_all_algorithms
Sun Mar 06 14:33:10 +0000 2016,Tick Tik Tik Tik tick BOOM,0.3,-1.5,-2.0,116.15,1,-0.54,-1th and 0th grade
Sun Mar 06 14:29:15 +0000 2016,"OK this made my day, watch these two love birds break it down to bad romance",5.42,3.6,4.5,97.54,1,4.17,4th and 5th grade
Sat Mar 05 12:08:36 +0000 2016,"Inspiring words First they ignore you, then they laugh at you, then they fight you, then you win. Mahatma Gandhi",7.79,7.6,10.5,76.56,1,8.53,7th and 8th grade
Fri Mar 04 22:35:39 +0000 2016,it's really awesome that people are listening and caring. It's healing a lot. It's really cool.,7.85,5.4,4.8,66.1,3,5.43,4th and 5th grade
Thu Mar 03 23:43:24 +0000 2016,The big problem It's tough to get courts to believe rape victims,6.86,4.4,5.4,84.68,1,6.95,4th and 5th grade
Thu Mar 03 23:15:46 +0000 2016,FreeEveryWoman FreeKesha,19.53,20.6,33.7,-49.0,1,36.1,20th and 21st grade
Thu Mar 03 21:56:18 +0000 2016,thank you,0.1,-3.1,-1.7,120.21,1,-7.41,-1th and 0th grade
Thu Mar 03 20:30:57 +0000 2016,"it might make u feel better to tell them who you really are, so you feel authentic and not like you are hiding. That's painful.",6.14,8.3,10.5,79.94,1,5.98,5th and 6th grade
Thu Mar 03 20:25:34 +0000 2016,. that is so powerful thank u I believe this song can help so many people with its message that you are not alone in pain.,1.24,8.3,9.3,79.94,1,5.06,9th and 10th grade
Thu Mar 03 19:29:58 +0000 2016,relaxation and calming down my nervous system with baths and healing thoughts and reading are really important for me.,8.73,10.7,12.8,52.19,1,12.94,12th and 13th grade
Thu Mar 03 19:20:33 +0000 2016,music,0.05,8.4,2.6,36.62,1,-16.41,-1th and 0th grade
Thu Mar 03 19:16:08 +0000 2016,not at all people with trauma all can relate to mental illness. We are all connected through our pain.,8.26,4.6,4.1,78.75,2,6.0,4th and 5th grade
Thu Mar 03 19:02:43 +0000 2016,I am sorry. So brave to come forward. You are so not alone that has happened to so many people. Don't feel ashamed.,0.97,0.8,0.5,99.43,4,1.38,0th and 1st grade
Thu Mar 03 18:56:50 +0000 2016,"Thank you. for standing up for women. notyourfault the more that stand, the more will hear the message.",6.28,6.8,10.1,78.59,1,8.87,8th and 9th grade
Thu Mar 03 16:54:31 +0000 2016,how amazing That an old hat I have from Chanel's hat makers Now on snap,6.49,3.2,4.0,98.55,1,3.76,3rd and 4th grade
Thu Mar 03 16:42:48 +0000 2016,you are so brave and now you don't have to hide and neither do I. It's a new day for u and me. No shame. Paws up.,0.67,1.5,0.5,108.53,2,-0.48,0th and 1st grade
Thu Mar 03 04:49:17 +0000 2016,The world changes one mind at a time,0.4,-0.8,-0.4,114.12,1,1.41,-1th and 0th grade
Wed Mar 02 23:39:33 +0000 2016,it was whiskey,0.15,-2.7,-1.2,119.19,1,-2.38,0th and 1st grade
Wed Mar 02 20:20:06 +0000 2016,Thank you.,0.1,-3.1,0.8,120.21,1,-7.41,-1th and 0th grade
Wed Mar 02 03:13:08 +0000 2016,Watch them as they rise up. SURVIVORS all around you. You won't believe it TilItHappensToYou,5.99,1.7,5.6,91.78,3,7.28,5th and 6th grade
Wed Mar 02 02:01:31 +0000 2016,My grandmother in the middle and my Aunt Sheri on the right both called me the day after the,0.94,6.0,6.4,86.03,1,5.28,5th and 6th grade
Wed Mar 02 00:51:52 +0000 2016,. thank you for writing articles that support amp inform the young girls that are your readers. These issues are important.,8.08,6.0,7.8,69.79,2,10.24,5th and 6th grade
Tue Mar 01 17:54:28 +0000 2016,Happy Birthday may you get EVERYTHING you want and more.,0.5,4.8,5.7,78.25,1,7.92,4th and 5th grade
Tue Mar 01 14:47:00 +0000 2016,The first day of rehearsal with all the survivors I could barely get myself together. My body,6.34,7.6,8.4,71.14,1,8.35,7th and 8th grade
Tue Mar 01 14:29:07 +0000 2016,". you are so brave to come forward, a warrior leading the way. I don't feel alone anymore watching this happen is unreal.",7.77,5.2,5.3,77.23,2,6.3,5th and 6th grade
Tue Mar 01 05:18:22 +0000 2016,Buy Til It Happens To You portion of proceeds go to the charities KnowYourIX EndRapeOnCampus amp CarryThatWeight,10.05,9.9,13.7,54.22,1,15.19,9th and 10th grade
Tue Mar 01 04:52:20 +0000 2016,Listen to TilItHappensToYou on,7.78,9.6,12.4,33.58,1,15.95,11th and 12th grade
Mon Feb 29 23:35:47 +0000 2016,Thank you to for giving us your stage to share this message. WATCH my TIHTY Oscars performance,6.84,4.2,4.4,79.77,2,6.92,6th and 7th grade
Mon Feb 29 22:24:19 +0000 2016,you are a warrior thank you TilItHappensToYou,8.5,6.0,8.3,64.37,1,12.36,8th and 9th grade
Mon Feb 29 22:22:44 +0000 2016,After my performance last night I felt a weight lifted. Like I didn't have to hide anymore. TilItHappensToYou,7.59,5.6,7.1,70.8,2,9.6,7th and 8th grade
Mon Feb 29 21:09:56 +0000 2016,those men were so brave and strong and inspiring. Its different for them too. love seeing all the support for them,5.66,3.8,4.9,86.2,2,6.64,5th and 6th grade
Mon Feb 29 09:59:52 +0000 2016,"Thank you for standing next to me on stage. Thank you for all the things you said, for listening",5.77,2.3,2.7,95.67,2,4.14,5th and 6th grade
Mon Feb 29 03:26:31 +0000 2016,I never thought anyone would ever love me because I felt like my body was ruined by my abuser.,6.24,7.2,6.9,77.57,1,5.63,6th and 7th grade
Sun Feb 28 22:47:51 +0000 2016,. I'll be thinking of u 2nite. This is not over we'll stand by u until you are free to live a HAPPY life. Everyone deserves that.,5.28,3.1,1.6,88.02,3,2.28,3rd and 4th grade
Sun Feb 28 22:34:57 +0000 2016,"Don't know about u but I'm rooting for LEO He's blessed us w years of his storytelling, he deserves this 1",6.93,6.8,8.4,84.0,1,5.34,6th and 7th grade
Sat Feb 27 20:05:44 +0000 2016,Watch live now I'm joining soon,6.57,0.9,2.0,99.23,1,3.35,1st and 2nd grade
Sat Feb 27 18:59:03 +0000 2016,Get your asses to Sunset Blvd Tower Records 12pm PT Elton John ft Me Live on the streets of LA,6.21,6.4,6.2,85.02,1,4.47,5th and 6th grade
Sat Feb 27 18:22:17 +0000 2016,12pm PT free show at Tower Records on Sunset Blvd Excited to sing with Elton for everyone see u soon,1.78,8.7,7.6,68.1,1,6.21,7th and 8th grade
Sat Feb 27 16:32:37 +0000 2016,PSALMS 26 III Confident Prayer For Forgiveness and Guidance,9.35,6.8,9.8,62.34,1,13.83,9th and 10th grade
Sat Feb 27 05:03:42 +0000 2016,PeopleOverProfit you can FreeKesha if you FreeDrLuke Do what is RIGHT not what is better for business,7.27,8.7,10.6,62.68,1,11.42,10th and 11th grade
Wed Feb 24 23:18:51 +0000 2016,Free Kesha,11.63,2.9,0.8,77.91,1,-4.51,-1th and 0th grade
Wed Feb 24 14:25:12 +0000 2016,"I mean this is just so amazing, the instrumentation and the performers Thank you from the bottom of my heart",7.0,8.7,9.5,68.1,1,8.24,8th and 9th grade
Wed Feb 24 05:05:52 +0000 2016,"New Anthrax Album Forallkings has landed, get it NOW on",10.45,6.0,5.2,69.79,1,7.34,7th and 8th grade
Tue Feb 23 20:40:51 +0000 2016,Congratulations to my team for Best makeup and for Best hair for Period,7.93,7.2,6.5,66.74,1,8.16,7th and 8th grade
Sat Feb 20 10:49:00 +0000 2016,"Till you're standing in my shoes, I don't wanna hear nothing from u, from u, from u. Cuz you don't know TIHTY",6.34,2.9,2.9,94.15,2,2.88,2nd and 3rd grade
Fri Feb 19 22:46:35 +0000 2016,There are people all over the world who love you And I can say truly I am in awe of your bravery.,1.81,6.0,5.8,91.45,1,2.5,5th and 6th grade
Wed Feb 17 15:10:45 +0000 2016,". me and Inez missed you last night, we were gushing about your inconceivable talent",8.84,7.6,9.1,65.73,1,10.32,7th and 8th grade
Wed Feb 17 05:51:09 +0000 2016,". collection tonight was clean, classic, timeless. Modern lines that are unstoppably chic.",10.51,6.8,12.2,56.93,2,14.43,6th and 7th grade
Tue Feb 16 19:19:58 +0000 2016,As the first drop of paint begins to transform the artist a lighting bolt strikes in his mind. A,7.07,6.0,7.4,86.03,1,6.21,5th and 6th grade
Tue Feb 16 18:50:52 +0000 2016,Tear away cape made in collaboration with it's original designer Kansai Yamamoto who made many of Bowies fashions.,9.79,11.5,13.0,44.75,1,13.05,12th and 13th grade
Tue Feb 16 18:37:41 +0000 2016,"This choreography referenced his 1974 Diamond Dogs Tour, Dancers in 1980s boiler suit seen in Fashion music Video",6.28,10.3,12.7,53.21,1,13.05,11th and 12th grade
Tue Feb 16 17:49:14 +0000 2016,"Ginger rat for ZIGGY, Shooting Star for Major Tom SPACE ODDITY, ASHES TO ASHES clown, lightning",8.38,9.5,10.1,55.24,1,10.32,9th and 10th grade
Tue Feb 16 17:48:03 +0000 2016,Marc Jacobs had this beautiful Klaus Nomi shape inspired jacket embroidered with custom handmade,11.1,9.9,13.5,48.81,1,16.52,7th and 8th grade
Tue Feb 16 16:36:25 +0000 2016,"Thank you to the incredible Nile Rodgers, Raphael Saadiq, Richard Jackson.",7.05,5.2,11.5,77.23,1,13.73,5th and 6th grade
Tue Feb 16 09:47:31 +0000 2016,Thank you for posting this. We loved working together thank you,6.78,3.1,4.0,82.81,2,6.31,2nd and 3rd grade
Tue Feb 16 09:32:57 +0000 2016,Thank You Marc Jacobs for making such beautiful pieces for us tonight. Me and,5.46,5.2,7.1,82.65,1,8.23,5th and 6th grade
Tue Feb 16 05:35:26 +0000 2016,David Bowie SETLIST Space Oddity Changes Ziggy Stardust Suffragette City RebelRebel Fashion Fame Let's Dance Heroes,10.35,9.5,16.0,55.24,1,18.33,9th and 10th grade
Tue Feb 16 04:31:28 +0000 2016,UPTOWN FUNK TOOK IT HOME WHAT A RECORD So much love,0.55,1.7,1.6,102.61,1,3.17,1st and 2nd grade
Sun Feb 14 23:05:33 +0000 2016,AN UNBELIEVABLE album. WonderfulCrazyNight is a KILLER tune. Say I U to someone today w Elton's new record,7.44,5.6,4.8,65.39,3,6.89,6th and 7th grade
Sun Feb 14 20:24:05 +0000 2016,When Lemmy pulls out the Ace of Hearts instead of Spades it's HAPPY v DAY to all the rockin men amp women in my life.,1.87,8.3,8.6,79.94,1,4.13,8th and 9th grade
Sat Feb 13 03:10:12 +0000 2016,. I know you're gonna rock the WILTERN tonight girl,0.45,0.9,5.1,104.64,1,6.7,3rd and 4th grade
Fri Feb 12 18:29:22 +0000 2016,via Refinery29,11.63,8.8,10.2,35.61,1,7.1,11th and 12th grade
Fri Feb 12 00:16:42 +0000 2016,Flashback to Sunday right before I went out on the field,5.62,4.0,3.8,85.69,1,5.78,3rd and 4th grade
Thu Feb 11 23:41:03 +0000 2016,I love you too. I'll never forget that day.,0.22,0.3,-1.0,100.75,2,-1.67,-1th and 0th grade
Thu Feb 11 20:25:50 +0000 2016,Daddy and Daddy.,0.15,5.6,2.1,59.97,1,-0.46,-1th and 0th grade
Thu Feb 11 18:22:35 +0000 2016,A triumph for glam rock and people who live a lifestyle of passion all over the world.,7.27,5.2,6.5,88.06,1,5.97,6th and 7th grade
Thu Feb 11 05:41:39 +0000 2016,Thank you for inspiring us all with that beautiful collection Hedi this was a piece of fashion HISTORY.,7.16,10.3,10.1,53.21,1,9.8,9th and 10th grade
Wed Feb 10 16:53:52 +0000 2016,Thank you for nominating Til It Happens To You for BestMovieSong You nominated the issue of sexual assault on campus' too.,10.69,11.5,12.0,50.16,1,10.33,11th and 12th grade
Wed Feb 10 16:43:35 +0000 2016,"no way man, I 100 percent sang it live but good question",5.55,3.3,2.2,93.14,1,3.12,4th and 5th grade
Wed Feb 10 01:51:12 +0000 2016,Can't describe how grateful I am to be a performer of this generation thanku for supporting me always.,7.16,9.1,9.8,61.67,1,9.16,9th and 10th grade
Tue Feb 09 20:53:59 +0000 2016,"Mommy captain cheerleader at a football game for WVU years ago, so cool to see this floating",7.27,7.6,8.1,71.14,1,8.0,7th and 8th grade
Tue Feb 09 01:18:04 +0000 2016,Had a truly wonderful time at the Oscar Nominees luncheon. So cool to take a picture some of the,6.6,4.6,2.7,78.75,2,4.43,4th and 5th grade
Mon Feb 08 10:02:55 +0000 2016,Congratulations to both teams and football fans. It was really an honor to sing for you on your big day.,1.29,4.8,3.6,78.25,2,5.31,4th and 5th grade
Sun Feb 07 19:09:51 +0000 2016,Joined Snapchat today to celebrate SB50. follow My Story my first Super Bowl,6.71,7.2,8.2,66.74,1,9.96,6th and 7th grade
Sat Feb 06 00:28:53 +0000 2016,"I'm honored to sing for the finest athletes, coaches amp fans in the USA SB50 Sun. by the dawns early light..",6.93,6.8,9.0,84.0,1,5.92,6th and 7th grade
Wed Feb 03 07:30:39 +0000 2016,Congratulations amp the whole cast amp crew of ThePeoplevOJSimpson Unforgettable performances amp drama AmericanCrimeStory,11.1,17.0,22.3,-1.96,1,27.31,11th and 12th grade
Sun Jan 31 02:18:47 +0000 2016,Congratulations Carol Burnett for winning the Lifetime Achievement Award Thank You for making us all so happy with laughter,10.4,10.7,14.1,52.19,1,14.79,10th and 11th grade
Fri Jan 29 06:48:59 +0000 2016,So proud of my friend for changing her life by being determined everyday and never,6.49,8.0,7.4,64.71,1,8.4,8th and 9th grade
Thu Jan 28 20:33:51 +0000 2016,Wooohoooo I'm so proud of you Brando,6.24,0.1,2.3,106.67,1,4.07,2nd and 3rd grade
Thu Jan 28 00:05:20 +0000 2016,"Being peaceful in your actions, will help you find peace within. Happy a happy and calm day everyone",5.84,4.4,4.8,79.26,2,7.04,3rd and 4th grade
Sun Jan 24 18:53:33 +0000 2016,Thanks you Producers Guild Awards for inviting me to perform last night,8.18,4.4,8.1,84.68,1,10.83,5th and 6th grade
Tue Jan 19 00:28:11 +0000 2016,"We must learn to live together as brothers, or perish together as fools. MLK, Jr.",6.49,6.8,7.1,73.17,1,6.49,6th and 7th grade
Thu Jan 14 14:28:34 +0000 2016,Til It Happens To You my original score with for The Hunting Ground was nominated for an OSCAR,8.92,8.0,7.7,70.13,1,7.25,7th and 8th grade
Thu Jan 14 12:38:40 +0000 2016,Catch up on the The Finale of watch show stopping performances from the whole cast,6.49,5.6,7.4,81.63,1,8.4,5th and 6th grade
Thu Jan 14 05:11:36 +0000 2016,The season finale of starts on the west coast in 49 min So bittersweet I miss you all already ahshotel you won't want to miss it,6.14,8.7,10.2,78.93,1,5.75,5th and 6th grade
Mon Jan 11 21:04:45 +0000 2016,Thank you truly and the HFPA for a night myself and my fans will truly never forget. Can't wait to book my next job,1.25,4.4,2.6,84.68,2,3.58,4th and 5th grade
Mon Jan 11 05:27:17 +0000 2016,I am so grateful to the Hollywood Foreign Press. Thank you Taylor for being right there for me,6.71,3.3,3.2,87.72,2,5.42,3rd and 4th grade
Sat Jan 09 22:56:18 +0000 2016,So happy for and proud of my sweetie for winning People's Choice Award for his acting on,8.19,6.4,7.0,79.6,1,6.67,6th and 7th grade
Sat Jan 09 22:45:17 +0000 2016,Out now THIS WEEKEND Based on true events TheForest Starring Natalie Dormer,9.5,6.8,9.7,67.76,1,12.75,6th and 7th grade
Fri Jan 08 20:33:39 +0000 2016,These hats are replicas of the hats Treacy made for Isabella Blow. Issie thought there should be humor in fashion.,7.29,3.7,5.9,86.71,2,8.21,5th and 6th grade
Fri Jan 08 20:30:12 +0000 2016,Asia amp I were thrilled to honor our friend Philip Treacy amp his gift to the world though his magical hats.,6.18,6.8,9.0,84.0,1,7.02,6th and 7th grade
Fri Jan 08 18:08:32 +0000 2016,Cover 16 16 is my Queen. ASIA shot by Terry Richardson in miniature custom Philip Treacy Hat. V99,8.47,3.3,4.0,87.72,2,6.06,3rd and 4th grade
Fri Jan 08 16:24:22 +0000 2016,Read our piece Adult Finger Painting. How simple thoughts and gestures of love can make harmony out of chaos V99,5.71,3.7,5.5,86.71,2,7.92,5th and 6th grade
Fri Jan 08 16:18:51 +0000 2016,Cover 15 16 Gaga amp Taylor By Taylor Kinney 100 of sale goes to We made love on a canvas for peace.,6.88,7.2,6.5,82.99,1,3.31,6th and 7th grade
Fri Jan 08 16:18:51 +0000 2016,Cover 15 16 Gaga amp Taylor By Taylor Kinney 100 of sale goes to We made love on a canvas for peace.,6.88,7.2,6.5,82.99,1,3.31,6th and 7th grade
Fri Jan 08 16:00:45 +0000 2016,Cover 14 16 V99 Inez van Lamsweerde and Lady Gaga photographed by Vinoodh Matadin,8.84,6.4,8.5,74.19,1,10.32,5th and 6th grade
Fri Jan 08 16:00:26 +0000 2016,Cover 13 16 V99 Lady Gaga photographed by Styled by Hair by,5.55,4.4,3.4,84.68,1,5.03,4th and 5th grade
Fri Jan 08 04:04:10 +0000 2016,Cover 12 16 V99 Lady Gaga photographed by,6.01,4.1,2.6,80.28,1,5.0,2nd and 3rd grade
Thu Jan 07 21:44:34 +0000 2016,Cover 11 16 Lady Gaga in VERSACE by Inez amp Vinoodh V99 Donatella,9.14,7.2,4.6,66.74,1,5.9,6th and 7th grade
Thu Jan 07 18:57:12 +0000 2016,On Sale Now BOX SET All 16 covers guest edited by Gaga in plexi cube V99,6.4,3.6,3.3,97.54,1,3.07,3rd and 4th grade
Thu Jan 07 18:01:40 +0000 2016,"Cover 10 16 Gaga Shot by Chadwick Tyler. Live acting inside shoot w cast, story by James Franco and myself.",6.5,4.8,4.3,78.25,2,5.89,3rd and 4th grade
Thu Jan 07 17:57:45 +0000 2016,Cover 9 16 Photographed by friend amp collaborator Nick Knight. Cierra Skye in his piece The Moon and the Cat's Eye.,6.41,3.8,5.3,86.2,2,6.93,5th and 6th grade
Wed Jan 06 23:44:44 +0000 2016,"A letter from me, the guest editor of V99 to you",5.62,4.0,0.3,85.69,1,1.02,5th and 6th grade
Wed Jan 06 23:24:54 +0000 2016,Cover 8 16 by Steven Klein. Styling Patti Wilson Hair Frederic Aspiras Makeup Sarah Tanno,10.32,6.2,5.9,63.86,2,8.95,8th and 9th grade
Wed Jan 06 18:07:45 +0000 2016,Get it Steven Klein shoots couture from McQueen's Plato's Atlantis owned by Daphne amp Gaga,7.54,4.4,10.2,90.09,1,11.13,4th and 5th grade
Wed Jan 06 07:04:05 +0000 2016,Me and Taylor at his screening for 'The Forest.' I can't wait for it to come out so you all can,5.66,1.5,0.6,103.12,2,0.84,0th and 1st grade
Tue Jan 05 23:21:18 +0000 2016,"Buy one, collect a few, or collect all 16 covers. The most ever for a single fashion issue.",6.71,4.4,2.4,79.26,2,3.51,3rd and 4th grade
Tue Jan 05 19:55:28 +0000 2016,Shot by Steven Klein. Gaga Wearing original Countess glove designed by for Alexander McQueen V99,10.32,5.0,8.1,72.32,2,11.67,4th and 5th grade
Tue Jan 05 19:37:32 +0000 2016,Cover 7 16 V99 Daphne Guinness amp LadyGaga in archive Alexander McQueen. Masks Philip Treacy owned by Isabella Blow.,9.93,7.0,7.9,61.83,2,10.58,7th and 8th grade
Tue Jan 05 19:07:45 +0000 2016,It's called The Sweets Hat and I feel very lucky to wear her hats They were a piece of her soul,1.04,4.4,5.9,100.92,1,3.14,3rd and 4th grade
Tue Jan 05 19:04:31 +0000 2016,"Cover 6 16 V99 Isabella Blow. Best friend, muse amp discoverer of Alexander McQueen, Philip Treacy, Daphne Guinness.",9.35,6.8,9.0,62.34,2,11.22,8th and 9th grade
Tue Jan 05 18:25:33 +0000 2016,Cover 5 16 Lee Alexander McQueen 2002 shot by Steven Klein. EXCLUSIVE never before seen PHOTOGRAPH for V99,7.59,5.6,6.3,70.8,2,9.31,5th and 6th grade
Tue Jan 05 16:19:33 +0000 2016,". I love you. This image is powerful to me, a statue of mystery amp wisdom, like you both.",7.59,4.4,1.9,79.26,2,2.52,3rd and 4th grade
Tue Jan 05 16:16:36 +0000 2016,V99 cover 4 16 of guest edited by me DAPHNE GUINNESS in archive Alexander McQueen shot by Steven Klein,8.73,7.2,8.9,77.57,1,8.36,8th and 9th grade
Tue Jan 05 00:42:51 +0000 2016,"For this issue, I wanted nothing more than to have one story that my children amp the future of",7.07,7.2,7.1,77.57,1,5.92,7th and 8th grade
Mon Jan 04 19:36:29 +0000 2016,Cover 3 is GuestEditor LadyGaga Shot by Steven Klein in archive Alexander McQueen,10.35,10.7,10.1,41.36,1,12.63,10th and 11th grade
Mon Jan 04 18:34:14 +0000 2016,Cover 2 16. Karl Lagerfeld shot by Hedi Slimane,9.12,2.7,1.2,83.83,2,2.16,1st and 2nd grade
Mon Jan 04 18:21:21 +0000 2016,Cover 1 of 16 Hedi Slimane shot by Karl Lagerfeld.,8.87,4.8,2.9,78.25,1,4.44,3rd and 4th grade
Mon Jan 04 17:20:38 +0000 2016,Are you ready for V99 Guest edited amp curated by Lady Gaga.,6.86,4.4,3.8,84.68,1,5.03,5th and 6th grade
Sun Jan 03 17:24:04 +0000 2016,thank you so much you're a real sweetie. thanks for believing in that girl so she could live her dreams,6.21,6.4,8.4,85.02,1,6.5,6th and 7th grade
Sun Jan 03 17:21:22 +0000 2016,looking good what a cruelly glamorous job,10.75,6.0,5.6,64.37,1,9.06,5th and 6th grade
Sun Jan 03 06:15:39 +0000 2016,Sweet girl what do you think of this melody,0.45,-0.4,1.4,113.1,1,3.51,3rd and 4th grade
Fri Jan 01 16:36:27 +0000 2016,"Who knows why humanity each year decides in unity to reboot their hearts amp each other. A beautiful ritual. Find healing, forgiveness. 2016",8.82,6.3,6.6,63.66,3,9.12,8th and 9th grade
Fri Jan 01 16:30:54 +0000 2016,Happy New Year Monsters I will love you for all of eternity up,6.71,4.8,3.2,83.66,1,4.16,6th and 7th grade
Fri Jan 01 16:23:00 +0000 2016,happy new year,0.15,0.9,-1.2,93.81,1,-2.38,0th and 1st grade
Fri Jan 01 16:22:27 +0000 2016,So proud of my longtime friend amp collaborator Perry Meek for designing this MAJOR dress for Ms.Paula,8.19,8.7,10.9,62.68,1,11.42,10th and 11th grade
Fri Jan 01 16:18:26 +0000 2016,way to make me cry at 8 am Rock on,0.5,0.1,-4.8,112.09,1,-4.27,3rd and 4th grade
Thu Dec 31 23:13:52 +0000 2015,thank you to our fans and loved ones who bless us with so much each year. We had a beautiful,0.5,1.3,0.8,103.63,2,2.12,0th and 1st grade
Fri Dec 25 22:23:22 +0000 2015,MERRY CHRISTMAS EVERYONE,0.15,12.7,14.6,9.21,1,16.95,12th and 13th grade
Wed Dec 23 01:11:26 +0000 2015,I feel like I've known her my whole life she wants to show me things.,0.74,2.1,3.4,107.01,1,2.6,2nd and 3rd grade
Sun Dec 20 22:09:36 +0000 2015,Happy Holidays This season may all your pain he cham payne . All I have is because of you.,4.96,3.3,1.9,87.72,2,3.51,3rd and 4th grade
Tue Dec 15 15:51:03 +0000 2015,Find out what happens Wednesday 10pm Hotel,6.24,3.7,6.3,81.29,1,9.87,2nd and 3rd grade
Tue Dec 15 00:47:26 +0000 2015,Thank you for the yummy chocolates and charity donations for the holidays I'm so humbled,10.7,9.1,9.3,56.25,1,10.37,10th and 11th grade
Mon Dec 14 18:00:39 +0000 2015,Congrats to my costars Wes Bentley on your nominations Honored to work w you all,8.59,6.8,6.8,73.17,1,7.65,6th and 7th grade
Sun Dec 13 16:06:23 +0000 2015,"I could sit on the couch, landline on my lap, watching live TV shopping networks ALL DAY. Take my money I need and holiday deals",6.15,4.6,4.4,84.17,2,5.26,4th and 5th grade
Sat Dec 12 02:58:56 +0000 2015,"Thank you K Goss for dressing me on the carpet, what can I say. I love a power suit",4.94,2.3,-0.7,95.67,2,0.2,-1th and 0th grade
Sat Dec 12 02:32:51 +0000 2015,"I would like to thank my fans from the bottom of my heart for loving me and my music, everything",1.78,7.6,6.7,76.56,1,4.76,7th and 8th grade
Sat Dec 12 02:17:30 +0000 2015,"He said, honey you're always my Woman of the Year. HAPPY HOLIDAYS billboard",5.17,4.6,4.7,73.34,2,6.56,4th and 5th grade
Thu Dec 10 23:34:15 +0000 2015,WATCH LIVE at 7pm ET myself and The Hunting Ground team sit down to discuss campus rapes. TilItHappensToYou,8.04,8.0,11.1,70.13,1,11.08,8th and 9th grade
Thu Dec 10 17:37:54 +0000 2015,My mom and my manager are so emotional about our Best Actress Golden Globe,6.59,6.4,6.1,74.19,1,7.42,6th and 7th grade
Thu Dec 10 16:11:20 +0000 2015,thank you what a special day,6.57,0.9,-0.5,99.23,1,1.38,1st and 2nd grade
Thu Dec 10 14:04:08 +0000 2015,I apologize to my neighbors I'm still screaming in my apt in NY I'm nominated as an actress for a Golden Globe what a dream is this real,7.84,11.8,10.9,59.98,1,5.17,11th and 12th grade
Wed Dec 09 23:19:53 +0000 2015,Just another day at the Haus of Gaga office with Ruth Hogben artpunk technologyjunkie,7.71,8.8,9.8,57.27,1,11.94,7th and 8th grade
Wed Dec 09 20:26:06 +0000 2015,"On deadline as Guest Editor for Photographers, writers, stylists, hair, makeup,",11.36,8.8,13.6,51.85,1,15.29,11th and 12th grade
Wed Dec 09 04:24:10 +0000 2015,You are stronger than hell and we love you,0.45,-0.4,0.9,113.1,1,2.87,-1th and 0th grade
Tue Dec 08 07:00:46 +0000 2015,Tuxedo by,11.63,2.9,-1.7,77.91,1,-7.41,-1th and 0th grade
Mon Dec 07 16:34:20 +0000 2015,Thank you fans and The Grammys for nominating my song Til It Happens You You for a Grammy Me,7.9,7.2,6.4,77.57,1,5.28,6th and 7th grade
Mon Dec 07 06:20:04 +0000 2015,You are so amazing I fall in love every single time. that performance was just heaven.,6.4,7.2,7.5,72.16,1,7.42,7th and 8th grade
Mon Dec 07 03:48:05 +0000 2015,"Happy Birthday Frank from backstage Love, Tony Gaga",6.01,4.1,8.5,80.28,1,11.56,2nd and 3rd grade
Sun Dec 06 21:49:38 +0000 2015,Today I will enjoy the gift of life. I will do that and only that.,0.37,1.5,-1.4,97.7,2,-0.34,-1th and 0th grade
Sun Dec 06 20:57:54 +0000 2015,The Queen and her Birds...,0.25,-1.9,1.8,117.16,1,0.32,1st and 2nd grade
Sat Dec 05 22:35:23 +0000 2015,"Darkness cannot drive out darkness only light can do that. Hate cannot drive out hate only love can do that. Martin Luther King, Jr.",1.05,2.9,4.0,88.74,3,5.76,2nd and 3rd grade
Sat Dec 05 12:17:53 +0000 2015,So you know I'm so excited for this movie because not only is in it but it's also a HORROR,1.78,7.6,5.3,76.56,1,2.73,7th and 8th grade
Fri Dec 04 10:29:55 +0000 2015,There is a emoji but no Butterfly.,6.24,3.7,0.9,81.29,1,2.44,3rd and 4th grade
Fri Dec 04 07:47:53 +0000 2015,Sunset at home with and Koji,6.57,2.1,-0.5,90.77,1,1.38,1st and 2nd grade
Fri Dec 04 06:21:07 +0000 2015,Thanku for photographing me WOMAN OF THE YEAR. I felt like a human storm w mom and dad,5.84,2.1,1.1,96.18,2,2.87,5th and 6th grade
Fri Dec 04 02:56:02 +0000 2015,Thank you David Casavant for the Dior Homme by Hedi Slimane jeans he lent and then gave to me,7.07,6.0,6.7,86.03,1,5.63,5th and 6th grade
Thu Dec 03 23:18:25 +0000 2015,Today is your last chance to vote for me at the People's Choice Awards,5.46,2.9,4.7,99.57,1,5.33,5th and 6th grade
Thu Dec 03 22:38:30 +0000 2015,Thank you to my fans all over the world and for making me WOMAN OF THE YEAR. I'm here because of you,0.55,1.7,1.0,102.61,2,1.84,1st and 2nd grade
Thu Dec 03 08:53:35 +0000 2015,Happy Birthday Frank,0.15,5.6,8.3,59.97,1,9.23,0th and 1st grade
Thu Dec 03 08:39:20 +0000 2015,Nothing I love more than when my guy's proud of me. TonyGaga Sinatra100,6.71,4.8,6.5,83.66,1,7.24,6th and 7th grade
Thu Dec 03 05:00:59 +0000 2015,I loved getting all dressed like a lady for Frank tonight Sinatra100 Tony Daddy Jack Daniels a swinging bday,6.24,7.2,10.4,77.57,1,10.21,6th and 7th grade
