created_at,text,dale_chall_readability_score,flesch_kincaid,automated_readability,flesch_reading,sentence_count,coleman_liau_index,based_on_all_algorithms
Mon May 04 12:19:45 +0000 2020,"Getting great reviews, finally, for how well we are handling the pandemic, especially our strong production of desperately needed ventilators, the building of field hospitals amp beds, and soon, the great things we are doing on testing. People are really working well together",9.11,12.9,14.9,41.19,2,13.34,14th and 15th grade
Mon May 04 10:38:11 +0000 2020,"Concast should open up a long overdue Florida Cold Case against Psycho Joe Scarborough. I know him and Crazy Mika well, used them beautifully in the last Election, dumped them nicely, and will state on the record that he is nuts . Besides, bad ratings OPENJOECOLDCASE",8.24,6.8,9.3,73.17,3,9.97,9th and 10th grade
Mon May 04 02:42:50 +0000 2020,I m with the TRUCKERS all the way. Thanks for the meeting at the White House with my representatives from the Administration. It is all going to work out well,5.71,4.8,3.8,78.25,3,5.77,4th and 5th grade
Sun May 03 20:41:08 +0000 2020,Thank you Ryan. Working hard,7.04,0.5,3.7,100.24,1,4.96,1st and 2nd grade
Sun May 03 20:18:19 +0000 2020,"....Fake News got it wrong again, as always, and tens of thousands of lives were saved by my EARLY BAN of China into our Country. The people that we re allowed were heavily scrutinized and tested U.S. citizens, and as such, I welcome them with open arms",6.82,8.9,11.0,73.0,2,7.2,6th and 7th grade
Sun May 03 20:18:19 +0000 2020,"Intelligence has just reported to me that I was correct, and that they did NOT bring up the CoronaVirus subject matter until late into January, just prior to my banning China from the U.S. Also, they only spoke of the Virus in a very non threatening, or matter of fact, manner...",7.07,12.1,12.5,54.05,2,7.9,12th and 13th grade
Sun May 03 18:10:00 +0000 2020,Thank you very much to our beautiful boaters. I will never let you down,0.35,1.3,1.6,98.21,2,3.66,2nd and 3rd grade
Sun May 03 14:43:31 +0000 2020,"....And then came a Plague, a great and powerful Plague, and the World was never to be the same again But America rose from this death and destruction, always remembering its many lost souls, and the lost souls all over the World, and became greater than ever before",3.04,18.5,24.0,48.14,1,9.01,18th and 19th grade
Sun May 03 14:36:19 +0000 2020,So nice to see this great honor. Thank you but haven t played golf in a long time,0.45,0.9,-0.3,104.64,2,1.24,0th and 1st grade
Sun May 03 14:30:44 +0000 2020,Going well despite the Fake News,6.57,2.1,2.8,90.77,1,5.27,1st and 2nd grade
Sun May 03 13:00:38 +0000 2020,Some things never get old,0.25,0.5,0.9,100.24,1,2.64,0th and 1st grade
Sun May 03 12:57:40 +0000 2020,Progress being made,0.15,0.9,6.8,93.81,1,7.32,0th and 1st grade
Sun May 03 12:56:15 +0000 2020,Thank you,0.1,-3.1,-1.7,120.21,1,-7.41,-1th and 0th grade
Sun May 03 12:54:31 +0000 2020,Keep punching Mike,9.05,0.9,5.2,93.81,1,5.35,0th and 1st grade
Sun May 03 12:52:37 +0000 2020,Thank you,0.1,-3.1,-1.7,120.21,1,-7.41,-1th and 0th grade
Sun May 03 12:49:43 +0000 2020,Wow,0.05,-3.5,-6.9,121.22,1,-28.01,-1th and 0th grade
Sun May 03 12:46:51 +0000 2020,"Hopefully our Country will soon mend. We are all missing our wonderful rallies, and many other things",6.84,5.4,6.4,71.31,2,8.95,5th and 6th grade
Sun May 03 12:20:05 +0000 2020,"Many complaints coming in about Maine. I love that State, won Maine 2 Don t make the cure worse than the problem itself. That can happen, you know",5.23,2.2,3.3,95.88,3,4.78,3rd and 4th grade
Sun May 03 11:57:19 +0000 2020,"The Fake News doesn t show real polls. Lamestream Media is totally CORRUPT, the Enemy of the People",6.71,4.4,4.5,79.26,2,6.7,4th and 5th grade
Sun May 03 11:42:16 +0000 2020,". Oh bye the way, I appreciate the message from former President Bush, but where was he during Impeachment calling for putting partisanship aside. He was nowhere to be found in speaking up against the greatest Hoax in American history",7.44,9.7,11.9,60.14,2,11.14,11th and 12th grade
Sun May 03 03:30:19 +0000 2020,"Beautiful, thank you to our GREAT and",0.35,2.5,2.9,89.75,1,4.94,2nd and 3rd grade
Sat May 02 23:04:53 +0000 2020,"No reason to turn it down, except politics. We have plenty of testing. Maybe you need a new Doctor over there. Crazy Nancy will use it as an excuse not to show up to work",5.43,3.2,1.3,87.92,4,2.81,5th and 6th grade
Sat May 02 23:00:39 +0000 2020,"The Democrats are just, as always, looking for trouble. They do nothing constructive, even in times of crisis. They don t want to blame their cash cow, China, for the plague. China is blaming Europe. Dr. Fauci will be testifying before the Senate very soon DONOTHINGDEMOCRATS",7.18,4.5,6.7,79.06,5,8.67,6th and 7th grade
Sat May 02 22:32:38 +0000 2020,Not much time to sleep. Thank you,0.35,-1.2,0.3,115.13,1,1.57,-1th and 0th grade
Sat May 02 22:26:23 +0000 2020,"So true, although Honest Abe wasn t bad. Thank you",5.71,2.5,2.9,95.17,1,3.86,3rd and 4th grade
Sat May 02 21:51:30 +0000 2020,"She was thrown off The View like a dog, Zero T.V. Personas. Now Wallace is a 3rd rate lapdog for Fake News MSDNC Concast . Doesn t have what it takes",7.29,3.7,2.3,86.71,3,3.28,3rd and 4th grade
Sat May 02 21:34:47 +0000 2020,Very cool. Please thank him,0.25,-1.9,2.7,117.16,1,3.8,1st and 2nd grade
Sat May 02 21:24:13 +0000 2020,"I, for one, am glad to see he is back, and well",0.6,0.9,-1.4,110.06,1,-2.23,0th and 1st grade
Sat May 02 21:14:35 +0000 2020,"Border Wall is going up FAST. Over 172 miles already built. 450 miles by early next year, or sooner Dems want OPEN BORDERS. I want STRONG BORDERS",5.84,3.3,3.8,87.72,3,5.65,3rd and 4th grade
Sat May 02 21:07:34 +0000 2020,"The Impeachment Hoax will be exposed. Crazy Nancy gets Nothing Done, that s why she got thrown out as Speaker the first time. Also, she should come back to Washington now",6.18,3.8,5.0,86.4,3,6.7,6th and 7th grade
Sat May 02 20:49:24 +0000 2020,"I hate to be promoting AT amp T, but is Great News, not Fake News. Everybody should be carrying them",5.71,3.7,2.6,86.71,2,3.86,5th and 6th grade
Sat May 02 20:36:12 +0000 2020,That s right Jack. Keep up the good work,0.22,-2.1,-2.5,117.67,2,-2.37,-4th and -3th grade
Sat May 02 17:02:15 +0000 2020,Thank you Michael. You also,0.25,0.5,2.7,100.24,1,3.8,1st and 2nd grade
Sat May 02 16:56:46 +0000 2020,The Russia Hoax is the biggest political scandal in American history. Treason Lets see how it ends,8.7,6.6,5.5,62.85,2,8.26,8th and 9th grade
Sat May 02 14:21:02 +0000 2020,Thank you,0.1,-3.1,-1.7,120.21,1,-7.41,-1th and 0th grade
Sat May 02 13:17:42 +0000 2020,"96 Approval Rating in the Republican Party. Thank you Also, just out, highest ever Approval Rating overall in the new Gallup Poll, and shows Trump beating Sleepy Joe Biden.",7.08,6.6,9.2,73.68,2,9.91,6th and 7th grade
Sat May 02 13:06:53 +0000 2020,"There is tremendous CoronaVirus testing capacity in Washington for the Senators returning to Capital Hill on Monday. Likewise the House, which should return but isn t because of Crazy Nancy P. The 5 minute Abbott Test will be used. Please inform Dr. Brian P. Monahan.",8.76,7.7,7.6,60.01,4,9.38,7th and 8th grade
Fri May 01 23:36:20 +0000 2020,Don t allow RIGGED ELECTIONS,7.04,2.9,3.7,83.32,1,6.12,1st and 2nd grade
Fri May 01 20:05:58 +0000 2020,....Together we will Fight for Small Businesses and Protect American Energy workers Shelley has my Complete and Total Endorsement,10.4,13.1,15.6,35.27,1,15.37,13th and 14th grade
Fri May 01 20:05:58 +0000 2020,"Senator Shelley Moore Capito is doing a tremendous job for the great people of West Virginia She strongly defends our Second Amendment, Supports our Veterans and is Strong on Life and the Border....",11.02,15.0,18.8,46.44,1,11.62,18th and 19th grade
Fri May 01 15:27:29 +0000 2020,Concast and Fake News are going out of their way to say GREAT things about China. They are Chinese puppets who want to do business there. They use USA airwaves to help China. The Enemy of the People,5.77,3.5,3.3,87.21,4,5.07,3rd and 4th grade
Fri May 01 12:42:23 +0000 2020,"The Governor of Michigan should give a little, and put out the fire. These are very good people, but they are angry. They want their lives back again, safely See them, talk to them, make a deal.",5.53,3.4,4.8,92.83,3,5.32,5th and 6th grade
Fri May 01 12:14:36 +0000 2020,"Cryin Chuck Schumer, compared to what other Senators have brought home to their states, has brought very little back to N.Y. A totally overrated loser, the one thing he has given them is SALT. He never even called me to stop it. No wonder Cuomo amp most others can t stand him. AOC",6.08,4.9,5.5,83.36,4,6.02,5th and 6th grade
Fri May 01 12:07:51 +0000 2020,"Cryin Chuck Schumer was on a late night show using a false talking point over amp over again. We don t have enough testing , he would repeat, when he knows we have done a great job on Testing, just like we have on Ventilators and everything else. He lied, gave NY SALT. Run AOC",5.7,5.6,7.0,87.05,3,5.62,5th and 6th grade
Fri May 01 11:55:42 +0000 2020,Dirty Cop,0.1,-3.1,-1.7,120.21,1,-7.41,-1th and 0th grade
Fri May 01 11:54:13 +0000 2020,"I have done more for farmers and ranchers than any President in history, and it has been my honor in doing so",7.6,9.5,8.4,66.07,1,5.63,7th and 8th grade
Fri May 01 00:54:46 +0000 2020,The only thing we got wrong is that it was even worse the corruption than we thought. DIRTY COPS,5.41,6.0,7.4,86.03,1,6.21,5th and 6th grade
Fri May 01 00:23:04 +0000 2020,"Vote by May 12th His opponent voted to fire teachers, and cut their salaries while bumping up her pay. Now she s mocking our Great Vets We need Navy Fighter Pilot Mike Garcia in CA25",8.11,6.6,7.2,79.09,2,6.61,6th and 7th grade
Fri May 01 00:11:06 +0000 2020,"....He is Strong on Crime, the Border, and Second Amendment. Tom has deep roots in Wisconsin, is a big Tax Cutter, and will help me DRAIN THE SWAMP Tom has my Complete and Total Endorsement. Vote for Tom Tiffany",7.12,4.8,6.0,83.66,3,6.08,5th and 6th grade
Fri May 01 00:11:06 +0000 2020,"Tom Tiffany is a Great Advocate for the incredible people of Wisconsin WI07 . We need Tom in Congress to help us Make America Great Again He will Fight for Small Business, supports our Incredible Farmers, Loves our Military and our Vets....",7.35,10.1,11.7,59.13,2,9.86,9th and 10th grade
Thu Apr 30 18:25:29 +0000 2020,"Over 120 MILLION Economic Impact Payments have already gone out to hardworking Americans If you haven t yet received your payment, go to and click on GET MY PAYMENT to receive your money FAST",8.11,14.2,17.5,53.89,1,10.11,17th and 18th grade
Thu Apr 30 14:09:10 +0000 2020,"We can t let the Fake News, and their partner, the Radical Left, Do Nothing Democrats, get away with stealing the Election. They tried that in 2016. How did that work out",5.65,2.7,4.3,94.45,3,5.66,5th and 6th grade
Thu Apr 30 12:53:30 +0000 2020,The Do Nothing Democrats,0.2,1.3,5.3,92.8,1,7.25,0th and 1st grade
Thu Apr 30 12:31:39 +0000 2020,FAKE NEWS,0.1,-3.1,-1.7,120.21,1,-7.41,-1th and 0th grade
Thu Apr 30 12:30:54 +0000 2020,Great,0.05,-3.5,2.6,121.22,1,-16.41,-1th and 0th grade
Thu Apr 30 12:11:23 +0000 2020,DIRTY COP JAMES COMEY GOT CAUGHT,0.3,-1.5,2.8,116.15,1,5.27,-1th and 0th grade
Thu Apr 30 12:02:43 +0000 2020,Plus many,0.1,-3.1,-1.7,120.21,1,-7.41,-1th and 0th grade
Thu Apr 30 11:59:20 +0000 2020,Really Have you looked at the numbers lately,7.98,5.2,4.4,71.82,1,7.21,3rd and 4th grade
Thu Apr 30 11:56:44 +0000 2020,"FAKE POLLING, just like 2016 but worse",0.35,-1.2,3.6,115.13,1,5.75,2nd and 3rd grade
Thu Apr 30 11:47:47 +0000 2020,"What happened to General Michael Flynn, a war hero, should never be allowed to happen to a citizen of the United States again",6.84,9.9,11.2,65.05,1,8.48,9th and 10th grade
Thu Apr 30 11:47:04 +0000 2020,"Does anybody really believe that Roger Stone, a man whose house was raided early in the morning by 29 gun toting FBI Agents with Fake News closely in toe , was treated fairly. How about the jury forewoman with her unannounced hatred amp bias. Same scammers as General Flynn",8.05,7.2,8.7,72.16,3,9.1,8th and 9th grade
Thu Apr 30 11:45:41 +0000 2020,"Despite reports to the contrary, Sweden is paying heavily for its decision not to lockdown. As of today, 2462 people have died there, a much higher number than the neighboring countries of Norway 207 , Finland 206 or Denmark 443 . The United States made the correct decision",9.2,9.3,9.5,55.95,3,9.97,9th and 10th grade
Thu Apr 30 04:41:15 +0000 2020,Lyin Brian Williams of MSDNC,10.2,5.2,3.7,66.4,1,6.12,9th and 10th grade
Thu Apr 30 04:23:59 +0000 2020,"I must admit that Lyin Brian Williams is, while dumber than hell, quite a bit smarter than Fake News anchorman Don Lemon, the dumbest man on television . Then you have Psycho Joe What Ever Happened To Your Girlfriend Scarborough, another of the low I.Q. individuals",8.61,10.9,12.9,57.1,2,10.45,12th and 13th grade
Thu Apr 30 04:09:52 +0000 2020,"Lyin Brian Williams of MSDNC, a Concast Scam Company, wouldn t know the truth if it was nailed to his wooden forehead. Remember when he lied about his bravery in a helicopter Totally made up story. He s a true dummy who was thrown off Network News like a dog. Stay tuned",6.92,6.5,7.1,79.3,3,6.32,6th and 7th grade
Thu Apr 30 04:01:08 +0000 2020,"Just told that Fake News is falsely reporting that I was recently shouting at my campaign manager over made up nonsense. Actually, he is doing a great job, I never shouted at him been with me for years, including the 2016 win , amp have no intention to do so. Just FAKE NEWS",7.83,7.7,7.3,70.84,3,6.49,7th and 8th grade
Thu Apr 30 03:52:46 +0000 2020,". doesn t want to speak about their persecution of General Michael Flynn amp why they got the story so wrong. They, along with others, should pay a big price for what they have purposely done to this man amp his family. They won t even cover the big breaking news about this scam",6.0,6.7,7.5,78.89,3,6.61,6th and 7th grade
Thu Apr 30 00:52:36 +0000 2020,"Happy Birthday to three time Olympian and five term Congressman,",5.71,4.8,9.5,78.25,1,12.56,4th and 5th grade
Wed Apr 29 14:55:22 +0000 2020,"No, I think Amash would make a wonderful candidate, especially since he is way behind in his district and has no chance of maintaining his Congressional seat. He almost always votes for the Do Nothing Dems anyway. I like him even more than Jill Stein",6.13,6.8,7.6,73.17,3,8.17,6th and 7th grade
Wed Apr 29 14:42:56 +0000 2020,THANK YOU,0.1,-3.1,-1.7,120.21,1,-7.41,-1th and 0th grade
Wed Apr 29 13:09:39 +0000 2020,At least they admit it. The Failing amp never correct their Fake Reporting,7.6,4.6,4.3,73.34,2,6.96,4th and 5th grade
Wed Apr 29 04:23:38 +0000 2020,"The only reason the U.S. has reported one million cases of CoronaVirus is that our Testing is sooo much better than any other country in the World. Other countries are way behind us in Testing, and therefore show far fewer cases",7.35,10.1,10.4,59.13,2,8.76,9th and 10th grade
Wed Apr 29 02:39:07 +0000 2020,THANK YOU MICHAEL,0.15,-2.7,3.6,119.19,1,3.43,0th and 1st grade
Tue Apr 28 14:43:53 +0000 2020,Thank you and AmericaStrong,7.78,9.6,8.8,33.58,1,11.6,11th and 12th grade
Tue Apr 28 13:57:14 +0000 2020,"But I love Diamond amp Silk, and so do millions of people",5.55,4.4,2.6,84.68,1,3.58,5th and 6th grade
Tue Apr 28 13:42:38 +0000 2020,Texas to open businesses in phases beginning Friday. Great job being done by,6.39,4.6,5.0,73.34,2,7.89,4th and 5th grade
Tue Apr 28 13:38:54 +0000 2020,Many States moving to SAFELY amp QUICKLY reopen,7.98,5.2,6.1,71.82,1,9.35,2nd and 3rd grade
Tue Apr 28 12:06:03 +0000 2020,"We are doing far more, and better, Testing than any other country in the world, and yet the media does nothing but complain. No matter how good a job is done, the same as with the Ventilators, they will never say we are doing a great job, they will only viciously gripe",6.75,9.9,11.3,70.47,2,6.56,6th and 7th grade
Tue Apr 28 02:54:29 +0000 2020,Because Shifty is a crooked politician,6.57,2.1,7.5,90.77,1,11.07,1st and 2nd grade
Mon Apr 27 20:58:59 +0000 2020,I will be having a White House Press Conference today at 5 30 P.M. Thank you,5.42,6.0,4.5,80.62,1,3.83,5th and 6th grade
Mon Apr 27 14:41:11 +0000 2020,"Why should the people and taxpayers of America be bailing out poorly run states like Illinois, as example and cities, in all cases Democrat run and managed, when most of the other states are not looking for bailout help I am open to discussing anything, but just asking",9.64,19.6,24.4,39.68,1,9.94,9th and 10th grade
Mon Apr 27 13:48:07 +0000 2020,"FAKE NEWS, THE ENEMY OF THE PEOPLE",0.35,3.7,0.9,81.29,1,2.44,3rd and 4th grade
Mon Apr 27 13:41:01 +0000 2020,"There has never been, in the history of our Country, a more vicious or hostile Lamestream Media than there is right now, even in the midst of a National Emergency, the Invisible Enemy",8.14,15.0,16.6,46.44,1,9.12,16th and 17th grade
Mon Apr 27 12:20:41 +0000 2020,"Blame the Democrats for any lateness in your Enhanced Unemployment Insurance. I wanted the money to be paid directly, they insisted it be paid by states for distribution. I told them this would happen, especially with many states which have old computers.",8.09,7.6,9.6,65.73,3,11.01,7th and 8th grade
Mon Apr 27 01:42:10 +0000 2020,So true,0.1,-3.1,-6.4,120.21,1,-13.21,-1th and 0th grade
Mon Apr 27 01:06:17 +0000 2020,"American citizens We were long ahead of Dems, who were all against the BAN.",5.46,5.2,6.4,82.65,1,7.01,5th and 6th grade
Mon Apr 27 00:59:33 +0000 2020,Great,0.05,-3.5,2.6,121.22,1,-16.41,-1th and 0th grade
Mon Apr 27 00:22:26 +0000 2020,They are one of the worst in the news business. Total slime balls,5.17,1.1,1.0,98.72,2,2.96,2nd and 3rd grade
Mon Apr 27 00:19:55 +0000 2020,"They asked me to be at West Point on June 13th., amp I will be there",0.79,2.4,2.2,106.0,1,0.93,0th and 1st grade
Mon Apr 27 00:14:39 +0000 2020,"Laura, just another Fake News Report",6.57,6.8,5.9,56.93,1,8.17,6th and 7th grade
Sun Apr 26 22:54:17 +0000 2020,"Does anybody get the meaning of what a so called Noble not Nobel Prize is, especially as it pertains to Reporters and Journalists Noble is defined as, having or showing fine personal qualities or high moral principles and ideals. Does sarcasm ever work",9.48,10.5,12.3,58.11,2,10.62,10th and 11th grade
Sun Apr 26 21:53:32 +0000 2020,"Reports that H.H.S. Secretary is going to be fired by me are Fake News. The Lamestream Media knows this, but they are desperate to create the perception of chaos amp havoc in the minds of the public. They never even called to ask. Alex is doing an excellent job",7.02,3.6,4.0,86.91,5,5.6,3rd and 4th grade
Sun Apr 26 21:21:03 +0000 2020,"....fraud and others who are even worse . Chris Wallace is nastier to Republicans than even Deface the Nation or Sleepy Eyes. The people who are watching in record numbers thank you President Trump , are angry. They want an alternative now. So do I",7.74,5.5,5.2,71.21,5,6.92,6th and 7th grade
Sun Apr 26 21:21:02 +0000 2020,....Even the Radical Left Do Nothing Democrats laughed at the Fox suggestion. No respect for the people running But Fox keeps on plugging to try and become politically correct. They put RINO Paul Ryan on their Board. They hire debate questions to Crooked Hillary ....,7.05,5.2,7.9,77.23,4,9.49,7th and 8th grade
Sun Apr 26 21:21:02 +0000 2020,". just doesn t get what s happening They are being fed Democrat talking points, and they play them without hesitation or research. They forgot that Fake News amp MSDNC wouldn t let participate, even a little bit, in the poor ratings Democrat Debates.....",8.01,10.5,12.4,58.11,2,9.81,12th and 13th grade
Sun Apr 26 18:28:35 +0000 2020,"....schedule and eating habits, written by a third rate reporter who knows nothing about me. I will often be in the Oval Office late into the night amp read amp see that I am angrily eating a hamburger amp Diet Coke in my bedroom. People with me are always stunned. Anything to demean",6.38,6.1,5.8,74.9,4,6.37,6th and 7th grade
Sun Apr 26 18:28:35 +0000 2020,"I work from early in the morning until late at night, haven t left the White House in many months except to launch Hospital Ship Comfort in order to take care of Trade Deals, Military Rebuilding etc., and then I read a phony story in the failing about my work....",7.38,19.3,23.7,46.11,1,7.5,7th and 8th grade
Sun Apr 26 18:21:24 +0000 2020,"The people that know me and know the history of our Country say that I am the hardest working President in history. I don t know about that, but I am a hard worker and have probably gotten more done in the first 3 1 2 years than any President in history. The Fake News hates it",5.96,7.2,6.3,77.57,3,4.88,6th and 7th grade
Sun Apr 26 17:42:04 +0000 2020,". Thank you for a great call yesterday with Catholic Leaders, and a great Service today from",5.42,7.2,8.9,72.16,1,9.28,8th and 9th grade
Sun Apr 26 16:06:42 +0000 2020,"Happy Birthday to Melania, our great First Lady",6.01,5.2,6.1,71.82,1,8.66,5th and 6th grade
Sun Apr 26 01:06:20 +0000 2020,Had a great call with Catholic Leaders and Educators earlier today. I will be online tomorrow at 10 15 A.M. Eastern for Sunday Mass celebrated by at St. Patrick s Cathedral in New York City. Join me,6.66,4.6,3.8,78.96,4,5.54,6th and 7th grade
Sat Apr 25 22:23:30 +0000 2020,"I never said the pandemic was a Hoax Who would say such a thing I said that the Do Nothing Democrats, together with their Mainstream Media partners, are the Hoax. They have been called out amp embarrassed on this, even admitting they were wrong, but continue to spread the lie",7.09,9.5,12.5,71.48,2,8.77,12th and 13th grade
Sat Apr 25 22:17:13 +0000 2020,"Remember, the Cure can t be worse than the problem itself. Be careful, be safe, use common sense",5.84,3.3,3.7,87.72,2,5.13,3rd and 4th grade
Sat Apr 25 22:01:41 +0000 2020,"What is the purpose of having White House News Conferences when the Lamestream Media asks nothing but hostile questions, amp then refuses to report the truth or facts accurately. They get record ratings, amp the American people get nothing but Fake News. Not worth the time amp effort",7.39,7.2,9.8,72.16,3,10.55,9th and 10th grade
Sat Apr 25 20:30:42 +0000 2020,"Was just informed that the Fake News from the Thursday White House Press Conference had me speaking amp asking questions of Dr. Deborah Birx. Wrong, I was speaking to our Laboratory expert, not Deborah, about sunlight etc. amp the CoronaVirus. The Lamestream Media is corrupt amp sick",8.11,8.2,10.2,64.0,3,10.9,8th and 9th grade
Sat Apr 25 15:59:22 +0000 2020,"If the Wall Street Journal Editorial writers had called, as they should have, they would have easily found that I was NOT happy with the Georgia Governor on Tuesday night. You said the opposite, and got it wrong as you often do",7.31,9.1,9.9,67.08,2,7.83,7th and 8th grade
Sat Apr 25 15:06:08 +0000 2020,"The Do Nothing Democrats are spending much of their money on Fake Ads. I never said that the CoronaVirus is a Hoax , I said that the Democrats, and the way they lied about it, are a Hoax. Also, it did start with one person from China , and then grew, amp will be a Miracle end",5.41,5.7,6.6,86.74,3,5.05,5th and 6th grade
Sat Apr 25 14:57:29 +0000 2020,"We have now Tested more than 5 Million People. That is more than any other country in the World, and even more than all major countries combined",6.06,5.0,5.9,83.15,2,7.07,5th and 6th grade
Sat Apr 25 14:51:54 +0000 2020,"It is a wonderful feeling to know that our States are loaded up with Ventilators, many brand new and high quality just off of our production lines, and that we are now in a position to help other countries that so desperately need them. Every person needing a Ventilator got one",8.0,12.1,12.4,54.05,2,8.59,11th and 12th grade
Sat Apr 25 14:10:21 +0000 2020,"Just spoke to Prime Minister Abiy Ahmed Ali of Ethiopia. His Country needs Ventilators, and the U.S. is in good position to help him. We will",6.1,4.8,6.1,83.66,2,6.6,6th and 7th grade
Sat Apr 25 12:59:20 +0000 2020,"Many testing sites are, and have been, open amp available. Just passed 5 Million Tests, far more than any other country in the world. In fact, more than all other major countries combined Don t believe the Fake News",5.9,4.8,6.5,83.66,3,7.24,5th and 6th grade
Sat Apr 25 12:45:55 +0000 2020,Thank you to the people of Colorado for the warm and gracious notes and letters sent to me for all of the Ventilators we got for you. It was my great honor,5.91,6.0,4.8,80.62,2,4.7,5th and 6th grade
Sat Apr 25 12:20:16 +0000 2020,. is a total winner,7.78,7.2,-1.9,50.5,1,-2.91,1st and 2nd grade
Sat Apr 25 12:14:56 +0000 2020,Thank you to William Perry Pendley of the Bureau of Land Management. Great job on describing some of the most beautiful land in the world,7.41,5.8,6.1,75.71,2,7.82,6th and 7th grade
Fri Apr 24 20:51:16 +0000 2020,I will be having a White House Press Conference today at 5 30 P.M. Thank you,5.42,6.0,4.5,80.62,1,3.83,5th and 6th grade
Fri Apr 24 19:08:09 +0000 2020,"I will never let our Post Office fail. It has been mismanaged for years, especially since the advent of the internet and modern day technology. The people that work there are great, and we re going to keep them happy, healthy, and well",6.55,6.5,6.9,73.88,3,7.36,6th and 7th grade
Fri Apr 24 14:59:34 +0000 2020,"Great conversation with President Lenin Moreno of the Republic of Ecuador. We will be sending them desperately needed Ventilators, of which we have recently manufactured many, and helping them in other ways. They are fighting hard against CoronaVirus",9.25,9.4,11.3,50.12,3,13.73,13th and 14th grade
