created_at,text,dale_chall_readability_score,flesch_kincaid,automated_readability,flesch_reading,sentence_count,coleman_liau_index,based_on_all_algorithms
Fri Aug 10 04:47:07 +0000 2018,"Oh like you couldn't imagine, simply INCREDIBLE",10.75,9.6,9.7,38.99,1,12.36,9th and 10th grade
Fri Aug 10 04:46:36 +0000 2018,Yes I have,0.15,-2.7,-7.5,119.19,1,-10.09,0th and 1st grade
Fri Aug 10 04:45:56 +0000 2018,ohhh it's gonna be Rowdy Rathore,6.57,0.9,2.8,99.23,1,4.28,2nd and 3rd grade
Fri Aug 10 04:44:07 +0000 2018,Hi,0.05,-3.5,-11.6,121.22,1,-33.81,-1th and 0th grade
Fri Aug 10 04:43:55 +0000 2018,To do more and more and more and more and more annndddd a little bit more,5.42,3.6,3.7,97.54,1,3.48,3rd and 4th grade
Fri Aug 10 04:42:32 +0000 2018,The beach,0.1,-3.1,-1.7,120.21,1,-7.41,-1th and 0th grade
Fri Aug 10 04:42:01 +0000 2018,"Of course I eat street food, but only on Sundays",5.71,2.5,1.9,95.17,1,3.28,3rd and 4th grade
Fri Aug 10 04:41:09 +0000 2018,I promote what is good for our country,6.01,2.9,0.8,88.74,1,2.86,2nd and 3rd grade
Fri Aug 10 04:39:40 +0000 2018,I would've wanted to join the army or coach youngsters in martial arts,7.93,3.6,6.1,92.12,1,7.24,5th and 6th grade
Fri Aug 10 04:37:55 +0000 2018,My son,0.1,-3.1,-8.8,120.21,1,-16.11,-1th and 0th grade
Fri Aug 10 04:36:33 +0000 2018,That's a tricky one but I'd have to say or maybe or p,0.64,1.3,-0.2,109.04,1,-0.78,-1th and 0th grade
Fri Aug 10 04:32:54 +0000 2018,Happy birthday lt 3,0.2,3.7,-0.7,75.88,1,0.0,-1th and 0th grade
Fri Aug 10 04:32:07 +0000 2018,Most memorable...scoring the only goal that I shoot in the film,7.05,6.4,6.8,68.77,1,7.93,7th and 8th grade
Fri Aug 10 04:30:06 +0000 2018,"Hi guys, here I am...let's begin AskAkshay",6.24,3.7,6.3,81.29,1,5.75,5th and 6th grade
Fri Aug 10 03:54:23 +0000 2018,"Planning a AskAkshay session at 10 am today, so keep your questions ready. Chat you all sooner than later",9.09,4.6,4.9,78.75,2,6.87,4th and 5th grade
Thu Aug 09 09:50:22 +0000 2018,"There's nothing as unpredictable as England weather...rain, sun, rain is bound to give anyone a cold braved it all for Gold, in cinemas on 15th August. 6DaysToGold",7.31,11.5,15.9,60.99,1,10.74,11th and 12th grade
Thu Aug 09 07:46:36 +0000 2018,"When your eyes speak the language of love BolteParini, Naino Ne Baandhi Bengali version out now",8.38,6.0,10.1,80.62,1,11.08,5th and 6th grade
Thu Aug 09 05:11:54 +0000 2018,"Nomoshkar Kolkata In your city today on this beautiful morning with Kemon achhish A special treat coming up for our Bengali fans, stay tuned",6.8,9.1,13.6,72.5,1,11.03,9th and 10th grade
Wed Aug 08 15:47:09 +0000 2018,Be the first one to GoForGold Advance booking opens this Friday. Gold in cinemas on 15th August.,7.77,5.4,5.0,71.31,2,7.27,4th and 5th grade
Wed Aug 08 07:54:10 +0000 2018,"When you're happy and you know it 'Take Your Clothes Off ' TeamTalk with Find out why he has no clothes on, on 15th August. 7DaysToGold",1.87,8.3,11.8,79.94,1,7.38,7th and 8th grade
Tue Aug 07 11:35:15 +0000 2018,"Swag mera desi Tapan Das, one of my most interesting onscreen character coming to you on 15th August. 8DaysToGold",7.9,9.5,11.6,60.65,1,11.08,11th and 12th grade
Tue Aug 07 09:32:27 +0000 2018,"Wondering what am I celebrating YOU ALL Delighted to share, we are now a family of 20 MILLION AKKIANS on Instagram Thank you for being there with me as we cross such milestones together. Love amp prayers",6.69,8.1,9.1,69.62,2,8.59,8th and 9th grade
Tue Aug 07 06:31:07 +0000 2018,"Foot tapping music, crazy lyrics, a hook step and Monobina make this song pure Gold",6.49,4.4,7.7,90.09,1,8.05,7th and 8th grade
Tue Aug 07 04:56:11 +0000 2018,"Get ready to dance with Monobina on foot tapping jazz music, out at 12pm",6.59,4.0,5.4,91.11,1,6.14,5th and 6th grade
Mon Aug 06 11:16:32 +0000 2018,The whole family was walking on eggshells when she was writing this one and I for one am so glad she is finally done Pre order Pyjamas Are Forgiving at Amazon Flipkart,7.69,13.4,14.6,55.92,1,7.96,7th and 8th grade
Mon Aug 06 09:34:05 +0000 2018,"Just another day of eating, sleeping and breathing Gold GoldPromotions",10.45,9.6,12.3,44.41,1,16.04,9th and 10th grade
Mon Aug 06 05:33:02 +0000 2018,. your reaction was Gold Still remains the best prank played on you,6.86,4.4,6.1,84.68,1,7.93,6th and 7th grade
Mon Aug 06 05:33:02 +0000 2018,. your reaction was Gold Still remains the best prank played on you,6.86,4.4,6.1,84.68,1,7.93,6th and 7th grade
Sat Aug 04 13:40:45 +0000 2018,This mean machine is the newest addition in the family. Join the tribe with the latest AfricanTwin 2018 and experience true adventure,7.05,6.4,8.0,68.77,2,10.83,7th and 8th grade
Sat Aug 04 05:47:30 +0000 2018,"A lot more than just lights, camera, action...watch this making of video to know how the WorldOfGold came to life",7.0,7.6,10.7,76.56,1,8.53,6th and 7th grade
Fri Aug 03 08:00:42 +0000 2018,"No matter what the sport, it takes teamwork to accomplish even the smallest victory. I know because team Gold had a hard but fun time doing this. Can you unite your team and take up the GoldBinChallenge",6.38,4.5,5.9,84.37,3,7.41,5th and 6th grade
Thu Aug 02 12:54:49 +0000 2018,Recently saw an inspiring short film titled ChaloJeeteHain. Loved its underlying philosophy 'Woh hi jeete hai jo doosron ke liye jeete hai.' So simple yet so powerful.,8.18,6.8,7.7,62.34,3,10.18,7th and 8th grade
Thu Aug 02 05:30:10 +0000 2018,"Good News That's the name of our film and so is the news I am sharing It is a dramedy Due Date 19th July, 2019. GoodNews KareenaKapoorKhan CapeOfGoodFilms",7.15,5.2,7.0,82.65,2,7.82,6th and 7th grade
Wed Aug 01 09:45:04 +0000 2018,"Experience the victory, larger than life Gold in on 15th August.",7.05,7.6,7.2,60.31,1,8.97,7th and 8th grade
Wed Aug 01 09:04:41 +0000 2018,Experience Gold in IMAX this 15th August. Watch GoldIMAXTrailer now,7.04,5.2,8.4,66.4,2,11.34,7th and 8th grade
Wed Aug 01 04:28:27 +0000 2018,"Had a great time working on this ad for Twinz from Just like the biscuit which offers TasteMeinNayaTwist, watch out for the fun twist at the end. It is seriously wicked",6.44,5.8,7.3,81.12,2,7.89,7th and 8th grade
Tue Jul 31 10:30:33 +0000 2018,Excited to share the news that you can experience Gold in IMAX. Watch the new 60 sec trailer launching with IMAX tomorrow. Stay tuned GoldIMAXTrailer,6.57,4.2,6.3,79.97,3,9.18,6th and 7th grade
Tue Jul 31 08:32:09 +0000 2018,"Loved the GoldFanmadeTrailer...hard not to smile after watching this Kudos to the efforts of Akola Akkians, you guys never fail to amaze me. Love and appreciate all your efforts",7.62,7.8,10.0,65.22,2,10.95,7th and 8th grade
Tue Jul 31 02:47:37 +0000 2018,200SaalKaBadla,19.48,32.0,45.0,-132.59,1,35.8,31st and 32nd grade
Mon Jul 30 15:33:42 +0000 2018,"Interviews, chatter and an eyebrow raising fun kinda day for Gold promotions today.",9.14,9.5,10.8,49.82,1,12.63,10th and 11th grade
Mon Jul 30 12:03:47 +0000 2018,A Golden Moment with my Team Gold GoldPromotions,6.01,6.4,6.7,63.36,1,10.11,6th and 7th grade
Mon Jul 30 09:11:18 +0000 2018,", MotarichaChaak. Chumbak now in cinemas SahilJadhav SangramDesai",15.26,14.3,21.1,5.15,1,26.46,14th and 15th grade
Sat Jul 28 07:32:38 +0000 2018,Excited to meet the Asian Games athletes this afternoon.,5.84,6.8,8.2,62.34,1,11.22,5th and 6th grade
Fri Jul 27 13:21:56 +0000 2018,"First a super cop and now a super author Congratulations for BiharDiaries, it is as real as it gets. A gripping and interesting read.",6.86,6.8,6.1,67.76,2,7.7,6th and 7th grade
Fri Jul 27 06:44:45 +0000 2018,"Likewise, was lovely meeting you as well and thank you for your wishes for Chumbak",7.54,5.6,7.4,81.63,1,8.05,5th and 6th grade
Fri Jul 27 06:43:31 +0000 2018,Thank you so much for your love Awaiting your review of Chumbak,6.86,4.4,5.0,84.68,1,6.95,4th and 5th grade
Thu Jul 26 13:31:55 +0000 2018,One of my most nonsensical meeting...watch to know what happened when I met for Gold promotions,7.39,8.4,10.1,63.7,1,10.32,10th and 11th grade
Wed Jul 25 11:40:49 +0000 2018,"Here s the winning anthem of this year, GharLayengeGold",9.35,4.4,7.7,79.26,1,10.58,4th and 5th grade
Wed Jul 25 03:49:33 +0000 2018,So glad to know Chumbak struck a chord with you,5.71,1.3,1.5,103.63,1,3.28,3rd and 4th grade
Tue Jul 24 08:30:54 +0000 2018,"Join the Gold group on Facebook, its exclusive",7.98,4.1,5.6,80.28,1,7.9,7th and 8th grade
Mon Jul 23 12:51:02 +0000 2018,Watch Tapan Das proposal in this new dialogue promo from Gold,8.49,6.4,5.9,68.77,1,8.45,5th and 6th grade
Mon Jul 23 04:30:51 +0000 2018,My quirkiest character ever Here s how we made him MakingofTapanDas,8.49,7.6,8.5,60.31,1,11.58,7th and 8th grade
Sun Jul 22 09:14:26 +0000 2018,"Another beautiful holiday comes to an end and before getting back to the grind, cherishing some precious moments from the past month...until the next one lifelines",7.36,12.3,16.6,53.55,1,12.89,16th and 17th grade
Sat Jul 21 16:54:32 +0000 2018,"One of those days when a news brings tears of joy as a cause close to ur heart gets fulfilled.Thank you, GSTCouncil,for understanding the need for menstrual hygiene amp exempting sanitary pads from tax. I'm sure crores of women in our country are silently sending gratitude ur way",8.12,10.3,13.4,64.04,2,10.57,14th and 15th grade
Fri Jul 20 11:33:15 +0000 2018,"A song for every emotion. GoldJukebox, out now",7.78,3.7,3.6,75.88,2,3.65,3rd and 4th grade
Fri Jul 20 07:34:10 +0000 2018,"Harpic mein mil gaya hai mujhe HarGharSwachh mission ka perfect partner. Har ghar mein banegi, ek saaf Toilet ki pratha Ab agla ghar aapka. Be ready",7.93,4.8,7.3,83.66,2,8.63,5th and 6th grade
Wed Jul 18 09:14:42 +0000 2018,Who wore it better BehindTheScenes Gold,6.57,2.1,8.3,90.77,1,12.05,1st and 2nd grade
Tue Jul 17 12:07:13 +0000 2018,"KhechaKhechi Watch this fun song from releasing on 27th July, 2018 gt ChumbakTheFilm SahilJadhav SangramDesai",8.59,10.3,15.9,47.79,1,18.49,10th and 11th grade
Fri Jul 13 13:37:20 +0000 2018,GharLayengeGold coming out soon...,7.78,7.2,17.1,50.5,1,17.4,7th and 8th grade
Thu Jul 12 18:14:14 +0000 2018,Historic Congratulations Hima Das for winning India's first Gold at a global track event in Under 20 World Athletics. Nicely done,10.69,11.5,13.5,50.16,1,12.3,11th and 12th grade
Thu Jul 12 06:32:22 +0000 2018,Let your feet dance kyunki ChadGayiHai is out Watch my moves and then send me yours,6.4,4.8,6.6,89.08,1,7.07,6th and 7th grade
Wed Jul 11 10:29:42 +0000 2018,Kya dekh rahe ho ChadGayiHai kya Song out tomorrow.,7.59,6.8,5.6,62.34,1,8.03,7th and 8th grade
Wed Jul 11 06:30:44 +0000 2018,Excuse my typossss kyusjiii mujhkkkko...,13.36,7.6,15.0,49.48,1,16.56,1st and 2nd grade
Tue Jul 10 17:10:14 +0000 2018,"Get ready for the ultimate clash, 2Point0 on 29th November, 2018",5.62,5.2,7.2,77.23,1,8.97,6th and 7th grade
Tue Jul 10 07:20:32 +0000 2018,Here's the first song from ChumbakTitleTrack. Chumbak Chitak Chikatla ChumbakTheFilm SahilJadhav SangramDesai,13.14,12.7,20.1,14.63,2,25.57,12th and 13th grade
Mon Jul 09 15:26:34 +0000 2018,Hope you row far with your oar. Wishing you lots of love and luck Kapoor King,5.02,0.5,0.8,105.66,2,2.45,0th and 1st grade
Mon Jul 09 10:02:29 +0000 2018,"It's time to be a Silver Fox, break funny bone and play every game under the sun with my buddy Because the Boyz are Back with 4 Times the Fun HouseFull4",6.19,11.8,12.6,65.39,1,5.76,5th and 6th grade
Sun Jul 08 09:56:10 +0000 2018,To be comfortable in one's own skin...a life lesson we all need to be reminded of from time to time.,6.21,7.6,7.6,76.56,1,4.76,7th and 8th grade
Sun Jul 08 06:31:10 +0000 2018,Ab sabki battery rahegi full. Revital H keeps me fully charged amp energetic always. So go get your energy boost with KeepsYouCharged,9.02,7.3,6.2,55.61,3,9.06,9th and 10th grade
Sat Jul 07 07:59:08 +0000 2018,"When people ask me what makes me do films like Pad Man, Toilet etc. the answer is right here, the power of cinema...so happy to see this",1.92,10.3,11.2,69.45,1,5.35,10th and 11th grade
Fri Jul 06 11:44:50 +0000 2018,And here is Gold's first song and my personal favourite NainoSeBaandhi out now YasserDesai,7.71,6.4,11.5,74.19,1,13.62,7th and 8th grade
Fri Jul 06 09:31:28 +0000 2018,Tune in for the GoldRoyalCelebration today at 4 pm,5.84,9.2,5.1,45.42,1,8.03,8th and 9th grade
Fri Jul 06 07:19:22 +0000 2018,One word that comes to mind for DYNAMITE Dynamic personality and vibes which always make you smile. Wishing you a very happy birthday and an explosive year ahead,7.15,7.6,8.1,65.73,2,9.68,7th and 8th grade
Fri Jul 06 05:28:14 +0000 2018,"When words fail, let the eyes do the talking. Our first song, NainoNeBaandhi will be out today. YasserDesai",6.71,3.3,6.6,87.72,2,8.67,6th and 7th grade
Thu Jul 05 11:04:40 +0000 2018,"A film that moved me so much that for the first time ever I decided to lend my name to a film. So here it is, Akshay Kumar proudly presents, the ChumbakTrailer . SahilJadhav SangramDesai",7.73,7.6,8.1,71.14,2,7.65,7th and 8th grade
Thu Jul 05 08:40:43 +0000 2018,"When he starts playing, the opposition becomes the spectator. Meet Raghubir Pratap Singh.",11.25,7.0,9.7,56.42,2,12.76,9th and 10th grade
Thu Jul 05 06:41:33 +0000 2018,"Iske sirf naam mein hi nahi, game mein bhi bohot Himmat hain Meet Himmat Singh.",6.49,4.4,6.5,90.09,1,6.49,6th and 7th grade
Thu Jul 05 06:35:51 +0000 2018,A true leader and a great player. Meet Imtiaz.,5.84,4.4,2.9,79.26,1,4.14,4th and 5th grade
Thu Jul 05 06:33:22 +0000 2018,"A brother, a friend and the coach of the dream team. Meet Samrat.",5.5,3.6,4.3,92.12,1,4.16,5th and 6th grade
Thu Jul 05 06:30:37 +0000 2018,"Meet Mrs. Monobina Das, my wife.",6.57,0.9,2.8,99.23,1,2.37,1st and 2nd grade
Thu Jul 05 04:27:54 +0000 2018,Caught Wicked the musical at TheWestEnd and what a WICKED performance it was Hats off to the unbelievable effort these incredibly talented women put on stage. I'd be dead if I had to work as hard as them. Respect,7.84,8.5,9.3,68.6,2,8.12,8th and 9th grade
Wed Jul 04 15:18:12 +0000 2018,"Chumbak, a story of dreams and choices made to fulfil those dreams. ChumbakTrailer out tomorrow at 4.30 pm. SahilJadhav SangramDesai",8.87,8.4,10.2,52.87,2,12.85,9th and 10th grade
Mon Jul 02 04:30:01 +0000 2018,"Ab har ghar mein banegi, ek saaf Toilet ki pratha Join me in the Clean India mission with to make clean and hygienic toilets a reality for all HarGharSwachh",8.89,12.2,13.8,58.96,1,8.72,8th and 9th grade
Sat Jun 30 12:35:55 +0000 2018,"Heartiest congratulations to this little 12 year old champ, Vedika Amin for swimming her way to not just one but four golds, one silver and setting three new national records at the 45th Junior National Aquatic Championships So happy and proud of you",7.97,17.7,22.9,44.75,1,11.39,17th and 18th grade
Sat Jun 30 10:12:21 +0000 2018,Time to get ready for the next Blockbuster Mission Toilet2 Iss baar badlega poora desh Coming soon.,9.12,7.6,10.1,71.14,1,10.38,7th and 8th grade
Thu Jun 28 06:30:00 +0000 2018,"Life is a never ending battle of choices. Here's the glimpse of a sweet story, Chumbak which is bound to stick to your heart. Presenting the ChumbakTeaser SahilJadhav SangramDesai",7.38,5.9,7.9,70.09,3,10.65,5th and 6th grade
Wed Jun 27 06:30:00 +0000 2018,"Here it is the poster of our film Chumbak featuring characters Baalu, Disco Prasanna. ChumbakTeaser out tomorrow at 12 pm. Stay tuned SahilJadhav SangramDesai",9.3,7.6,9.1,54.9,3,12.25,11th and 12th grade
Wed Jun 27 05:54:24 +0000 2018,Thank you,0.1,-3.1,-1.7,120.21,1,-7.41,-1th and 0th grade
Wed Jun 27 05:54:09 +0000 2018,Thank you,0.1,-3.1,-1.7,120.21,1,-7.41,-1th and 0th grade
Wed Jun 27 05:49:45 +0000 2018,Thank you so much,0.2,-2.3,-3.0,118.18,1,-2.91,-1th and 0th grade
Wed Jun 27 05:49:09 +0000 2018,Thank you Sonu,0.15,-2.7,-1.2,119.19,1,-2.38,0th and 1st grade
Tue Jun 26 11:25:01 +0000 2018,Thank you Huma,9.05,0.9,-1.2,93.81,1,-2.38,0th and 1st grade
Tue Jun 26 11:24:19 +0000 2018,Thank you Sid,0.15,-2.7,-2.7,119.19,1,-4.29,0th and 1st grade
Tue Jun 26 06:47:28 +0000 2018,Thank you Varun,0.15,-2.7,0.5,119.19,1,-0.46,0th and 1st grade
Tue Jun 26 06:26:24 +0000 2018,Thank you Bhumi,9.05,0.9,0.5,93.81,1,-0.46,0th and 1st grade
Tue Jun 26 06:25:54 +0000 2018,Thank you,0.1,-3.1,-1.7,120.21,1,-7.41,-1th and 0th grade
Tue Jun 26 06:24:16 +0000 2018,Thank you,0.1,-3.1,-1.7,120.21,1,-7.41,-1th and 0th grade
Tue Jun 26 06:23:30 +0000 2018,Thank you Karan,0.15,-2.7,0.5,119.19,1,-0.46,0th and 1st grade
Tue Jun 26 06:21:26 +0000 2018,Thank you,0.1,-3.1,-1.7,120.21,1,-7.41,-1th and 0th grade
Tue Jun 26 06:20:16 +0000 2018,Thank you,0.1,-3.1,-1.7,120.21,1,-7.41,-1th and 0th grade
Tue Jun 26 06:19:52 +0000 2018,Thank you Esha,9.05,0.9,-1.2,93.81,1,-2.38,0th and 1st grade
Tue Jun 26 06:19:26 +0000 2018,Thank you,0.1,-3.1,-1.7,120.21,1,-7.41,-1th and 0th grade
Tue Jun 26 06:18:27 +0000 2018,Thank you,0.1,-3.1,-1.7,120.21,1,-7.41,-1th and 0th grade
Tue Jun 26 06:17:41 +0000 2018,Thank you,0.1,-3.1,-1.7,120.21,1,-7.41,-1th and 0th grade
Tue Jun 26 06:17:13 +0000 2018,Thank you Neil,0.15,-2.7,-1.2,119.19,1,-2.38,0th and 1st grade
Tue Jun 26 06:16:15 +0000 2018,Thanks Atul,11.63,2.9,3.1,77.91,1,-1.61,-1th and 0th grade
Tue Jun 26 05:55:33 +0000 2018,Dhanyavaad bhaji,11.63,2.9,14.9,77.91,1,12.9,-1th and 0th grade
Tue Jun 26 05:54:43 +0000 2018,Thank you,0.1,-3.1,-1.7,120.21,1,-7.41,-1th and 0th grade
Tue Jun 26 05:54:26 +0000 2018,Glad you liked it,0.2,-2.3,-3.0,118.18,1,-2.91,-1th and 0th grade
Tue Jun 26 05:53:52 +0000 2018,Thank you,0.1,-3.1,-1.7,120.21,1,-7.41,-1th and 0th grade
Tue Jun 26 05:53:04 +0000 2018,Thank you Rohit,9.05,0.9,0.5,93.81,1,-0.46,0th and 1st grade
Mon Jun 25 04:31:46 +0000 2018,"Winners under British India, Legends under Free India. Witness the golden era of Indian Hockey through Gold. GoldTrailer Out Now",8.71,7.1,7.6,56.21,3,10.5,7th and 8th grade
Sat Jun 23 11:57:12 +0000 2018,"Join the dream team. Say hi to me on my Facebook messenger and I ll message you the GoldTrailer on Monday, 25th June.",6.27,4.2,3.8,85.18,2,4.74,5th and 6th grade
Fri Jun 22 10:12:11 +0000 2018,"One generation dreamt it, the other achieved it. GoldTrailer out on 25th June at 10 am. GOLD TRAILER IN 3DAYS",6.34,3.5,3.1,81.59,3,4.99,3rd and 4th grade
Fri Jun 22 05:33:12 +0000 2018,"And finally introducing the character which compelled me to present this film, the multi talented as Prasanna from",9.79,11.5,13.0,44.75,1,13.34,12th and 13th grade
Wed Jun 20 06:33:12 +0000 2018,"Another new find, meet SangramDesai who plays Disco, Baalu's friend and partner in crime in",6.49,6.8,10.2,73.17,1,10.72,6th and 7th grade
Tue Jun 19 06:30:42 +0000 2018,"The dream that united our nation, The dream that began in 1936, The dream that took 12 years to become a reality. Get ready to witness... GoldTrailer releasing on the 25th of June",6.57,5.2,5.0,77.23,3,6.3,5th and 6th grade
Mon Jun 18 09:12:46 +0000 2018,"Presenting SahilJadhav, our Baalu from",10.2,7.6,13.1,49.48,1,16.56,7th and 8th grade
Sun Jun 17 12:21:23 +0000 2018,"Been reading and loving your innovative suggestions. Meanwhile found a quick fix, keeping Nitara entertained being her unicorn pin board Happiness is in all these little moments",9.57,9.7,11.6,49.31,2,14.14,9th and 10th grade
Sun Jun 17 05:25:03 +0000 2018,"Help It's FathersDay and the little one asks Dad, can I have a pet My fatherly love taking over, Of course Beta what would you like She, Dad, can you get me a Unicorn with wings Any suggestions DaddysLilGirl",8.0,15.0,18.5,57.27,1,7.73,7th and 8th grade
Sat Jun 16 09:19:25 +0000 2018,Thank you,0.1,-3.1,-1.7,120.21,1,-7.41,-1th and 0th grade
Sat Jun 16 09:18:53 +0000 2018,You're too kind Thank you so much Rana,0.4,-0.8,0.8,114.12,1,2.1,-1th and 0th grade
Sat Jun 16 09:17:22 +0000 2018,Thank you,0.1,-3.1,-1.7,120.21,1,-7.41,-1th and 0th grade
Sat Jun 16 09:16:45 +0000 2018,Thank you,0.1,-3.1,-1.7,120.21,1,-7.41,-1th and 0th grade
Sat Jun 16 09:15:53 +0000 2018,Thank you Dia,0.15,-2.7,-2.7,119.19,1,-4.29,0th and 1st grade
Sat Jun 16 09:15:09 +0000 2018,Thank you,0.1,-3.1,-1.7,120.21,1,-7.41,-1th and 0th grade
Sat Jun 16 08:22:40 +0000 2018,"Wishing you and your family love, peace and prosperity in abundance. EidMubarak",9.5,10.3,11.3,42.38,1,13.73,10th and 11th grade
Fri Jun 15 13:06:50 +0000 2018,"Thank you everyone for all the love and support pouring in for the special unit of Gold...sharing it here, on popular demand It's time to StandUpForGold",9.18,12.3,14.6,53.55,1,10.22,9th and 10th grade
Wed Jun 13 03:51:21 +0000 2018,Desh banta hai jab sab deshvasiyon ki aankhon mein ek sapna hota hai. Gold15Aug,8.84,6.4,7.8,74.19,1,9.04,6th and 7th grade
Mon Jun 11 08:47:30 +0000 2018,"Came across something very honest and pure...it has been stuck in my head like Chumbak, thought of sharing it with you all. , . ChumbakTheFilm",6.84,9.9,14.2,65.05,1,11.03,10th and 11th grade
Sat Jun 09 11:16:22 +0000 2018,"Happiest birthday dear This has been a great year, wishing you even more happiness and success superseding it with every year",7.69,10.3,12.6,58.62,1,11.43,12th and 13th grade
Sat Jun 09 08:11:52 +0000 2018,Thank you audiences in China for your appreciation for 'Toilet Hero' delighted to receive so much love,8.19,9.9,10.9,54.22,1,11.08,9th and 10th grade
Sat Jun 09 05:30:00 +0000 2018,"When says ZeroDefect, they mean it. Had a blast shooting for their new ad, so will you while watching it, that s a ZeroDefectGuarantee",6.86,5.6,6.4,76.22,2,7.7,5th and 6th grade
Wed Jun 06 12:01:16 +0000 2018,"My dear friend, Shabina Khan's show ZindagiKeCrossroads starts tonight. It is about the difficult situations you face in life and the important decisions you take. Don't forget to catch it on tonight at 8 30 PM on",6.38,5.7,7.2,75.91,3,8.8,6th and 7th grade
Wed Jun 06 05:34:06 +0000 2018,Delighted that our film ToiletEkPremKatha is continuing to break new grounds and is all set to release as Toilet Hero across 4300 screens in China on 8th June.,7.28,10.7,14.8,68.44,1,10.16,10th and 11th grade
Tue Jun 05 11:59:04 +0000 2018,"Take pride in our rich heritage of Ayurveda, dating back to 5000 years. 'Garv Se Apnaiye Sahi Ayurveda' with SahiAyurveda",9.37,8.7,12.6,68.1,1,11.14,8th and 9th grade
Sun Jun 03 03:36:06 +0000 2018,Honoured to associate with and take forward the 'Road Safety' movement. I sincerely hope the campaign will bring about a behavioral change towards traffic amp road safety and in turn help save precious lives.,8.66,7.6,11.3,71.14,2,11.6,8th and 9th grade
Sat Jun 02 15:23:48 +0000 2018,"I'm always for health and all things healthy. Glad to associate with Svarn Saathi, a product made with active natural ingredients in the right composition which helps counter the ill effects of bad habits like smoking, alcohol and tobacco.",8.25,9.7,12.6,60.14,2,11.89,12th and 13th grade
Wed May 30 15:42:39 +0000 2018,Absolutely So proud of you brother heard you've done a swell job in Parmanu...gonna catch it real soon. Hugs,6.24,8.3,10.4,69.11,1,8.65,8th and 9th grade
Tue May 29 05:52:26 +0000 2018,Menstrual Hygiene is every woman's need and right. Very inspiring to meet these 9 Pad Heroes who have been diligently working towards bridging the menstrual hygiene gap from 18to82 at Menstrual Hygiene Conclave yesterday. NotAllHeroesWearCapes,9.47,11.3,15.4,45.25,2,16.59,11th and 12th grade
Sat May 26 05:15:59 +0000 2018,"Sahi paagalpan bhi ek superpower hain Watch the inspiring story of a mad man who went on to become Pad Man. Catch the World TV Premiere of Pad Man with your entire family, tonight at 8 PM, only on PadManOnZeeCinema.",7.0,8.7,9.3,68.1,2,7.66,8th and 9th grade
Wed May 16 13:18:23 +0000 2018,My new look for as Money Singh. Coming Soon,0.45,2.1,1.4,96.18,1,2.87,3rd and 4th grade
Sun May 13 09:10:53 +0000 2018,"As the Sun sets in our Home, the Light within us Shines because of this very Woman. Our Mom Our Hero Our reason for Eternal SunShine Happy MothersDay Everyone",5.99,6.6,6.9,73.68,2,7.71,6th and 7th grade
Sun May 13 07:06:10 +0000 2018,The mother of my children always has a different way of looking at everything. Here's her usually unusual take on MothersDay,7.16,8.6,7.1,52.36,2,9.43,9th and 10th grade
Fri May 11 10:35:43 +0000 2018,"Always believed, be the change you want to see Proud of her too, kudos to you Vaani.",6.34,5.2,5.9,88.06,1,4.58,5th and 6th grade
Fri May 11 10:30:00 +0000 2018,Free Credit Report. Every Month. Always. Here s the first look of my campaign with Lot of exciting stuff coming up. Watch out,5.58,4.2,5.4,85.18,2,6.48,5th and 6th grade
Fri May 11 05:27:41 +0000 2018,"Theatre Ke Baad, Pehli Baar, watch PadManOnZEE5 and make a difference to someone's life. Subscribe to amp Rs. 5 from your subscription will be donated to Saafkins. Kadam Chota, Change Bada.",8.22,4.9,7.9,77.94,3,9.49,8th and 9th grade
Thu May 10 10:30:01 +0000 2018,Happy to announce my association with and Was good fun playing a new age Yamraj Your thoughts,8.19,8.7,8.4,62.68,1,8.7,8th and 9th grade
Thu May 10 06:28:11 +0000 2018,"ONLY 18 of Indian women use sanitary napkins vs 82 who use unhygienic means. I support the which breaks the taboos amp encourages conversations on periods. Help bridge the gap from 18to82, register on",8.38,7.7,7.4,60.01,3,9.49,7th and 8th grade
Tue May 08 10:46:22 +0000 2018,Here's a glimpse of an interesting new avatar I donned for Coming soon,0.64,4.8,6.1,83.66,1,7.24,6th and 7th grade
Mon May 07 10:33:39 +0000 2018,Make women strong only then will the country be strong latest initiative wherein for your every post tweet using Padathon tagging they will donate Rs.10 to the cause of women s menstrual hygiene. It's time for you too to be a PADMAN,8.44,9.1,10.5,67.08,2,8.7,8th and 9th grade
Sun May 06 15:26:35 +0000 2018,"At KhasdarKridaMahotsav ,a unique multi sport event to help showcase talent at the grassroots level. Kudos to Hon. ji for providing this platform, Hon. ji amp Pullela Gopichand for their support.Hope it helps to bring more sporting talent to the forefront",9.27,10.1,13.5,59.13,2,12.3,9th and 10th grade
