created_at,text,dale_chall_readability_score,flesch_kincaid,automated_readability,flesch_reading,sentence_count,coleman_liau_index,based_on_all_algorithms
Sun Jun 01 15:31:31 +0000 2014,You've never seen me play like this riskeverything,6.01,5.2,7.9,71.82,1,10.8,7th and 8th grade
Sun Jun 01 11:19:12 +0000 2014,"Hey guys, check out the new cool wallpapers on my website.",7.05,4.0,4.6,85.69,1,5.78,5th and 6th grade
Sun Jun 01 09:46:30 +0000 2014,Were you one of the winners of my CR7underwear competition Check out,8.18,6.8,6.9,67.76,1,9.38,6th and 7th grade
Fri May 30 17:22:06 +0000 2014,"Very soon will reach a million users. To celebrate I will follow the millionth user, will it be you",6.6,3.5,3.4,87.21,2,5.07,3rd and 4th grade
Fri May 30 15:07:26 +0000 2014,"You asked Hola Cris, saludos desde Ecuador, xitos en el mundial, eres el mejor.",9.97,6.4,7.8,74.19,1,7.82,5th and 6th grade
Fri May 30 15:05:45 +0000 2014,You asked Can you say Ciao Chiara I'm italian,5.84,0.9,2.4,104.64,1,4.14,3rd and 4th grade
Fri May 30 15:04:41 +0000 2014,"You asked Say hello to me and my cousin Nicholas, we are huge friends My name is Brianne",5.41,4.4,6.1,95.51,1,4.99,4th and 5th grade
Fri May 30 15:03:42 +0000 2014,You asked Can you say hello to me My name is Narin and I am from Germany,6.34,5.2,2.6,88.06,1,1.51,5th and 6th grade
Fri May 30 15:00:36 +0000 2014,You asked Can you say hello to me My name is Maria,0.6,2.1,-0.2,101.6,1,0.68,0th and 1st grade
Fri May 30 14:59:57 +0000 2014,"You asked Hola idolo, como estas Puedes saludarme Me llamo Mayra y te apoyo desde Argentina idolo",10.98,8.7,9.5,62.68,1,9.74,8th and 9th grade
Fri May 30 14:58:54 +0000 2014,"You asked Ol , poderia mandar um abra o para uma grande f do Brasil",6.59,4.0,3.4,91.11,1,3.65,3rd and 4th grade
Fri May 30 13:40:45 +0000 2014,"On June 3rd, play for an exclusive trip to Brazil win top seats for the Final and much more.",6.24,6.0,6.4,86.03,1,4.7,5th and 6th grade
Fri May 30 11:19:49 +0000 2014,Download the official song of the Portuguese National Team by produced by,10.81,8.0,8.9,59.3,1,11.82,11th and 12th grade
Thu May 29 19:31:20 +0000 2014,"Here is the official song of the Portuguese National Team for the World Cup, performed by Kika. So uplifting",9.57,9.5,10.4,60.65,1,9.57,9th and 10th grade
Thu May 29 16:54:40 +0000 2014,"Today, the Sun publishes an interview with me that I never gave. So its content is pure fiction.",7.59,4.4,3.7,79.26,2,5.42,4th and 5th grade
Thu May 29 09:04:20 +0000 2014,"Behind the scenes of the Shooting, guess which model I chose",7.05,4.0,5.5,85.69,1,7.35,3rd and 4th grade
Wed May 28 21:01:26 +0000 2014,"Next week the National Team will be in the USA preparing the World Cup First up, Mexico at Gillette Stadium, June 6th.Come support Portugal",8.77,11.5,13.3,55.58,1,10.33,11th and 12th grade
Wed May 28 19:47:41 +0000 2014,Relaxing time.,11.63,8.8,10.2,35.61,1,4.2,11th and 12th grade
Wed May 28 14:41:30 +0000 2014,Taking a break to play the new GALAXY11 Striker Soccer game. Who's got next,6.24,1.3,2.9,98.21,2,4.94,2nd and 3rd grade
Tue May 27 14:45:36 +0000 2014,Thanks for the support Crazy days these last ones,5.84,0.9,4.5,104.64,1,7.39,3rd and 4th grade
Tue May 27 13:47:42 +0000 2014,"Play soon for an exclusive trip seats FINAL Rio, Brazil Follow amp register for a signed Team Shirt.",7.16,6.8,9.3,78.59,1,8.52,6th and 7th grade
Mon May 26 08:52:55 +0000 2014,We re Champions of Europe I m living a dream Thank you all halamadrid UCLfinal lisbon,9.36,9.5,7.2,55.24,1,7.83,9th and 10th grade
Sat May 24 23:04:33 +0000 2014,La D cima is ours. Hala Madrid uclfinal realmadrid lisbon,10.2,4.1,3.7,74.86,2,5.54,5th and 6th grade
Fri May 23 20:26:36 +0000 2014,Let's go team APorLaD cima,7.04,0.5,1.8,100.24,1,2.64,1st and 2nd grade
Fri May 23 11:57:02 +0000 2014,"Tomorrow will be a dream come true to play the final in Portugal, my welcoming country.",7.39,8.4,7.8,63.7,1,7.83,7th and 8th grade
Fri May 23 11:14:23 +0000 2014,"In the biggest game against our closest rivals, there is only one option. riskeverything",9.97,7.6,10.8,65.73,1,12.35,7th and 8th grade
Thu May 22 20:13:15 +0000 2014,Acabei de fazer as minhas previs es para o R. Madrid vs. A. Madrid no VivaRonaldo. E tu,7.59,3.3,1.4,87.72,2,2.23,3rd and 4th grade
Thu May 22 12:28:12 +0000 2014,Saturday we ll play APorLaD cima. Cheer for the team and predict the result on Sportlobster,7.98,4.1,4.9,80.28,2,7.55,7th and 8th grade
Wed May 21 14:17:39 +0000 2014,Hey all fans Come cheer us APorLaD cima. Your support is our strenght.,6.39,1.1,2.8,98.72,2,4.76,2nd and 3rd grade
Tue May 20 14:32:54 +0000 2014,Would u like to fly to the final in Brazil Pre register amp qualify to win a signed Team Shirt.,7.0,7.6,6.5,76.56,1,4.47,6th and 7th grade
Tue May 20 11:21:33 +0000 2014,Training for the final on Saturday APorLaD cima,9.95,6.4,6.1,63.36,1,9.35,9th and 10th grade
Mon May 19 20:18:34 +0000 2014,Brazil here we go For aPortugal,6.57,2.1,2.0,90.77,1,4.28,1st and 2nd grade
Mon May 19 14:18:57 +0000 2014,You asked Hello Cristiano Can you greet me. Your great fan from Mexico.,6.39,2.3,3.2,90.26,2,5.16,2nd and 3rd grade
Mon May 19 14:17:04 +0000 2014,You asked Hi Ronaldo I love you so much Please say hello to me I am from Turkey,5.41,5.6,3.8,87.05,1,2.38,5th and 6th grade
Mon May 19 14:13:19 +0000 2014,You asked Hi Cristiano how are you can you tell me Hello Sofia,5.5,3.6,3.2,92.12,1,4.16,5th and 6th grade
Mon May 19 14:10:21 +0000 2014,"You asked Hola Cristiano, puedes saludarme 'Hola Tito'",11.93,5.2,10.3,71.82,1,12.25,11th and 12th grade
Mon May 19 14:09:48 +0000 2014,You asked Can you say hello to me.My name is Elbasan.,5.62,4.0,2.5,85.69,1,3.17,3rd and 4th grade
Mon May 19 14:08:43 +0000 2014,"You asked Hi Cristiano, I m a big fan from Norway",7.05,2.9,0.8,94.15,1,1.55,4th and 5th grade
Mon May 19 13:58:10 +0000 2014,How fun it was to be part of this new commercial. Check out what happened behind the scenes.,5.84,2.1,2.7,96.18,2,4.49,5th and 6th grade
Sun May 18 16:01:04 +0000 2014,"Hi guys, is giving away 2 shirts signed by me Check for details. APorLaDecima",6.59,6.4,7.1,74.19,1,7.82,6th and 7th grade
Sat May 17 09:47:57 +0000 2014,Proud to be an ambassador for Football is my lobster WhatsYourLobster,8.49,8.8,9.3,51.85,1,12.62,8th and 9th grade
Fri May 16 13:57:23 +0000 2014,Great day shooting Rankin x Ronaldo for CR7Underwear with Can't wait to show you the new collection,8.19,7.6,10.1,71.14,1,10.38,10th and 11th grade
Thu May 15 14:54:25 +0000 2014,Know how it feels to be a winner Pre register at and qualify to win a Team Shirt signed by me.,6.18,6.8,5.6,84.0,1,2.9,5th and 6th grade
Wed May 14 17:21:01 +0000 2014,"Hey guys, have you checked out the different Fanzones on Sportlobster Choose yours amp follow me",6.4,7.2,10.4,72.16,1,11.42,8th and 9th grade
Wed May 14 13:32:43 +0000 2014,"Hey, how crazy was training today Have you ever gone against an 8 arm goalie before",5.42,6.0,6.6,80.62,1,6.73,6th and 7th grade
Wed May 14 11:41:04 +0000 2014,Morning training session,14.31,9.2,14.6,34.59,1,16.95,14th and 15th grade
Sat May 10 14:15:30 +0000 2014,I am pleased to see 95 of fans have predicted a win on Sportlobster. Have you made yours yet,5.77,2.3,1.6,95.67,2,3.22,1st and 2nd grade
Sat May 10 08:10:47 +0000 2014,I've been training with the best to take down aliens amp save the world. Stay tuned GALAXY11 GALAXYS5,4.96,0.9,5.1,104.64,2,7.39,3rd and 4th grade
Fri May 09 20:03:35 +0000 2014,Sabem o que quer dizer CR N o bem o que est o a pensar. A D. In rcia do BES diz vos.,5.58,1.9,-3.1,102.1,2,-3.57,4th and 5th grade
Fri May 09 15:54:28 +0000 2014,There are only a few days left to win one of the 5 pairs of CR7Underwear trunks signed by me Go to to enter,1.85,7.9,7.1,80.96,1,3.32,7th and 8th grade
Tue May 06 20:03:12 +0000 2014,N o imaginam a pergunta que a Dona In rcia me fez. Vejam em,7.71,6.4,1.1,74.19,1,0.75,7th and 8th grade
Tue May 06 14:37:05 +0000 2014,"I m pleased to see I have so many followers on Sportlobster Stay tuned, I ll be following some fans. Will it be you",5.55,4.4,2.6,84.68,2,3.58,3rd and 4th grade
Mon May 05 15:48:19 +0000 2014,"But stay tuned, because there's a lot more to come from You can join now at",0.79,3.6,4.2,97.54,1,3.48,3rd and 4th grade
Mon May 05 15:12:20 +0000 2014,A round of applause to International FC for winning Round One of The GAME by Ronaldo. Congrats guys,8.92,8.0,9.0,70.13,1,8.52,8th and 9th grade
Sun May 04 11:46:39 +0000 2014,Check out how revealed my new Flyknit Mercurial Superfly boots last week. riskeverything,10.35,9.5,12.6,49.82,1,15.3,9th and 10th grade
Sat May 03 20:07:12 +0000 2014,O que que eu e a Dona In rcia temos em comum Descubram em,6.59,4.0,0.4,91.11,1,0.34,-1th and 0th grade
Fri May 02 17:28:32 +0000 2014,Go to for your chance to win one of the 5 signed pairs of CR7Underwear trunks. Good luck.,5.41,4.4,6.4,95.51,1,4.99,4th and 5th grade
Wed Apr 30 10:51:06 +0000 2014,Living a dream Lisbon here we go thank you all for the amazing support roadtoLisbon HalaMadrid.,9.36,8.4,10.1,63.7,1,11.08,8th and 9th grade
Mon Apr 28 12:01:14 +0000 2014,Check out the gift I got from This TAG Heuer Carrera really suits me What do you think,5.41,5.6,5.6,87.05,1,4.64,5th and 6th grade
Fri Apr 25 18:25:39 +0000 2014,Winner stays RiskEverything,9.05,9.2,19.3,34.59,1,22.75,8th and 9th grade
Fri Apr 25 15:29:15 +0000 2014,Such an honour to be one of TIME's 100 most influential people.,6.86,5.6,5.0,76.22,1,6.02,5th and 6th grade
Thu Apr 24 16:48:44 +0000 2014,And even after May 1st you'll be able to continue playing on So stay tuned at,6.4,6.0,4.8,80.62,1,4.52,5th and 6th grade
Thu Apr 24 16:01:19 +0000 2014,Last days of Round One guys but this amazing championship has more to come Stay tuned join at,6.28,5.6,7.4,87.05,1,6.9,5th and 6th grade
Thu Apr 24 13:57:29 +0000 2014,Thanks guys.,0.1,-3.1,5.5,120.21,1,-1.61,-1th and 0th grade
Thu Apr 24 10:55:11 +0000 2014,"Good to be back on the pitch, specially with a win against Bayern. One step forward to the final. RoadToLisbon",7.29,4.8,5.0,78.25,2,6.76,4th and 5th grade
Wed Apr 23 14:46:15 +0000 2014,You only become a giant by making them fall. RiskEverything,5.71,7.2,7.1,61.33,1,9.66,7th and 8th grade
Wed Apr 23 10:16:34 +0000 2014,Do you know Sportlobster It s a great new social network just for sports. Get the app and follow me here.,6.41,2.7,2.9,94.66,2,4.15,2nd and 3rd grade
Tue Apr 22 16:22:22 +0000 2014,"You asked Can you say hello to me ,please I am from Bulgaria",5.5,3.6,2.4,92.12,1,2.83,2nd and 3rd grade
Tue Apr 22 16:15:39 +0000 2014,You asked Eres un gran jugador pero a n mejor persona. Saludos desde Alicante,9.62,3.7,3.6,81.29,2,6.16,3rd and 4th grade
Tue Apr 22 16:14:49 +0000 2014,You asked Ol Cristiano Como voc est Sauda es da Argentina. Eu te amo dolo,9.27,3.9,0.8,80.78,2,2.8,3rd and 4th grade
Tue Apr 22 16:12:08 +0000 2014,You asked I'm your 1 fan from England Please could you possibly say hi Noah ...,6.49,5.6,6.2,81.63,1,5.33,5th and 6th grade
Tue Apr 22 16:11:01 +0000 2014,You asked greetings from italy,7.04,0.5,5.6,100.24,1,8.44,1st and 2nd grade
Tue Apr 22 16:07:52 +0000 2014,You asked Hello Cristiano Could you please say hi to all madridistas here in Honduras,7.54,5.6,8.3,81.63,1,9.56,5th and 6th grade
Tue Apr 22 14:48:27 +0000 2014,I've scored 14 goals in the Champions League. Can you do the same in CR Footy Try it for free,1.29,1.3,1.0,103.63,2,2.12,0th and 1st grade
Thu Apr 17 15:28:02 +0000 2014,Download the CR7emag to check it out. Available in Android and iOS,7.88,2.1,3.1,90.77,2,5.27,1st and 2nd grade
Thu Apr 17 15:26:19 +0000 2014,He awoke from a coma while listening to reports of Real Madrid games and came to Madrid to meet me.,7.0,7.6,7.4,76.56,1,5.63,6th and 7th grade
Thu Apr 17 15:25:10 +0000 2014,Do you wanna know more about the touching story of 14 year old Dawid,7.71,5.2,4.1,82.65,1,4.92,5th and 6th grade
Thu Apr 17 10:47:08 +0000 2014,What an incredible night Thanks to all the fans who celebrated with us. CopadelRey,7.71,8.8,8.8,57.27,1,10.32,8th and 9th grade
Wed Apr 16 22:38:02 +0000 2014,First title of the season. FinalCopa champions,8.5,10.7,9.0,30.53,1,12.36,8th and 9th grade
Wed Apr 16 22:01:42 +0000 2014,What an exciting FinalCopa We are the Copa del Rey Champions. I'm proud of the team. Hala Madrid,7.59,5.6,3.7,70.8,2,5.42,5th and 6th grade
Tue Apr 15 11:29:29 +0000 2014,Tomorrow is the FinalCopa del Rey. Let s all support the team Hala Madrid,7.37,4.8,2.3,72.83,2,4.47,4th and 5th grade
Mon Apr 14 14:28:44 +0000 2014,Check the standings What's your favourite team Who will win,5.71,1.3,7.1,103.63,1,9.66,3rd and 4th grade
Mon Apr 14 14:00:49 +0000 2014,A big shout out for all players and teams playing on Round One. Good luck for this final stretch guys,6.5,2.5,2.9,95.17,2,4.73,2nd and 3rd grade
Mon Apr 14 11:47:22 +0000 2014,Welcome back Khedira,9.05,5.6,8.3,59.97,1,9.23,9th and 10th grade
Fri Apr 11 14:08:45 +0000 2014,"Flying with is an amazing experience, you never know who you re going to bump into. Watch and share",6.6,4.6,3.4,78.75,2,5.07,4th and 5th grade
Thu Apr 10 17:16:28 +0000 2014,Congratulations . Keep up the good work.,6.57,8.0,8.3,48.47,1,10.08,7th and 8th grade
Thu Apr 10 15:03:01 +0000 2014,Have you seen the fan portrait of in my CR7emag Maybe I will choose you for the next issue. Check it out.,5.62,1.7,2.1,102.61,2,3.17,1st and 2nd grade
Wed Apr 09 16:51:48 +0000 2014,Check out my Mercurial Vapor IXs,9.2,6.8,2.8,56.93,1,5.27,2nd and 3rd grade
Wed Apr 09 10:11:16 +0000 2014,Another step in the competition. The team is now on the Champions League semi finals.,8.22,6.2,4.6,63.86,2,7.03,7th and 8th grade
Mon Apr 07 15:21:38 +0000 2014,Enter the CR7emag competition to win a Meet amp Greet with me. Download it and take your chance,5.84,3.3,3.5,87.72,2,5.77,5th and 6th grade
Fri Apr 04 11:33:41 +0000 2014,You can also sign up using mobile apps. Download them at Have fun,7.6,2.3,1.0,90.26,2,2.96,2nd and 3rd grade
Fri Apr 04 11:32:42 +0000 2014,Just to let you know that Round One of is running until gt May 1st lt Join at,0.89,4.4,3.3,95.51,1,1.74,7th and 8th grade
Tue Apr 01 08:27:24 +0000 2014,Every challenge is a new chance Be brave when you step on the pitch. riskeverything,6.49,5.6,7.7,81.63,1,8.4,7th and 8th grade
Mon Mar 31 17:00:20 +0000 2014,Come support Portugal vs Ireland on June 10 at It s Portugal National Day.,8.84,8.8,6.1,57.27,1,7.01,8th and 9th grade
Mon Mar 31 14:53:11 +0000 2014,You asked Can you say Hay I am your 1 fan from Croatia.,5.5,3.6,0.7,92.12,1,0.57,0th and 1st grade
Mon Mar 31 14:42:44 +0000 2014,You asked Hello Cristiano. I'm a huge fan from maldives. Please say hi.,6.28,0.2,2.1,100.95,3,1.93,1st and 2nd grade
Mon Mar 31 14:42:13 +0000 2014,"You asked Ronaldo can you say hello Im your 1 fan, in from M xico",6.49,4.4,2.1,90.09,1,1.44,5th and 6th grade
Mon Mar 31 14:41:19 +0000 2014,You asked tu felicidad es lo mas preciado que se puede tener. Saludos desde Per .,9.27,7.4,3.0,55.4,2,5.12,7th and 8th grade
Mon Mar 31 14:37:29 +0000 2014,You asked Podrias mandarme saludos a Almeria,13.01,6.0,7.6,64.37,1,11.55,2nd and 3rd grade
Mon Mar 31 14:36:26 +0000 2014,You asked If you just say Hello Raphael Will be the best day of my life,0.79,3.6,3.1,97.54,1,2.72,3rd and 4th grade
Mon Mar 31 14:35:21 +0000 2014,You asked Hi Cris. How are you Greetings from Argentina,7.04,1.7,2.7,91.78,2,4.38,1st and 2nd grade
Mon Mar 31 14:02:11 +0000 2014,I ve lived to play football since I was a kid. My dreams became real but I never forgot where I m from Madeira,0.6,3.3,1.7,93.14,2,2.6,4th and 5th grade
Sat Mar 29 14:12:53 +0000 2014,Great shoot day for vogue with,0.3,-1.5,1.2,116.15,1,3.35,1st and 2nd grade
Fri Mar 28 17:01:02 +0000 2014,"Hey guys, never let anything stop you Step up to every challenge",5.55,4.4,5.4,84.68,1,6.95,4th and 5th grade
Fri Mar 28 13:04:40 +0000 2014,You will never guess who I bumped in to on my flight. Watch my new film here and share AllTimeGreats,1.29,1.3,2.6,103.63,2,4.44,3rd and 4th grade
Wed Mar 26 11:48:59 +0000 2014,It was great meeting you at the stadium on Sunday Thanks for entering my CR7Underwear competition,8.38,10.7,10.7,46.78,1,12.18,10th and 11th grade
Tue Mar 25 14:57:33 +0000 2014,"Hello all, have you checked the CR7emag with lots of unpublished and exclusive content",7.71,6.4,10.1,74.19,1,11.94,7th and 8th grade
Tue Mar 25 12:58:14 +0000 2014,Hey team Do you want a ride for the training session,7.05,2.9,2.1,94.15,1,3.69,4th and 5th grade
Sat Mar 22 20:58:18 +0000 2014,"Hey guys, it s WorldWaterDay. iLoveWater.Appreciate it and make a difference with",8.18,12.7,12.0,25.46,1,14.2,12th and 13th grade
Sat Mar 22 16:54:52 +0000 2014,Check out the real time stats for tomorrow s Real Madrid Barcelona match here by,0.74,5.6,6.8,81.63,1,7.65,5th and 6th grade
Fri Mar 21 21:42:10 +0000 2014,Dinner time.,0.1,2.9,5.5,77.91,1,-1.61,-1th and 0th grade
Fri Mar 21 20:30:07 +0000 2014,Nutrition is a weapon for me. It s an honor to be part of the family...many good things to come.,1.29,3.7,1.7,86.71,2,2.12,1st and 2nd grade
Fri Mar 21 14:44:02 +0000 2014,Acabei de fazer as minhas previs es para o R. Madrid vs. Barcelona no VivaRonaldo. E tu,7.77,3.1,2.5,88.23,2,3.85,3rd and 4th grade
Fri Mar 21 12:46:24 +0000 2014,Real Madrid will face Borussia Dortmund on the quarterfinals of Champions League. Let s go team,7.98,5.2,6.1,71.82,2,9.0,8th and 9th grade
Thu Mar 20 16:39:50 +0000 2014,Thank you all for making CR Footy the 1 sports game in 23 countries Hope you enjoy playing,6.28,5.6,6.7,87.05,1,5.97,5th and 6th grade
Wed Mar 19 15:22:07 +0000 2014,Ask me questions on Mobio and I may answer yours,7.29,3.7,1.9,86.71,1,3.86,3rd and 4th grade
Wed Mar 19 12:57:33 +0000 2014,"Victory for the team, we are now qualified for the quarter finals of the Champions League",7.39,8.4,8.4,63.7,1,8.87,8th and 9th grade
Tue Mar 18 17:00:49 +0000 2014,Acabei de fazer as minhas previs es para o Team CR vs. Schalke 04 no VivaRonaldo. E tu,7.59,3.3,1.1,87.72,2,2.52,2nd and 3rd grade
Mon Mar 17 15:43:44 +0000 2014,Training session before the match against Schalke tomorrow.,7.98,6.4,13.2,63.36,1,17.36,7th and 8th grade
Sun Mar 16 16:05:35 +0000 2014,And don t forget to download the mobile apps,7.59,3.3,1.9,87.72,1,4.14,3rd and 4th grade
Sun Mar 16 15:38:31 +0000 2014,Glad to see many teams and players already having a good time playing with each other Good luck guys,6.24,7.2,8.4,77.57,1,7.78,7th and 8th grade
Sun Mar 16 15:01:50 +0000 2014,If you have a team with friends sign it up on my championship It's a great way to enjoy real football.,1.79,6.8,7.4,84.0,1,4.82,6th and 7th grade
Fri Mar 14 17:04:53 +0000 2014,The new mobile version of Cristiano Ronaldo Footy is now live. Download it free,9.62,3.7,4.3,81.29,2,6.97,2nd and 3rd grade
Thu Mar 13 15:46:23 +0000 2014,Thank you for your kind words.Glad to be part of the team with so many amazing athletes like you,6.24,6.0,7.4,86.03,1,6.21,5th and 6th grade
Wed Mar 12 17:01:58 +0000 2014,The last Cheer event on was great Congrats Thanks everyone,5.71,3.7,6.6,86.71,1,9.66,3rd and 4th grade
Wed Mar 12 13:16:41 +0000 2014,I stand withSyria. Innocent children need our help. Learn more about here,6.47,2.5,4.9,84.34,3,5.8,5th and 6th grade
Tue Mar 11 14:57:41 +0000 2014,Get my new mobile game Cristiano Ronaldo Footy for free,8.87,3.7,5.2,86.71,1,7.92,3rd and 4th grade
Mon Mar 10 09:00:45 +0000 2014,"Hi guys, who wants to join me in space Suit up for GALAXY11 and help fight for Earth",0.89,3.2,5.1,103.97,1,3.71,3rd and 4th grade
Mon Mar 10 09:00:45 +0000 2014,"Hi guys, who wants to join me in space Suit up for GALAXY11 and help fight for Earth",0.89,3.2,5.1,103.97,1,3.71,3rd and 4th grade
Thu Mar 06 18:39:57 +0000 2014,Take a look at this Sport doesn t care video. Sport makes no distinctions.,5.11,0.1,2.6,106.67,2,4.47,2nd and 3rd grade
Thu Mar 06 17:24:53 +0000 2014,You asked Any memorable fan you have met so far,5.71,2.5,1.5,95.17,1,3.28,2nd and 3rd grade
Thu Mar 06 17:18:16 +0000 2014,You asked Ronaldo Can you tell me hello,6.01,2.9,1.4,88.74,1,3.55,2nd and 3rd grade
Thu Mar 06 16:57:56 +0000 2014,You asked Do you like Greece,0.3,-1.5,-0.5,116.15,1,1.38,-1th and 0th grade
Thu Mar 06 16:49:46 +0000 2014,You asked Favorite place to travel,6.57,2.1,4.3,90.77,1,7.18,1st and 2nd grade
Thu Mar 06 16:37:38 +0000 2014,"You asked hi,do you have any brothers",6.24,2.5,2.9,89.75,1,4.94,2nd and 3rd grade
Thu Mar 06 16:34:10 +0000 2014,You asked Can you make my dream come true by saying something to me,5.46,2.9,3.8,99.57,1,4.52,5th and 6th grade
Thu Mar 06 16:30:33 +0000 2014,You asked Top 3 songs you love at the moment,0.5,1.3,0.1,103.63,1,1.54,0th and 1st grade
Thu Mar 06 16:27:47 +0000 2014,You asked What was your first tought when you won Ballon d'Or,5.55,2.1,4.2,101.6,1,5.5,4th and 5th grade
Thu Mar 06 11:18:21 +0000 2014,Great game for the National Team last night for aportugal,7.29,4.8,6.2,78.25,1,9.08,6th and 7th grade
Tue Mar 04 19:14:24 +0000 2014,Acabei de fazer as minhas previs es para o Portugal vs. Cameroon no VivaRonaldo. E tu,8.97,4.1,3.2,80.28,2,5.0,3rd and 4th grade
Tue Mar 04 16:49:15 +0000 2014,uma grande honra apresentar o nosso novo equipamento para jogar sem medo. jogasemmedo,14.0,11.9,11.5,32.9,1,13.96,11th and 12th grade
Mon Mar 03 12:51:05 +0000 2014,Have you seen Sir Alex Ferguson exclusive interview on the CR7emag about my time on Take a look.,7.16,6.8,8.2,78.59,1,7.54,6th and 7th grade
Sun Mar 02 10:58:49 +0000 2014,Today I m launching the CR7emag with lots of behind the scenes and really cool exclusive content. Hope you like it,6.41,5.0,4.9,77.74,2,6.93,4th and 5th grade
Thu Feb 27 14:14:29 +0000 2014,What a night A great result leads us one step closer to the next stage.,6.49,3.2,4.0,98.55,1,3.76,3rd and 4th grade
Wed Feb 26 12:17:27 +0000 2014,Big game coming up tonight. The team will play for the Champions League. Hala Madrid,6.11,2.7,4.3,89.24,2,6.63,5th and 6th grade
Tue Feb 25 19:18:00 +0000 2014,Acabei de fazer as minhas previs es para o Schalke 04 vs. Team CR no VivaRonaldo. E tu,7.59,3.3,1.1,87.72,2,2.52,2nd and 3rd grade
Mon Feb 24 15:10:45 +0000 2014,"Hey guys, I m preparing something really cool for all my fans that I ll share with you very soon. Stay tuned.",1.81,7.2,8.4,82.99,1,5.11,7th and 8th grade
Sat Feb 22 19:01:49 +0000 2014,"Well done, team Hala Madrid",7.04,0.5,2.7,100.24,1,3.8,1st and 2nd grade
Thu Feb 20 15:37:48 +0000 2014,Thank you for all the posts you shared on the Fanwall on my new website. They are really great Keep sharing here,6.34,2.9,3.6,94.15,2,5.26,4th and 5th grade
Wed Feb 19 15:56:06 +0000 2014,Hey guys. Have a sneak peek of an interview I gave with my friends from Are you curious,6.28,5.6,5.9,87.05,1,4.64,5th and 6th grade
Tue Feb 18 12:18:47 +0000 2014,"Today I m proud to present you my new official website, a little gift for all of you. Welcome to What do you think",5.55,4.4,2.4,84.68,2,3.35,5th and 6th grade
Thu Feb 13 14:34:11 +0000 2014,Loading...,19.48,8.4,26.2,36.62,1,-4.81,-1th and 0th grade
Wed Feb 12 11:44:00 +0000 2014,What a great match The team made it to the final of Copa del Rey Hala Madrid,7.27,5.2,3.7,88.06,1,2.9,6th and 7th grade
Mon Feb 10 17:56:54 +0000 2014,Your participation on the Happy Birthday event was fantastic Congrats Thanks everyone for the support.,8.59,11.5,13.7,39.33,1,15.77,11th and 12th grade
Mon Feb 10 14:15:52 +0000 2014,"It was fabulous to celebrate my birthday yesterday with my friends and family, I had a great time. Thank you all",5.66,5.0,4.4,77.74,2,6.12,5th and 6th grade
Sun Feb 09 23:02:50 +0000 2014,Thanks you're fantastic,9.05,5.6,13.0,59.97,1,13.12,12th and 13th grade
Sun Feb 09 15:53:49 +0000 2014,"Check out the video below, sign up and let s make some great matches people. How far are you willing to go",1.26,2.9,2.3,94.15,2,3.4,2nd and 3rd grade
Sun Feb 09 15:16:36 +0000 2014,Hey footballers Sign up your Team on the most exciting football competition of the moment. Step up to the challenge.,6.5,6.0,6.4,69.79,2,8.79,5th and 6th grade
Thu Feb 06 15:37:25 +0000 2014,Great photos from the fans last night at the stadium. Thank you so much,6.24,1.3,1.6,98.21,2,3.66,1st and 2nd grade
Thu Feb 06 12:48:10 +0000 2014,The team did a great match last night One step closer to the Copa del Rey final. Hala Madrid,7.9,6.0,6.4,86.03,1,4.99,5th and 6th grade
Wed Feb 05 21:52:09 +0000 2014,Thanks It looks really nice,0.25,2.9,2.7,83.32,1,4.96,2nd and 3rd grade
Wed Feb 05 21:48:26 +0000 2014,Thank you so much,0.2,-2.3,-3.0,118.18,1,-2.91,-1th and 0th grade
Wed Feb 05 21:45:42 +0000 2014,Thank you for the birthday present It will look better on me than you though.,0.74,3.2,5.9,98.55,1,6.08,5th and 6th grade
Wed Feb 05 17:08:32 +0000 2014,Hello Paris Thank you,0.2,1.3,1.8,92.8,1,2.9,1st and 2nd grade
Wed Feb 05 17:04:02 +0000 2014,Thank you Greetings to Indonesia.,10.2,5.2,8.4,66.4,1,10.76,10th and 11th grade
Wed Feb 05 16:52:50 +0000 2014,Gracias,19.48,8.4,12.0,36.62,1,-4.81,-1th and 0th grade
Wed Feb 05 16:51:29 +0000 2014,Thanks,0.05,-3.5,7.3,121.22,1,-10.61,-1th and 0th grade
Wed Feb 05 16:50:50 +0000 2014,Muchas gracias,11.63,2.9,10.2,77.91,1,7.1,-1th and 0th grade
Wed Feb 05 16:50:21 +0000 2014,Thank you,0.1,-3.1,-1.7,120.21,1,-7.41,-1th and 0th grade
Fri Jan 31 17:08:25 +0000 2014,Acabei de fazer as minhas previs es para o Bilbao vs. Team CR no VivaRonaldo. E tu,8.7,4.2,1.1,79.77,2,2.46,3rd and 4th grade
Fri Jan 31 15:13:21 +0000 2014,FF,0.05,-3.5,-11.6,121.22,1,-33.81,-1th and 0th grade
Fri Jan 31 14:28:45 +0000 2014,"Very good news about my young friend Guillermo. With your help he found a bone marrow donor Thanks everyone, let's keep helping other kids.",6.21,4.4,7.3,84.68,2,8.92,5th and 6th grade
Thu Jan 30 17:35:22 +0000 2014,You asked Can you PLZ say HI to my son Peyton who is a huge fan......,5.42,3.6,2.5,97.54,1,-0.19,-1th and 0th grade
Thu Jan 30 17:33:43 +0000 2014,You asked Out of football what is your most preferred sport,5.62,2.9,5.0,94.15,1,7.35,4th and 5th grade
