created_at,text,dale_chall_readability_score,flesch_kincaid,automated_readability,flesch_reading,sentence_count,coleman_liau_index,based_on_all_algorithms
Tue May 26 15:01:26 +0000 2020,"We made most Governors look very good, even great, by getting them the Ventilators, unlimited Testing, and supplies, all of which they should have had in their own stockpiles. So they look great, and I just keep rolling along, doing great things and getting Fake Lamestream News",7.15,8.9,13.6,73.0,2,10.68,13th and 14th grade
Tue May 26 13:45:49 +0000 2020,"Stock Market up BIG, DOW crosses 25,000. S amp P 500 over 3000. States should open up ASAP. The Transition to Greatness has started, ahead of schedule. There will be ups and downs, but next year will be one of the best ever",6.27,1.9,2.7,96.59,5,3.96,3rd and 4th grade
Tue May 26 13:19:17 +0000 2020,"....about whether or not Joe could have done such a horrible thing Maybe or maybe not, but I find Joe to be a total Nut Job, and I knew him well, far better than most. So many unanswered amp obvious questions, but I won t bring them up now Law enforcement eventually will",7.04,8.9,11.3,78.42,2,5.98,8th and 9th grade
Tue May 26 13:19:14 +0000 2020,"The opening of a Cold Case against Psycho Joe Scarborough was not a Donald Trump original thought, this has been going on for years, long before I joined the chorus. In 2016 when Joe amp his wacky future ex wife, Mika, would endlessly interview me, I would always be thinking....",8.03,10.7,12.7,63.02,2,8.54,8th and 9th grade
Tue May 26 12:25:11 +0000 2020,"Sean Parnell is an American Hero. Conor Lamb has proven to be an American fraud, and a puppet for Crazy Nancy Pelosi. He said he would NOT vote for her for Speaker, and did. Will kill 2A. Voted to impeach on nothing . A TOTAL amp COMPLETE Sean Parnell Endorsement",6.62,2.9,3.2,88.53,6,5.12,3rd and 4th grade
Tue May 26 12:17:55 +0000 2020,"....living in the state, no matter who they are or how they got there, will get one. That will be followed up with professionals telling all of these people, many of whom have never even thought of voting before, how, and for whom, to vote. This will be a Rigged Election. No way",5.71,5.5,7.6,87.35,3,5.86,5th and 6th grade
Tue May 26 12:17:53 +0000 2020,"There is NO WAY ZERO that Mail In Ballots will be anything less than substantially fraudulent. Mail boxes will be robbed, ballots will be forged amp even illegally printed out amp fraudulently signed. The Governor of California is sending Ballots to millions of people, anyone.....",8.24,9.1,10.9,56.25,3,11.53,8th and 9th grade
Tue May 26 12:05:44 +0000 2020,Joe Biden s handling of the H1N1 Swine Flu was a complete and total disaster. Even polls on the matter were terrible,7.05,5.2,4.4,77.23,2,6.3,5th and 6th grade
Mon May 25 20:16:06 +0000 2020,"Great reviews on our handling of Covid 19, sometimes referred to as the China Virus. Ventilators, Testing, Medical Supply Distribution, we made a lot of Governors look very good And got no credit for so doing. Most importantly, we helped a lot of great people",8.59,8.0,8.6,64.71,3,8.92,8th and 9th grade
Mon May 25 20:05:34 +0000 2020,"Nobody in 50 years has been WEAKER on China than Sleepy Joe Biden. He was asleep at the wheel. He gave them EVERYTHING they wanted, including rip off Trade Deals. I am getting it all back",5.4,3.3,2.9,87.72,4,4.78,4th and 5th grade
Mon May 25 20:00:26 +0000 2020,"Sleepy Joe Biden mostly his reps. went crazy when I banned, in late January, people coming in from China. He called me xenophobic amp then went equally nuts when we let in 44,000 people until he was told they were American citizens coming home. He later apologized",6.1,7.1,8.3,72.46,3,8.58,8th and 9th grade
Mon May 25 18:29:39 +0000 2020,"I have zero interest in moving the Republican National Convention to Doral in Miami, as falsely reported by the Fake News in order to stir up trouble. Ballroom is not nearly big enough amp would like to stay in N.C., whose gov. doesn t even know if he can let people in",7.96,11.1,11.3,62.01,2,6.68,7th and 8th grade
Mon May 25 13:31:53 +0000 2020,"....Hawaii in a big, fully loaded 747, to play. What did that do to the so called Carbon Footprint He also played moments after the brutal killing by ISIS of a wonderful young man. Totally inappropriate and it was me who shattered 100 of the ISIS Caliphate. I was left a MESS",6.41,4.8,5.4,83.66,4,5.79,5th and 6th grade
Mon May 25 13:31:53 +0000 2020,"....3 months and, if I waited 3 years, they would do their usual hit pieces anyway. They are sick with hatred and dishonesty. They are truly deranged They don t mention Sleepy Joe s poor work ethic, or all of the time Obama spent on the golf course, often flying to....",7.27,6.4,7.3,79.6,3,5.74,7th and 8th grade
Mon May 25 13:31:52 +0000 2020,"Some stories about the fact that in order to get outside and perhaps, even a little exercise, I played golf over the weekend. The Fake amp Totally Corrupt News makes it sound like a mortal sin I knew this would happen What they don t say is that it was my first golf in almost...",6.44,10.5,11.6,68.94,2,6.1,11th and 12th grade
Mon May 25 12:18:36 +0000 2020,"TRANSITION TO GREATNESS Get ready, it is already happening again",8.87,7.2,9.5,61.33,1,12.56,8th and 9th grade
Mon May 25 12:16:20 +0000 2020,HAPPY MEMORIAL DAY,9.05,9.2,5.2,34.59,1,5.35,8th and 9th grade
Mon May 25 12:12:08 +0000 2020,"...to find, with all of the jobs and economic development it brings, another Republican National Convention site. This is not something I want to do. Thank you, and I LOVE the people of North Carolina",6.92,6.7,6.7,68.06,3,7.69,6th and 7th grade
Mon May 25 12:12:07 +0000 2020,"...made by many thousands of enthusiastic Republicans, and others, to head to beautiful North Carolina in August. They must be immediately given an answer by the Governor as to whether or not the space will be allowed to be fully occupied. If not, we will be reluctantly forced...",7.72,9.5,9.4,55.24,3,9.28,9th and 10th grade
Mon May 25 12:12:07 +0000 2020,"...full attendance in the Arena. In other words, we would be spending millions of dollars building the Arena to a very high standard without even knowing if the Democrat Governor would allow the Republican Party to fully occupy the space. Plans are being....",8.39,8.9,9.4,56.96,3,9.91,9th and 10th grade
Mon May 25 12:12:06 +0000 2020,"I love the Great State of North Carolina, so much so that I insisted on having the Republican National Convention in Charlotte at the end of August. Unfortunately, Democrat Governor, is still in Shutdown mood amp unable to guarantee that by August we will be allowed...",9.24,12.3,13.0,48.13,2,10.39,12th and 13th grade
Mon May 25 03:06:47 +0000 2020,MAKE AMERICA GREAT AGAIN,0.2,3.7,5.3,75.88,1,7.25,1st and 2nd grade
Mon May 25 03:06:14 +0000 2020,OBAMAGATE,19.48,32.0,21.5,-132.59,1,6.8,31st and 32nd grade
Mon May 25 02:41:14 +0000 2020,Schools in our country should be opened ASAP. Much very good information now available.,7.37,3.7,7.0,81.29,2,9.87,5th and 6th grade
Mon May 25 02:16:06 +0000 2020,"Having the G7 meeting in Washington is very important for those countries, and the World",6.49,8.0,9.3,64.71,1,10.37,8th and 9th grade
Mon May 25 02:13:20 +0000 2020,"Among many other very important events, meetings, and calls",5.84,4.4,9.8,79.26,1,12.5,3rd and 4th grade
Mon May 25 01:57:23 +0000 2020,"I give, and have given from the beginning, my entire yearly salary, 400,000 to 450,000, back to our government. Last check to HHS Covid relief. My great honor",5.79,3.4,5.3,87.42,3,6.41,5th and 6th grade
Mon May 25 01:46:17 +0000 2020,"...vacationing, relaxing amp making shady deals with other countries, amp that Barack was always playing golf, doing much of his traveling in a fume spewing 747 to play golf in Hawaii Once even teeing off immediately after announcing the gruesome death of a great young man by ISIS",9.64,20.8,25.6,31.22,1,11.16,20th and 21st grade
Mon May 25 01:46:17 +0000 2020,"Sleepy Joe s representatives have just put out an ad saying that I went to play golf exercise today. They think I should stay in the White House at all times. What they didn t say is that it s the first time I ve played golf in almost 3 months, that Biden was constantly.....",5.69,5.7,6.7,86.74,3,5.17,5th and 6th grade
Mon May 25 00:38:54 +0000 2020,"The Democrats are trying to Rig the 2020 Election, plain and simple",6.86,4.4,6.6,84.68,1,8.4,4th and 5th grade
Mon May 25 00:31:39 +0000 2020,A disgrace. Total corruption,15.68,9.6,10.0,33.58,1,11.6,11th and 12th grade
Mon May 25 00:25:42 +0000 2020,Thank you. We love our boaters,0.3,-1.5,1.2,116.15,1,2.37,1st and 2nd grade
Sun May 24 22:51:58 +0000 2020,"Be sure to watch, Witch Hunt, the Flynn Vindication hosted by the very knowledgeable on tonight at 8 00 P.M. This is yet another part of the greatest Criminal Hoax in American History",7.33,8.5,8.4,63.19,2,8.23,8th and 9th grade
Sun May 24 20:11:43 +0000 2020,You are right,0.15,-2.7,-2.7,119.19,1,-4.29,0th and 1st grade
Sun May 24 17:16:35 +0000 2020,"I always stand with leaders who weren t afraid to stand early with me. That s why I am supporting a true conservative, for State Treasurer of North Dakota",7.08,6.6,6.3,73.68,2,6.95,6th and 7th grade
Sun May 24 14:31:41 +0000 2020,"Cases, numbers and deaths are going down all over the Country",7.05,5.2,5.9,77.23,1,7.93,4th and 5th grade
Sun May 24 14:29:49 +0000 2020,"A lot of interest in this story about Psycho Joe Scarborough. So a young marathon runner just happened to faint in his office, hit her head on his desk, amp die I would think there is a lot more to this story than that An affair What about the so called investigator Read story",6.73,10.3,11.6,69.45,2,6.74,6th and 7th grade
Sun May 24 14:23:06 +0000 2020,"Allen, get well soon",0.2,-2.3,0.6,118.18,1,0.0,-1th and 0th grade
Sun May 24 14:08:36 +0000 2020,"The United States cannot have all Mail In Ballots. It will be the greatest Rigged Election in history. People grab them from mailboxes, print thousands of forgeries and force people to sign. Also, forge names. Some absentee OK, when necessary. Trying to use Covid for this Scam",7.05,4.0,5.6,80.48,6,7.84,5th and 6th grade
Sun May 24 13:30:00 +0000 2020,Full Measure with Sheryl Attkisson interview on at 10 00 A.M. Sunday. Enjoy,7.93,7.2,7.9,66.74,1,8.63,7th and 8th grade
Sun May 24 13:21:16 +0000 2020,"Michael Moore Torches Biden He Lacks Necessary Enthusiasm to Beat Trump via Well, he was right in 2016, and we do have great enthusiasm. Many say, done a fantastic job DJT",6.44,7.0,7.8,72.66,2,8.06,6th and 7th grade
Sun May 24 03:12:23 +0000 2020,Thank you Herschel,9.05,0.9,5.2,93.81,1,5.35,0th and 1st grade
Sun May 24 02:39:43 +0000 2020,I HOPE ALL AFRICAN AMERICANS WILL READ AND STUDY THIS. 100 CORRECT. SLEEPY JOE WILL NEVER GET YOU THERE. HE NEVER HAS IN THE PAST. I WILL amp HAVE,0.91,1.4,1.4,97.91,4,2.85,0th and 1st grade
Sun May 24 02:31:59 +0000 2020,"Many physicians agree with you. Also, some very good studies",7.04,1.7,5.1,91.78,2,6.7,1st and 2nd grade
Sun May 24 02:25:43 +0000 2020,True,0.05,-3.5,-2.2,121.22,1,-22.21,-1th and 0th grade
Sun May 24 00:05:58 +0000 2020,"A blow to her head Body found under his desk Left Congress suddenly Big topic of discussion in Florida...and, he s a Nut Job with bad ratings . Keep digging, use forensic geniuses",8.87,7.2,8.2,72.16,2,8.0,8th and 9th grade
Sun May 24 00:05:58 +0000 2020,"A blow to her head Body found under his desk Left Congress suddenly Big topic of discussion in Florida...and, he s a Nut Job with bad ratings . Keep digging, use forensic geniuses",8.87,7.2,8.2,72.16,2,8.0,8th and 9th grade
Sat May 23 23:50:11 +0000 2020,Thank you,0.1,-3.1,-1.7,120.21,1,-7.41,-1th and 0th grade
Sat May 23 22:59:02 +0000 2020,TRANSITION TO GREATNESS,14.31,9.2,13.0,34.59,1,15.03,14th and 15th grade
Sat May 23 22:57:22 +0000 2020,MAKE AMERICA GREAT AGAIN,0.2,3.7,5.3,75.88,1,7.25,1st and 2nd grade
Sat May 23 22:54:00 +0000 2020,"....price. You should drop out of the race amp pray that super liberal a weak amp pathetic puppet for Crazy Nancy Pelosi amp Cryin Chuck Schumer, gets beaten badly. He voted for impeachment based on ZERO . Disgraced Alabama. Coach will be a GREAT Senator",8.67,6.7,8.4,73.47,3,8.63,8th and 9th grade
Sat May 23 22:53:57 +0000 2020,"Jeff, you had your chance amp you blew it. Recused yourself ON DAY ONE you never told me of a problem , and ran for the hills. You had no courage, amp ruined many lives. The dirty cops, amp others, got caught by better amp stronger people than you. Hopefully this slime will pay a big...",5.62,2.9,3.9,94.15,5,4.74,4th and 5th grade
Sat May 23 12:55:04 +0000 2020,Who are the 4 A RINO or two,6.01,0.5,-5.8,105.66,1,-5.16,2nd and 3rd grade
Sat May 23 12:52:11 +0000 2020,Sleepy Joe cannot bring us to greatness. He is the reason I m here,5.11,1.3,-0.2,98.21,2,1.57,2nd and 3rd grade
Sat May 23 12:48:41 +0000 2020,...And Sleepy Joe,0.15,-2.7,3.6,119.19,1,-2.38,0th and 1st grade
Sat May 23 12:28:52 +0000 2020,"All things that I have GOTTEN DONE, including Criminal Justice Reform",11.36,7.6,9.3,60.31,1,12.1,11th and 12th grade
Sat May 23 12:25:32 +0000 2020,Sean Parnell is a Star. We need him in Washington to Drain the Swamp,6.24,1.3,0.6,98.21,2,2.44,0th and 1st grade
Sat May 23 12:22:47 +0000 2020,Patriots,19.48,20.2,16.8,-47.99,1,1.0,0th and 1st grade
Sat May 23 12:21:02 +0000 2020,So bad,0.1,-3.1,-8.8,120.21,1,-16.11,-1th and 0th grade
Sat May 23 12:17:12 +0000 2020,Caught in the act,0.2,-2.3,-3.0,118.18,1,-2.91,-1th and 0th grade
Fri May 22 23:54:19 +0000 2020,"Admiral Ronny Jackson is a very successful doctor and Navy Veteran running for Congress in TX13. Strong on Crime, the Border and Agriculture and he loves our Vets Ronny has my Complete and Total Endorsement Vote for Ronny",9.15,9.5,10.9,60.65,2,10.5,10th and 11th grade
Fri May 22 23:51:16 +0000 2020,"We need back in Congress to fight for the incredible people of Georgia She is a tremendous advocate for our Military, Vets, Border Security and the Second Amendment. Karen has my Complete and Total Endorsement GA06",9.79,10.3,11.0,53.21,2,10.79,10th and 11th grade
Fri May 22 23:50:12 +0000 2020,"Congressman Guy Reschenthaler is doing tremendous work for the people of Pennsylvania A Navy veteran, Guy strongly supports our Vets, Borders, and always votes to uphold the Rule of Law. Guy has my Complete and Total Endorsement PA14",9.98,9.5,12.4,60.65,2,12.01,11th and 12th grade
Fri May 22 23:49:37 +0000 2020,"Congressman John Joyce is a fighter for the Commonwealth of Pennsylvania John loves our Vets, Military and Small Businesses and always defends Life and the Second Amendment. John has my Complete and Total Endorsement PA13",9.47,10.1,12.5,53.71,2,13.11,9th and 10th grade
Fri May 22 23:36:31 +0000 2020,Sean has my Complete and Total Endorsement PA17,9.95,5.2,6.1,71.82,1,9.35,9th and 10th grade
Fri May 22 23:35:19 +0000 2020,"Congressman Mike Kelly is an incredible advocate for Pennsylvania He fights to Lower your Taxes, Create Jobs, Protect our Borders, and Defend the Second Amendment. Mike has my Complete and Total Endorsement PA16",10.68,10.9,12.3,46.27,2,13.16,10th and 11th grade
Fri May 22 23:34:31 +0000 2020,"Congressman Fred Keller has been doing a phenomenal job in Congress since his special election He strongly supports our Vets, Small Businesses, Workers, and the Second Amendment. Fred has my Complete and Total Endorsement PA12",10.82,10.1,13.2,53.71,2,13.57,10th and 11th grade
Fri May 22 23:34:22 +0000 2020,"Congressman Glenn GT Thompson is a hard worker for Pennsylvania The Dean of the Delegation , he strongly supports our incredible Farmers, Vets and the Second Amendment. GT has my Complete and Total Endorsement PA15",10.05,11.1,12.0,45.76,2,12.64,10th and 11th grade
Fri May 22 23:31:49 +0000 2020,"Congressman Scott Perry is an incredible fighter for Pennsylvania He served our country as an Army General and now he fights for our Seniors, Vets, Military, and the Second Amendment. Scott has my Complete and Total Endorsement PA10",9.15,10.7,12.2,52.19,2,11.89,12th and 13th grade
Fri May 22 23:25:16 +0000 2020,"Congressman Lloyd Smucker is working hard for the people of Pennsylvania Lloyd strongly supports the Second Amendment, and he s fighting for our incredible Workers, Military and Vets. Lloyd has my Complete and Total Endorsement PA11",10.67,10.3,13.3,53.21,2,13.69,10th and 11th grade
Fri May 22 23:13:56 +0000 2020,"Congressman Dan Meuser is a tremendous advocate for Pennsylvania Dan loves our Military, Vets and the Second Amendment a real supporter of our MAGA agenda. Dan has my Complete and Total Endorsement PA09",10.2,9.7,11.1,54.73,2,11.95,9th and 10th grade
Fri May 22 23:12:56 +0000 2020,"Lisa Scheller will fight for the incredible people of Pennsylvania in Congress She strongly supports our Military, Vets, Small Businesses and the Second Amendment. Lisa has my Complete and Total Endorsement PA07",9.86,9.5,13.1,55.24,2,14.5,9th and 10th grade
Fri May 22 23:12:27 +0000 2020,"David Young is a champion for Iowa He helped us pass the Trump Tax Cuts and he will always fight for our Small Businesses, Military, the Second Amendment and our Great Farmers David has my Complete amp Total Endorsement IA03",8.38,16.5,20.4,47.8,1,9.88,16th and 17th grade
Fri May 22 23:11:59 +0000 2020,"Ashley Hinson will be a tremendous advocate for the People of Iowa She will fight for our Military, Vets, Small Businesses, amp our Incredible Farmers a true supporter of our MAGA Agenda Ashley has my Complete and Total Endorsement IA01",11.15,18.9,21.8,30.88,1,11.44,21st and 22nd grade
Fri May 22 23:10:41 +0000 2020,"3 years ago, after Jeff Sessions recused himself, the Fraudulent Mueller Scam began. Alabama, do not trust Jeff Sessions. He let our Country down. That s why I endorsed Coach Tommy Tuberville the true supporter of our MAGA agenda",8.17,5.9,6.5,69.99,4,8.73,8th and 9th grade
Fri May 22 22:46:28 +0000 2020,"....beginning, was forced to apologize Fake News after the seriously wrong call of the 2016 Election, and is now willing to write anything, even if not truthful. He laughs at his boss, Publisher A.G. Sulzberger, and I laugh at them all. The is a total mess",6.61,4.2,5.9,85.18,4,6.48,5th and 6th grade
Fri May 22 22:46:25 +0000 2020,". is to be seriously respected. He has long been considered one of the dumbest men in the world of journalism, and he became Executive Editor of the Failing New York Times. Not easy to do. He has given up on figuring Trump out . Called it all wrong from the....",7.02,4.8,3.8,78.45,5,5.02,9th and 10th grade
Fri May 22 22:31:04 +0000 2020,49.8M is on its way to Airport to aid in economic recovery. This Federal funding will support aviation in the Dallas area amp keep aviation workers on the job amp commerce moving at one of our important medium hub airports. Proud to support our friends in Dallas,8.11,8.2,8.1,64.0,3,8.7,8th and 9th grade
Fri May 22 22:29:43 +0000 2020,I am proud to announce that the Maryland Aviation Administration will receive 87.8M in CARES Act Airport Grants funding to support aviation and keep commerce moving at this important gateway to the U.S. Capital Region. Very important for economic recovery,8.97,12.3,14.0,42.72,2,13.46,13th and 14th grade
Fri May 22 20:22:07 +0000 2020,HARRIS IS A GREAT AMERICAN,7.04,5.2,1.8,66.4,1,3.8,1st and 2nd grade
Fri May 22 19:46:45 +0000 2020,THANK YOU RollingToRemember,9.05,9.2,19.3,34.59,1,22.75,8th and 9th grade
Fri May 22 14:44:12 +0000 2020,Why doesn t put up the CNBC POLL or the believe it or not Poll Hope Roger A is looking down and watching what has happened to this once beautiful creation,7.72,11.8,12.9,65.39,1,6.51,11th and 12th grade
Fri May 22 14:39:10 +0000 2020,. should fire their Fake Pollster. Never had a good Fox Poll,5.34,1.9,2.3,91.27,2,3.64,1st and 2nd grade
Fri May 22 05:13:18 +0000 2020,Thank you,0.1,-3.1,-1.7,120.21,1,-7.41,-1th and 0th grade
Fri May 22 03:20:42 +0000 2020,"Do nothing A.G. of the Great State of Michigan, Dana Nessel, should not be taking her anger and stupidity out on Ford Motor they might get upset with you and leave the state, like so many other companies have until I came along and brought business back to Michigan. JOBS",7.38,19.3,24.5,46.11,1,8.66,-1th and 0th grade
Fri May 22 03:14:05 +0000 2020,"The Wacky Do Nothing Attorney General of Michigan, Dana Nessel, is viciously threatening Ford Motor Company for the fact that I inspected a Ventilator plant without a mask. Not their fault, amp I did put on a mask. No wonder many auto companies left Michigan, until I came along",7.02,8.5,8.8,63.39,3,8.93,8th and 9th grade
Fri May 22 02:43:36 +0000 2020,No Voter Fraud,9.05,0.9,-1.2,93.81,1,-2.38,0th and 1st grade
Fri May 22 02:40:53 +0000 2020,USA will be bigger and stronger than ever before,0.45,3.3,4.0,87.72,1,6.7,3rd and 4th grade
Fri May 22 02:29:55 +0000 2020,"Is this even possible to believe Can this be for real Where is this nursing home, how is the victim doing",6.93,7.9,8.1,75.54,1,5.92,7th and 8th grade
Fri May 22 02:15:48 +0000 2020,"President Trump is leading Joe Biden D in the battleground state of Pennsylvania 50.2 percent to 45.5 percent...This is significant, as it reflects a 4.7 percent jump from the previous survey.",9.76,15.4,18.7,40.01,1,12.14,18th and 19th grade
Fri May 22 01:34:51 +0000 2020,96 Approval Rating in the Republican Party. Thank you,9.35,8.0,6.6,53.88,1,9.31,7th and 8th grade
Fri May 22 01:23:30 +0000 2020,Big day for JUSTICE. Congratulations John,9.2,8.0,9.8,48.47,1,12.98,9th and 10th grade
Fri May 22 01:04:23 +0000 2020,THANK YOU MAGA,9.05,0.9,-1.2,93.81,1,-2.38,0th and 1st grade
Thu May 21 22:41:21 +0000 2020,"....On Monday, the flags will be at half staff in honor of the men and women in our Military who have made the Ultimate Sacrifice for our Nation.",7.28,11.8,12.4,59.98,1,6.22,11th and 12th grade
Thu May 21 22:41:20 +0000 2020,I will be lowering the flags on all Federal Buildings and National Monuments to half staff over the next three days in memory of the Americans we have lost to the CoronaVirus....,9.17,14.6,16.2,47.46,1,9.24,14th and 15th grade
Thu May 21 22:34:01 +0000 2020,"Another 298M heading to adding up to over 2B in federal funding from so far, part of the 3.9B total from the CARES Act. This is critical to keeping essential personnel moving and aiding metro NYC in recovery. We are here for the people of New York",7.77,7.1,6.6,72.46,3,6.73,6th and 7th grade
Thu May 21 18:43:10 +0000 2020,DOJ Democrats Paid Pennsylvania Election Officials to Stuff Ballot Box via,9.92,7.6,11.5,60.31,1,15.29,11th and 12th grade
Thu May 21 18:30:04 +0000 2020,"....Hahn, Richard Goodstein, Donna Brazile, Niel Cavuto, and many others. They repeat the worst of the Democrat speaking points, and lies. All of the good is totally nullified, and more. Net Result BAD CNN amp MSDNC are all in for the Do Nothing Democrats Fox WAS Great",7.58,4.4,6.8,84.88,4,7.46,7th and 8th grade
Thu May 21 18:30:02 +0000 2020,"Many will disagree, but is doing nothing to help Republicans, and me, get re elected on November 3rd. Sure, there are some truly GREAT people on Fox, but you also have some real garbage littered all over the network, people like Dummy Juan Williams, Schumerite Chris...",7.18,9.9,13.0,65.05,2,9.87,9th and 10th grade
Thu May 21 17:29:04 +0000 2020,Just departed the for the Great State of Michigan,7.59,3.3,4.5,87.72,1,7.39,7th and 8th grade
Thu May 21 04:28:40 +0000 2020,Wow,0.05,-3.5,-6.9,121.22,1,-28.01,-1th and 0th grade
Thu May 21 01:37:02 +0000 2020,"China is on a massive disinformation campaign because they are desperate to have Sleepy Joe Biden win the presidential race so they can continue to rip off the United States, as they have done for decades, until I came along",7.99,16.5,20.4,47.8,1,9.88,19th and 20th grade
Thu May 21 01:36:31 +0000 2020,"....It all comes from the top. They could have easily stopped the plague, but they didn t",4.99,0.7,3.0,105.15,2,3.5,3rd and 4th grade
Thu May 21 01:36:30 +0000 2020,"Spokesman speaks stupidly on behalf of China, trying desperately to deflect the pain and carnage that their country spread throughout the world. Its disinformation and propaganda attack on the United States and Europe is a disgrace....",9.35,10.3,13.8,53.21,2,13.69,10th and 11th grade
Thu May 21 00:13:01 +0000 2020,"....Together, we built the greatest economy in history. We will do it again better than ever before",5.92,6.6,5.8,62.85,2,6.92,5th and 6th grade
Thu May 21 00:13:00 +0000 2020,"Great call with thousands of our Hispanic community, business, and faith leaders today. During this national trial, we have been uplifted by the grit, determination, prayers, and patriotism of Hispanic Americans....",9.5,11.7,14.4,38.82,2,14.96,11th and 12th grade
Wed May 20 18:13:01 +0000 2020,Michigan sends absentee ballot applications to 7.7 million people ahead of Primaries and the General Election. This was done illegally and without authorization by a rogue Secretary of State. I will ask to hold up funding to Michigan if they want to go down this Voter Fraud path,8.05,8.4,9.3,63.7,3,10.09,8th and 9th grade
Wed May 20 15:10:12 +0000 2020,"....beaten Sleepy Joe in a LANDSLIDE, every State, if these events didn t happen. Even if Warren just dropped out, he would have easily won. Dems did it to him with Crooked Hillary and now, even more so...and Bernie doesn t even complain. VOTE for Trump on TRADE, better than BS",5.82,3.6,6.0,92.32,4,6.08,5th and 6th grade
Wed May 20 15:10:11 +0000 2020,"Crazy Bernie Sanders is not a fighter. He gives up too easy The Dem establishment gets Alfred E. Newman Mayor Pete amp to quit amp endorse Sleepy Joe BEFORE Super Tuesday, amp gets Pocahontas to stay in the race, taking thousands of votes from Bernie. He would have....",7.19,5.6,6.4,76.22,4,7.58,5th and 6th grade
