created_at,text,dale_chall_readability_score,flesch_kincaid,automated_readability,flesch_reading,sentence_count,coleman_liau_index,based_on_all_algorithms
Sun Sep 11 03:37:28 +0000 2011,Cause when I'm not around...I'll still be there in spirit.,0.5,1.3,6.6,103.63,1,6.18,3rd and 4th grade
Sat Sep 10 22:37:17 +0000 2011,Club Paradise,11.63,2.9,7.8,77.91,1,4.2,-1th and 0th grade
Sat Sep 10 09:28:01 +0000 2011,Crack for the culture. ovoxo,7.04,0.5,3.7,100.24,1,4.96,1st and 2nd grade
Sat Sep 10 09:22:27 +0000 2011,Since talked me out of dropping songs at 6am for once...check this evening.,5.5,3.6,7.9,92.12,1,8.16,5th and 6th grade
Sat Sep 10 08:29:57 +0000 2011,You think I'm so caught up in where I am right now...but believe I remember it all.,0.84,5.2,5.6,88.06,1,3.59,5th and 6th grade
Thu Sep 08 17:08:09 +0000 2011,Squad so familiar.,9.05,5.6,5.2,59.97,1,3.43,5th and 6th grade
Tue Sep 06 11:22:19 +0000 2011,That's how you know it's real...when you don't try and beat the traffic you just wait till it's over. Take Care.,1.79,5.6,9.7,92.46,1,5.63,5th and 6th grade
Tue Sep 06 11:21:43 +0000 2011,"Me, and still up recording till traffic dies down.",7.59,2.1,5.1,96.18,1,6.7,3rd and 4th grade
Tue Sep 06 11:18:18 +0000 2011,Best wishes to everybody going back to school today.,5.84,6.8,6.1,62.34,1,8.67,6th and 7th grade
Tue Sep 06 10:24:59 +0000 2011,Alllllllll the way from memphis tennessee...and he got something special for ya'll tonight...,9.14,11.9,14.4,32.9,1,14.83,11th and 12th grade
Tue Sep 06 06:37:57 +0000 2011,It always trips me out to see 40 in the other room mixing as opposed to tracking my vocals...let's me know this shit is really about to drop,7.28,10.7,11.6,68.44,1,5.58,10th and 11th grade
Mon Sep 05 08:19:13 +0000 2011,She in love with my crew...Crew Love.,0.35,-1.2,2.9,115.13,1,2.44,2nd and 3rd grade
Sun Sep 04 05:52:39 +0000 2011,happy birthday my love,0.2,3.7,2.9,75.88,1,4.35,3rd and 4th grade
Sun Sep 04 05:33:56 +0000 2011,gt people who can't beat me at Word Feud without cheating and taking 3 days to finish the game.,5.41,7.2,7.1,77.57,1,5.63,7th and 8th grade
Sun Sep 04 05:29:59 +0000 2011,gt people I can out drink.,0.3,0.9,-2.0,99.23,1,-1.53,0th and 1st grade
Sun Sep 04 02:17:55 +0000 2011,Take Care October 24th,0.2,3.7,2.9,75.88,1,4.35,1st and 2nd grade
Sun Sep 04 01:14:08 +0000 2011,Shout out to KOTD man they do it stoopid big for our city...that Dizaster vs. SMP battle was psycho Take that mirror down...NOW Haaaa,5.55,3.3,6.1,93.14,2,6.71,4th and 5th grade
Sat Sep 03 14:52:12 +0000 2011,One time for Les forreal.,7.04,2.9,0.9,83.32,1,1.48,2nd and 3rd grade
Fri Sep 02 05:40:38 +0000 2011,Haaaa. If you give me 7 of the company...I'll cook one up.,0.6,4.4,3.0,84.68,1,1.67,4th and 5th grade
Fri Sep 02 04:52:58 +0000 2011,3 Million A thug tear just came to my eye...a thug tear though not a regular tear cause that's soft if it was a regular one...OVOXOYMCMBMMG,6.14,9.9,12.2,70.47,1,6.91,6th and 7th grade
Thu Sep 01 13:18:17 +0000 2011,R U Still Down,0.2,-2.3,-6.6,118.18,1,-7.26,-1th and 0th grade
Thu Sep 01 11:13:01 +0000 2011,Look what you've done.,0.2,1.3,2.9,92.8,1,1.45,0th and 1st grade
Wed Aug 31 05:16:30 +0000 2011,Just me and low down loretta brown,6.24,0.1,0.9,106.67,1,3.26,2nd and 3rd grade
Wed Aug 31 05:16:30 +0000 2011,Just me and low down loretta brown,6.24,0.1,0.9,106.67,1,3.26,2nd and 3rd grade
Sat Aug 27 05:54:11 +0000 2011,I hope everybody in LA comes to Supper Club Saturday night...it shall be too turnt up my friends. Too turnt up indeed. ovoxo,0.57,4.2,5.2,85.18,2,6.01,5th and 6th grade
Sat Aug 27 05:35:51 +0000 2011,Congrats to Snoop A true LEGEND. I had so much fun tonight,6.57,0.9,0.0,99.23,2,1.38,-1th and 0th grade
Sat Aug 27 05:33:49 +0000 2011,24 24 24 24 24 24 24...Take Care,0.4,0.5,-2.8,105.66,1,-3.71,0th and 1st grade
Thu Aug 25 04:39:09 +0000 2011,RIP Baby Girl...in my ear at every show letting me know the next move I should make. Love you.,5.41,6.0,6.9,86.03,1,4.41,5th and 6th grade
Thu Aug 25 04:37:23 +0000 2011,Say yes or no cause I'm on the road............wait a minute my battery's low.,5.46,2.9,7.4,99.57,1,2.83,5th and 6th grade
Wed Aug 24 05:48:19 +0000 2011,The rep grows bigga.,7.78,1.3,0.6,92.8,1,0.0,0th and 1st grade
Wed Aug 24 02:08:35 +0000 2011,"I love lists...to do lists, top 10 lists...any type of list is entertaining to me",5.43,5.6,7.1,81.63,1,5.33,5th and 6th grade
Tue Aug 23 05:54:55 +0000 2011,Swangin Wide.,11.63,2.9,7.8,77.91,1,1.3,-1th and 0th grade
Mon Aug 22 09:22:45 +0000 2011,Me and are so proud of man. Real shit.,0.45,0.9,-1.3,104.64,1,-1.03,3rd and 4th grade
Mon Aug 22 08:18:59 +0000 2011,Pretty girls make graves.,0.2,1.3,6.5,92.8,1,7.25,0th and 1st grade
Mon Aug 22 06:12:57 +0000 2011,Aftermarket bezels on a presidential,10.2,12.3,11.2,15.64,1,15.4,11th and 12th grade
Mon Aug 22 00:56:48 +0000 2011,Are you free when I'm free,0.3,-1.5,-2.0,116.15,1,-1.53,-1th and 0th grade
Fri Aug 19 04:32:47 +0000 2011,That's that north north...that up top...that ovo...and that xo,0.45,-0.4,11.3,113.1,1,9.31,-1th and 0th grade
Fri Aug 19 04:18:11 +0000 2011,You could have the cars the clothes the jewels the sex the house...baby you could be a star. The lonely star.,5.66,2.7,3.8,94.66,2,4.44,4th and 5th grade
Fri Aug 19 03:37:04 +0000 2011,Thursday,0.05,8.4,16.8,36.62,1,1.0,-1th and 0th grade
Fri Aug 19 03:09:39 +0000 2011,beat on Take Care is...................fuck its good. That's my brother real deal down to the last meal.,0.42,1.9,7.2,96.69,2,3.15,-1th and 0th grade
Thu Aug 18 03:37:04 +0000 2011,Wednesday is just the day before Thursday. But on Thursday...,0.25,2.9,5.6,83.32,2,6.12,5th and 6th grade
Tue Aug 16 06:40:19 +0000 2011,Accept that some days you're the pigeon And some days you're the statue.,5.5,3.6,6.8,92.12,1,7.24,5th and 6th grade
Tue Aug 16 02:04:31 +0000 2011,24,0.05,-3.5,-11.6,121.22,1,-33.81,-1th and 0th grade
Mon Aug 15 09:46:45 +0000 2011,in Higher Learning and All I Ask Of You . Deja and that song were my life at one point.,6.6,2.3,0.2,95.67,2,1.07,3rd and 4th grade
Sat Aug 13 03:46:33 +0000 2011,We never listen unless it comes with a 808 Kendrick,0.5,3.7,3.4,86.71,1,5.6,3rd and 4th grade
Fri Aug 12 06:56:13 +0000 2011,she pop x i smoke o's that's tic tac toe...xo.,0.5,0.1,1.0,112.09,1,-0.79,0th and 1st grade
Wed Aug 10 07:46:29 +0000 2011,In the studio listening to that B 32...all respects to the general. YMCMB,9.14,7.2,7.2,66.74,1,7.24,7th and 8th grade
Tue Aug 09 02:14:26 +0000 2011,Sorry junior. I already ruined ya.,6.57,6.8,4.3,56.93,1,5.27,6th and 7th grade
Mon Aug 08 04:21:15 +0000 2011,Watermelon fiend.,0.1,14.7,17.3,-6.7,1,12.9,0th and 1st grade
Mon Aug 08 04:12:14 +0000 2011,I need you too.,0.2,-2.3,-5.4,118.18,1,-7.26,-1th and 0th grade
Mon Aug 08 04:04:45 +0000 2011,You need me.,0.15,-2.7,-4.3,119.19,1,-8.18,0th and 1st grade
Mon Aug 08 00:08:53 +0000 2011,No ice cream sound...my sound.,0.25,0.5,5.6,100.24,1,3.8,1st and 2nd grade
Sun Aug 07 03:56:41 +0000 2011,I'll take alcohol over dessert...anyday. Grappa shots if you're down with the team.,7.6,3.5,7.5,81.8,2,8.3,7th and 8th grade
Sat Aug 06 01:00:50 +0000 2011,Maybe she won't...but shit then again maybe she will.,0.45,0.9,6.6,104.64,1,6.7,6th and 7th grade
Fri Aug 05 22:28:59 +0000 2011,That my friend...is a bet.,0.25,-1.9,1.8,117.16,1,-0.85,1st and 2nd grade
Fri Aug 05 21:59:22 +0000 2011,Alright we'll put 50k on it. But I also want an original silver yellow Vokal jersey...signed by you and framed when Hollow wins.,6.27,4.2,6.0,85.18,2,6.77,5th and 6th grade
Thu Aug 04 01:44:25 +0000 2011,I cannot wait to put it on you and make you sweat..........during our match this weekend.,5.42,6.0,8.4,80.62,1,5.28,5th and 6th grade
Tue Aug 02 23:35:08 +0000 2011,I'm looking for somebody who's gonna be somebody.,6.01,4.1,7.3,80.28,1,8.66,2nd and 3rd grade
Tue Aug 02 23:27:16 +0000 2011,Boosie.,0.05,-3.5,12.0,121.22,1,-10.61,-1th and 0th grade
Tue Aug 02 23:25:41 +0000 2011,She say sex ain't the only way to solve it...well lets solve it.,0.64,2.5,3.9,100.58,1,2.83,2nd and 3rd grade
Sun Jul 31 05:49:28 +0000 2011,The real is on the rise. Goodnight.,6.24,2.5,1.6,89.75,1,2.44,2nd and 3rd grade
Sun Jul 31 03:48:23 +0000 2011,O V O FEST...can't wait to see you all.,0.45,0.9,-0.8,104.64,1,-2.3,-1th and 0th grade
Thu Jul 28 07:57:31 +0000 2011,"My thought pattern on a daily basis is pretty much a combination of you, Hank Moody, and the don Clooney George .",6.93,9.1,9.7,67.08,1,7.31,9th and 10th grade
Thu Jul 28 07:53:11 +0000 2011,you are one of my heroes.,6.57,0.9,-2.8,99.23,1,-2.46,1st and 2nd grade
Thu Jul 28 06:45:07 +0000 2011,Happy Birthday to a boss Even though you're weak as shit on Fifa,5.5,3.6,3.9,92.12,1,4.57,5th and 6th grade
Wed Jul 27 05:21:04 +0000 2011,Buying tickets to our own shit. ovoxo.,8.5,2.5,3.6,89.75,1,4.94,2nd and 3rd grade
Wed Jul 27 03:33:41 +0000 2011,Let's eat.,0.1,-3.1,0.8,120.21,1,-10.31,-1th and 0th grade
Tue Jul 26 05:36:46 +0000 2011,Stories you can't tell until I'm gone.,0.35,2.5,3.6,89.75,1,4.07,2nd and 3rd grade
Mon Jul 25 04:13:47 +0000 2011,I am so fuckin proud. You performed magic tonight.,5.61,0.3,2.8,100.75,2,3.44,-1th and 0th grade
Fri Jul 22 05:31:39 +0000 2011,Drop life.,0.1,-3.1,0.8,120.21,1,-7.41,-1th and 0th grade
Wed Jul 20 05:21:56 +0000 2011,"Cleveland July 23rd, Weeknd Mod Club July 24th, OVO Fest July 31st...damn them toronto kids got it.",6.34,7.6,10.1,71.14,1,8.7,7th and 8th grade
Tue Jul 19 09:36:49 +0000 2011,In rare form right this eve.,0.3,-1.5,-0.5,116.15,1,0.45,-1th and 0th grade
Tue Jul 19 03:35:32 +0000 2011,Four chains I want four more...,0.3,-1.5,2.0,116.15,1,1.38,1st and 2nd grade
Mon Jul 18 19:40:44 +0000 2011,Headlines.,19.48,8.4,26.2,36.62,1,6.8,-1th and 0th grade
Sun Jul 17 06:43:14 +0000 2011,I walk around wit my mind blown in my own fuckin zone cause one day you here but the next day you gone Bun B,1.24,6.0,6.9,96.86,1,2.5,5th and 6th grade
Sat Jul 16 01:55:13 +0000 2011,Sorry to the people of Orlando. I will make the next one our best one.,5.06,2.7,-0.2,89.24,2,1.23,5th and 6th grade
Fri Jul 15 08:03:09 +0000 2011,Stay Now...Then Go.,0.15,-2.7,6.8,119.19,1,-0.46,-1th and 0th grade
Fri Jul 15 04:48:35 +0000 2011,Bravo.,19.48,8.4,7.3,36.62,1,-16.41,-1th and 0th grade
Thu Jul 14 05:50:33 +0000 2011,10242011,0.05,-3.5,16.8,121.22,1,1.0,-1th and 0th grade
Tue Jul 05 07:12:46 +0000 2011,The kids I hang with are gonna be parents one day...scary.,5.62,1.7,4.6,102.61,1,4.74,4th and 5th grade
Tue Jul 05 03:16:10 +0000 2011,"Damn i just took the beard down and realized I'm still the same age as ya'll boys...447,000 first week off MY flows. See you in the fall.",1.25,2.7,4.7,100.07,2,4.23,4th and 5th grade
Sun Jul 03 06:01:22 +0000 2011,just ate pizza but left the crust...crust issues.,7.98,2.9,7.3,88.74,1,7.9,2nd and 3rd grade
Sat Jul 02 09:14:03 +0000 2011,Always make it work but I live like I'm retired.,5.71,2.5,1.9,95.17,1,2.7,2nd and 3rd grade
Sat Jul 02 05:46:03 +0000 2011,Did you say wine or water I dunno I'm delirious...,7.29,3.7,2.9,86.71,1,2.7,3rd and 4th grade
Fri Jul 01 07:08:37 +0000 2011,Happy bday to my one and only,0.35,2.5,-2.5,89.75,1,-0.87,2nd and 3rd grade
Fri Jul 01 01:51:36 +0000 2011,October Language.,0.1,14.7,17.3,-6.7,1,12.9,0th and 1st grade
Thu Jun 30 05:30:11 +0000 2011,Crab cakes everywhere...Tony Montana,7.78,7.2,19.4,50.5,1,20.3,1st and 2nd grade
Thu Jun 30 00:03:21 +0000 2011,I'll just blame it on you.,0.3,-1.5,-2.0,116.15,1,-2.46,-3th and -2th grade
Fri Jun 24 05:11:16 +0000 2011,By your laughter...I'll assume that's a yes.,8.5,3.7,7.6,81.29,1,6.56,3rd and 4th grade
Thu Jun 23 19:52:08 +0000 2011,Universal needs to stop taking my fucking songs down. I am doing this for the people not for your label.,7.29,4.8,3.6,78.25,2,5.31,4th and 5th grade
Thu Jun 23 19:13:47 +0000 2011,Free up da man dem from captivity.,6.24,3.7,0.9,81.29,1,2.44,3rd and 4th grade
Thu Jun 23 00:28:12 +0000 2011,Empty home...pretty things...tryna write the songs that my city sings...,5.71,4.8,13.2,78.25,1,12.56,4th and 5th grade
Wed Jun 22 22:16:28 +0000 2011,Haaaaaa...shit like this can only be settled in Tel Aviv. Birthright sound clash.,5.17,1.1,6.8,98.72,2,8.3,2nd and 3rd grade
Wed Jun 22 22:07:41 +0000 2011,the world needs that.,0.2,-2.3,1.8,118.18,1,1.45,1st and 2nd grade
Wed Jun 22 21:56:42 +0000 2011,I can't wait to see you all on tour in the fall...its going be a hell of a fackin' reunion...ovoxo,1.78,6.4,7.2,85.02,1,3.31,7th and 8th grade
Wed Jun 22 04:43:51 +0000 2011,Elevator Fight night...Jack and Ginger and me.,8.5,7.2,9.0,55.91,1,9.87,8th and 9th grade
Tue Jun 21 17:14:56 +0000 2011,Trust Issues is just a fun thing I did while writing on one...not on Take Care.,5.42,3.6,5.4,97.54,1,4.17,4th and 5th grade
Tue Jun 21 09:46:51 +0000 2011,I love you as much as you love me...so if you hate me it works out perfectly,5.41,4.0,3.7,96.52,1,1.85,3rd and 4th grade
Tue Jun 21 00:06:00 +0000 2011,Next Williams Invitational is ours...B Mac maybe you can make it to play us this time...or not.,5.41,6.4,9.0,79.6,1,7.02,8th and 9th grade
Mon Jun 20 17:59:32 +0000 2011,Trust Issues.,11.63,2.9,7.8,77.91,1,1.3,-1th and 0th grade
Mon Jun 20 17:47:37 +0000 2011,Monday Tuesday Wednesday Friday Saturday Sunday...but on Thursday.,0.4,12.3,17.3,21.06,1,20.26,-1th and 0th grade
Sun Jun 19 03:26:03 +0000 2011,ovoxo,0.05,-3.5,2.6,121.22,1,-16.41,-1th and 0th grade
Fri Jun 17 03:16:46 +0000 2011,Thank you. You're far too kind.,0.3,-1.5,2.0,116.15,1,1.38,1st and 2nd grade
Fri Jun 17 01:51:46 +0000 2011,Young Happy,0.1,2.9,3.1,77.91,1,-1.61,-1th and 0th grade
Thu Jun 16 13:34:30 +0000 2011,If you could have it...would you even want it,0.45,0.9,2.4,104.64,1,2.87,3rd and 4th grade
Thu Jun 16 01:55:54 +0000 2011,You tried to warn me...but baby...I'm warning you.,7.98,2.9,7.9,88.74,1,5.76,2nd and 3rd grade
Wed Jun 15 09:25:39 +0000 2011,Awlready.,19.48,8.4,21.5,36.62,1,1.0,-1th and 0th grade
Wed Jun 15 04:56:58 +0000 2011,June 15th in this bitch whatttttuuuuuuup...ThankMeLater,9.2,12.7,20.8,14.63,1,24.58,12th and 13th grade
Tue Jun 14 03:43:44 +0000 2011,Chop Stars,0.1,-3.1,0.8,120.21,1,-4.51,-1th and 0th grade
Mon Jun 13 18:21:15 +0000 2011,Give it up. Sit down. Sip this. Watch this. Smoke this. You're the one baby ya know this. Ok.,4.94,1.1,1.9,104.13,2,1.42,1st and 2nd grade
Fri Jun 10 07:55:04 +0000 2011,Life is all so crazy and god must be thoroughly entertained by all our little dances E,6.34,6.4,6.5,79.6,1,6.32,6th and 7th grade
Thu Jun 09 13:21:47 +0000 2011,She told me the outro keys are chilling...,7.98,2.9,3.2,88.74,1,3.55,2nd and 3rd grade
Thu Jun 09 04:19:02 +0000 2011,Next time isn't really my thing.,0.3,4.5,2.8,73.85,1,3.35,2nd and 3rd grade
Sun Jun 05 04:10:18 +0000 2011,Sorry if you've ever worked up all your courage to ask for a picture and I wasn't able to take it right then. I hate being that guy.,0.69,4.0,3.2,91.11,2,3.07,3rd and 4th grade
Sat Jun 04 09:58:00 +0000 2011,Flights in the morning...what you doing that's so important,5.84,6.8,9.8,62.34,1,11.22,5th and 6th grade
Fri Jun 03 08:21:14 +0000 2011,"OVO Fest Tickets on sale TODAY through Ticketmaster TheWeeknd, Rick Ross, Drake...ovoxo",8.18,6.8,14.4,67.76,1,16.17,7th and 8th grade
Fri Jun 03 02:16:14 +0000 2011,La Familia. The Ring Leader.,7.04,5.2,3.7,66.4,1,3.8,3rd and 4th grade
Wed Jun 01 01:14:36 +0000 2011,Its your time...get it done.,0.25,-1.9,3.7,117.16,1,1.48,1st and 2nd grade
Sat May 28 08:28:45 +0000 2011,Rehab Pool Party in Vegas is going to alter your life if you come...just FYI.,7.54,6.8,5.9,73.17,1,4.92,6th and 7th grade
Sat May 28 01:23:14 +0000 2011,What's your real name What's your work name,0.4,0.5,3.8,105.66,1,5.0,0th and 1st grade
Thu May 26 22:58:21 +0000 2011,"Get SELF MADE in stores now MMG...Shot to Meek, Wale, and Pill Young and gettin it. You a",5.41,4.4,6.4,95.51,1,3.71,3rd and 4th grade
Thu May 26 08:32:19 +0000 2011,"2nd annual OVO Fest at Molson Amphitheater July 31st...The Weeknd, Ricky Rozay, and myself...tickets on sale June 3rd",8.04,9.1,13.8,61.67,1,12.06,11th and 12th grade
Tue May 24 02:35:03 +0000 2011,You're a shooting star...but the crying stops tonight,7.98,4.1,9.7,80.28,1,10.8,2nd and 3rd grade
Sun May 22 03:56:03 +0000 2011,Love them women that like to lay it on eight 8 Ball,0.6,2.1,0.3,101.6,1,1.15,0th and 1st grade
Fri May 20 15:57:51 +0000 2011,Just let that shit breathe...we're just getting started,6.01,2.9,10.8,88.74,1,12.25,2nd and 3rd grade
Fri May 20 15:47:03 +0000 2011,Hov diss Hov of all people has not lost it...that's god body flow.,0.64,3.6,4.6,92.12,1,3.7,3rd and 4th grade
Fri May 20 11:59:49 +0000 2011,Everybody yelled surprise...I wasn't surprised,7.04,12.3,20.6,15.64,1,22.36,12th and 13th grade
Fri May 20 07:10:53 +0000 2011,Dreams Money Can Buy.,0.2,1.3,1.8,92.8,1,1.45,1st and 2nd grade
Thu May 19 05:32:15 +0000 2011,Studio with kings.,9.05,0.9,5.2,93.81,1,3.43,0th and 1st grade
Mon May 16 11:33:40 +0000 2011,I always loved a sense of humor...but tonight you shoulda seen how quiet the room was...,6.4,6.0,8.0,80.62,1,6.73,5th and 6th grade
Mon May 16 09:27:58 +0000 2011,Still ain't tryna die to get to heaven.,6.01,2.9,1.4,88.74,1,2.1,2nd and 3rd grade
Sat May 14 11:36:24 +0000 2011,Dj Kaki...that's epic.,9.05,-2.7,11.5,119.19,1,3.43,0th and 1st grade
Fri May 13 10:39:16 +0000 2011,Purple or Pink Tell me how to fix this drink...,0.5,1.3,1.5,103.63,1,1.54,1st and 2nd grade
Thu May 12 23:54:32 +0000 2011,Wildfire.,19.48,8.4,21.5,36.62,1,1.0,-1th and 0th grade
Thu May 12 09:06:40 +0000 2011,Still playing like I'm being scouted till I'm outty.,9.35,4.4,6.1,79.26,1,7.39,3rd and 4th grade
Thu May 12 06:07:05 +0000 2011,Feel like a million counted one at a time.,5.84,2.1,0.9,96.18,1,2.23,3rd and 4th grade
Tue May 10 09:06:07 +0000 2011,Dime was super brash and rappery of me...I meant you were stunning.,8.18,4.4,6.6,84.68,1,6.95,4th and 5th grade
Tue May 10 09:00:39 +0000 2011,Kat Dennings I just woke up out of bed to let you know you were a dime on Conan tonight. XO.,6.18,5.6,5.2,92.46,1,2.03,5th and 6th grade
Tue May 10 01:32:19 +0000 2011,What up killa Man stop bringing up my past.,7.59,2.1,1.4,96.18,1,2.87,3rd and 4th grade
Fri May 06 02:12:06 +0000 2011,The Calm...The Resistance...The Ride.,7.78,3.7,20.6,75.88,1,15.95,3rd and 4th grade
Thu May 05 07:59:11 +0000 2011,All the care that we take...all the love that we make...,0.55,0.5,3.8,111.07,1,2.65,0th and 1st grade
Wed Apr 27 08:32:08 +0000 2011,Got a single...yea bitch a sinnnngle...,0.3,0.9,8.3,99.23,1,6.25,0th and 1st grade
Wed Apr 27 07:07:01 +0000 2011,you snooooooooooo dat,0.15,-2.7,9.9,119.19,1,11.15,0th and 1st grade
Wed Apr 27 04:04:36 +0000 2011,Go do that voodoo that you do so well.,0.45,-0.4,-1.3,113.1,1,-0.39,-1th and 0th grade
Tue Apr 26 05:13:57 +0000 2011,Last night I cried tears of joy...what did we do to deserve this,0.64,3.6,3.9,92.12,1,3.7,3rd and 4th grade
Mon Apr 25 04:29:28 +0000 2011,Do you want to be loved or do you want to be respected,5.5,3.6,0.3,92.12,1,0.57,-1th and 0th grade
Sun Apr 24 10:29:34 +0000 2011,6 29 AM and the west end of the city looks golden...dear summer...allow us to begin what we will forever remember. ovoxo,1.81,10.7,10.8,57.61,1,6.96,10th and 11th grade
Sat Apr 23 06:02:55 +0000 2011,I wanna talk to Sampson,10.2,2.9,-1.1,83.32,1,0.32,1st and 2nd grade
Thu Apr 21 09:36:13 +0000 2011,I love when the feeling's mutual.,9.2,4.5,3.6,73.85,1,4.28,4th and 5th grade
Wed Apr 20 22:33:14 +0000 2011,13,0.05,-3.5,-11.6,121.22,1,-33.81,-1th and 0th grade
Thu Apr 14 00:37:05 +0000 2011,We're on a different ride. OVOXO,0.3,2.1,2.8,90.77,1,3.35,2nd and 3rd grade
Wed Apr 13 07:27:37 +0000 2011,...And all the broads puttin' cars in they name for the stars of the game,0.74,2.1,4.6,107.01,1,3.41,2nd and 3rd grade
Tue Apr 12 09:26:06 +0000 2011,Watch me take it.,0.2,-2.3,-3.0,118.18,1,-4.36,-1th and 0th grade
Sun Apr 10 08:16:24 +0000 2011,It's all about you but it's only me here.,0.45,0.9,0.4,104.64,1,0.26,0th and 1st grade
Sun Apr 10 07:25:30 +0000 2011,I remember it all. Whether it happened or not.,5.61,1.5,0.7,92.29,2,0.89,1st and 2nd grade
Mon Apr 04 19:03:43 +0000 2011,Got campaign going so strong.,7.04,2.9,4.6,83.32,1,6.12,1st and 2nd grade
Sun Apr 03 03:30:00 +0000 2011,UK played hard...Kemba is a beast...Lamb and Napier played an incredible game as well...Congrats UConn,8.59,9.1,13.7,56.25,1,12.69,8th and 9th grade
Wed Mar 30 03:18:43 +0000 2011,Caretaker.,19.48,20.2,26.2,-47.99,1,6.8,19th and 20th grade
Mon Mar 28 21:55:10 +0000 2011,Go Big Blue...cant wait to see my squad Saturday.,0.45,3.3,4.5,87.72,1,4.78,4th and 5th grade
Sat Mar 26 18:56:52 +0000 2011,My phone just sent a random pic to this shit. Odd way to start the day.,5.02,0.5,-1.0,105.66,2,-0.05,-1th and 0th grade
Sat Mar 26 08:43:41 +0000 2011,Prayers for my brother Soulja and his family before I lay it down tonight.,5.46,6.4,6.1,74.19,1,7.01,6th and 7th grade
Thu Mar 24 16:18:23 +0000 2011,I aint lying to nobody but me...and you...and me...but you especially.,5.62,6.4,9.7,68.77,1,7.93,5th and 6th grade
Wed Mar 23 13:19:58 +0000 2011,New flows.,0.1,-3.1,0.8,120.21,1,-7.41,-1th and 0th grade
Mon Mar 21 11:44:02 +0000 2011,Sippin on this...living off this.,7.04,5.2,8.4,66.4,1,7.28,7th and 8th grade
Sun Mar 20 19:30:38 +0000 2011,XO GANG.,0.1,-3.1,-4.0,120.21,1,-13.21,-1th and 0th grade
Sat Mar 19 09:20:40 +0000 2011,Wow. 2 Million. That's real as shit. I'm touched.,0.22,0.3,2.3,100.75,2,0.25,-1th and 0th grade
Sat Mar 19 05:05:35 +0000 2011,This shit feels like Escape or Club 26...Me Jordan and Niko...Free TJ,5.55,3.3,7.3,93.14,1,6.95,4th and 5th grade
Sat Mar 19 04:33:48 +0000 2011,Toronto is truly the greatest place on this earth.,7.59,3.3,5.1,87.72,1,7.39,3rd and 4th grade
Wed Mar 16 06:50:50 +0000 2011,It's easy to love me now. RIP Nate Dogg.,0.22,-2.1,-2.5,117.67,2,-3.65,-4th and -3th grade
Sun Mar 13 12:45:50 +0000 2011,Hank Moody just hit Kravitz with the Thank Me Later on Californication when he serves her dinner. Ur a god Moody.,5.66,3.8,4.7,86.2,2,6.35,5th and 6th grade
Sun Mar 13 01:32:52 +0000 2011,We didn't know where we were going we just kept going. OVO,0.6,4.4,3.0,84.68,1,3.58,4th and 5th grade
Sun Mar 13 01:00:47 +0000 2011,I got a party with bill clinton on thursday.,5.84,3.3,1.9,87.72,1,3.51,3rd and 4th grade
Sat Mar 12 10:38:01 +0000 2011,Pimp woulda loved it.,7.78,1.3,1.8,92.8,1,1.45,1st and 2nd grade
Fri Mar 11 07:15:03 +0000 2011,People I stalk and hope for their love in return...George Clooney and,0.6,4.4,7.3,84.68,1,8.4,4th and 5th grade
Thu Mar 10 18:02:48 +0000 2011,Follow the young king,0.2,1.3,1.8,92.8,1,2.9,1st and 2nd grade
Wed Mar 09 23:35:30 +0000 2011,And they tell me welcome home,0.3,0.9,0.4,99.23,1,2.37,0th and 1st grade
Wed Mar 09 23:17:33 +0000 2011,Finally made it back to Jamaica...New Waaaaaaaaaaaave.,6.24,3.7,14.4,81.29,1,16.54,3rd and 4th grade
Wed Mar 09 23:17:33 +0000 2011,Finally made it back to Jamaica...New Waaaaaaaaaaaave.,6.24,3.7,14.4,81.29,1,16.54,3rd and 4th grade
Mon Mar 07 01:29:04 +0000 2011,Bring your love baby I could bring my shame. The Weeknd,5.62,1.7,3.3,102.61,1,4.74,4th and 5th grade
Sun Mar 06 10:52:56 +0000 2011,Just some toronto kids...,7.78,1.3,6.5,92.8,1,4.35,0th and 1st grade
Sun Mar 06 03:38:53 +0000 2011,Vegas nights. Been too long.,7.04,0.5,3.7,100.24,1,3.8,3rd and 4th grade
Fri Mar 04 08:11:18 +0000 2011,Bad decisions...good intentions.,14.31,21.0,27.2,-50.02,1,24.72,27th and 28th grade
Wed Mar 02 12:55:46 +0000 2011,do sumthin wit chaself marl.,7.04,0.5,3.7,100.24,1,4.96,1st and 2nd grade
Mon Feb 21 06:14:10 +0000 2011,"Live without pretending, Love without depending, Listen without defending, Speak without offending.",9.5,13.9,19.1,17.0,1,22.43,13th and 14th grade
Sat Feb 19 03:39:18 +0000 2011,And Drake Griffin in the game sunday...young and wild...we on,5.71,4.8,8.1,78.25,1,7.92,4th and 5th grade
Sat Feb 19 03:35:58 +0000 2011,Look at my brothers wall and cousins Proud of ya'll man.,5.62,1.7,3.8,102.61,1,4.74,4th and 5th grade
Thu Feb 17 02:52:58 +0000 2011,OVO too real.,0.15,0.9,-2.7,93.81,1,-6.26,0th and 1st grade
Mon Feb 14 09:15:45 +0000 2011,Anthony Hamilton and Henny and Cranberry...feeling like a winner no matter what...Mazel Tov Esperanza,9.97,12.3,15.2,31.89,1,16.12,11th and 12th grade
Mon Feb 14 09:10:59 +0000 2011,You picked a fine time to leave me Lucille...,5.84,0.9,2.4,104.64,1,2.87,3rd and 4th grade
Mon Feb 14 03:11:54 +0000 2011,Hilary from Lady Ant looks so right up there I'm very aroused.,5.55,3.3,4.6,93.14,1,5.5,4th and 5th grade
Sun Feb 13 11:13:56 +0000 2011,Tonight I could have became something else...but I walked away and remain as myself.,0.69,6.4,9.4,74.19,1,9.91,5th and 6th grade
Fri Feb 11 23:53:07 +0000 2011,YMCMB for the rest of my life. Always All Days.,5.46,0.5,-1.1,100.24,2,-0.85,1st and 2nd grade
Fri Feb 11 08:43:46 +0000 2011,Just talked to moms...told her she's the sweetest.,6.01,2.9,7.9,88.74,1,7.9,2nd and 3rd grade
Mon Feb 07 04:26:04 +0000 2011,Take care of me.,0.2,-2.3,-4.2,118.18,1,-5.81,-1th and 0th grade
Fri Feb 04 02:31:40 +0000 2011,Jet cannot take off tonight due to weather. Me and Alex and will make it up to Atlanta...that's my word,1.29,2.5,3.4,95.17,2,4.15,3rd and 4th grade
Mon Jan 31 23:46:04 +0000 2011,I'd like to help you out...soon as I figure out how you came in.,0.69,2.9,2.7,99.57,1,1.21,2nd and 3rd grade
Sun Jan 30 07:06:48 +0000 2011,Zoe Kravitz on Californication...my two favorite things in the world. But she's not a thing...she's everything.,5.02,7.6,10.8,54.9,2,11.56,4th and 5th grade
Sat Jan 29 01:18:51 +0000 2011,My mom is 63 today WOW. I'm gonna celebrate you baby...I'm gonna praise you like I should,5.92,1.9,3.0,96.69,2,3.5,3rd and 4th grade
Sat Jan 29 01:16:40 +0000 2011,Are we on the air Ty Harper is one of the smartest hip hop heads ever. He is from Toronto.,5.71,2.5,0.3,95.17,2,1.25,3rd and 4th grade
Fri Jan 28 18:05:24 +0000 2011,Happy Birthday Mom,0.15,5.6,5.2,59.97,1,5.35,5th and 6th grade
