created_at,text,dale_chall_readability_score,flesch_kincaid,automated_readability,flesch_reading,sentence_count,coleman_liau_index,based_on_all_algorithms
Tue Nov 08 08:26:31 +0000 2016,we need everyone WOKE for the next 24 hrs. Encourage all your friends to vote tomorrow and makes a thing of it.,1.26,4.0,3.3,85.69,2,4.74,5th and 6th grade
Tue Nov 08 08:23:18 +0000 2016,Emma from Wisconsin has Cerebral Palsy. In a wheelchair her whole life. She saw the video of Trump making fun of a disabled reporter.,8.64,4.1,4.1,80.28,3,6.22,4th and 5th grade
Tue Nov 08 06:38:49 +0000 2016,"Hillary we love you because we know, that you know, WE ARE StrongerTogether ImWithHer",6.59,6.4,9.8,74.19,1,11.13,6th and 7th grade
Tue Nov 08 03:46:40 +0000 2016,Election2016,19.48,8.4,35.6,36.62,1,24.2,-1th and 0th grade
Tue Nov 08 03:42:15 +0000 2016,THATS THE SPIRIT,0.15,0.9,2.1,93.81,1,1.52,0th and 1st grade
Tue Nov 08 03:21:11 +0000 2016,Trump is anti LGBT rights. GoVote VoteHillary election2016 ImWithHer Vote LGBT equality,11.83,5.6,11.4,65.39,2,15.42,5th and 6th grade
Tue Nov 08 00:49:06 +0000 2016,ElectionFinalThoughts ImWithHer GoVote Vote You cannot sit this one out it's too important it will change our country forever.,7.9,9.5,14.8,60.65,1,15.08,7th and 8th grade
Mon Nov 07 22:26:25 +0000 2016,"On my way to Raleigh, NC. Let's Do This. Text GAGA to 47246 amp hear a message from me about Election Day. Election2016 GoVote Vote",5.84,1.0,1.9,98.92,4,3.13,2nd and 3rd grade
Mon Nov 07 21:14:52 +0000 2016,Listen up Florida. He says ImWithHer he lost a loved one in Orlando Massacre,8.5,4.8,3.3,72.83,2,5.75,8th and 9th grade
Mon Nov 07 19:54:51 +0000 2016,GoVote Election2016 ImWithHer VoteHillary,19.62,9.6,25.3,33.58,1,31.9,9th and 10th grade
Sun Nov 06 21:40:42 +0000 2016,. you divided us with hateful language amp fear . I love everyone in this country and I vote for to unite us.,5.66,5.0,3.3,77.74,2,4.44,5th and 6th grade
Sun Nov 06 21:26:58 +0000 2016,BREAKING NEWS FBI CONFIRMED to congress TODAY there's NO criminal grounds for reasonable prosecution in relation to Clinton emails. RT RT,10.69,12.7,15.3,41.7,1,14.5,14th and 15th grade
Sun Nov 06 21:03:20 +0000 2016,MinnesotaMonsters mobilize RT Our republican candidate is a reality star leveraging our country for his own business. Vote for honesty.,9.66,11.9,10.9,27.49,2,14.3,11th and 12th grade
Sun Nov 06 19:18:13 +0000 2016,. to say u will stand for anti bullying is hypocrisy. Your husband is 1 of the most notorious bullies we have ever witnessed.,7.64,6.6,5.2,68.26,2,6.48,7th and 8th grade
Sun Nov 06 18:21:55 +0000 2016,"Young people listen up. We need to mobilize now, VoteHillary and stop this dangerous man from continuing to divide and wreck our democracy.",6.95,7.8,8.3,59.8,2,10.3,9th and 10th grade
Sun Nov 06 17:22:12 +0000 2016,Vote GoVote I've been traveling the world. Our election is an international issue. If he wins we will be in a weak position globally.,8.64,5.2,4.1,71.82,3,5.99,9th and 10th grade
Sun Nov 06 01:18:33 +0000 2016,"Ok monsters WHO I KNOW ARE VOTING Get to work. RT My thoughts as a celebrity insider, on Trump. And why it's important to VoteHillary",7.21,3.0,3.3,88.43,3,5.01,2nd and 3rd grade
Sat Nov 05 05:26:55 +0000 2016,GagaSnapchatFilter AYO JOANNE,9.05,9.2,22.5,34.59,1,26.63,8th and 9th grade
Fri Nov 04 15:41:59 +0000 2016,Click the YouTube link and watch my 1st ever live tv performance of JOANNE Thank u to my fans for embracing something so close to my heart.,6.15,9.1,11.8,77.91,1,7.09,6th and 7th grade
Fri Nov 04 14:07:43 +0000 2016,thanks you,0.1,-3.1,0.8,120.21,1,-4.51,-1th and 0th grade
Fri Nov 04 10:27:15 +0000 2016,Strong women have been called Witches amp Bitches for centuries. In 2016 they're called nasty. GetNasty VoteHillary,8.7,4.2,10.2,79.77,2,13.42,3rd and 4th grade
Thu Nov 03 23:08:52 +0000 2016,"If you haven't yet, pick up my song MillionReasons or my new album JOANNE here gt",6.4,6.0,6.0,80.62,1,5.62,5th and 6th grade
Thu Nov 03 22:43:41 +0000 2016,"take 20 deep breaths slowly and then if you can hold ice cubes in your hands still it's hurts so bad you cant, helps me. Xoxo, J",1.34,6.7,9.9,94.83,1,4.07,6th and 7th grade
Thu Nov 03 22:38:14 +0000 2016,Wow this is so so special thank you my little creative angel,6.86,4.4,3.8,84.68,1,5.5,4th and 5th grade
Thu Nov 03 22:25:22 +0000 2016,"Awesome pants, even more awesome band. xoxo, JOANNE",6.01,2.9,8.5,88.74,1,10.11,2nd and 3rd grade
Thu Nov 03 13:44:16 +0000 2016,JoanneVibes say hello from backstage at...,9.2,4.5,10.6,73.85,1,12.05,1st and 2nd grade
Thu Nov 03 08:05:54 +0000 2016,"Photo from Japanese Press Conference yesterday in Tokyo. Joanne has been all about pastels, flowers and woman power JoanneVibes",9.09,7.0,10.4,61.83,2,13.6,8th and 9th grade
Thu Nov 03 00:05:25 +0000 2016,Go JOANNE And go JoanneCrew,7.04,0.5,2.7,100.24,1,4.96,1st and 2nd grade
Wed Nov 02 21:59:19 +0000 2016,I couldn't hold back the tears when my record label presented me with a custom JoanneVibes Kimono. This is such a high honor. Aishetemasu,7.52,4.4,6.9,84.68,2,8.69,5th and 6th grade
Tue Nov 01 14:04:03 +0000 2016,I am so grateful to have the 1 Album in Japan for the 2nd week in a row. Can't wait to tell you the story of JOANNE,1.25,2.7,0.9,100.07,2,0.8,0th and 1st grade
Tue Nov 01 13:44:13 +0000 2016,I could look out this window all night. But I have to be up early for Sukkiri Going to sing.....,0.5,2.5,1.7,95.17,2,1.83,1st and 2nd grade
Tue Nov 01 08:59:33 +0000 2016,Wish I could sign and take pictures with every single one of you Aishetemasu Japan amp I can't wait to sing for you on TV JOANNE,1.9,7.5,10.2,87.39,1,5.75,5th and 6th grade
Tue Nov 01 08:57:25 +0000 2016,So many gorgeous Japanese Angels at the airport waiting for me I love your s amp joyful SPIRIT We're back monsters Get ready for JOANNE,8.03,10.7,12.0,63.02,1,8.54,8th and 9th grade
Tue Nov 01 08:08:37 +0000 2016,Up close write up on my last Dive Bar show...for now. JOANNE,0.6,2.1,3.8,101.6,1,3.58,3rd and 4th grade
Mon Oct 31 20:17:32 +0000 2016,When Halloween is on the to Tokyo. I need to sleep so I can kill my performances in Tokyo but I need a comfy costume HappyHalloween,7.32,4.8,4.3,83.66,2,5.26,4th and 5th grade
Mon Oct 31 19:55:34 +0000 2016,"TOKYO, here we come Thank you for the beautiful plane",0.5,2.5,4.3,95.17,1,6.18,4th and 5th grade
Sun Oct 30 20:10:33 +0000 2016,I can't believe I'm the Female Artist with THE MOST 1 ALBUMS THIS DECADE 4 1s That's a grand slam Thank you to my fans,6.14,7.1,8.8,88.4,1,4.13,6th and 7th grade
Sun Oct 30 17:16:24 +0000 2016,i love this how can i buy it,0.4,-0.8,-5.1,114.12,1,-4.4,-1th and 0th grade
Sun Oct 30 05:19:09 +0000 2016,Yes you are So cool I love it . JoanneHalloween Joanne,5.71,3.7,4.3,86.71,1,6.18,5th and 6th grade
Sun Oct 30 04:46:49 +0000 2016,JoanneHalloween and show me your JoanneVibes this hollows eve,9.35,4.4,10.8,79.26,1,15.11,4th and 5th grade
Sun Oct 30 02:42:15 +0000 2016,polka,19.48,8.4,2.6,36.62,1,-16.41,-1th and 0th grade
Sun Oct 30 00:04:55 +0000 2016,Wow John Vincent THATS HOW YOU SING THE National Anthem Goosebumps Let's go,9.14,6.0,7.9,75.2,1,9.5,6th and 7th grade
Sat Oct 29 02:44:55 +0000 2016,So proud of my dad his JOANNE TRATTORIA COOKBOOK full of family recipes and photos Pre order for the holidays,7.79,9.9,9.8,59.64,1,8.82,9th and 10th grade
Fri Oct 28 22:01:27 +0000 2016,no way Everyone is welcome tattoos or not JoanneCrew is for everybody,6.86,8.0,7.3,59.3,1,9.85,6th and 7th grade
Fri Oct 28 21:02:04 +0000 2016,"The Joanne Crew is all about people helping amp loving each other. U r not alone, well heal each other w xoxo",5.62,2.9,2.9,94.15,2,4.21,4th and 5th grade
Fri Oct 28 20:58:58 +0000 2016,duh,0.05,-3.5,-6.9,121.22,1,-28.01,-1th and 0th grade
Fri Oct 28 20:38:06 +0000 2016,U don't have to get the tattoo to be in the JoanneCrew you jus' gotta carry those good vibes amp persevere through the pain.,7.46,9.1,10.4,72.5,1,6.68,6th and 7th grade
Fri Oct 28 20:21:55 +0000 2016,Ladies and gentlemen.. drum roll little monsters...let's welcome in The Joanne Crew... JoanneCrew JOANNE,6.59,7.6,16.2,65.73,1,16.12,7th and 8th grade
Fri Oct 28 20:09:36 +0000 2016,Here's me performing last night DiveBarTour i missed performing for you amp hearing you sing along millionreasons,7.27,9.9,14.0,54.22,1,15.19,13th and 14th grade
Fri Oct 28 15:28:50 +0000 2016,GET READY for the SUPERBOWL amp my tour for JOANNE. This is just the beginning Song John Wayne available gt here,5.66,2.7,4.4,94.66,2,6.35,5th and 6th grade
Fri Oct 28 15:15:15 +0000 2016,Million Reasons is the 1 song on in my home USA at. Cc ..,5.5,3.6,1.0,92.12,1,0.1,5th and 6th grade
Fri Oct 28 09:20:12 +0000 2016,JOANNE my Album debuted 1 in Japan Thank U SO MUCH Aishetemasu SEE U S N,6.4,4.8,3.3,89.08,1,3.07,4th and 5th grade
Fri Oct 28 03:10:26 +0000 2016,"We're late, we're late But we're driving up now DiveBarTour WATCH LIVE",6.86,4.4,7.7,84.68,1,8.4,7th and 8th grade
Fri Oct 28 01:46:45 +0000 2016,"DiveBarTour Los Angeles, it's almost time Show starts at 10 45pm ET 7 45pm PT WATCH LIVE at MillionReasons",7.07,9.5,9.9,60.65,1,8.99,9th and 10th grade
Thu Oct 27 22:38:38 +0000 2016,Tonight we're smokin em all... The final DiveBarTour show starts at 10pm ET,6.39,2.3,4.7,90.26,2,6.09,5th and 6th grade
Thu Oct 27 22:34:27 +0000 2016,"thank you so much, I poured my heart and soul into that song and to know it touched you gives me purpose girl, u",1.85,6.8,8.0,89.42,1,4.07,6th and 7th grade
Thu Oct 27 21:30:45 +0000 2016,MillionReasons available HERE gt JOANNE,10.2,7.6,14.0,49.48,1,18.88,9th and 10th grade
Thu Oct 27 19:28:26 +0000 2016,"Obsessed with all of these new GIFs, thank you for my new page",5.5,2.5,3.2,100.58,1,3.7,5th and 6th grade
Thu Oct 27 09:13:19 +0000 2016,that makes me so happy that's what I WANT my music to do for you,0.74,3.2,1.8,98.55,1,1.09,0th and 1st grade
Thu Oct 27 08:06:34 +0000 2016,"I love A YO I couldn't wait to share it with you, I U x o x o JOANNE mirror on the.ceilin'",1.09,6.0,4.4,91.45,1,-0.18,-1th and 0th grade
Thu Oct 27 07:49:30 +0000 2016,JOANNE,0.05,-3.5,7.3,121.22,1,-10.61,-1th and 0th grade
Thu Oct 27 01:23:43 +0000 2016,AYO A YO get it here,0.3,-1.5,-6.8,116.15,1,-6.34,-1th and 0th grade
Thu Oct 27 00:30:43 +0000 2016,That's what JoanneVibes are ALL ABOUT.,6.57,0.9,7.5,99.23,1,9.15,1st and 2nd grade
Wed Oct 26 22:14:32 +0000 2016,If you haven't yet.. catch up on this weeks episode of ChicagoFire love my whole family there,0.84,4.0,8.4,96.52,1,7.65,7th and 8th grade
Wed Oct 26 16:12:40 +0000 2016,Looking for Mirror On the Ceilin' It's actually called A YO Get it here RT Monsters JOANNE,7.27,7.6,7.6,71.14,1,7.02,7th and 8th grade
Wed Oct 26 16:09:46 +0000 2016,Here's a RECAP of GagaCarpool surprise performer host in the studio AYO Mirror on The Ceilin',8.38,7.2,9.6,72.16,1,9.97,6th and 7th grade
Wed Oct 26 07:37:22 +0000 2016,. on again NOW You don't want to miss it there's a JOANNE style surprise AYO GagaCarpool,5.42,4.8,7.8,89.08,1,7.42,7th and 8th grade
Wed Oct 26 00:35:06 +0000 2016,"I had so much fun driving to work, maybe I'll stick around for some more fun... See u tonight on CarpoolKaraoke",5.66,1.5,4.2,103.12,2,5.02,4th and 5th grade
Tue Oct 25 17:35:34 +0000 2016,Lady Gaga is doing Carpool Karaoke JOANNE,8.5,3.7,5.6,81.29,1,9.06,2nd and 3rd grade
Tue Oct 25 17:08:51 +0000 2016,A YO new song get it HERE gt JOANNE mirror on the ceilin' signin' away over here AYO,0.89,4.4,5.1,95.51,1,3.36,4th and 5th grade
Tue Oct 25 15:32:26 +0000 2016,Bringing JOANNE to the on 11 20 See u there AMAs,5.62,1.7,0.3,102.61,1,1.55,1st and 2nd grade
Tue Oct 25 00:35:01 +0000 2016,GET READY,0.1,-3.1,-1.7,120.21,1,-7.41,-1th and 0th grade
Mon Oct 24 23:44:03 +0000 2016,Lady Gaga will tour after the Super Bowl,6.01,4.1,2.0,80.28,1,4.31,3rd and 4th grade
Mon Oct 24 22:57:30 +0000 2016,It's JOANNE release week celebrate by downloading here or streaming here,9.92,6.4,10.6,68.77,1,13.73,6th and 7th grade
Mon Oct 24 14:44:56 +0000 2016,You're the best Howard. JOANNE Just did a live performance of Million Reasons,6.39,2.3,5.4,90.26,2,7.89,5th and 6th grade
Mon Oct 24 12:28:33 +0000 2016,Sign up now for a free trial of to hear me on this morning,5.46,2.9,0.7,99.57,1,0.75,5th and 6th grade
Mon Oct 24 11:08:16 +0000 2016,gettin' ready for you baby doin' my vocal la la las vocal warmups ...should I brings donuts,7.27,5.2,7.8,88.06,1,6.32,7th and 8th grade
Mon Oct 24 10:37:34 +0000 2016,Up and at 'em Getting ready for an interview amp performance on at 9 am EST JOANNE JoanneCrew,7.16,6.8,7.4,78.59,1,6.61,6th and 7th grade
Mon Oct 24 04:33:57 +0000 2016,JOANNE so awesome. Such an honor to be apart of this episode,5.25,0.9,0.8,99.23,2,2.37,0th and 1st grade
Mon Oct 24 04:14:44 +0000 2016,"don't give up girl, then that pain into power. That's ure wisdom and knowledge feel better",6.01,2.9,4.7,88.74,2,6.1,2nd and 3rd grade
Mon Oct 24 01:22:00 +0000 2016,A YO from my new album JOANNE LIVE on SNL Download or stream HERE AYO,6.49,3.2,3.4,98.55,1,3.41,2nd and 3rd grade
Mon Oct 24 01:15:30 +0000 2016,Million Reasons live on SNL,7.04,2.9,2.7,83.32,1,4.96,2nd and 3rd grade
Mon Oct 24 00:38:21 +0000 2016,20 lbs,0.1,-3.1,-8.8,120.21,1,-16.11,-1th and 0th grade
Sun Oct 23 18:36:56 +0000 2016,LOOK who came to support me at SNL What a doll We are so excited for our AStarIsBorn Thank you for my glam gear JOANNE,6.14,8.3,8.8,79.94,1,4.82,8th and 9th grade
Sun Oct 23 14:27:14 +0000 2016,Mine too I had the best time ever couldn't erase my smile,0.6,3.3,2.6,93.14,1,3.58,4th and 5th grade
Sun Oct 23 14:24:34 +0000 2016,Thank you Tom ure the best and THANM YOU for my KILLER purple outfit I love it,0.84,4.0,4.3,96.52,1,3.59,3rd and 4th grade
Sun Oct 23 14:01:28 +0000 2016,that is so sweet I sang it from I heart for you I swear I could feel the world through the TV,1.09,4.8,5.0,99.91,1,1.69,4th and 5th grade
Sun Oct 23 13:37:26 +0000 2016,I sang every word live thank u very much What a blast it was and just the FIRST ONE,0.94,4.8,4.2,94.49,1,2.56,4th and 5th grade
Sun Oct 23 08:15:29 +0000 2016,twitter moment Lady Gaga Performs On Saturday Night Live GagaOnSNL by,8.49,7.6,9.3,60.31,1,12.62,7th and 8th grade
Sun Oct 23 03:35:24 +0000 2016,GagaOnSNL I love you monsters and fans so much I can't wait to sing for you and our beautiful country,6.21,7.6,7.9,76.56,1,6.21,7th and 8th grade
Sun Oct 23 03:33:04 +0000 2016,We're live LADIES AND GENTLEMAN AND JOANNE Crew its Saturday Night Here We Go,0.69,5.2,7.1,82.65,1,8.23,5th and 6th grade
Sat Oct 22 20:45:58 +0000 2016,HERE WE GO My commercial for AYO,6.24,2.5,-0.6,89.75,1,1.57,-1th and 0th grade
Sat Oct 22 19:44:22 +0000 2016,GET READY FOR TONIGHT JOANNE on SNL with host Tom Hanks Listen here with,5.46,2.9,5.4,99.57,1,6.55,5th and 6th grade
Sat Oct 22 16:07:39 +0000 2016,Lady Gaga invited fans to her dad's NYC restaurant,7.59,4.4,5.1,79.26,1,7.39,4th and 5th grade
Sat Oct 22 15:48:47 +0000 2016,Go JOANNE,0.1,-3.1,-1.7,120.21,1,-7.41,-1th and 0th grade
Sat Oct 22 07:18:23 +0000 2016,that is so special,7.78,1.3,-1.9,92.8,1,-1.46,0th and 1st grade
Sat Oct 22 07:09:28 +0000 2016,wow,0.05,-3.5,-6.9,121.22,1,-28.01,-1th and 0th grade
Sat Oct 22 06:57:56 +0000 2016,JoanneVibes I had the best time today signin' for fans at dad's restaurant I got to be with family eat pasta reunite w u,7.46,9.1,9.6,72.5,1,5.98,9th and 10th grade
Sat Oct 22 06:52:19 +0000 2016,That's the most awesome sentence ever,6.57,4.5,6.7,73.85,1,9.15,6th and 7th grade
Sat Oct 22 06:46:32 +0000 2016,"it's really important to tell someone close to you that you feel this way. You are not alone, there are ways to help anxiety.",1.25,4.4,4.6,84.68,2,5.5,5th and 6th grade
Sat Oct 22 01:28:53 +0000 2016,"thank you Tyler, this week is truly a release week. I feel our community healing amp spreading it to the world. love u JOANNE",6.86,4.4,4.6,84.68,2,5.79,5th and 6th grade
Sat Oct 22 01:23:08 +0000 2016,"Flo I love you, your wisdom amp undeniable power in your voice gave me so much strength, you are a genius of a woman",6.8,9.1,8.8,72.5,1,5.0,8th and 9th grade
Sat Oct 22 01:18:16 +0000 2016,The GP is going Gaga for Joanne by,0.4,0.5,-1.6,105.66,1,-0.05,-1th and 0th grade
Fri Oct 21 21:05:12 +0000 2016,SURPRISE NYC MONSTERS meet me at my dad's restaurant ASAP I'll be behind the bar selling amp signing copies of JOANNE,8.44,7.9,10.8,75.54,1,8.94,7th and 8th grade
Fri Oct 21 21:02:03 +0000 2016,"Obsessed with my JOANNE stickers, thank u Twitter",9.95,4.1,7.3,80.28,1,10.11,9th and 10th grade
Fri Oct 21 20:30:41 +0000 2016,oh my is that so cute JOANNE,0.35,-1.2,-3.2,115.13,1,-1.74,2nd and 3rd grade
Fri Oct 21 15:01:35 +0000 2016,HAPPY JOANNE DAY,0.15,0.9,2.1,93.81,1,1.52,0th and 1st grade
Fri Oct 21 14:20:01 +0000 2016,YOU shut the block down I have the best fans in the world and we always come back together because of what we stand for.,1.24,8.3,9.2,79.94,1,5.06,9th and 10th grade
Fri Oct 21 13:31:12 +0000 2016,Thank you amp for a wonderful release morning interview You look good in pink baby JoanneVibes,8.38,8.4,9.8,63.7,1,11.08,8th and 9th grade
Fri Oct 21 13:23:09 +0000 2016,See you guys soon I'm so excited JOANNE Out Today,0.5,3.7,2.4,86.71,1,3.86,3rd and 4th grade
Fri Oct 21 06:19:15 +0000 2016,My new album JOANNE is now available WORLDWIDE I hope you enjoy it as much as I enjoyed making it,7.79,7.6,6.9,76.56,1,5.34,7th and 8th grade
Fri Oct 21 02:28:38 +0000 2016,Light me up and breathe in The DiveBarTour starts now LIVE from New York City JOANNE,5.42,4.8,6.9,89.08,1,7.42,4th and 5th grade
Fri Oct 21 01:52:13 +0000 2016,"DiveBarTour stop 2 Just finished rehearsin new songs I added JUST for u, see u at 10 30pm ET Stream Live HERE",6.88,7.2,8.4,82.99,1,5.63,6th and 7th grade
Fri Oct 21 01:46:41 +0000 2016,Really care about this. From my heart.,0.17,1.1,1.8,93.3,2,0.5,0th and 1st grade
Thu Oct 20 22:49:04 +0000 2016,GET READY UK Monsters JOANNE is coming I love you so much your loyalty means the,6.4,6.0,5.7,80.62,1,5.97,5th and 6th grade
Thu Oct 20 21:21:28 +0000 2016,MAKING JOANNE EPISODE 1 A YO Watch the creative process w Me MakingJOANNE JOANNE,6.59,4.0,8.1,91.11,1,9.91,5th and 6th grade
Thu Oct 20 20:54:22 +0000 2016,Here's my full interview JOANNE,7.04,2.9,6.5,83.32,1,8.44,2nd and 3rd grade
Thu Oct 20 20:47:54 +0000 2016,"JOANNE is now 1 in Australia on and in 18 countries around the world The roll out continues, can't wait till midnight in the US",6.77,8.3,10.5,79.94,1,6.45,6th and 7th grade
Thu Oct 20 20:41:11 +0000 2016,me too I cry every time,0.3,0.9,-4.4,99.23,1,-3.44,0th and 1st grade
Thu Oct 20 20:40:11 +0000 2016,"love you darling, thank you for a great interview Nothing like talking w family JOANNE",6.49,8.0,8.7,64.71,1,9.56,8th and 9th grade
Thu Oct 20 20:02:35 +0000 2016,Only 6 hours left until I hit the stage on the 2nd date of the DiveBarTour here we go A YO A YO,1.83,7.5,5.0,81.97,1,1.4,1st and 2nd grade
Thu Oct 20 17:00:07 +0000 2016,Tune into with now Talking all things JOANNE and playing some new music,6.71,4.8,6.5,83.66,1,8.16,5th and 6th grade
Thu Oct 20 14:57:19 +0000 2016,2nd stop of my DiveBarTour w is tonight Watch LIVE 10pm ET on FB Live for more new music from JOANNE,1.79,6.8,7.0,84.0,1,4.82,6th and 7th grade
Thu Oct 20 14:52:47 +0000 2016,We're already 1 in NZ and Hong Kong on HERE WE GO JOANNE best fans in the world,0.89,4.4,3.8,95.51,1,2.09,3rd and 4th grade
Thu Oct 20 14:09:53 +0000 2016,"don't pay attention he has been brutal for YEARS, meaningless. Don't let it bring you down this is OUR time to celebrate",6.34,4.0,5.3,85.69,2,6.59,5th and 6th grade
Thu Oct 20 14:05:06 +0000 2016,To my Aussie amp Kiwi monsters I YOU My album JOANNE is out NOW out in AU amp NZ GO GET IT BEFORE THEY RUN OUT,6.75,8.7,7.0,78.93,1,1.98,6th and 7th grade
Thu Oct 20 05:41:58 +0000 2016,Quiet your mind of all the noise and interference from the truth that's in your heart. Be with friends. Be with family.,1.08,2.6,3.2,89.45,3,4.82,2nd and 3rd grade
Thu Oct 20 05:37:03 +0000 2016,"I confess, I am lost, in the age of the social. On our knees, take a test, to be loving and grateful. Angel Down JOANNE",5.94,1.8,0.6,96.89,3,1.3,1st and 2nd grade
Thu Oct 20 00:18:34 +0000 2016,I'll be performing that song tonight in honor of BlackLivesMatter as I'm honored by YOUR publication. Tune in Jon. JOANNE,7.29,6.0,7.6,69.79,2,9.66,5th and 6th grade
Thu Oct 20 00:11:29 +0000 2016,how far must ANYONE need to 4 inspiration amp write a song re the tragic murder of Trayvon Martin as I did w Angel Down .,6.77,10.7,9.2,63.02,1,5.06,10th and 11th grade
Wed Oct 19 20:57:46 +0000 2016,he's not as snarky as I would be watching him in a guitar death match w Kevin Parker and Josh F cking Homme,7.52,7.5,7.5,81.97,1,4.19,7th and 8th grade
Wed Oct 19 19:51:17 +0000 2016,love you babies. And love our love baby. Joanne,5.61,0.3,1.2,100.75,2,1.53,1st and 2nd grade
Wed Oct 19 19:35:41 +0000 2016,true,0.05,-3.5,-2.2,121.22,1,-22.21,-1th and 0th grade
Wed Oct 19 19:15:01 +0000 2016,ure hat Can't wait to share it with u,0.45,-0.4,-1.9,113.1,1,-1.03,-1th and 0th grade
Wed Oct 19 19:08:19 +0000 2016,"Joannevibes my fans r 1 Amazing how something so simple like music a colorful hat can brighten ure day, amp mine",7.69,9.1,9.7,67.08,1,7.83,7th and 8th grade
Wed Oct 19 15:14:47 +0000 2016,"we don't have to become anything , except for each other. That's all. Xoxo, Joanne",0.69,6.4,8.5,74.19,1,7.82,6th and 7th grade
Wed Oct 19 14:49:32 +0000 2016,OUT TOMORROW 10 20 Episode 1 A YO from our online mini series titled MAKING JOANNE JOANNE MakingJOANNE AYO,8.73,8.3,9.9,69.11,1,9.57,7th and 8th grade
Wed Oct 19 14:06:43 +0000 2016,This is amazing,9.05,0.9,0.5,93.81,1,-0.46,0th and 1st grade
Wed Oct 19 14:00:47 +0000 2016,I'm sorry I meant YOUR hats..but could also say you ARE hats. JOANNE JoanneVibes JoanneStyle,5.06,2.7,6.8,89.24,2,8.95,2nd and 3rd grade
Wed Oct 19 13:56:48 +0000 2016,ma gurl. You're hats,0.2,-2.3,0.6,118.18,1,-1.46,0th and 1st grade
Wed Oct 19 13:29:46 +0000 2016,yes Just look for that pink hat and pick up those Joanne Vibes,0.64,1.3,3.2,109.04,1,4.16,0th and 1st grade
Wed Oct 19 12:54:05 +0000 2016,"cool article, thanks for being so chill. I'm jus tryin' to keep it sane Joanne",5.06,1.5,2.4,97.7,2,3.55,1st and 2nd grade
Wed Oct 19 09:23:00 +0000 2016,you can say that again My brothers couldn't have been a more beautiful recording experience.,7.54,8.0,10.6,64.71,1,11.53,7th and 8th grade
Wed Oct 19 06:29:55 +0000 2016,did u just say simple stage w band to me. What do u think this is a dive bar,0.47,1.1,-2.4,104.13,2,-1.67,3rd and 4th grade
Wed Oct 19 06:28:18 +0000 2016,why don't you go tell yourself a bedtime story,0.45,3.3,2.9,87.72,1,4.78,3rd and 4th grade
Wed Oct 19 06:26:26 +0000 2016,"All of the above. Leavin ur haters in the dust is a sexy feelin, drag em' like a smoke, leave ur blazin' tracks in the road AYO",5.48,2.7,2.9,100.07,2,2.78,2nd and 3rd grade
Wed Oct 19 06:22:06 +0000 2016,it's means my body's got u pleadin and u light me up amp breath in u up and see a wild view in that mirror on the ceilin' AYO,1.44,7.5,8.8,92.8,1,2.1,7th and 8th grade
Wed Oct 19 06:15:52 +0000 2016,"it's our new theme song. Space funk monster drunk calling out to kids in the country, meet us in the city. Or we'll come to u. AYO",1.03,0.9,1.2,104.64,3,2.0,3rd and 4th grade
Wed Oct 19 06:11:32 +0000 2016,"I love you all so very much I wrote this for you. You are all so strong, time for us to make others strong. Dance, laugh, cry.",1.03,-0.4,0.5,113.1,3,1.13,3rd and 4th grade
Wed Oct 19 06:10:30 +0000 2016,same,0.05,-3.5,-2.2,121.22,1,-22.21,-1th and 0th grade
Wed Oct 19 05:52:39 +0000 2016,it's for all women w daddy issues and all the men that enjoy them,5.46,5.2,3.0,82.65,1,3.24,5th and 6th grade
Wed Oct 19 03:33:04 +0000 2016,hahahahha,19.48,32.0,21.5,-132.59,1,6.8,31st and 32nd grade
Wed Oct 19 03:32:18 +0000 2016,Surprise B tch.,0.15,0.9,0.5,93.81,1,-2.38,0th and 1st grade
Tue Oct 18 20:15:49 +0000 2016,Hey Girl We can make it easy if we lift each other thanks for the shoutout AYO,0.84,4.0,4.3,96.52,1,3.59,3rd and 4th grade
Tue Oct 18 18:27:12 +0000 2016,AYO maybe u guys'll like this 1 better NowPlaying Apple Spotify,8.49,7.6,6.8,60.31,1,8.97,7th and 8th grade
Tue Oct 18 18:17:51 +0000 2016,Here it is Get AYO my new song here and or pre order my new album out FRIDAY,5.41,5.6,3.0,87.05,1,1.45,5th and 6th grade
Tue Oct 18 16:59:19 +0000 2016,BUT BABY I LACED IT ',7.04,2.9,-4.0,83.32,1,-4.33,1st and 2nd grade
Tue Oct 18 16:58:13 +0000 2016,"GET OFF ON ME, MY BODY'S GOT YOU PLEADIN' LIGHT ME UP AND BREATHE IN MIRROR ON THE CEILIN' JOANNE lyrics comin' AYO A YO",1.24,6.0,9.2,96.86,1,4.13,9th and 10th grade
Tue Oct 18 16:39:25 +0000 2016,then Do it AND FORGET EVERYTHING ELSE,0.35,3.7,2.9,81.29,1,5.75,3rd and 4th grade
Tue Oct 18 16:34:32 +0000 2016,I'm listening omg it's on AYO Love you and love,5.71,2.5,1.5,95.17,1,2.12,2nd and 3rd grade
Tue Oct 18 16:08:59 +0000 2016,AYO is WORLD RECORD today on radio Listen now at to hear another peek from JOANNE,0.79,6.0,6.0,80.62,1,6.38,5th and 6th grade
Tue Oct 18 04:34:20 +0000 2016,that means so much to me you have no idea. You guys are the best and I just want to sing and write songs for you forever.,1.25,2.7,1.9,100.07,2,2.08,1st and 2nd grade
Tue Oct 18 04:31:37 +0000 2016,that's so awesome Maybe I'll bump into you and get to sign it Xxx,5.46,2.9,3.0,99.57,1,2.83,2nd and 3rd grade
Tue Oct 18 04:29:53 +0000 2016,THATS THE BIGGEST COMPLIMENT AND HONOR EVER,8.5,7.2,7.0,55.91,1,10.74,8th and 9th grade
Mon Oct 17 20:53:58 +0000 2016,Pre order JOANNE and you'll get AYO tomorrow at 9am PST The next sneak peek into the world of Joanne,0.99,6.4,7.6,85.02,1,5.92,5th and 6th grade
Mon Oct 17 20:46:21 +0000 2016,Enter code MEETGAGA on I ll fly you to my next secret stop I'll give you MY signed pink hat JOANNE,1.79,6.8,6.5,84.0,1,4.01,6th and 7th grade
Mon Oct 17 18:32:56 +0000 2016,If your wondering what my new album JOANNE is all about. Just watch this.,6.24,1.3,2.3,98.21,2,4.07,2nd and 3rd grade
