created_at,text,dale_chall_readability_score,flesch_kincaid,automated_readability,flesch_reading,sentence_count,coleman_liau_index,based_on_all_algorithms
Sat May 18 14:59:51 +0000 2013,Thank you all for the support you gave me yesterday. Cheers to the Viva Ronaldo winners,7.98,4.1,3.8,80.28,2,6.1,3rd and 4th grade
Fri May 17 14:02:06 +0000 2013,"Together as a team and with your support, let's win this trophy. Hala Madrid",7.71,6.4,6.8,74.19,1,7.01,6th and 7th grade
Thu May 16 17:29:36 +0000 2013,Viva Ronaldo is live Play at or get the FREE iOS app at VivaRonaldo,7.71,5.2,3.8,82.65,1,4.52,4th and 5th grade
Wed May 15 18:02:33 +0000 2013,I ll be retweeting a few ones. Hala Madrid,7.59,2.1,0.9,96.18,1,2.23,3rd and 4th grade
Wed May 15 18:01:57 +0000 2013,Hey guys. Friday there s a big match at Bernab u. Send photos of your tickets under the hashtag copadelreyfinal.,7.29,6.0,5.5,69.79,2,7.34,5th and 6th grade
Wed May 15 14:04:32 +0000 2013,Today's training session for the Copa del Rey final.,12.86,6.8,6.1,62.34,1,8.03,3rd and 4th grade
Mon May 13 14:01:50 +0000 2013,My name in Chinese. Love it,6.57,0.9,-1.2,99.23,1,-0.54,-1th and 0th grade
Fri May 10 15:32:18 +0000 2013,I m so proud of my sister Katia Aveiro and her new musical project.,6.59,5.2,3.8,82.65,1,4.11,6th and 7th grade
Fri May 10 13:39:08 +0000 2013,Good luck to Real Madrid basket team for tonight's game.,0.5,2.5,5.7,95.17,1,7.34,3rd and 4th grade
Thu May 09 13:08:53 +0000 2013,What an amazing game last night. Hala Madrid,7.98,2.9,4.4,88.74,1,6.45,2nd and 3rd grade
Wed May 08 11:12:01 +0000 2013,"Thanks for everything, Boss.",0.2,3.7,10.0,75.88,1,10.15,1st and 2nd grade
Tue May 07 15:52:25 +0000 2013,Training for tomorrow s match against Malaga.,8.5,6.0,8.3,64.37,1,11.55,8th and 9th grade
Mon May 06 12:08:27 +0000 2013,Real Madrid 4 Valladolid 3. What a great game.,5.61,1.5,0.7,92.29,2,0.89,1st and 2nd grade
Fri May 03 17:08:03 +0000 2013,Getting ready for tomorrow's match against Valladolid.,8.5,7.2,14.4,55.91,1,18.16,-1th and 0th grade
Mon Apr 29 12:58:13 +0000 2013,Tomorrow there's a big match and the team needs all your support to reach the goal. Can I count on you Hala Madrid,5.58,3.1,3.2,93.64,2,4.21,4th and 5th grade
Sat Apr 27 23:16:40 +0000 2013,Everything else is pure fiction and forgery.,6.24,3.7,7.6,81.29,1,10.74,3rd and 4th grade
Sat Apr 27 23:16:17 +0000 2013,I was in fact at the Hotel Villa Magna on April 22nd giving an interview to Manu Sainz something the reporter himself is able to corroborate,7.36,11.1,12.4,62.01,1,8.65,8th and 9th grade
Sat Apr 27 23:14:15 +0000 2013,"Deeply outraged by a situation intended, in vain, to afect my personal life, I just want to clarify...",8.92,10.3,9.8,53.21,1,7.89,9th and 10th grade
Sat Apr 27 23:12:49 +0000 2013,...someone seeking the limelight on my account. And I wonder why this happens one day before a very important game for my team,6.27,5.4,5.6,76.72,2,6.77,5th and 6th grade
Sat Apr 27 23:11:52 +0000 2013,"I was informed that The Sun, faithful to its editorial line, will publish an article where is given voice to a so called Andressa...",8.77,11.5,12.0,55.58,1,8.13,11th and 12th grade
Wed Apr 24 13:04:21 +0000 2013,Ready to play the ball. Hala Madrid,6.24,0.1,1.6,106.67,1,3.26,2nd and 3rd grade
Tue Apr 23 18:00:09 +0000 2013,Watching a movie at the hotel.,6.57,2.1,1.2,90.77,1,2.37,1st and 2nd grade
Mon Apr 22 14:28:26 +0000 2013,Check out the behindthescenes from shoot. I had a great time,5.34,-0.6,2.8,108.19,2,4.68,-1th and 0th grade
Fri Apr 19 14:00:11 +0000 2013,Do you like the new Ghostwatch I'm the new face of Watches. Love it. bold,6.11,0.3,0.8,106.16,2,1.99,2nd and 3rd grade
Wed Apr 17 15:33:14 +0000 2013,I ll be retweeting some of my favourites mymercurials,7.59,4.4,6.6,79.26,1,9.94,4th and 5th grade
Wed Apr 17 15:32:49 +0000 2013,Have you got them already Send your photos of you with the new boots in the next days with mymercurials,6.21,7.6,8.4,76.56,1,7.08,7th and 8th grade
Wed Apr 17 15:32:30 +0000 2013,Hey guys. What do you think about my new CR7 Mercurial Vapor IX,6.71,4.8,3.5,83.66,1,4.16,6th and 7th grade
Mon Apr 15 14:33:26 +0000 2013,Great win against Athletic Bilbao last night.,8.5,3.7,8.3,81.29,1,11.55,8th and 9th grade
Thu Apr 11 15:31:18 +0000 2013,Do you love to win but hate to lose Be Mercurial.,5.62,4.0,0.8,85.69,1,1.55,5th and 6th grade
Wed Apr 10 16:24:13 +0000 2013,Here we go to the semifinals of the Champions League.,7.29,4.8,4.3,78.25,1,6.18,4th and 5th grade
Mon Apr 08 17:21:22 +0000 2013,Be fast. BeMercurial. Pre order Europe or U.S.,7.98,8.8,5.6,46.44,1,5.76,5th and 6th grade
Mon Apr 08 09:02:04 +0000 2013,Already in Turkey.,0.15,5.6,5.2,59.97,1,3.43,0th and 1st grade
Sat Apr 06 15:37:43 +0000 2013,Ready for the game.,0.2,-2.3,-0.7,118.18,1,-1.46,-1th and 0th grade
Fri Apr 05 13:59:23 +0000 2013,My friends at launch a free contest Win my autographed photos CRContest,9.5,6.8,8.1,67.76,1,10.83,6th and 7th grade
Wed Apr 03 21:54:02 +0000 2013,"Great game, great win. Hala Madrid",6.57,0.9,4.3,99.23,1,5.27,4th and 5th grade
Wed Apr 03 10:34:26 +0000 2013,"Hey guys, big game today against Galatasaray Let's make it.",0.5,1.3,7.1,103.63,1,8.5,3rd and 4th grade
Tue Apr 02 14:01:38 +0000 2013,Vea como ense a a padres a usar leche de cabra para hacer frente al hambre en Guatemala,8.04,5.6,5.9,87.05,1,4.99,5th and 6th grade
Tue Apr 02 14:00:10 +0000 2013,See how is showing parents how to use goat milk to tackle child hunger in Guatemala,7.39,4.8,6.6,89.08,1,7.07,6th and 7th grade
Sat Mar 30 12:15:33 +0000 2013,Pre order Europe U.S,7.78,3.7,0.6,75.88,1,0.0,-1th and 0th grade
Sat Mar 30 12:15:12 +0000 2013,Check out my new CR7 Mercurial Vapor IX. Thanks,7.59,4.4,3.5,79.26,1,5.42,4th and 5th grade
Fri Mar 29 16:54:02 +0000 2013,What do you think of my new Summer Collection Pre order Europe U.S,6.71,6.0,4.6,75.2,1,5.5,6th and 7th grade
Thu Mar 28 16:32:15 +0000 2013,Take a closer look,7.78,1.3,-1.9,92.8,1,-1.46,0th and 1st grade
Wed Mar 27 16:09:27 +0000 2013,"Soon, I will be closer to all of you Together we are stronger. Together we will win.",4.99,3.1,1.7,88.23,2,2.8,2nd and 3rd grade
Tue Mar 26 14:30:24 +0000 2013,For a Portugal Todos juntos vamos conseguir,15.26,9.6,7.0,38.99,1,10.74,9th and 10th grade
Sun Mar 24 18:32:34 +0000 2013,Congratulations You ll win a double ticket to see Azerbaijan Portugal on Tuesday.,7.93,10.7,10.1,41.36,1,12.17,10th and 11th grade
Sun Mar 24 18:03:13 +0000 2013,The one with more RT will win a double ticket to see Portugal play in Azerbaijan. Stay tuned.,6.28,6.8,7.4,78.59,1,6.26,6th and 7th grade
Sun Mar 24 18:01:20 +0000 2013,Thank you so much for all your replies. Here are some of my favourites.,0.35,-1.2,1.6,115.13,2,3.26,2nd and 3rd grade
Sat Mar 23 14:09:46 +0000 2013,"Still have a double ticket to Azerbaijan Portugal. Keep sending your photos, videos and comments of support to win it.",8.87,6.0,6.9,69.79,2,9.08,8th and 9th grade
Sat Mar 23 14:08:22 +0000 2013,loved what you did by giving away your tickets to a girl in Israel. That was really nice.,5.84,3.3,1.9,87.72,2,3.51,3rd and 4th grade
Sat Mar 23 14:07:57 +0000 2013,"Guys, you are the best fans in the world Thank you so much for your support.",5.42,3.6,4.5,97.54,1,3.83,3rd and 4th grade
Thu Mar 21 12:12:21 +0000 2013,Great morning in Israel with my colleagues.,8.5,3.7,7.0,81.29,1,9.87,2nd and 3rd grade
Wed Mar 20 21:51:32 +0000 2013,"Keep sending your photos, comments and videos to get a double ticket to see Portugal play in Azerbaijan next Tuesday.",8.58,9.9,11.6,59.64,1,10.56,11th and 12th grade
Wed Mar 20 21:33:26 +0000 2013,Congratulations You ll win a double ticket to see Israel Portugal on Friday.,7.93,10.7,8.2,41.36,1,9.96,7th and 8th grade
Wed Mar 20 20:54:48 +0000 2013,"The one with more RT will win a double ticket to see Portugal play in Israel. Hurry, I ll announce it in a bit.",6.21,4.4,1.9,84.68,2,2.36,5th and 6th grade
Wed Mar 20 20:51:09 +0000 2013,Thank you so much for all your replies and your support. Here are some of my favourites.,4.99,0.7,2.8,105.15,2,4.54,4th and 5th grade
Wed Mar 20 10:47:07 +0000 2013,Today I ll RT some of your most original replies and the ones who get most RT will win tickets to see Portugal play in Israel on Friday,7.28,10.7,10.8,68.44,1,5.4,10th and 11th grade
Tue Mar 19 19:17:40 +0000 2013,"Send your photos, comments and videos of support to the Portuguese team and you ll have the chance to win some tickets.",8.32,7.2,10.5,82.99,1,8.01,8th and 9th grade
Tue Mar 19 19:17:04 +0000 2013,Hey guys The Portuguese National Team will play against Israel and Azerbaijan in the next days.,8.38,7.2,10.1,72.16,1,11.08,10th and 11th grade
Mon Mar 18 19:25:23 +0000 2013,"Thank you for another award, the Trofeo Di St fano.",5.71,3.7,3.4,86.71,1,4.44,3rd and 4th grade
Fri Mar 15 15:01:29 +0000 2013,We'll meet Galatasaray in the quarterfinals of the Champions League. Together as a team we can make it,5.84,4.4,5.3,79.26,2,7.68,4th and 5th grade
Wed Mar 13 15:00:36 +0000 2013,I've heard that you rocked in Lisbon. Now welcome to Madrid. I'm sure you will have also huge success and positivity.,6.24,3.7,3.8,81.29,3,5.46,3rd and 4th grade
Fri Mar 08 11:54:05 +0000 2013,Ups Feel like will never notice me on twitter,5.84,3.3,2.4,87.72,1,4.78,3rd and 4th grade
Fri Mar 08 11:53:50 +0000 2013,thank you guys,0.15,-2.7,-1.2,119.19,1,-2.38,0th and 1st grade
Fri Mar 08 11:52:27 +0000 2013,Go Canada PLEASE RT a huge fan from Canada I always support you no matter what. You're the best xo,5.71,3.7,2.2,86.71,2,3.57,3rd and 4th grade
Fri Mar 08 11:52:12 +0000 2013,I like all kind of sports and they are great team,0.55,0.5,0.8,111.07,1,2.13,0th and 1st grade
Fri Mar 08 11:51:10 +0000 2013,where are you,0.15,-2.7,-2.7,119.19,1,-4.29,0th and 1st grade
Fri Mar 08 11:47:59 +0000 2013,congrats for the amazing Miami Heat's 16 game win streak. Keep pushing and good luck for the next ones,7.43,3.5,4.1,87.21,2,6.0,5th and 6th grade
Fri Mar 08 11:46:12 +0000 2013,"Thank you S O to keep pushing yourself, it only gets harder from here. Goodluck in the QuarterFinals.",7.59,4.4,5.1,79.26,2,7.04,3rd and 4th grade
Thu Mar 07 18:06:34 +0000 2013,The exclusive VIP pack for my new game launched today Click to get it and a chance to win jerseys signed by me,6.15,7.5,8.1,81.97,1,5.23,7th and 8th grade
Wed Mar 06 17:14:34 +0000 2013,Check out some moments from yesterday's game.,8.5,3.7,8.3,81.29,1,10.74,8th and 9th grade
Wed Mar 06 10:36:18 +0000 2013,Thank you for a massive and unbelievable reception. I'm happy to win but also sad for Manchester United.,7.59,6.8,5.8,62.34,2,8.03,7th and 8th grade
Mon Mar 04 15:29:35 +0000 2013,I'm looking forward to return to Old Trafford. I've so many good memories there. It will be an exciting,6.44,3.4,2.8,82.0,3,4.17,2nd and 3rd grade
Mon Mar 04 11:32:58 +0000 2013,"Already in Manchester, getting ready for the big game tomorrow.",5.71,7.2,9.0,61.33,1,11.4,7th and 8th grade
Mon Mar 04 11:32:58 +0000 2013,"Already in Manchester, getting ready for the big game tomorrow.",5.71,7.2,9.0,61.33,1,11.4,7th and 8th grade
Sun Mar 03 12:41:42 +0000 2013,Great fun with Maradona.,0.2,-2.3,5.3,118.18,1,5.8,-1th and 0th grade
Sat Mar 02 20:47:07 +0000 2013,Great match and another win. Hala Madrid,6.24,3.7,5.0,81.29,1,7.37,3rd and 4th grade
Fri Mar 01 15:46:20 +0000 2013,Tomorrow we will play again against Fc Barcelona but now in front of our supporters. Hala Madrid,6.34,6.4,9.3,79.6,1,9.39,6th and 7th grade
Tue Feb 26 23:29:31 +0000 2013,We made it to the final of Copa del Rey. Thanks everyone.,6.86,4.4,2.6,84.68,1,3.12,4th and 5th grade
Fri Feb 22 20:31:58 +0000 2013,Pilot for a few hours.,7.04,0.5,-2.1,100.24,1,-2.01,1st and 2nd grade
Fri Feb 22 16:44:43 +0000 2013,Getting ready for tomorrow s game against Deportivo.,6.01,6.4,9.1,63.36,1,12.25,8th and 9th grade
Mon Feb 18 12:31:10 +0000 2013,Another great game last night,0.25,2.9,4.6,83.32,1,7.28,2nd and 3rd grade
Sat Feb 16 18:17:48 +0000 2013,Check out this teaser for my new Facebook game. LIKE it,7.05,2.9,3.3,94.15,1,4.74,4th and 5th grade
Fri Feb 15 19:13:25 +0000 2013,"Hey guys, today I've been filming. Have a nice weekend everyone.",6.78,4.3,4.4,74.35,2,5.26,4th and 5th grade
Fri Feb 15 17:50:36 +0000 2013,Thanks everyone for reaching the 16 million followers on Twitter.,8.87,8.4,9.9,52.87,1,13.14,7th and 8th grade
Fri Feb 15 15:53:20 +0000 2013,Have you tried my Mac app Go to the Mac OS X app store if you don t wanna miss any of my Facebook posts and Tweets.,6.15,7.9,7.6,86.37,1,1.92,7th and 8th grade
Thu Feb 14 11:45:09 +0000 2013,What an exciting game yesterday,0.25,7.6,6.5,49.48,1,9.6,-1th and 0th grade
Tue Feb 12 20:54:41 +0000 2013,Look forward to see you too tomorrow,0.35,3.7,2.3,81.29,1,4.94,3rd and 4th grade
Tue Feb 12 15:04:58 +0000 2013,"Tomorrow we ll play against Manchester United, a very special game for me. Don t miss it.",5.92,4.2,3.0,79.77,2,4.54,4th and 5th grade
Tue Feb 12 12:10:42 +0000 2013,Happy to be part of the 10 top scorers of Real Madrid s history.,5.46,6.4,2.7,74.19,1,2.83,5th and 6th grade
Fri Feb 08 16:15:56 +0000 2013,"Tomorrow night, we'll play against Sevilla, are you ready",5.84,3.3,8.7,87.72,1,10.58,3rd and 4th grade
Tue Feb 05 21:06:58 +0000 2013,What a great day Nice to celebrate my birthday with the portuguese National Team.,7.71,6.4,8.5,74.19,1,9.91,7th and 8th grade
Tue Feb 05 18:49:10 +0000 2013,"Hey guys, I m so happy with all your kind birthday messages. Thank you so much.",5.02,1.7,1.4,97.2,2,2.45,1st and 2nd grade
Fri Feb 01 16:00:05 +0000 2013,Tomorrow we'll play against Granada. Let's work hard to bring the win home. Hala Madrid,6.11,2.7,5.3,89.24,2,7.03,2nd and 3rd grade
Fri Feb 01 14:25:35 +0000 2013,gracias,19.48,8.4,12.0,36.62,1,-4.81,-1th and 0th grade
Fri Feb 01 14:24:59 +0000 2013,gracias,19.48,8.4,12.0,36.62,1,-4.81,-1th and 0th grade
Fri Feb 01 14:24:47 +0000 2013,Would be fun to receive your messages like always 4 days to go your special days..,6.4,6.0,6.3,80.62,1,5.97,5th and 6th grade
Fri Feb 01 14:23:01 +0000 2013,obrigado,19.48,20.2,16.8,-47.99,1,1.0,0th and 1st grade
Fri Feb 01 14:22:34 +0000 2013,melhor o,11.63,2.9,-4.0,77.91,1,-10.31,-1th and 0th grade
Fri Feb 01 14:20:37 +0000 2013,gracias,19.48,8.4,12.0,36.62,1,-4.81,-1th and 0th grade
Fri Feb 01 14:19:55 +0000 2013,Para ti tamb m. Abra o,0.3,-1.5,-5.2,116.15,1,-5.36,-1th and 0th grade
Thu Jan 31 16:00:43 +0000 2013,Don t just be fast. BeMercurial TeamNike,8.5,7.2,5.0,55.91,1,7.37,8th and 9th grade
Thu Jan 31 14:00:03 +0000 2013,Check out this photo from yesterday's match.,8.5,3.7,7.6,81.29,1,9.87,3rd and 4th grade
Wed Jan 30 12:50:52 +0000 2013,Watch me train with the PES fans.,0.35,-1.2,0.3,115.13,1,1.57,-1th and 0th grade
Tue Jan 29 12:07:18 +0000 2013,"Hey guys, take a look at the Meet amp Greet with the winners of the contest, last Friday",6.28,5.6,6.1,87.05,1,4.64,5th and 6th grade
Mon Jan 28 15:01:02 +0000 2013,What a game yesterday. Thanks again for all your support. Let s work hard for the next game.,4.81,0.9,1.2,99.23,3,2.37,1st and 2nd grade
Sat Jan 26 15:01:32 +0000 2013,Tomorrow we will fight for another win. What's your hint for the result Hala Madrid,6.11,3.9,4.0,80.78,2,6.28,3rd and 4th grade
Fri Jan 25 18:22:43 +0000 2013,Thanks to the winners of the PES contest. It was a fun day.,6.39,1.1,-1.2,98.72,2,-0.18,-1th and 0th grade
Fri Jan 25 16:38:19 +0000 2013,"What a nice day I had with the winners of the PES contest. Stay tuned, I ll share more photos in a few days.",6.21,2.1,1.2,101.6,2,1.67,1st and 2nd grade
Fri Jan 25 11:40:21 +0000 2013,"And U, how do you plan to spend your weekend",5.71,1.3,0.1,103.63,1,0.96,0th and 1st grade
Fri Jan 25 11:30:09 +0000 2013,Hello guys. Finishing training and with a little different day ahead. I'll be with the winners of last PES contest. Looking forward to it.,7.32,5.2,5.1,71.82,3,6.92,4th and 5th grade
Thu Jan 24 16:00:44 +0000 2013,"To me, this is what means to BeMercurial. What do you think TeamNike",6.39,3.5,2.1,81.8,2,3.83,3rd and 4th grade
Wed Jan 23 12:35:20 +0000 2013,Hi everyone. Don't forget to get my new Mac OS X app and stay up to date with all my latest news.,1.81,7.2,5.8,82.99,1,1.98,1st and 2nd grade
Tue Jan 22 15:58:33 +0000 2013,BeMercurial,19.48,43.8,30.9,-217.19,1,18.4,43rd and 44th grade
Mon Jan 21 15:03:28 +0000 2013,"If you love to play football, stay tuned This year I'm launching a world championship where YOU and your friends will",6.18,6.8,10.8,84.0,1,8.94,6th and 7th grade
Sun Jan 20 12:03:20 +0000 2013,Got my Mercurial Vapor IX for today's match. Hope they give me luck. BeMercurial,8.5,6.0,4.6,64.37,2,6.56,8th and 9th grade
Sat Jan 19 15:39:04 +0000 2013,Thinking of tomorrow's game. All together we can make it. Hala Madrid,7.88,4.5,4.3,73.85,2,5.73,5th and 6th grade
Fri Jan 18 16:06:47 +0000 2013,This is the autographed photo that won. Do you like it Get yours,6.39,1.1,0.7,98.72,2,2.5,2nd and 3rd grade
Thu Jan 17 10:56:18 +0000 2013,Check out my video for the new Mercurials. What do you think BeMercurial TeamNike,7.37,6.0,5.0,64.37,2,7.84,7th and 8th grade
Wed Jan 16 12:19:10 +0000 2013,Hi everyone. Yesterday s important win leads us forward in this round. There s still a lot to play and we count on you,0.6,4.4,3.2,84.68,2,4.34,4th and 5th grade
Thu Jan 10 16:00:29 +0000 2013,"Yesterday, with your support, we got an important win. Step by step we are closer to the final. Thank you.",6.5,4.8,4.1,78.25,2,5.02,4th and 5th grade
Wed Jan 09 16:31:00 +0000 2013,Hey guys. Don t forget to watch today s match with Celta de Vigo for the Copa del Rey. Hala Madrid,6.93,6.8,6.5,84.0,1,3.72,6th and 7th grade
Sun Jan 06 19:12:20 +0000 2013,Winners of twitter contest. Thank you guys Me and lt 3,8.22,1.9,0.2,91.27,2,1.55,1st and 2nd grade
Thu Jan 03 16:00:21 +0000 2013,Very proud to join Save the Children's work around the world,5.62,1.7,5.5,102.61,1,7.35,5th and 6th grade
Thu Jan 03 09:30:06 +0000 2013,Honored to be the newest artist ambassador for Excited to tackle child hunger and nutrition,9.64,9.1,10.2,56.25,1,11.88,9th and 10th grade
Tue Jan 01 19:59:31 +0000 2013,I want to thank you all for your replies and retweets. Celebrate15M was a success,6.11,1.5,3.4,97.7,2,5.87,5th and 6th grade
Tue Jan 01 19:58:48 +0000 2013,The winner of a Portugal s CR autographed jersey is I will also follow you.,7.54,8.0,5.2,64.71,1,5.33,7th and 8th grade
Tue Jan 01 17:04:08 +0000 2013,Don't forget to retweet your favourite. The most retweeted gets the jersey and will be followed by me Celebrate15M,7.43,3.5,7.1,87.21,2,9.65,3rd and 4th grade
Tue Jan 01 16:59:53 +0000 2013,Here's the last top 15 of the day.,0.4,-0.8,-1.6,114.12,1,-1.5,-1th and 0th grade
Tue Jan 01 16:01:35 +0000 2013,The most retweeted will be followed by me and wins a Portugal s CR autographed jersey. Celebrate15M,10.05,8.7,10.1,62.68,1,10.38,8th and 9th grade
Tue Jan 01 16:00:41 +0000 2013,Hi there. I ll be retweeting the last top 15 in no time. Don t forget to retweet your favourite.,1.29,1.3,1.7,103.63,2,2.7,1st and 2nd grade
Mon Dec 31 19:31:07 +0000 2012,Well done I ll follow you and you win a Portugal s CR autographed jersey.,7.54,6.8,4.6,73.17,1,4.57,4th and 5th grade
Mon Dec 31 17:45:39 +0000 2012,And I'm enjoying it a lot 2012's New Notable Instagrammers,8.87,7.2,6.6,61.33,1,8.5,8th and 9th grade
Mon Dec 31 17:06:47 +0000 2012,Retweet your favourite in the next hours. The most retweeted will be the lucky winner Celebrate15M,6.01,2.9,7.0,88.74,2,10.11,5th and 6th grade
Mon Dec 31 16:57:54 +0000 2012,Here s the top 15. Celebrate15M,6.57,2.1,2.0,90.77,1,3.35,2nd and 3rd grade
Mon Dec 31 15:59:41 +0000 2012,The winner of this challenge wins a Portugal s CR autographed jersey Celebrate15M,10.35,9.5,10.1,49.82,1,12.63,9th and 10th grade
Mon Dec 31 15:59:02 +0000 2012,Here s the last challenge. What are your wishes for the New Year Reply with Celebrate15M in the next 24 hours.,7.16,2.7,4.0,94.66,2,5.54,4th and 5th grade
Mon Dec 31 15:58:34 +0000 2012,The most retweeted will be followed by me and wins a Portugal s CR autographed jersey.,9.36,7.2,7.5,72.16,1,7.83,7th and 8th grade
Mon Dec 31 15:58:10 +0000 2012,Hi. I ll be retweeting the top 15 in a bit. Don t forget to retweet your favourite.,4.96,0.9,0.4,104.64,2,1.24,0th and 1st grade
Mon Dec 31 10:53:07 +0000 2012,I wish you all a Happy New Year,0.4,0.5,-3.4,105.66,1,-2.26,0th and 1st grade
Sun Dec 30 19:38:59 +0000 2012,"Well done I ll follow you and you win a double ticket for Real Madrid Real Sociedad match, January 6th",1.78,8.7,8.1,68.1,1,6.5,8th and 9th grade
Sun Dec 30 17:03:08 +0000 2012,Retweet your favourite in the next hours. The most retweeted will be the daily winner Celebrate15M,6.01,2.9,7.0,88.74,2,10.11,5th and 6th grade
Sun Dec 30 16:57:57 +0000 2012,Here's the top 15 lucky ones of the day. Celebrate15M,5.71,2.5,4.3,95.17,1,5.6,4th and 5th grade
Sun Dec 30 16:03:31 +0000 2012,The winner of this challenge will win a Portugal's CR autographed jersey. Celebrate15M. Good luck.,9.64,9.1,12.4,56.25,1,13.04,9th and 10th grade
Sun Dec 30 16:02:32 +0000 2012,Challenge of the day. What would you like to see on my twitter in 2013 Reply with Celebrate15M in the next 24 hours.,6.95,3.1,3.6,93.64,2,4.74,4th and 5th grade
Sun Dec 30 16:01:12 +0000 2012,"The most retweeted will be followed by me and will win a double ticket for Real Madrid Real Sociedad match, January 6th",6.88,9.5,10.5,66.07,1,8.3,8th and 9th grade
Sun Dec 30 16:00:36 +0000 2012,"Hello there, I' ll retweet the top 15 in no time. Stay tuned. Then retweet your favourite of the 15.",0.5,1.3,2.6,103.63,2,3.28,3rd and 4th grade
Sat Dec 29 19:30:23 +0000 2012,"Congrats I ll follow you and you'll win a double ticket for Real Madrid Real Sociedad match, January 6th",6.24,9.5,9.4,60.65,1,8.36,7th and 8th grade
Sat Dec 29 19:00:30 +0000 2012,See who the winner is in half an hour. Good luck. Celebrate15M,5.55,4.4,4.6,84.68,1,5.5,5th and 6th grade
Sat Dec 29 16:56:51 +0000 2012,Don't forget to retweet your favourite. The most retweeted will be the daily winner Celebrate15M,6.11,3.9,8.1,80.78,2,11.27,5th and 6th grade
Sat Dec 29 16:50:54 +0000 2012,Here's the top 15 of the day Celebrate15M,6.01,2.9,2.6,88.74,1,4.31,2nd and 3rd grade
Sat Dec 29 16:01:21 +0000 2012,"The winner of this challenge will also win a double ticket for Real Madrid Real Sociedad match, January 6th. Good luck.",6.18,10.3,11.3,58.62,1,9.23,9th and 10th grade
Sat Dec 29 16:00:28 +0000 2012,Challenge of the day. Prove that you re the fan who knows me the best. Reply with Celebrate15M in the next 24 hours,6.08,1.6,1.4,97.5,3,3.32,1st and 2nd grade
Sat Dec 29 15:53:05 +0000 2012,"The most retweeted will be followed by me and will win a double ticket for Real Madrid Real Sociedad match, January 6th",6.88,9.5,10.5,66.07,1,8.3,8th and 9th grade
Sat Dec 29 15:52:34 +0000 2012,Hi. I ll retweet the top 15 in a bit. Stay tuned. Then retweet your favourite of the 15.,0.47,-0.2,0.7,112.59,2,1.07,-1th and 0th grade
Fri Dec 28 20:09:36 +0000 2012,Congrats I ll follow you and you will win a customized autographed photo by,8.84,7.6,6.4,65.73,1,7.82,7th and 8th grade
Fri Dec 28 19:37:36 +0000 2012,I'll anounce the winner in half an hour. Celebrate15M,5.84,3.3,6.6,87.72,1,8.67,5th and 6th grade
Fri Dec 28 17:05:51 +0000 2012,Retweet your favourite in the next hours. The most retweeted will be the daily winner Celebrate15M,6.01,2.9,7.0,88.74,2,10.11,5th and 6th grade
Fri Dec 28 17:00:17 +0000 2012,Here s the top 15 of the day Celebrate15M,5.84,2.1,0.4,96.18,1,2.23,4th and 5th grade
Fri Dec 28 16:04:59 +0000 2012,"The winner of this challenge will win a double ticket for Real Madrid Real Sociedad match, January 6th",6.28,9.1,9.8,61.67,1,9.51,9th and 10th grade
Fri Dec 28 16:04:15 +0000 2012,"Meanwhile, here s the challenge for today. Why should I follow you Reply with Celebrate15M in the next 24 hours",7.29,4.8,5.2,78.25,2,7.34,4th and 5th grade
Fri Dec 28 16:03:54 +0000 2012,The most retweeted will be followed by me and will win a customized autographed photo by,9.36,7.2,8.0,72.16,1,8.87,8th and 9th grade
Fri Dec 28 16:03:27 +0000 2012,Hi. I ll look at your replies and retweet the top 15 in a bit. Stay tuned. Then retweet your favourite of the 15.,0.6,0.9,2.2,110.06,2,2.6,0th and 1st grade
Fri Dec 28 11:02:48 +0000 2012,Hey everyone What do you think of me following the 5 daily winners forever Celebrate15M,7.54,10.3,9.0,47.79,1,10.37,10th and 11th grade
Thu Dec 27 16:03:37 +0000 2012,The winner of today s challenge wins a customized autographed photo by Celebrate15M,10.35,10.7,10.8,41.36,1,13.5,10th and 11th grade
Thu Dec 27 16:02:36 +0000 2012,Let's start now. Tell me why you re my greatest fan. Reply in the next 24 hours with Celebrate15M,6.44,1.0,1.3,98.92,3,2.66,2nd and 3rd grade
Thu Dec 27 16:01:57 +0000 2012,And can also win other prizes Celebrate15M,6.24,6.0,6.3,64.37,1,9.87,5th and 6th grade
Thu Dec 27 16:01:38 +0000 2012,The author of the most retweeted post from that 15 replies will be followed by me for 24 hours Celebrate15M,7.0,7.6,9.3,76.56,1,8.24,7th and 8th grade
Thu Dec 27 16:00:39 +0000 2012,The 15 most original replies of the day with Celebrate15M will be retweeted by me,7.54,5.6,7.1,81.63,1,8.05,7th and 8th grade
Thu Dec 27 16:00:06 +0000 2012,Hey everyone For the next 5 days I ll be asking you a question a day to Celebrate15M,6.28,6.8,5.1,78.59,1,4.0,6th and 7th grade
Wed Dec 26 17:31:40 +0000 2012,The most active and original fans will be rewarded Celebrate15M,10.45,8.4,9.0,52.87,1,12.56,8th and 9th grade
Wed Dec 26 17:31:10 +0000 2012,Let s Celebrate15M in the next 5 days starting tomorrow. Stay connected.,8.18,8.0,8.5,59.3,1,10.37,7th and 8th grade
Wed Dec 26 17:30:23 +0000 2012,Hi everyone. Thank you for all your ideas to Celebrate15M on twitter.,6.86,5.6,7.3,76.22,1,8.92,6th and 7th grade
Mon Dec 24 12:44:26 +0000 2012,Merry Xmas for everyone.,0.2,7.2,5.3,50.5,1,5.8,1st and 2nd grade
