created_at,text,dale_chall_readability_score,flesch_kincaid,automated_readability,flesch_reading,sentence_count,coleman_liau_index,based_on_all_algorithms
Fri Jun 26 14:00:25 +0000 2020,"If you've purchased a ticket already, you'll find all of the new information in your email inbox. I can't wait to see you there Keep dancing at home in the meantime",6.44,5.8,6.7,81.12,2,6.55,6th and 7th grade
Fri Jun 26 14:00:24 +0000 2020,"The Chromatica Ball is officially moving to Summer 2021 We've been working hard to figure out the safest and soonest way to bring this show to you, but most importantly want everyone to be healthy and able to dance together at the shows as we always have.",7.65,19.3,23.0,40.69,1,9.01,-1th and 0th grade
Thu Jun 25 20:38:19 +0000 2020,"I've welcomed you into my world of Chromatica amp now I want to see what Chromatica looks like through your eyes. Use your favorite creative app and design your Chromatica. You could win 10,000 and a copy of your work signed by me LadyGagaxAdobe",6.16,6.7,7.5,73.47,3,8.23,7th and 8th grade
Thu Jun 25 04:30:11 +0000 2020,Thanks for partying at our Fundrager for Please donate Thank u,8.49,5.2,6.3,77.23,1,8.97,5th and 6th grade
Thu Jun 25 03:46:55 +0000 2020,Is me ClubQuarantine Chromatica,11.73,13.1,13.5,8.2,1,17.4,13th and 14th grade
Mon Jun 22 19:15:29 +0000 2020,Change in the music industry begins now.,8.5,6.0,5.0,64.37,1,7.37,8th and 9th grade
Fri Jun 19 23:12:48 +0000 2020,Taking the day to reflect on Juneteenth in the spirit of celebrating and making more progress. Sending my love to the Black community today as we rest upon an anniversary that is both significant and heartbreaking. We have to do more. There must be more change.,6.95,6.6,6.5,68.26,4,8.27,6th and 7th grade
Tue Jun 16 19:21:45 +0000 2020,Shop the SourCandy collection,11.73,9.6,11.2,33.58,1,14.5,11th and 12th grade
Tue Jun 16 19:21:23 +0000 2020,SourCandy lyric video out now,7.04,2.9,4.6,83.32,1,7.28,2nd and 3rd grade
Sun Jun 14 03:25:57 +0000 2020,What is happening in America right now is appalling and beyond inflammatory. I wish for everyone as much peace as possible while we witness the rotten fruits of prejudice.,7.62,8.9,9.0,56.76,2,10.32,9th and 10th grade
Mon Jun 08 17:14:39 +0000 2020,Congratulations to the class of 2020.,6.57,6.8,6.7,56.93,1,9.15,6th and 7th grade
Sun Jun 07 17:28:50 +0000 2020,"DearClassOf2020, you are the seeds of our future, and you have the power to make this world a better place. Join me, and many others with in honoring your accomplishments today at 12PM PT",6.8,6.4,8.4,79.6,2,8.0,6th and 7th grade
Fri Jun 05 00:04:24 +0000 2020,"And after I vow to regularly, in perpetuity, across all of my social media platforms, post stories, content, and otherwise lift up the voices of the countless inspiring members and groups within the Black community.",10.79,18.1,20.4,27.49,1,12.31,18th and 19th grade
Fri Jun 05 00:04:23 +0000 2020,"Starting tomorrow, I m giving over my Instagram account to each of the organizations I ve recently donated to, in an effort to amplify their important voices.",9.65,16.2,15.1,27.15,1,10.74,15th and 16th grade
Thu Jun 04 05:31:07 +0000 2020,Community Justice Action Fund,15.68,13.1,11.2,8.2,1,14.5,11th and 12th grade
Thu Jun 04 05:31:06 +0000 2020,National Lawyers Guild,9.05,5.6,11.5,59.97,1,13.12,5th and 6th grade
Thu Jun 04 05:31:06 +0000 2020,Fair Fight,0.1,-3.1,0.8,120.21,1,-4.51,-1th and 0th grade
Thu Jun 04 05:31:06 +0000 2020,Black Futures Lab,9.05,0.9,3.6,93.81,1,3.43,0th and 1st grade
Thu Jun 04 05:31:06 +0000 2020,Color of Change,0.15,0.9,0.5,93.81,1,-0.46,0th and 1st grade
Thu Jun 04 05:31:06 +0000 2020,NAACP Legal Defense Fund,7.78,3.7,5.3,75.88,1,7.25,7th and 8th grade
Thu Jun 04 05:31:05 +0000 2020,Marsha P. Johnson Institute,15.68,9.6,8.8,33.58,1,10.15,9th and 10th grade
Thu Jun 04 05:31:05 +0000 2020,Campaign Zero,19.53,8.8,7.8,35.61,1,4.2,-1th and 0th grade
Thu Jun 04 05:31:05 +0000 2020,Black Lives Matter,0.15,0.9,5.2,93.81,1,5.35,0th and 1st grade
Thu Jun 04 05:31:05 +0000 2020,Loveland Foundation,19.53,14.7,22.0,-6.7,1,21.6,21st and 22nd grade
Thu Jun 04 05:31:04 +0000 2020,Black Lives Matter.,0.15,0.9,6.8,93.81,1,5.35,0th and 1st grade
Tue Jun 02 04:08:06 +0000 2020,I love you. You re a true talent. I m so happy to be a part of your first 1. I feel so honored and love your message.,5.11,0.1,-2.9,106.67,4,-2.15,2nd and 3rd grade
Fri May 29 17:57:06 +0000 2020,"I m so glad the album is bringing you some joy, because that s what I always wanted it to do. We ll reschedule this very soon.",6.65,3.8,2.7,91.61,2,2.95,2nd and 3rd grade
Fri May 29 17:57:05 +0000 2020,"As much as I want to listen to Chromatica together as a global group of kindness punks right now, our kindness is needed for the world today. I m going to postpone our listening session right now and encourage you all to take this time to register to vote and raise your voice.",7.33,11.3,11.8,61.5,2,7.32,11th and 12th grade
Fri May 29 16:45:51 +0000 2020,Oh my g,0.15,-2.7,-12.2,119.19,1,-15.89,0th and 1st grade
Fri May 29 16:20:24 +0000 2020,Chromatica,19.48,32.0,26.2,-132.59,1,12.6,12th and 13th grade
Fri May 29 05:00:15 +0000 2020,I m not tweeting cuz I can t stop crying I m so happy. Thank you,6.4,4.8,1.0,89.08,1,-0.19,6th and 7th grade
Fri May 29 04:10:38 +0000 2020,"Please listen from the beginning to the end, no need to shuffle, it s my true story.",5.41,6.4,5.9,79.6,1,4.58,5th and 6th grade
Fri May 29 04:04:53 +0000 2020,Now dance motherf ckers Chromatica,13.36,10.0,9.3,32.56,1,13.08,9th and 10th grade
Fri May 29 04:00:31 +0000 2020,Welcome to Chromatica,9.05,12.7,9.9,9.21,1,11.15,12th and 13th grade
Fri May 29 04:00:15 +0000 2020,1 minute IM SCREAMINGGgggggg Chromatica,10.2,7.6,14.0,49.48,1,18.88,9th and 10th grade
Fri May 29 03:56:06 +0000 2020,Omg my album is out in 5 minutes in THE US IM FREAKING OUT,7.71,4.0,0.7,91.11,1,0.75,0th and 1st grade
Fri May 29 01:11:12 +0000 2020,LESS THAN 3 hrs to go until the US also enter Chromatica,5.55,6.8,2.2,67.76,1,3.58,5th and 6th grade
Fri May 29 01:10:11 +0000 2020,Last chance for Rain On Me music products,6.01,2.9,2.6,88.74,1,5.0,2nd and 3rd grade
Fri May 29 00:21:46 +0000 2020,Not yet,0.1,-3.1,-6.4,120.21,1,-13.21,-1th and 0th grade
Fri May 29 00:15:41 +0000 2020,PICKKKKLEEEEE RICKKKKKKKK,19.53,8.8,36.1,35.61,1,39.0,-1th and 0th grade
Fri May 29 00:12:03 +0000 2020,"This made me cry you threw yourself a party I want the whole world to throw themselves a party tonight, I love you and you deserve to smile and dance Chromatica",6.19,11.8,13.8,65.39,1,7.44,13th and 14th grade
Fri May 29 00:10:02 +0000 2020,I need a Rick and Morty in Chromatica meme to happen help,5.55,4.4,2.6,84.68,1,4.05,5th and 6th grade
Fri May 29 00:08:58 +0000 2020,Same,0.05,-3.5,-2.2,121.22,1,-22.21,-1th and 0th grade
Fri May 29 00:04:08 +0000 2020,Me as Chromatica approaches the US launch. 4 more hrs TAKE ME LITTLE MONSTERS ITS HAPPENING,8.38,9.5,8.9,55.24,1,9.63,9th and 10th grade
Thu May 28 23:44:16 +0000 2020,"Me and Morgan screamed when we were done and then I fell off my chair, got drunk and lost at Nintendo 64 Mario Kart to Bloodpop and threw my controller across the room.",7.19,11.4,14.5,71.82,1,6.86,6th and 7th grade
Thu May 28 23:31:19 +0000 2020,I dance so you can sit.,0.3,-1.5,-4.4,116.15,1,-4.43,-1th and 0th grade
Thu May 28 21:20:51 +0000 2020,And we all know this is not the first time the country has spoken up about this corrupt and unacceptable activity.,7.69,9.1,10.2,67.08,1,8.41,7th and 8th grade
Thu May 28 21:20:51 +0000 2020,"My heart breaks for George Floyd, his family and for the people in Minneapolis. Murder is murder. Cops are also citizens, the same rules should apply to them. This is absolutely horrific and if the mayor and DA do not step up it sets a poor example for this entire country.",6.44,7.1,5.5,66.94,4,6.48,6th and 7th grade
Thu May 28 19:41:53 +0000 2020,"Listen to Chromatica with me tomorrow, here on Twitter The ChromaticaListeningParty starts at 11am PT 2pm ET",7.27,13.5,12.6,28.84,1,13.45,12th and 13th grade
Thu May 28 18:54:40 +0000 2020,You two had a stroke of genius when you turned this song into a k pop basement banger u dance music fools Ilysm,1.83,7.5,8.3,81.97,1,5.46,7th and 8th grade
Thu May 28 17:04:54 +0000 2020,I m pretty sure it s flooding already,6.01,4.1,0.2,80.28,1,2.1,2nd and 3rd grade
Thu May 28 15:49:32 +0000 2020,CHROMATICA MIDNIGHT LOCAL TIME,11.73,13.1,12.4,8.2,1,15.95,11th and 12th grade
Thu May 28 11:03:39 +0000 2020,SOURCANDY WITH FROM CHROMATICA OUT NOW,9.2,8.0,7.5,48.47,1,11.07,7th and 8th grade
Wed May 27 22:52:43 +0000 2020,RainOnMe Vinyl available now,11.73,7.2,10.0,50.5,1,13.05,11th and 12th grade
Wed May 27 19:21:47 +0000 2020,Delivering Chromatica myself to every retailer around the world in Chromatica time and distance do not exist,9.12,13.5,12.6,28.84,1,13.8,13th and 14th grade
Wed May 27 17:52:30 +0000 2020,RainOnMe,19.48,20.2,16.8,-47.99,1,1.0,0th and 1st grade
Wed May 27 16:45:15 +0000 2020,CHROMATICA 2 DAYS,9.05,9.2,3.6,34.59,1,3.43,3rd and 4th grade
Wed May 27 04:40:33 +0000 2020,how did you raise such a perfect fairy. You must also be a fairy. The fairy convention has begun. BRING ON THE FAIRIES. Thank you for your daughter and her beautiful spirit.,4.94,2.2,2.7,90.36,5,4.29,2nd and 3rd grade
Tue May 26 22:43:50 +0000 2020,Are most of our streaming numbers just us being crazy and obsessed listening on repeat,8.59,8.0,8.7,64.71,1,9.97,8th and 9th grade
Tue May 26 21:13:55 +0000 2020,Are we thirsty or what BRING ON THE RAIN RainOnMe,5.71,2.5,2.4,95.17,1,4.44,4th and 5th grade
Tue May 26 17:44:07 +0000 2020,THIS IS A MESSAGE FROM CHROMATICA 3 DAYS,6.01,5.2,2.0,71.82,1,4.31,3rd and 4th grade
Tue May 26 17:30:58 +0000 2020,Love you UK Feeling very grateful RainOnMe Chromatica,9.95,10.0,9.7,37.98,1,13.7,9th and 10th grade
Tue May 26 03:29:44 +0000 2020,"Celebrating Rain On Me with my little buddy KOJI. Miss my gurl Ari. I have a bottle of ros with our name on it, when it s ok to hug u again Chromatica is coming",6.02,4.3,1.4,84.98,3,1.89,5th and 6th grade
Tue May 26 01:29:59 +0000 2020,It makes me so happy too AND I got to get to know you and have so much fun creating together you always make me smile ily so much,1.98,9.9,9.5,75.88,1,3.5,9th and 10th grade
Mon May 25 22:08:10 +0000 2020,RainOnMe,19.48,20.2,16.8,-47.99,1,1.0,0th and 1st grade
Mon May 25 18:49:38 +0000 2020,Rain is stored in the boobs.,0.3,-1.5,-0.5,116.15,1,0.45,-1th and 0th grade
Mon May 25 18:10:30 +0000 2020,In Chromatica no one thing is greater than another 4 days,5.62,6.4,4.2,68.77,1,6.3,5th and 6th grade
Sun May 24 19:33:47 +0000 2020,I hear the thunder coming down,0.3,2.1,1.2,90.77,1,3.35,1st and 2nd grade
Sat May 23 23:16:38 +0000 2020,RainOnMe on AListPop,14.31,12.7,8.3,9.21,1,9.23,12th and 13th grade
Sat May 23 19:45:08 +0000 2020,RainOnMe,19.48,20.2,16.8,-47.99,1,1.0,0th and 1st grade
Fri May 22 22:04:51 +0000 2020,RainOnMe,19.48,20.2,16.8,-47.99,1,1.0,0th and 1st grade
Fri May 22 18:36:18 +0000 2020,RainOnMe with on the cover of RELEASED,8.5,6.0,3.6,64.37,1,6.56,8th and 9th grade
Fri May 22 18:29:42 +0000 2020,RainOnMe with on the cover of NewMusicDaily,8.5,10.7,7.0,30.53,1,10.74,10th and 11th grade
Fri May 22 18:24:26 +0000 2020,"Welcome To Chromatica , the experiential playlist on Two Italian American girls taking over Times Square",7.54,12.7,14.0,30.87,1,16.17,10th and 11th grade
Fri May 22 18:18:07 +0000 2020,RainOnMe with out now,7.78,3.7,1.8,75.88,1,2.9,1st and 2nd grade
Fri May 22 17:07:05 +0000 2020,RAINONME MUSIC VIDEO WITH OUT NOW DIRECTED BY ROBERT RODRIGUEZ,8.87,7.2,8.5,61.33,1,11.98,8th and 9th grade
Fri May 22 17:00:43 +0000 2020,IF YOU WERE UP ALL NIGHT DRINKING WINE ON CALLS W UR FRIENDS LISTENING TO RainOnMe U BETTER WAKE UP AND GET SOME COFFEE FOR THAT HANGOVER CUZ THE VIDEO IS OUT,7.2,12.2,13.3,64.38,1,6.34,12th and 13th grade
Fri May 22 16:58:11 +0000 2020,2 MINUTES RAINONMEMUSICVIDEO,14.31,12.7,20.9,9.21,1,24.72,12th and 13th grade
Fri May 22 16:54:09 +0000 2020,Ahhhhh 7 min,9.05,9.2,-4.3,34.59,1,-6.26,8th and 9th grade
Fri May 22 16:01:44 +0000 2020,RainOnMeMusicVideo 1 hour,9.05,9.2,16.2,34.59,1,18.92,8th and 9th grade
Fri May 22 04:21:24 +0000 2020,"If we re gonna cry we re gonna cry together, but we re gonna dance while we do it. RainOnMe LittleMonsters let it pour I m crying on my porch that I use to not be able to leave, I was stuck. Now I dance on it and sing about how I got through it.",5.41,4.5,4.1,95.2,3,2.32,4th and 5th grade
Fri May 22 04:08:12 +0000 2020,"Now when I cry instead of fighting it I say I m ready rain on me thank u for encouraging me to keep going when I was sad. Turns out even if you don t feel good enough you still can be. I heard my joy back when we wrote this song. It was there, I just needed to find it",1.54,3.4,2.3,98.25,4,1.5,1st and 2nd grade
Fri May 22 04:07:37 +0000 2020,RAINONME out now Video premiere at 10am PT 1pm ET TOMORROW on my YouTube channel,7.54,6.8,6.8,73.17,1,7.65,6th and 7th grade
Fri May 22 04:05:49 +0000 2020,"One time I felt like I was crying so much it would never stop. Instead of fighting it, I thought bring it on, I can do hard things. I love you for your strength and friendship. Let s show them what we ve got.",1.26,1.7,1.7,102.61,4,2.47,1st and 2nd grade
Fri May 22 04:02:20 +0000 2020,"Thank you for reminding me I m strong, I m super emotional and love you so very much, I cherish you and little monsters without you I don t know how I would survive. I d rather be dry, but at least I m alive.",6.86,7.3,7.0,82.48,2,3.49,6th and 7th grade
Fri May 22 03:55:44 +0000 2020,MOOD,0.05,-3.5,-2.2,121.22,1,-22.21,-1th and 0th grade
Fri May 22 03:13:01 +0000 2020,You inspire me let s go,6.57,0.9,-4.4,99.23,1,-3.44,1st and 2nd grade
Fri May 22 02:00:12 +0000 2020,TWO HOURS RAINONME,9.05,5.6,5.2,59.97,1,5.35,5th and 6th grade
Fri May 22 00:00:08 +0000 2020,RainOnMe,19.48,20.2,16.8,-47.99,1,1.0,0th and 1st grade
Thu May 21 22:00:05 +0000 2020,I never asked for the rainfall At least I showed up You showed me nothing at all RAINONME SIX HOURS,6.21,7.6,7.4,76.56,1,5.92,7th and 8th grade
Thu May 21 20:00:05 +0000 2020,8 HOURS RAINONME,9.05,5.6,2.1,59.97,1,1.52,1st and 2nd grade
Thu May 21 18:27:36 +0000 2020,Welome to Chromatica Watch the interview on,8.5,7.2,7.0,55.91,1,10.74,6th and 7th grade
Thu May 21 18:02:45 +0000 2020,"Love u let s do this. Nothing can stop us, we know that now.",0.35,0.1,-2.2,106.67,2,-1.74,-1th and 0th grade
Thu May 21 17:16:44 +0000 2020,RAINONME TONIGHT,11.63,8.8,14.9,35.61,1,12.9,11th and 12th grade
Wed May 20 17:41:11 +0000 2020,THIS IS A MESSAGE FROM CHROMATICA,6.57,6.8,3.6,56.93,1,6.25,6th and 7th grade
Wed May 20 16:01:44 +0000 2020,I brought into the world of Chromatica. Watch the interview Thursday at 10am PT on,6.11,5.0,3.7,72.32,2,6.28,3rd and 4th grade
Wed May 20 01:16:30 +0000 2020,I ve got my umbrella ready,0.3,2.1,-2.0,90.77,1,-0.54,2nd and 3rd grade
Tue May 19 16:04:41 +0000 2020,"I'm so happy to introduce you to the STUPID LOVE EYESHADOW PALETTE that we created inspired by Chromatica. It's filled with bright shades for you to color with creativity, kindness, and LOVE. Now available on and globally",8.09,6.9,8.3,67.45,3,9.9,7th and 8th grade
Mon May 18 16:01:11 +0000 2020,... water like misery RainOnMe 5 22,9.2,8.0,4.3,48.47,1,4.28,3rd and 4th grade
Sat May 16 22:20:22 +0000 2020,Saturday,0.05,20.2,16.8,-47.99,1,1.0,0th and 1st grade
Fri May 15 21:29:49 +0000 2020,"RAINONME WITH FRIDAY 5 22, MIDNIGHT ET WORLDWIDE",7.98,6.4,6.7,63.36,1,9.35,7th and 8th grade
Thu May 14 16:04:47 +0000 2020,". is stepping onto Chromatica with the STUPID LOVE EYESHADOW PALETTE 18 shades of color, yours on 5 19. Head to to see the full lineup",7.41,5.8,5.4,75.71,2,6.42,6th and 7th grade
Mon May 11 17:14:06 +0000 2020,ENERGY,19.48,20.2,7.3,-47.99,1,-10.61,19th and 20th grade
Fri May 08 21:39:19 +0000 2020,FEEL THRU DANCE AND SOUND,0.25,-1.9,0.9,117.16,1,2.64,1st and 2nd grade
Wed May 06 16:00:25 +0000 2020,The journey continues. You can officially join me on Chromatica on May 29.,7.6,7.0,4.3,56.42,2,6.56,6th and 7th grade
Tue May 05 19:24:43 +0000 2020,I m so excited to speak to the class of 2020 with and many more incredible people as we celebrate your accomplishments in this graduate withme livestream event. Tune in June 6th on DearClassOf2020,6.8,7.6,9.6,71.14,2,10.03,6th and 7th grade
Tue May 05 19:18:11 +0000 2020,"Want to help fight COVID19 from home Download and check in, it takes less than 30 seconds a day and helps world class doctors and scientists learn more about the COVID19 pandemic",7.69,11.1,16.2,72.84,1,9.76,-1th and 0th grade
Fri May 01 19:22:15 +0000 2020,"I deeply thank all of our customers for supporting the work that is doing, and helping me join the fight to create access to more mental health resources and awareness, and to create a kinder, braver world.",9.31,14.2,18.7,59.3,1,9.35,9th and 10th grade
Fri May 01 19:22:15 +0000 2020,"I have always wanted to build a company that would support charitable efforts. Starting today, will donate 1 from every paid transaction on to",8.84,8.0,7.9,59.3,2,10.14,7th and 8th grade
Fri May 01 00:22:34 +0000 2020,"I love you, everyone",0.2,3.7,0.6,75.88,1,0.0,-1th and 0th grade
Wed Apr 22 22:06:14 +0000 2020,"Even though I was born in Manhattan, I have immense Jersey pride from my family there and the time I spent there growing up. I'm excited to see my friends and more perform on JERSEY4JERSEY tonight. Find out where to watch",6.63,5.1,6.2,82.95,3,7.18,6th and 7th grade
Wed Apr 22 20:57:08 +0000 2020,Chromatica LG6,11.63,14.7,10.2,-6.7,1,7.1,14th and 15th grade
Mon Apr 20 01:53:44 +0000 2020,"If you want to relive the music, you can click here to stream all of the performances",6.34,5.2,6.2,88.06,1,5.62,5th and 6th grade
Mon Apr 20 01:53:03 +0000 2020,"Thank you with all of my heart for watching TogetherAtHome, sharing in a global moment of kindness with each other, and spreading positive and loving intentions. We love you.",8.71,7.8,9.5,65.22,2,10.55,7th and 8th grade
Sun Apr 19 05:44:14 +0000 2020,I am so humbled to have been a part of this project. Thank you Thank you I love you,4.94,1.1,-0.7,104.13,2,0.49,-1th and 0th grade
Sun Apr 19 03:38:08 +0000 2020,I love all the artists on TogetherAtHome. And everyone that watched and everyone the didn t or couldn t. We all matter. We re one world.,0.93,2.3,1.9,90.26,4,3.66,1st and 2nd grade
Sun Apr 19 00:04:53 +0000 2020,It s time our TV special One World TogetherAtHome starts right now celebrating those on the frontlines. Stream here or click here to find out where to watch the broadcast on TV,6.4,6.0,7.9,80.62,2,8.52,5th and 6th grade
Sat Apr 18 18:10:58 +0000 2020,"The TV broadcast I curated starts in 6 hours It airs on many major networks across the globe and so many places online. For more information on where you can watch anywhere in the world, click here",6.26,7.0,8.3,78.08,2,7.66,6th and 7th grade
Sat Apr 18 18:03:04 +0000 2020,The TogetherAtHome digital stream starts now So proud of the team that put this together,6.49,8.0,9.3,64.71,1,10.72,10th and 11th grade
Fri Apr 17 17:55:37 +0000 2020,Thank you Netherlands amp for your support for a COVID19 vaccine and to Global citizens hope that the Netherlands will also continue to support and that other countries will follow your example and contribute to,9.43,15.8,19.9,44.41,1,12.66,15th and 16th grade
Fri Apr 17 17:52:21 +0000 2020,"That s amazing news You can count on me amp to help. The fight against COVID can only be global G7 amp G20 members heads up, Global Citizens will be out campaigning for amp",6.8,6.4,6.3,79.6,2,5.8,6th and 7th grade
Tue Apr 14 20:24:39 +0000 2020,Can t wait for you to see what we ve put together Tune in,0.69,2.9,0.4,99.57,1,0.34,-1th and 0th grade
Mon Apr 13 16:53:17 +0000 2020,"Hi thanks for funding the appeal, and for all is doing to stop COVID19 and PlankTheCurve. Will Canada give new funds to to deliver vaccines and save lives in the poorest countries We re all in this together as GlobalCitizens.",8.58,9.9,10.5,59.64,2,9.28,9th and 10th grade
Mon Apr 13 16:50:11 +0000 2020,President as a doctor you know that disease doesn't know borders. Thanks for stepping up on and bilateral COVID19 help. We need your leadership on the lifesaving work of amp We re all in this together as GlobalCitizens.,7.18,8.2,7.5,58.58,3,8.98,7th and 8th grade
Mon Apr 13 16:48:07 +0000 2020,President last year you showed your leadership in the fight against pandemics. We need you to support the global fight against COVID19 through the amp We re all in this together as GlobalCitizens.,7.33,7.4,10.2,71.65,2,10.9,10th and 11th grade
Mon Apr 13 00:50:21 +0000 2020,"Happy Easter to the world. Many are suffering right now, whether you celebrate Easter or not, I wish you the best day you could possibly have. Maybe just one smile. I wish that for you all today.",5.8,3.4,3.4,87.42,4,4.96,3rd and 4th grade
Wed Apr 08 15:54:19 +0000 2020,. May 2020,0.1,2.9,-1.7,77.91,1,-10.31,0th and 1st grade
Tue Apr 07 20:33:39 +0000 2020,Calling all developers Now s the time to get behind your keyboard and help fight COVID19. Join the 2020 CallforCode Global Challenge now,7.64,5.4,7.7,76.72,2,10.01,7th and 8th grade
Tue Apr 07 03:09:45 +0000 2020,TogetherAtHome,19.48,32.0,45.0,-132.59,1,35.8,31st and 32nd grade
Sun Apr 05 21:01:24 +0000 2020,Chromatica 2020,11.63,14.7,12.5,-6.7,1,10.0,12th and 13th grade
Thu Apr 02 23:05:21 +0000 2020,"Proud to have donated to support AmericasFoodFund, a new initiative directly supporting amp to feed those in need amp impacted by COVID19. Thankful for my friends and for putting this together.",7.97,9.3,11.1,55.74,2,12.35,11th and 12th grade
Mon Mar 16 18:25:58 +0000 2020,We all have a responsibility to do our part,5.84,6.8,1.4,62.34,1,3.51,6th and 7th grade
Mon Mar 16 15:02:19 +0000 2020,.,0.0,-15.7,0.0,206.84,1,-15.81,-1th and 0th grade
Sun Mar 15 23:55:19 +0000 2020,We can t do this without kindness.,0.35,2.5,0.9,89.75,1,2.44,2nd and 3rd grade
Fri Mar 13 03:09:29 +0000 2020,"Now it s as important as ever to be kind. For those who are sick, or those who are not and are scared. We re in this together. I love you world",0.4,1.7,-1.0,97.2,4,-0.05,3rd and 4th grade
Thu Mar 12 00:44:29 +0000 2020,Thank u,0.1,-3.1,-6.4,120.21,1,-13.21,-1th and 0th grade
Wed Mar 11 03:44:32 +0000 2020,If Peter breaks up with Hannah Ann and proposes to Madison StupidLove,9.5,5.6,7.3,76.22,1,9.85,5th and 6th grade
Tue Mar 10 23:40:21 +0000 2020,Pre save Chromatica on,7.78,7.2,2.9,50.5,1,4.35,7th and 8th grade
Tue Mar 10 09:03:56 +0000 2020,"LADY GAGA THE CHROMATICA BALL LONDON AND PARIS PRE SALE NOW If you pre ordered a copy of Chromatica through Lady Gaga s official UK or France shop, use the individual code emailed to you to purchase your tickets.",8.41,17.3,19.1,40.35,1,8.89,8th and 9th grade
Mon Mar 09 18:18:04 +0000 2020,"From the beginning, and I wanted amp to be powered by the perspectives and experiences of young people. I can t wait for you to read the powerful stories from amazing young people in ChannelKindness. Preorder now",7.54,9.3,10.2,61.16,2,9.86,9th and 10th grade
Sun Mar 08 18:43:35 +0000 2020,"It s InternationalWomensDay and I m celebrating all of the strong, women of choice all over the world with this playlist full of songs all from female artists",6.72,11.8,14.6,59.98,1,9.93,9th and 10th grade
Fri Mar 06 01:33:39 +0000 2020,I would battle for you Even if we break in two,0.55,1.7,-0.6,102.61,1,0.5,0th and 1st grade
Thu Mar 05 09:09:32 +0000 2020,Fans in London amp Paris can get priority access to the best tickets by pre ordering Chromatica here If you ve already pre ordered the album from the Official Store you get automatic pre sale access. General sale is March 13th London 9am amp Paris 10am.,8.21,11.1,11.4,56.59,2,9.0,8th and 9th grade
Thu Mar 05 09:08:57 +0000 2020,"Fans in Toronto can register for Verified Fan for first access to tickets. Register before 11 59pm ET on Saturday, March 7 for the pre sale at 10am ET on Thursday, March 12 On sale will begin for the general public on Friday, March 13 at 10am ET.",6.47,10.3,10.1,64.04,2,6.45,10th and 11th grade
Thu Mar 05 09:08:05 +0000 2020,"Fans in the US can register for Verified Fan for first access to tickets. Register before 11 59p ET on Saturday, March 7 for the pre sale at 10a local time on Friday, March 13 On sale will begin for the general public on Monday, March 16 at 10a local time",6.45,10.9,10.3,62.51,2,5.87,10th and 11th grade
Thu Mar 05 09:06:33 +0000 2020,LADY GAGA THE CHROMATICA BALL,7.04,7.6,4.6,49.48,1,7.28,7th and 8th grade
Thu Mar 05 02:12:24 +0000 2020,when ure so tired from working nonstop u end up spray painting your whip,6.59,4.0,5.4,91.11,1,6.55,5th and 6th grade
Wed Mar 04 21:29:39 +0000 2020,GAGAVISION EPISODE 47 STUPID LOVE OUT NOW StupidLove Chromatica,7.59,6.8,11.8,62.34,1,16.38,7th and 8th grade
Wed Mar 04 07:57:42 +0000 2020,and this is why I make music,0.35,0.1,-3.2,106.67,1,-1.74,-1th and 0th grade
Mon Mar 02 23:33:19 +0000 2020,STUPID LOVE MERCH AVAILABLE NOW StupidLove Chromatica,8.5,6.0,13.7,64.37,1,18.97,8th and 9th grade
Mon Mar 02 17:02:49 +0000 2020,"Welcome to Chromatica , coming April 10. Pre order now This is not the album cover but we made it for you to enjoy in the meantime",6.1,6.0,3.9,75.2,2,4.57,6th and 7th grade
Sun Mar 01 21:06:17 +0000 2020,NewMusicDaily,19.48,43.8,40.3,-217.19,1,30.0,43rd and 44th grade
Sun Mar 01 20:01:29 +0000 2020,stupidlove,0.05,-3.5,26.2,121.22,1,12.6,-1th and 0th grade
Fri Feb 28 22:56:58 +0000 2020,"This girl couldn t be happier to see StupidLove celebrated in my favorite city in the world. Love u NYC, and thank you for all of the love",5.46,4.0,4.2,91.11,2,4.69,4th and 5th grade
Fri Feb 28 22:54:45 +0000 2020,StupidLove in Toronto Thank u,7.04,0.5,4.6,100.24,1,7.28,1st and 2nd grade
Fri Feb 28 22:53:01 +0000 2020,StupidLove in LA Listen on NMF,0.3,0.9,1.2,99.23,1,3.35,0th and 1st grade
